film_id,decade,file_path,start,end,text_clean,text_raw
english-tohfa-tohfa-downsub-com,1980s,/home/pratik/projects/GenderBias_TrendAnalysis/dataset/1980s/[English] Tohfa Tohfa [DownSub.com].srt,"01:08:34,083","01:08:35,583",you say I should die in the river,you say I should die in the river
english-tohfa-tohfa-downsub-com,1980s,/home/pratik/projects/GenderBias_TrendAnalysis/dataset/1980s/[English] Tohfa Tohfa [DownSub.com].srt,"01:08:36,083","01:08:37,583",You speak so I jumped down,You speak so I jumped down
english-tohfa-tohfa-downsub-com,1980s,/home/pratik/projects/GenderBias_TrendAnalysis/dataset/1980s/[English] Tohfa Tohfa [DownSub.com].srt,"01:08:38,083","01:08:40,000","Do you know, I went inside to give soda bottle.","Do you know, I went inside to give soda bottle."
english-tohfa-tohfa-downsub-com,1980s,/home/pratik/projects/GenderBias_TrendAnalysis/dataset/1980s/[English] Tohfa Tohfa [DownSub.com].srt,"01:08:40,500","01:08:43,750","Am ready to marry you, Lalita.","Am ready to marry you, Lalita."
english-tohfa-tohfa-downsub-com,1980s,/home/pratik/projects/GenderBias_TrendAnalysis/dataset/1980s/[English] Tohfa Tohfa [DownSub.com].srt,"01:08:44,250","01:08:44,916",But on the condition.,But on the condition.
english-tohfa-tohfa-downsub-com,1980s,/home/pratik/projects/GenderBias_TrendAnalysis/dataset/1980s/[English] Tohfa Tohfa [DownSub.com].srt,"01:08:45,416","01:08:47,625",I accept all your conditions.,I accept all your conditions.
english-tohfa-tohfa-downsub-com,1980s,/home/pratik/projects/GenderBias_TrendAnalysis/dataset/1980s/[English] Tohfa Tohfa [DownSub.com].srt,"01:08:48,125","01:08:49,666","Listen first, kamesh.","Listen first, kamesh."
english-tohfa-tohfa-downsub-com,1980s,/home/pratik/projects/GenderBias_TrendAnalysis/dataset/1980s/[English] Tohfa Tohfa [DownSub.com].srt,"01:08:50,166","01:08:55,083",I will not ask you anything about your past today.,I will not ask you anything about your past today.
english-tohfa-tohfa-downsub-com,1980s,/home/pratik/projects/GenderBias_TrendAnalysis/dataset/1980s/[English] Tohfa Tohfa [DownSub.com].srt,"01:08:55,583","01:09:02,333",Neither you ask me about my past tomorrow,Neither you ask me about my past tomorrow
english-tohfa-tohfa-downsub-com,1980s,/home/pratik/projects/GenderBias_TrendAnalysis/dataset/1980s/[English] Tohfa Tohfa [DownSub.com].srt,"01:09:02,833","01:09:04,833",I want only flowers smell,I want only flowers smell
english-tohfa-tohfa-downsub-com,1980s,/home/pratik/projects/GenderBias_TrendAnalysis/dataset/1980s/[English] Tohfa Tohfa [DownSub.com].srt,"01:09:05,333","01:09:06,125",i dont want to know Who hit plant?,i dont want to know Who hit plant?
english-tohfa-tohfa-downsub-com,1980s,/home/pratik/projects/GenderBias_TrendAnalysis/dataset/1980s/[English] Tohfa Tohfa [DownSub.com].srt,"01:09:06,625","01:09:08,208","Who gave the water, who is the gardener?","Who gave the water, who is the gardener?"
english-tohfa-tohfa-downsub-com,1980s,/home/pratik/projects/GenderBias_TrendAnalysis/dataset/1980s/[English] Tohfa Tohfa [DownSub.com].srt,"01:09:08,708","01:09:10,958","That means nothing to me, Lalita.","That means nothing to me, Lalita."
english-tohfa-tohfa-downsub-com,1980s,/home/pratik/projects/GenderBias_TrendAnalysis/dataset/1980s/[English] Tohfa Tohfa [DownSub.com].srt,"01:09:11,458","01:09:14,166","I just care about the future,","I just care about the future,"
english-tohfa-tohfa-downsub-com,1980s,/home/pratik/projects/GenderBias_TrendAnalysis/dataset/1980s/[English] Tohfa Tohfa [DownSub.com].srt,"01:09:14,666","01:09:18,166",which was not your past.,which was not your past.
english-tohfa-tohfa-downsub-com,1980s,/home/pratik/projects/GenderBias_TrendAnalysis/dataset/1980s/[English] Tohfa Tohfa [DownSub.com].srt,"01:10:04,833","01:10:06,500",We both got married.,We both got married.
english-tohfa-tohfa-downsub-com,1980s,/home/pratik/projects/GenderBias_TrendAnalysis/dataset/1980s/[English] Tohfa Tohfa [DownSub.com].srt,"01:10:07,000","01:10:08,416",No,No
english-tohfa-tohfa-downsub-com,1980s,/home/pratik/projects/GenderBias_TrendAnalysis/dataset/1980s/[English] Tohfa Tohfa [DownSub.com].srt,"01:10:08,916","01:10:10,958",It can not be.,It can not be.
english-tohfa-tohfa-downsub-com,1980s,/home/pratik/projects/GenderBias_TrendAnalysis/dataset/1980s/[English] Tohfa Tohfa [DownSub.com].srt,"01:10:11,458","01:10:13,666",That's a lie.,That's a lie.
english-tohfa-tohfa-downsub-com,1980s,/home/pratik/projects/GenderBias_TrendAnalysis/dataset/1980s/[English] Tohfa Tohfa [DownSub.com].srt,"01:10:14,166","01:10:16,750","It's a lie, right?, Lalita.","It's a lie, right?, Lalita."
english-tohfa-tohfa-downsub-com,1980s,/home/pratik/projects/GenderBias_TrendAnalysis/dataset/1980s/[English] Tohfa Tohfa [DownSub.com].srt,"01:10:17,250","01:10:18,750",No,No
english-tohfa-tohfa-downsub-com,1980s,/home/pratik/projects/GenderBias_TrendAnalysis/dataset/1980s/[English] Tohfa Tohfa [DownSub.com].srt,"01:10:19,250","01:10:21,750","It is true, sister.","It is true, sister."
english-tohfa-tohfa-downsub-com,1980s,/home/pratik/projects/GenderBias_TrendAnalysis/dataset/1980s/[English] Tohfa Tohfa [DownSub.com].srt,"01:10:22,250","01:10:26,708","Today, we are husband and wife.","Today, we are husband and wife."
english-tohfa-tohfa-downsub-com,1980s,/home/pratik/projects/GenderBias_TrendAnalysis/dataset/1980s/[English] Tohfa Tohfa [DownSub.com].srt,"01:10:27,208","01:10:29,708","Beware, which again came the","Beware, which again came the"
english-tohfa-tohfa-downsub-com,1980s,/home/pratik/projects/GenderBias_TrendAnalysis/dataset/1980s/[English] Tohfa Tohfa [DownSub.com].srt,"01:10:30,208","01:10:31,500",It can not be your husband.,It can not be your husband.
english-tohfa-tohfa-downsub-com,1980s,/home/pratik/projects/GenderBias_TrendAnalysis/dataset/1980s/[English] Tohfa Tohfa [DownSub.com].srt,"01:10:32,000","01:10:34,000",You can not wear this necklace.,You can not wear this necklace.
english-tohfa-tohfa-downsub-com,1980s,/home/pratik/projects/GenderBias_TrendAnalysis/dataset/1980s/[English] Tohfa Tohfa [DownSub.com].srt,"01:10:34,500","01:10:35,875","It's a lie, is false.","It's a lie, is false."
english-tohfa-tohfa-downsub-com,1980s,/home/pratik/projects/GenderBias_TrendAnalysis/dataset/1980s/[English] Tohfa Tohfa [DownSub.com].srt,"01:10:36,375","01:10:37,500",I am not ready to accept.,I am not ready to accept.
english-tohfa-tohfa-downsub-com,1980s,/home/pratik/projects/GenderBias_TrendAnalysis/dataset/1980s/[English] Tohfa Tohfa [DownSub.com].srt,"01:10:38,000","01:10:39,333",Dont accept Janaki,Dont accept Janaki
english-tohfa-tohfa-downsub-com,1980s,/home/pratik/projects/GenderBias_TrendAnalysis/dataset/1980s/[English] Tohfa Tohfa [DownSub.com].srt,"01:10:39,833","01:10:41,875",your accept or reject our relationship,your accept or reject our relationship
english-tohfa-tohfa-downsub-com,1980s,/home/pratik/projects/GenderBias_TrendAnalysis/dataset/1980s/[English] Tohfa Tohfa [DownSub.com].srt,"01:10:42,375","01:10:44,500",We both have the wedding i front of God.,We both have the wedding i front of God.
english-tohfa-tohfa-downsub-com,1980s,/home/pratik/projects/GenderBias_TrendAnalysis/dataset/1980s/[English] Tohfa Tohfa [DownSub.com].srt,"01:10:45,000","01:10:45,416",Keep quiet.,Keep quiet.
english-tohfa-tohfa-downsub-com,1980s,/home/pratik/projects/GenderBias_TrendAnalysis/dataset/1980s/[English] Tohfa Tohfa [DownSub.com].srt,"01:10:45,916","01:10:47,875",If you say that God is witness.,If you say that God is witness.
english-tohfa-tohfa-downsub-com,1980s,/home/pratik/projects/GenderBias_TrendAnalysis/dataset/1980s/[English] Tohfa Tohfa [DownSub.com].srt,"01:10:48,375","01:10:51,083","I will tell you this, he is not God.","I will tell you this, he is not God."
english-tohfa-tohfa-downsub-com,1980s,/home/pratik/projects/GenderBias_TrendAnalysis/dataset/1980s/[English] Tohfa Tohfa [DownSub.com].srt,"01:10:51,583","01:10:53,500","Lalita, to take off the necklace","Lalita, to take off the necklace"
english-tohfa-tohfa-downsub-com,1980s,/home/pratik/projects/GenderBias_TrendAnalysis/dataset/1980s/[English] Tohfa Tohfa [DownSub.com].srt,"01:10:54,000","01:10:54,791","and hit it on the mouth,","and hit it on the mouth,"
english-tohfa-tohfa-downsub-com,1980s,/home/pratik/projects/GenderBias_TrendAnalysis/dataset/1980s/[English] Tohfa Tohfa [DownSub.com].srt,"01:10:55,291","01:10:56,458",or I'll throw this scrape.,or I'll throw this scrape.
english-tohfa-tohfa-downsub-com,1980s,/home/pratik/projects/GenderBias_TrendAnalysis/dataset/1980s/[English] Tohfa Tohfa [DownSub.com].srt,"01:10:56,958","01:10:58,125",No sister,No sister
english-tohfa-tohfa-downsub-com,1980s,/home/pratik/projects/GenderBias_TrendAnalysis/dataset/1980s/[English] Tohfa Tohfa [DownSub.com].srt,"01:10:58,625","01:11:00,000",so it can not be.,so it can not be.
english-tohfa-tohfa-downsub-com,1980s,/home/pratik/projects/GenderBias_TrendAnalysis/dataset/1980s/[English] Tohfa Tohfa [DownSub.com].srt,"01:11:00,500","01:11:03,500",If you wear one necklace in life,If you wear one necklace in life
english-tohfa-tohfa-downsub-com,1980s,/home/pratik/projects/GenderBias_TrendAnalysis/dataset/1980s/[English] Tohfa Tohfa [DownSub.com].srt,"01:11:04,000","01:11:06,583",when he becomes married,when he becomes married
english-tohfa-tohfa-downsub-com,1980s,/home/pratik/projects/GenderBias_TrendAnalysis/dataset/1980s/[English] Tohfa Tohfa [DownSub.com].srt,"01:11:07,083","01:11:08,708",And takes off once,And takes off once
english-tohfa-tohfa-downsub-com,1980s,/home/pratik/projects/GenderBias_TrendAnalysis/dataset/1980s/[English] Tohfa Tohfa [DownSub.com].srt,"01:11:09,208","01:11:10,916",when her husband dies,when her husband dies
english-tohfa-tohfa-downsub-com,1980s,/home/pratik/projects/GenderBias_TrendAnalysis/dataset/1980s/[English] Tohfa Tohfa [DownSub.com].srt,"01:11:11,416","01:11:13,500",and she becomes a widow,and she becomes a widow
english-tohfa-tohfa-downsub-com,1980s,/home/pratik/projects/GenderBias_TrendAnalysis/dataset/1980s/[English] Tohfa Tohfa [DownSub.com].srt,"01:11:14,000","01:11:15,500",The necklace has remove,The necklace has remove
english-tohfa-tohfa-downsub-com,1980s,/home/pratik/projects/GenderBias_TrendAnalysis/dataset/1980s/[English] Tohfa Tohfa [DownSub.com].srt,"01:11:16,000","01:11:16,500",noone right given,noone right given
english-tohfa-tohfa-downsub-com,1980s,/home/pratik/projects/GenderBias_TrendAnalysis/dataset/1980s/[English] Tohfa Tohfa [DownSub.com].srt,"01:11:17,000","01:11:18,291","No, Lalita.","No, Lalita."
english-tohfa-tohfa-downsub-com,1980s,/home/pratik/projects/GenderBias_TrendAnalysis/dataset/1980s/[English] Tohfa Tohfa [DownSub.com].srt,"01:11:18,791","01:11:19,583",Why the yelling?,Why the yelling?
english-tohfa-tohfa-downsub-com,1980s,/home/pratik/projects/GenderBias_TrendAnalysis/dataset/1980s/[English] Tohfa Tohfa [DownSub.com].srt,"01:11:20,083","01:11:21,541",What is the right to admonish this?,What is the right to admonish this?
english-tohfa-tohfa-downsub-com,1980s,/home/pratik/projects/GenderBias_TrendAnalysis/dataset/1980s/[English] Tohfa Tohfa [DownSub.com].srt,"01:11:22,041","01:11:27,125","This is my wife, wife.","This is my wife, wife."
english-tohfa-tohfa-downsub-com,1980s,/home/pratik/projects/GenderBias_TrendAnalysis/dataset/1980s/[English] Tohfa Tohfa [DownSub.com].srt,"01:11:27,625","01:11:30,083","In this world, however lowly girl","In this world, however lowly girl"
english-tohfa-tohfa-downsub-com,1980s,/home/pratik/projects/GenderBias_TrendAnalysis/dataset/1980s/[English] Tohfa Tohfa [DownSub.com].srt,"01:11:30,583","01:11:32,166",she will not get married with you.,she will not get married with you.
english-tohfa-tohfa-downsub-com,1980s,/home/pratik/projects/GenderBias_TrendAnalysis/dataset/1980s/[English] Tohfa Tohfa [DownSub.com].srt,"01:11:32,666","01:11:34,500",I can not be so alive.,I can not be so alive.
english-tohfa-tohfa-downsub-com,1980s,/home/pratik/projects/GenderBias_TrendAnalysis/dataset/1980s/[English] Tohfa Tohfa [DownSub.com].srt,"01:11:35,000","01:11:38,208",I bullied you to Lalita will be forced.,I bullied you to Lalita will be forced.
english-tohfa-tohfa-downsub-com,1980s,/home/pratik/projects/GenderBias_TrendAnalysis/dataset/1980s/[English] Tohfa Tohfa [DownSub.com].srt,"01:11:38,708","01:11:39,500",That you get married.,That you get married.
english-tohfa-tohfa-downsub-com,1980s,/home/pratik/projects/GenderBias_TrendAnalysis/dataset/1980s/[English] Tohfa Tohfa [DownSub.com].srt,"01:11:40,000","01:11:42,541","Say, Say, Say What was the point?","Say, Say, Say What was the point?"
english-tohfa-tohfa-downsub-com,1980s,/home/pratik/projects/GenderBias_TrendAnalysis/dataset/1980s/[English] Tohfa Tohfa [DownSub.com].srt,"01:11:43,041","01:11:44,500",Sister,Sister
english-tohfa-tohfa-downsub-com,1980s,/home/pratik/projects/GenderBias_TrendAnalysis/dataset/1980s/[English] Tohfa Tohfa [DownSub.com].srt,"01:11:45,000","01:11:48,500",you can not insult my husband,you can not insult my husband
english-tohfa-tohfa-downsub-com,1980s,/home/pratik/projects/GenderBias_TrendAnalysis/dataset/1980s/[English] Tohfa Tohfa [DownSub.com].srt,"01:11:49,000","01:11:52,500",anything What happened to all my wish.,anything What happened to all my wish.
english-tohfa-tohfa-downsub-com,1980s,/home/pratik/projects/GenderBias_TrendAnalysis/dataset/1980s/[English] Tohfa Tohfa [DownSub.com].srt,"01:11:53,000","01:11:55,250",He is wearing to me necklace.,He is wearing to me necklace.
english-tohfa-tohfa-downsub-com,1980s,/home/pratik/projects/GenderBias_TrendAnalysis/dataset/1980s/[English] Tohfa Tohfa [DownSub.com].srt,"01:11:55,750","01:12:00,000",I accepted the husband.,I accepted the husband.
english-tohfa-tohfa-downsub-com,1980s,/home/pratik/projects/GenderBias_TrendAnalysis/dataset/1980s/[English] Tohfa Tohfa [DownSub.com].srt,"01:12:00,500","01:12:04,500",But how did it come to be,But how did it come to be
english-tohfa-tohfa-downsub-com,1980s,/home/pratik/projects/GenderBias_TrendAnalysis/dataset/1980s/[English] Tohfa Tohfa [DownSub.com].srt,"01:12:05,000","01:12:05,750",Wanted to marry you,Wanted to marry you
english-tohfa-tohfa-downsub-com,1980s,/home/pratik/projects/GenderBias_TrendAnalysis/dataset/1980s/[English] Tohfa Tohfa [DownSub.com].srt,"01:12:06,250","01:12:10,500",then tell me,then tell me
english-tohfa-tohfa-downsub-com,1980s,/home/pratik/projects/GenderBias_TrendAnalysis/dataset/1980s/[English] Tohfa Tohfa [DownSub.com].srt,"01:12:11,000","01:12:16,500",Or do you think that I am permitted will,Or do you think that I am permitted will
english-tohfa-tohfa-downsub-com,1980s,/home/pratik/projects/GenderBias_TrendAnalysis/dataset/1980s/[English] Tohfa Tohfa [DownSub.com].srt,"01:12:17,000","01:12:19,958","Or, or he better than, for you could","Or, or he better than, for you could"
english-tohfa-tohfa-downsub-com,1980s,/home/pratik/projects/GenderBias_TrendAnalysis/dataset/1980s/[English] Tohfa Tohfa [DownSub.com].srt,"01:12:20,458","01:12:23,958","I, what was I dead?","I, what was I dead?"
english-tohfa-tohfa-downsub-com,1980s,/home/pratik/projects/GenderBias_TrendAnalysis/dataset/1980s/[English] Tohfa Tohfa [DownSub.com].srt,"01:12:26,375","01:12:27,500",Why did it?,Why did it?
english-tohfa-tohfa-downsub-com,1980s,/home/pratik/projects/GenderBias_TrendAnalysis/dataset/1980s/[English] Tohfa Tohfa [DownSub.com].srt,"01:12:28,000","01:12:28,958",Tell me what?,Tell me what?
english-tohfa-tohfa-downsub-com,1980s,/home/pratik/projects/GenderBias_TrendAnalysis/dataset/1980s/[English] Tohfa Tohfa [DownSub.com].srt,"01:12:29,458","01:12:32,958","I want an answer, I want an answer?","I want an answer, I want an answer?"
english-tohfa-tohfa-downsub-com,1980s,/home/pratik/projects/GenderBias_TrendAnalysis/dataset/1980s/[English] Tohfa Tohfa [DownSub.com].srt,"01:12:37,416","01:12:38,500",So are you crying,So are you crying
english-tohfa-tohfa-downsub-com,1980s,/home/pratik/projects/GenderBias_TrendAnalysis/dataset/1980s/[English] Tohfa Tohfa [DownSub.com].srt,"01:12:39,000","01:12:42,750",you did not stand my pleasure.,you did not stand my pleasure.
english-tohfa-tohfa-downsub-com,1980s,/home/pratik/projects/GenderBias_TrendAnalysis/dataset/1980s/[English] Tohfa Tohfa [DownSub.com].srt,"01:12:43,250","01:12:44,708",Are you jealous,Are you jealous
english-tohfa-tohfa-downsub-com,1980s,/home/pratik/projects/GenderBias_TrendAnalysis/dataset/1980s/[English] Tohfa Tohfa [DownSub.com].srt,"01:12:45,208","01:12:48,708","that before you i got married, right?","that before you i got married, right?"
english-tohfa-tohfa-downsub-com,1980s,/home/pratik/projects/GenderBias_TrendAnalysis/dataset/1980s/[English] Tohfa Tohfa [DownSub.com].srt,"01:12:54,000","01:12:59,166",But marriage is not a crib,But marriage is not a crib
english-tohfa-tohfa-downsub-com,1980s,/home/pratik/projects/GenderBias_TrendAnalysis/dataset/1980s/[English] Tohfa Tohfa [DownSub.com].srt,"01:12:59,666","01:13:03,083",It is every man's own personal matter,It is every man's own personal matter
english-tohfa-tohfa-downsub-com,1980s,/home/pratik/projects/GenderBias_TrendAnalysis/dataset/1980s/[English] Tohfa Tohfa [DownSub.com].srt,"01:13:03,583","01:13:07,833",And also the right to decide,And also the right to decide
english-tohfa-tohfa-downsub-com,1980s,/home/pratik/projects/GenderBias_TrendAnalysis/dataset/1980s/[English] Tohfa Tohfa [DownSub.com].srt,"01:13:08,333","01:13:10,000",And nobody anyone.,And nobody anyone.
english-tohfa-tohfa-downsub-com,1980s,/home/pratik/projects/GenderBias_TrendAnalysis/dataset/1980s/[English] Tohfa Tohfa [DownSub.com].srt,"01:13:10,500","01:13:16,458",No matter who you are and,No matter who you are and
english-tohfa-tohfa-downsub-com,1980s,/home/pratik/projects/GenderBias_TrendAnalysis/dataset/1980s/[English] Tohfa Tohfa [DownSub.com].srt,"01:13:16,958","01:13:20,875",what?,what?
english-tohfa-tohfa-downsub-com,1980s,/home/pratik/projects/GenderBias_TrendAnalysis/dataset/1980s/[English] Tohfa Tohfa [DownSub.com].srt,"01:13:21,375","01:13:23,166",What did you say?,What did you say?
english-tohfa-tohfa-downsub-com,1980s,/home/pratik/projects/GenderBias_TrendAnalysis/dataset/1980s/[English] Tohfa Tohfa [DownSub.com].srt,"01:13:23,666","01:13:28,500","You say to me, 'Who am I?","You say to me, 'Who am I?"
english-tohfa-tohfa-downsub-com,1980s,/home/pratik/projects/GenderBias_TrendAnalysis/dataset/1980s/[English] Tohfa Tohfa [DownSub.com].srt,"01:13:29,000","01:13:35,958","Lalita, do not you know who I am?","Lalita, do not you know who I am?"
english-tohfa-tohfa-downsub-com,1980s,/home/pratik/projects/GenderBias_TrendAnalysis/dataset/1980s/[English] Tohfa Tohfa [DownSub.com].srt,"01:13:36,458","01:13:40,083","Lalita, I'm the one","Lalita, I'm the one"
english-tohfa-tohfa-downsub-com,1980s,/home/pratik/projects/GenderBias_TrendAnalysis/dataset/1980s/[English] Tohfa Tohfa [DownSub.com].srt,"01:13:40,583","01:13:48,250",who you never feel short of your,who you never feel short of your
english-tohfa-tohfa-downsub-com,1980s,/home/pratik/projects/GenderBias_TrendAnalysis/dataset/1980s/[English] Tohfa Tohfa [DownSub.com].srt,"01:13:48,750","01:13:54,958","Lit up every single day of my life,","Lit up every single day of my life,"
english-tohfa-tohfa-downsub-com,1980s,/home/pratik/projects/GenderBias_TrendAnalysis/dataset/1980s/[English] Tohfa Tohfa [DownSub.com].srt,"01:13:55,458","01:13:59,875","Every dream of life, all desires","Every dream of life, all desires"
english-tohfa-tohfa-downsub-com,1980s,/home/pratik/projects/GenderBias_TrendAnalysis/dataset/1980s/[English] Tohfa Tohfa [DownSub.com].srt,"01:14:00,375","01:14:02,000",all you had used Wish,all you had used Wish
english-tohfa-tohfa-downsub-com,1980s,/home/pratik/projects/GenderBias_TrendAnalysis/dataset/1980s/[English] Tohfa Tohfa [DownSub.com].srt,"01:14:02,500","01:14:08,250",And asks me who I am?,And asks me who I am?
english-tohfa-tohfa-downsub-com,1980s,/home/pratik/projects/GenderBias_TrendAnalysis/dataset/1980s/[English] Tohfa Tohfa [DownSub.com].srt,"01:14:08,750","01:14:10,500",Okay.,Okay.
english-tohfa-tohfa-downsub-com,1980s,/home/pratik/projects/GenderBias_TrendAnalysis/dataset/1980s/[English] Tohfa Tohfa [DownSub.com].srt,"01:14:11,000","01:14:14,666","Today, I do not even know that,","Today, I do not even know that,"
english-tohfa-tohfa-downsub-com,1980s,/home/pratik/projects/GenderBias_TrendAnalysis/dataset/1980s/[English] Tohfa Tohfa [DownSub.com].srt,"01:14:15,166","01:14:16,333",Get out there,Get out there
english-tohfa-tohfa-downsub-com,1980s,/home/pratik/projects/GenderBias_TrendAnalysis/dataset/1980s/[English] Tohfa Tohfa [DownSub.com].srt,"01:14:16,833","01:14:19,166",Get out of here,Get out of here
english-tohfa-tohfa-downsub-com,1980s,/home/pratik/projects/GenderBias_TrendAnalysis/dataset/1980s/[English] Tohfa Tohfa [DownSub.com].srt,"01:14:19,666","01:14:22,625",Lalita meets your face.,Lalita meets your face.
english-tohfa-tohfa-downsub-com,1980s,/home/pratik/projects/GenderBias_TrendAnalysis/dataset/1980s/[English] Tohfa Tohfa [DownSub.com].srt,"01:14:23,125","01:14:25,875",Spirit have brought someone else.,Spirit have brought someone else.
english-tohfa-tohfa-downsub-com,1980s,/home/pratik/projects/GenderBias_TrendAnalysis/dataset/1980s/[English] Tohfa Tohfa [DownSub.com].srt,"01:14:26,375","01:14:30,500","She whom I loved Lalita,","She whom I loved Lalita,"
english-tohfa-tohfa-downsub-com,1980s,/home/pratik/projects/GenderBias_TrendAnalysis/dataset/1980s/[English] Tohfa Tohfa [DownSub.com].srt,"01:14:31,000","01:14:33,500","My sister,.","My sister,."
english-tohfa-tohfa-downsub-com,1980s,/home/pratik/projects/GenderBias_TrendAnalysis/dataset/1980s/[English] Tohfa Tohfa [DownSub.com].srt,"01:14:34,000","01:14:37,000",You're not her,You're not her
english-tohfa-tohfa-downsub-com,1980s,/home/pratik/projects/GenderBias_TrendAnalysis/dataset/1980s/[English] Tohfa Tohfa [DownSub.com].srt,"01:14:37,500","01:14:41,000",died Lalita.,died Lalita.
english-tohfa-tohfa-downsub-com,1980s,/home/pratik/projects/GenderBias_TrendAnalysis/dataset/1980s/[English] Tohfa Tohfa [DownSub.com].srt,"01:14:42,875","01:14:43,500","Get out of here,","Get out of here,"
english-tohfa-tohfa-downsub-com,1980s,/home/pratik/projects/GenderBias_TrendAnalysis/dataset/1980s/[English] Tohfa Tohfa [DownSub.com].srt,"01:14:44,000","01:14:46,791","get out of here,","get out of here,"
english-tohfa-tohfa-downsub-com,1980s,/home/pratik/projects/GenderBias_TrendAnalysis/dataset/1980s/[English] Tohfa Tohfa [DownSub.com].srt,"01:14:47,291","01:14:50,791",I have shed tears over the death,I have shed tears over the death
english-tohfa-tohfa-downsub-com,1980s,/home/pratik/projects/GenderBias_TrendAnalysis/dataset/1980s/[English] Tohfa Tohfa [DownSub.com].srt,"01:15:06,750","01:15:09,500","No, I will not ask you any questions.","No, I will not ask you any questions."
english-tohfa-tohfa-downsub-com,1980s,/home/pratik/projects/GenderBias_TrendAnalysis/dataset/1980s/[English] Tohfa Tohfa [DownSub.com].srt,"01:15:10,000","01:15:12,500",Ask nothing.,Ask nothing.
english-tohfa-tohfa-downsub-com,1980s,/home/pratik/projects/GenderBias_TrendAnalysis/dataset/1980s/[English] Tohfa Tohfa [DownSub.com].srt,"01:15:13,000","01:15:17,500","Because, when you do not","Because, when you do not"
english-tohfa-tohfa-downsub-com,1980s,/home/pratik/projects/GenderBias_TrendAnalysis/dataset/1980s/[English] Tohfa Tohfa [DownSub.com].srt,"01:15:18,000","01:15:20,500",So even though I am a non-person.,So even though I am a non-person.
english-tohfa-tohfa-downsub-com,1980s,/home/pratik/projects/GenderBias_TrendAnalysis/dataset/1980s/[English] Tohfa Tohfa [DownSub.com].srt,"01:15:21,000","01:15:23,500","But one thing is clear Listen, Lalita.","But one thing is clear Listen, Lalita."
english-tohfa-tohfa-downsub-com,1980s,/home/pratik/projects/GenderBias_TrendAnalysis/dataset/1980s/[English] Tohfa Tohfa [DownSub.com].srt,"01:15:24,000","01:15:25,791",I your place if I had a daughter,I your place if I had a daughter
english-tohfa-tohfa-downsub-com,1980s,/home/pratik/projects/GenderBias_TrendAnalysis/dataset/1980s/[English] Tohfa Tohfa [DownSub.com].srt,"01:15:26,291","01:15:27,875",", I would be dead by now to know him.",", I would be dead by now to know him."
english-tohfa-tohfa-downsub-com,1980s,/home/pratik/projects/GenderBias_TrendAnalysis/dataset/1980s/[English] Tohfa Tohfa [DownSub.com].srt,"01:15:28,375","01:15:31,208",And i would have even finished.,And i would have even finished.
english-tohfa-tohfa-downsub-com,1980s,/home/pratik/projects/GenderBias_TrendAnalysis/dataset/1980s/[English] Tohfa Tohfa [DownSub.com].srt,"01:15:31,708","01:15:32,916","Kamesh,","Kamesh,"
english-tohfa-tohfa-downsub-com,1980s,/home/pratik/projects/GenderBias_TrendAnalysis/dataset/1980s/[English] Tohfa Tohfa [DownSub.com].srt,"01:15:33,416","01:15:35,541",am responsible for all waste.,am responsible for all waste.
english-tohfa-tohfa-downsub-com,1980s,/home/pratik/projects/GenderBias_TrendAnalysis/dataset/1980s/[English] Tohfa Tohfa [DownSub.com].srt,"01:15:36,041","01:15:39,958",I long ago gave you your share of,I long ago gave you your share of
english-tohfa-tohfa-downsub-com,1980s,/home/pratik/projects/GenderBias_TrendAnalysis/dataset/1980s/[English] Tohfa Tohfa [DownSub.com].srt,"01:15:40,458","01:15:43,500",so that the child's life should be spared.,so that the child's life should be spared.
english-tohfa-tohfa-downsub-com,1980s,/home/pratik/projects/GenderBias_TrendAnalysis/dataset/1980s/[English] Tohfa Tohfa [DownSub.com].srt,"01:15:44,000","01:15:45,791",But too late.,But too late.
english-tohfa-tohfa-downsub-com,1980s,/home/pratik/projects/GenderBias_TrendAnalysis/dataset/1980s/[English] Tohfa Tohfa [DownSub.com].srt,"01:15:46,291","01:15:50,125","Still wants to, and that your blood, you","Still wants to, and that your blood, you"
