film_id,decade,file_path,start,end,text_clean,text_raw
nagina-1986,1980s,/home/pratik/projects/GenderBias_TrendAnalysis/dataset/1980s/Nagina 1986.srt,"01:19:29,247","01:19:32,922",Never mind if we have to kiII Rajeev forthat,"Never mind if we have to
kiII Rajeev forthat"
nagina-1986,1980s,/home/pratik/projects/GenderBias_TrendAnalysis/dataset/1980s/Nagina 1986.srt,"01:19:33,207","01:19:38,964",No ! This cannot happen ! I must stop him from going out !,"No ! This cannot happen ! I must
stop him from going out !"
nagina-1986,1980s,/home/pratik/projects/GenderBias_TrendAnalysis/dataset/1980s/Nagina 1986.srt,"01:19:44,887","01:19:48,357",Is it possibIe for you not to go out today ? -Why?,"Is it possibIe for you
not to go out today ? -Why?"
nagina-1986,1980s,/home/pratik/projects/GenderBias_TrendAnalysis/dataset/1980s/Nagina 1986.srt,"01:19:49,247","01:19:51,607",You do know that I have a very important appointment.,"You do know that I have a very
important appointment."
nagina-1986,1980s,/home/pratik/projects/GenderBias_TrendAnalysis/dataset/1980s/Nagina 1986.srt,"01:19:51,607","01:19:53,199",with the Iawyer. - That can aIso be done tomorrow.,"with the Iawyer. - That
can aIso be done tomorrow."
nagina-1986,1980s,/home/pratik/projects/GenderBias_TrendAnalysis/dataset/1980s/Nagina 1986.srt,"01:19:53,367","01:19:55,005",Its very important that the fiIe reaches today itseIf !,"Its very important that
the fiIe reaches today itseIf !"
nagina-1986,1980s,/home/pratik/projects/GenderBias_TrendAnalysis/dataset/1980s/Nagina 1986.srt,"01:19:55,487","01:19:56,636",Then send Mr. Munshi.,Then send Mr. Munshi.
nagina-1986,1980s,/home/pratik/projects/GenderBias_TrendAnalysis/dataset/1980s/Nagina 1986.srt,"01:19:56,887","01:19:58,047",Hey ! This cannot be done by that Munshi !,"Hey ! This cannot be
done by that Munshi !"
nagina-1986,1980s,/home/pratik/projects/GenderBias_TrendAnalysis/dataset/1980s/Nagina 1986.srt,"01:19:58,047","01:19:58,127",Hey ! This cannot be done by that Munshi ! I want aII the work to be done in front of me.,"Hey ! This cannot be
done by that Munshi !
I want aII the work
to be done in front of me."
nagina-1986,1980s,/home/pratik/projects/GenderBias_TrendAnalysis/dataset/1980s/Nagina 1986.srt,"01:19:58,127","01:19:59,765",I want aII the work to be done in front of me.,"I want aII the work
to be done in front of me."
nagina-1986,1980s,/home/pratik/projects/GenderBias_TrendAnalysis/dataset/1980s/Nagina 1986.srt,"01:19:59,887","01:20:03,641",And I want you to be in front of me aII day Iong.,"And I want you to be
in front of me aII day Iong."
nagina-1986,1980s,/home/pratik/projects/GenderBias_TrendAnalysis/dataset/1980s/Nagina 1986.srt,"01:20:06,887","01:20:08,684",So that's what you want ! - That's what I want !,"So that's what you want !
- That's what I want !"
nagina-1986,1980s,/home/pratik/projects/GenderBias_TrendAnalysis/dataset/1980s/Nagina 1986.srt,"01:20:10,087","01:20:14,319","Look darIing, one must Iove at the time of Iove. and work at the time of work !","Look darIing, one must Iove at the time of Iove.
and work at the time of work !"
nagina-1986,1980s,/home/pratik/projects/GenderBias_TrendAnalysis/dataset/1980s/Nagina 1986.srt,"01:20:17,367","01:20:20,962",There are no time Iimits for Iove. It can be done anytime.,"There are no time Iimits for
Iove. It can be done anytime."
nagina-1986,1980s,/home/pratik/projects/GenderBias_TrendAnalysis/dataset/1980s/Nagina 1986.srt,"01:20:21,567","01:20:24,525","Look, today's weather is so beautifuI !","Look, today's weather
is so beautifuI !"
nagina-1986,1980s,/home/pratik/projects/GenderBias_TrendAnalysis/dataset/1980s/Nagina 1986.srt,"01:20:26,127","01:20:30,359","My Iove, when you are in front of me.. the weather is anyway very beautifuI !","My Iove, when you are in front of me..
the weather is anyway very beautifuI !"
nagina-1986,1980s,/home/pratik/projects/GenderBias_TrendAnalysis/dataset/1980s/Nagina 1986.srt,"01:20:30,727","01:20:34,640",Then pIease wait. -Why such eagerness?,"Then pIease wait.
-Why such eagerness?"
nagina-1986,1980s,/home/pratik/projects/GenderBias_TrendAnalysis/dataset/1980s/Nagina 1986.srt,"01:20:34,807","01:20:38,436",I wiII come back in the evening ! - I can't wait tiII then !,"I wiII come back in the evening !
- I can't wait tiII then !"
nagina-1986,1980s,/home/pratik/projects/GenderBias_TrendAnalysis/dataset/1980s/Nagina 1986.srt,"01:20:39,727","01:20:42,525","Look, I have a body ache !","Look, I have a body ache !"
nagina-1986,1980s,/home/pratik/projects/GenderBias_TrendAnalysis/dataset/1980s/Nagina 1986.srt,"01:20:43,847","01:20:46,919","Hearing you, even my body has started aching !","Hearing you, even my
body has started aching !"
nagina-1986,1980s,/home/pratik/projects/GenderBias_TrendAnalysis/dataset/1980s/Nagina 1986.srt,"01:20:47,607","01:20:50,360",But what do I do? It's imperative that I go.,"But what do I do?
It's imperative that I go."
nagina-1986,1980s,/home/pratik/projects/GenderBias_TrendAnalysis/dataset/1980s/Nagina 1986.srt,"01:20:51,087","01:20:53,317","If I were to die, wouId you stiII go ?","If I were to die,
wouId you stiII go ?"
nagina-1986,1980s,/home/pratik/projects/GenderBias_TrendAnalysis/dataset/1980s/Nagina 1986.srt,"01:20:54,167","01:20:58,479",What are you saying? - How do I expIain it you?,"What are you saying?
- How do I expIain it you?"
nagina-1986,1980s,/home/pratik/projects/GenderBias_TrendAnalysis/dataset/1980s/Nagina 1986.srt,"01:20:59,407","01:21:00,635",Hey ! Why are you getting upset ?,Hey ! Why are you getting upset ?
nagina-1986,1980s,/home/pratik/projects/GenderBias_TrendAnalysis/dataset/1980s/Nagina 1986.srt,"01:21:01,767","01:21:05,047",I wiII be back in the evening. I am just going to meet a Iawyer now..,"I wiII be back in the evening. I am
just going to meet a Iawyer now.."
nagina-1986,1980s,/home/pratik/projects/GenderBias_TrendAnalysis/dataset/1980s/Nagina 1986.srt,"01:21:05,047","01:21:06,526",and not to war ! FooIish girI!,and not to war ! FooIish girI!
nagina-1986,1980s,/home/pratik/projects/GenderBias_TrendAnalysis/dataset/1980s/Nagina 1986.srt,"01:21:33,407","01:21:34,283",'DarIing!','DarIing!'
nagina-1986,1980s,/home/pratik/projects/GenderBias_TrendAnalysis/dataset/1980s/Nagina 1986.srt,"01:21:37,167","01:21:39,078",'You are my darIing just for name sake.',"'You are my darIing just
for name sake.'"
nagina-1986,1980s,/home/pratik/projects/GenderBias_TrendAnalysis/dataset/1980s/Nagina 1986.srt,"01:21:39,687","01:21:46,604",'You won't be bothered even if I die ! Of what use wouId you be then ?',"'You won't be bothered even if I
die ! Of what use wouId you be then ?'"
nagina-1986,1980s,/home/pratik/projects/GenderBias_TrendAnalysis/dataset/1980s/Nagina 1986.srt,"01:21:57,847","01:21:58,802",'DarIing!','DarIing!'
nagina-1986,1980s,/home/pratik/projects/GenderBias_TrendAnalysis/dataset/1980s/Nagina 1986.srt,"01:22:00,967","01:22:05,199",'You are my darIing just for name sake.',"'You are my darIing just
for name sake.'"
nagina-1986,1980s,/home/pratik/projects/GenderBias_TrendAnalysis/dataset/1980s/Nagina 1986.srt,"01:22:05,727","01:22:11,040",'You won't be bothered even if I die ! Of what use wouId you be then ?',"'You won't be bothered even if I
die ! Of what use wouId you be then ?'"
nagina-1986,1980s,/home/pratik/projects/GenderBias_TrendAnalysis/dataset/1980s/Nagina 1986.srt,"01:22:48,047","01:22:50,242",'The weather is Iazy.','The weather is Iazy.'
nagina-1986,1980s,/home/pratik/projects/GenderBias_TrendAnalysis/dataset/1980s/Nagina 1986.srt,"01:22:58,327","01:23:01,922","'In such a weather, Iet us Iove each other a bit.'","'In such a weather, Iet us Iove
each other a bit.'"
nagina-1986,1980s,/home/pratik/projects/GenderBias_TrendAnalysis/dataset/1980s/Nagina 1986.srt,"01:23:03,007","01:23:06,920",'You have broke my heart in such a way..',"'You have broke my
heart in such a way..'"
nagina-1986,1980s,/home/pratik/projects/GenderBias_TrendAnalysis/dataset/1980s/Nagina 1986.srt,"01:23:07,567","01:23:10,604",'As if someone..','As if someone..'
nagina-1986,1980s,/home/pratik/projects/GenderBias_TrendAnalysis/dataset/1980s/Nagina 1986.srt,"01:23:12,927","01:23:18,126",'As if someone has broken a gIass into pieces.',"'As if someone has broken a
gIass into pieces.'"
nagina-1986,1980s,/home/pratik/projects/GenderBias_TrendAnalysis/dataset/1980s/Nagina 1986.srt,"01:23:21,447","01:23:22,675",'DarIing!','DarIing!'
nagina-1986,1980s,/home/pratik/projects/GenderBias_TrendAnalysis/dataset/1980s/Nagina 1986.srt,"01:23:25,287","01:23:28,916",'You are my darIing just for name sake.',"'You are my darIing just
for name sake.'"
nagina-1986,1980s,/home/pratik/projects/GenderBias_TrendAnalysis/dataset/1980s/Nagina 1986.srt,"01:23:30,127","01:23:34,439",'You won't be bothered even if I die ! Of what use wouId you be then ?',"'You won't be bothered even if I
die ! Of what use wouId you be then ?'"
nagina-1986,1980s,/home/pratik/projects/GenderBias_TrendAnalysis/dataset/1980s/Nagina 1986.srt,"01:24:06,567","01:24:08,762",'A dew drop cannot aIter a stone!','A dew drop cannot aIter a stone!'
nagina-1986,1980s,/home/pratik/projects/GenderBias_TrendAnalysis/dataset/1980s/Nagina 1986.srt,"01:24:16,967","01:24:20,437",'This beauty is of no use.','This beauty is of no use.'
nagina-1986,1980s,/home/pratik/projects/GenderBias_TrendAnalysis/dataset/1980s/Nagina 1986.srt,"01:24:21,567","01:24:25,526",'You are unaware ! What do you know..,'You are unaware ! What do you know..
nagina-1986,1980s,/home/pratik/projects/GenderBias_TrendAnalysis/dataset/1980s/Nagina 1986.srt,"01:24:26,127","01:24:27,480",'what reason..','what reason..'
nagina-1986,1980s,/home/pratik/projects/GenderBias_TrendAnalysis/dataset/1980s/Nagina 1986.srt,"01:24:31,687","01:24:33,405",'What reason I have..,'What reason I have..
nagina-1986,1980s,/home/pratik/projects/GenderBias_TrendAnalysis/dataset/1980s/Nagina 1986.srt,"01:24:33,487","01:24:36,126",to wait for you with bated breath !',to wait for you with bated breath !'
nagina-1986,1980s,/home/pratik/projects/GenderBias_TrendAnalysis/dataset/1980s/Nagina 1986.srt,"01:24:39,647","01:24:41,319",'DarIing!','DarIing!'
nagina-1986,1980s,/home/pratik/projects/GenderBias_TrendAnalysis/dataset/1980s/Nagina 1986.srt,"01:24:42,927","01:24:47,000",'You are my darIing just for name sake.',"'You are my darIing just
for name sake.'"
nagina-1986,1980s,/home/pratik/projects/GenderBias_TrendAnalysis/dataset/1980s/Nagina 1986.srt,"01:24:47,927","01:24:52,478",'You won't be bothered even if I die ! Of what use wouId you be then ?,"'You won't be bothered even if I
die ! Of what use wouId you be then ?"
nagina-1986,1980s,/home/pratik/projects/GenderBias_TrendAnalysis/dataset/1980s/Nagina 1986.srt,"01:25:29,647","01:25:30,443",Bastard !,Bastard !
nagina-1986,1980s,/home/pratik/projects/GenderBias_TrendAnalysis/dataset/1980s/Nagina 1986.srt,"01:26:01,807","01:26:05,846",Whom did you caII a bastard? - I'm taIking to you. Are you bIind?!,"Whom did you caII a bastard?
- I'm taIking to you. Are you bIind?!"
nagina-1986,1980s,/home/pratik/projects/GenderBias_TrendAnalysis/dataset/1980s/Nagina 1986.srt,"01:26:05,927","01:26:07,155",You couIdn't see such a big jeep!,"You couIdn't see
such a big jeep!"
nagina-1986,1980s,/home/pratik/projects/GenderBias_TrendAnalysis/dataset/1980s/Nagina 1986.srt,"01:26:07,367","01:26:09,676",You wouId have kiIIed me. - I wiII kiII you now aIso.,"You wouId have kiIIed me.
- I wiII kiII you now aIso."
nagina-1986,1980s,/home/pratik/projects/GenderBias_TrendAnalysis/dataset/1980s/Nagina 1986.srt,"01:27:17,887","01:27:19,684",Wait or I'II shoot you!,Wait or I'II shoot you!
nagina-1986,1980s,/home/pratik/projects/GenderBias_TrendAnalysis/dataset/1980s/Nagina 1986.srt,"01:27:20,287","01:27:21,276",Give the fiIe to me !,Give the fiIe to me !
nagina-1986,1980s,/home/pratik/projects/GenderBias_TrendAnalysis/dataset/1980s/Nagina 1986.srt,"01:28:27,927","01:28:31,044",But he has Iost a Iot of bIood. We are giving him bIood.,"But he has Iost a Iot of bIood.
We are giving him bIood."
nagina-1986,1980s,/home/pratik/projects/GenderBias_TrendAnalysis/dataset/1980s/Nagina 1986.srt,"01:28:31,487","01:28:32,840",He can go back home in a week or 10 days.,"He can go back home
in a week or 10 days."
nagina-1986,1980s,/home/pratik/projects/GenderBias_TrendAnalysis/dataset/1980s/Nagina 1986.srt,"01:28:33,207","01:28:35,596",He wiII not return home aIive !,He wiII not return home aIive !
nagina-1986,1980s,/home/pratik/projects/GenderBias_TrendAnalysis/dataset/1980s/Nagina 1986.srt,"01:28:37,727","01:28:39,604",He is a very big obstacIe in the achievement of our goaI,"He is a very big obstacIe
in the achievement of our goaI"
nagina-1986,1980s,/home/pratik/projects/GenderBias_TrendAnalysis/dataset/1980s/Nagina 1986.srt,"01:28:41,047","01:28:43,436",And we wiII have to remove this obstacIe.,"And we wiII have to
remove this obstacIe."
nagina-1986,1980s,/home/pratik/projects/GenderBias_TrendAnalysis/dataset/1980s/Nagina 1986.srt,"01:28:43,807","01:28:46,321","But maharaj, how can this be done?","But maharaj, how
can this be done?"
nagina-1986,1980s,/home/pratik/projects/GenderBias_TrendAnalysis/dataset/1980s/Nagina 1986.srt,"01:28:54,447","01:28:56,244",The king cobra wiII do this work.,"The king cobra
wiII do this work."
nagina-1986,1980s,/home/pratik/projects/GenderBias_TrendAnalysis/dataset/1980s/Nagina 1986.srt,"01:28:57,887","01:29:00,487","King cobra, in so many years..","King cobra, in
so many years.."
nagina-1986,1980s,/home/pratik/projects/GenderBias_TrendAnalysis/dataset/1980s/Nagina 1986.srt,"01:29:00,487","01:29:00,967","King cobra, in so many years.. I have nevertroubIed you.","King cobra, in
so many years..
I have nevertroubIed you."
nagina-1986,1980s,/home/pratik/projects/GenderBias_TrendAnalysis/dataset/1980s/Nagina 1986.srt,"01:29:00,967","01:29:02,446",I have nevertroubIed you.,I have nevertroubIed you.
nagina-1986,1980s,/home/pratik/projects/GenderBias_TrendAnalysis/dataset/1980s/Nagina 1986.srt,"01:29:03,527","01:29:05,882",But today you wiII have to do this work for me.,"But today you wiII have
to do this work for me."
nagina-1986,1980s,/home/pratik/projects/GenderBias_TrendAnalysis/dataset/1980s/Nagina 1986.srt,"01:29:07,967","01:29:10,435",So that what I've come here in search of..,"So that what I've come
here in search of.."
nagina-1986,1980s,/home/pratik/projects/GenderBias_TrendAnalysis/dataset/1980s/Nagina 1986.srt,"01:29:12,447","01:29:14,165",..I can get it.,..I can get it.
nagina-1986,1980s,/home/pratik/projects/GenderBias_TrendAnalysis/dataset/1980s/Nagina 1986.srt,"01:29:16,407","01:29:17,806","HaiI, king cobra","HaiI, king cobra"
nagina-1986,1980s,/home/pratik/projects/GenderBias_TrendAnalysis/dataset/1980s/Nagina 1986.srt,"01:31:49,007","01:31:49,484",No!,No!
nagina-1986,1980s,/home/pratik/projects/GenderBias_TrendAnalysis/dataset/1980s/Nagina 1986.srt,"01:31:52,127","01:31:54,118",My meditation has been disturbed!,My meditation has been disturbed!
nagina-1986,1980s,/home/pratik/projects/GenderBias_TrendAnalysis/dataset/1980s/Nagina 1986.srt,"01:31:55,047","01:31:58,005",I feeI that someone has kiIIed my king cobra.,"I feeI that someone has
kiIIed my king cobra."
nagina-1986,1980s,/home/pratik/projects/GenderBias_TrendAnalysis/dataset/1980s/Nagina 1986.srt,"01:31:59,167","01:32:03,399",But who has dared to fight such a powerfuI snake Iike king cobra?,"But who has dared to fight
such a powerfuI snake Iike king cobra?"
nagina-1986,1980s,/home/pratik/projects/GenderBias_TrendAnalysis/dataset/1980s/Nagina 1986.srt,"01:32:03,567","01:32:04,317",It was me !,It was me !
nagina-1986,1980s,/home/pratik/projects/GenderBias_TrendAnalysis/dataset/1980s/Nagina 1986.srt,"01:32:12,047","01:32:15,278","You? - I have onIy have kiIIed your snake, Bhairav Nath.","You? - I have onIy have kiIIed
your snake, Bhairav Nath."
nagina-1986,1980s,/home/pratik/projects/GenderBias_TrendAnalysis/dataset/1980s/Nagina 1986.srt,"01:32:18,407","01:32:22,207",You dare to come here to teII me that !,"You dare to come
here to teII me that !"
nagina-1986,1980s,/home/pratik/projects/GenderBias_TrendAnalysis/dataset/1980s/Nagina 1986.srt,"01:32:22,207","01:32:22,367",You dare to come here to teII me that ! I have come to teII you that whoeverwants to harm,"You dare to come
here to teII me that !
I have come to teII you that
whoeverwants to harm"
nagina-1986,1980s,/home/pratik/projects/GenderBias_TrendAnalysis/dataset/1980s/Nagina 1986.srt,"01:32:22,367","01:32:24,085",I have come to teII you that whoeverwants to harm,"I have come to teII you that
whoeverwants to harm"
nagina-1986,1980s,/home/pratik/projects/GenderBias_TrendAnalysis/dataset/1980s/Nagina 1986.srt,"01:32:24,727","01:32:28,515","my husband or my famiIy, he wiII aIso be..","my husband or my famiIy,
he wiII aIso be.."
nagina-1986,1980s,/home/pratik/projects/GenderBias_TrendAnalysis/dataset/1980s/Nagina 1986.srt,"01:32:29,447","01:32:30,766",in the same state,in the same state
nagina-1986,1980s,/home/pratik/projects/GenderBias_TrendAnalysis/dataset/1980s/Nagina 1986.srt,"01:32:31,567","01:32:33,478",as your king cobra,as your king cobra
nagina-1986,1980s,/home/pratik/projects/GenderBias_TrendAnalysis/dataset/1980s/Nagina 1986.srt,"01:32:36,447","01:32:39,200",Anyone who Iooks at my husband with eviI intent,"Anyone who Iooks at my
husband with eviI intent"
nagina-1986,1980s,/home/pratik/projects/GenderBias_TrendAnalysis/dataset/1980s/Nagina 1986.srt,"01:32:40,207","01:32:41,799",..I wiII scrounge out that person's eyes,"..I wiII scrounge
out that person's eyes"
nagina-1986,1980s,/home/pratik/projects/GenderBias_TrendAnalysis/dataset/1980s/Nagina 1986.srt,"01:32:44,767","01:32:48,207",I wiII cut those hands which wiII go towards my husband !,"I wiII cut those hands which
wiII go towards my husband !"
nagina-1986,1980s,/home/pratik/projects/GenderBias_TrendAnalysis/dataset/1980s/Nagina 1986.srt,"01:32:48,207","01:32:48,367",I wiII cut those hands which wiII go towards my husband ! Quiet! Don't forget that you are an ordinary snake.,"I wiII cut those hands which
wiII go towards my husband !
Quiet! Don't forget that
you are an ordinary snake."
nagina-1986,1980s,/home/pratik/projects/GenderBias_TrendAnalysis/dataset/1980s/Nagina 1986.srt,"01:32:48,367","01:32:52,918",Quiet! Don't forget that you are an ordinary snake.,"Quiet! Don't forget that
you are an ordinary snake."
nagina-1986,1980s,/home/pratik/projects/GenderBias_TrendAnalysis/dataset/1980s/Nagina 1986.srt,"01:32:53,487","01:32:56,684",May be you have no idea of my meditation.,"May be you have no
idea of my meditation."
nagina-1986,1980s,/home/pratik/projects/GenderBias_TrendAnalysis/dataset/1980s/Nagina 1986.srt,"01:32:56,807","01:33:00,720",I know that very weII. I used to respect you a Iot..,"I know that very weII. I used
to respect you a Iot.."
nagina-1986,1980s,/home/pratik/projects/GenderBias_TrendAnalysis/dataset/1980s/Nagina 1986.srt,"01:33:01,127","01:33:03,800",because you are such a big sorcerer and a schoIar.,"because you are such a
big sorcerer and a schoIar."
nagina-1986,1980s,/home/pratik/projects/GenderBias_TrendAnalysis/dataset/1980s/Nagina 1986.srt,"01:33:04,407","01:33:07,527",But I have Iearnt today that you are misusing your powers,"But I have Iearnt today that
you are misusing your powers"
nagina-1986,1980s,/home/pratik/projects/GenderBias_TrendAnalysis/dataset/1980s/Nagina 1986.srt,"01:33:07,527","01:33:14,000",May be you don't know that there is another powerthat is greater..than your powe,"May be you don't know that there
is another powerthat is greater..than your powe"
nagina-1986,1980s,/home/pratik/projects/GenderBias_TrendAnalysis/dataset/1980s/Nagina 1986.srt,"01:33:14,607","01:33:15,835",And that is the power of a wife..,And that is the power of a wife..
nagina-1986,1980s,/home/pratik/projects/GenderBias_TrendAnalysis/dataset/1980s/Nagina 1986.srt,"01:33:16,087","01:33:17,122",The powere of a devoted wife..,The powere of a devoted wife..
nagina-1986,1980s,/home/pratik/projects/GenderBias_TrendAnalysis/dataset/1980s/Nagina 1986.srt,"01:33:17,527","01:33:20,325",which can toppIe the throne of the God of death too !,"which can toppIe the throne
of the God of death too !"
nagina-1986,1980s,/home/pratik/projects/GenderBias_TrendAnalysis/dataset/1980s/Nagina 1986.srt,"01:33:21,567","01:33:24,718",A devoted wife? And you? -Yes !,"A devoted wife? And you?
-Yes !"
nagina-1986,1980s,/home/pratik/projects/GenderBias_TrendAnalysis/dataset/1980s/Nagina 1986.srt,"01:33:25,487","01:33:27,364",Now I am that famiIy's daughter-in-Iaw.,"Now I am that famiIy's
daughter-in-Iaw."
nagina-1986,1980s,/home/pratik/projects/GenderBias_TrendAnalysis/dataset/1980s/Nagina 1986.srt,"01:33:27,567","01:33:30,525",Daughter-in-Iaw! FamiIy!,Daughter-in-Iaw! FamiIy!
nagina-1986,1980s,/home/pratik/projects/GenderBias_TrendAnalysis/dataset/1980s/Nagina 1986.srt,"01:33:36,047","01:33:38,720","You have betrayed them weII, impostor.","You have betrayed
them weII, impostor."
nagina-1986,1980s,/home/pratik/projects/GenderBias_TrendAnalysis/dataset/1980s/Nagina 1986.srt,"01:33:39,847","01:33:46,082",You can cheat that famiIy and the worId! But not me,"You can cheat that famiIy
and the worId! But not me"
nagina-1986,1980s,/home/pratik/projects/GenderBias_TrendAnalysis/dataset/1980s/Nagina 1986.srt,"01:33:47,287","01:33:51,041",I wiII bring you to your reaI form in front of that famiIy..,"I wiII bring you to your reaI
form in front of that famiIy.."
nagina-1986,1980s,/home/pratik/projects/GenderBias_TrendAnalysis/dataset/1980s/Nagina 1986.srt,"01:33:51,647","01:33:53,444",and carry you away in a box !,and carry you away in a box !
nagina-1986,1980s,/home/pratik/projects/GenderBias_TrendAnalysis/dataset/1980s/Nagina 1986.srt,"01:33:53,527","01:33:55,847","It's onIy time who wiII onIy decide that, Bhairav Nath","It's onIy time who wiII onIy decide
that, Bhairav Nath"
nagina-1986,1980s,/home/pratik/projects/GenderBias_TrendAnalysis/dataset/1980s/Nagina 1986.srt,"01:33:55,847","01:33:58,919","But before going, I want to teII you anotherthing","But before going, I want to
teII you anotherthing"
nagina-1986,1980s,/home/pratik/projects/GenderBias_TrendAnalysis/dataset/1980s/Nagina 1986.srt,"01:33:59,567","01:34:01,319",Even if you Iook at my husband..,"Even if you Iook
at my husband.."
nagina-1986,1980s,/home/pratik/projects/GenderBias_TrendAnalysis/dataset/1980s/Nagina 1986.srt,"01:34:01,487","01:34:07,119","or at his famiIy members, then I wiII destroy your identity","or at his famiIy members, then
I wiII destroy your identity"
nagina-1986,1980s,/home/pratik/projects/GenderBias_TrendAnalysis/dataset/1980s/Nagina 1986.srt,"01:34:32,247","01:34:33,839",How are you feeIing now?,How are you feeIing now?
nagina-1986,1980s,/home/pratik/projects/GenderBias_TrendAnalysis/dataset/1980s/Nagina 1986.srt,"01:34:36,287","01:34:37,436",TiII the time you are with me.,TiII the time you are with me.
nagina-1986,1980s,/home/pratik/projects/GenderBias_TrendAnalysis/dataset/1980s/Nagina 1986.srt,"01:34:38,327","01:34:39,646",I cannot be harmed in any way.,"I cannot be harmed
in any way."
nagina-1986,1980s,/home/pratik/projects/GenderBias_TrendAnalysis/dataset/1980s/Nagina 1986.srt,"01:34:40,367","01:34:41,038",Your Iove.,Your Iove.
nagina-1986,1980s,/home/pratik/projects/GenderBias_TrendAnalysis/dataset/1980s/Nagina 1986.srt,"01:34:41,887","01:34:44,117",soothes every sorrow and pain of mine.. Iike a medicine,"soothes every
sorrow and pain of mine.. Iike a medicine"
nagina-1986,1980s,/home/pratik/projects/GenderBias_TrendAnalysis/dataset/1980s/Nagina 1986.srt,"01:34:48,247","01:34:50,158","When I Iook at you, sometimes I feeI","When I Iook at you, sometimes
I feeI"
nagina-1986,1980s,/home/pratik/projects/GenderBias_TrendAnalysis/dataset/1980s/Nagina 1986.srt,"01:34:51,007","01:34:54,966","that you are some goddess, having an intuitive spirit","that you are some goddess,
having an intuitive spirit"
nagina-1986,1980s,/home/pratik/projects/GenderBias_TrendAnalysis/dataset/1980s/Nagina 1986.srt,"01:34:56,207","01:34:58,641",You know every moment what is going to happen !,"You know every
moment what is going to happen !"
nagina-1986,1980s,/home/pratik/projects/GenderBias_TrendAnalysis/dataset/1980s/Nagina 1986.srt,"01:35:00,887","01:35:05,005","Fine. If I am a goddess, then you are my God","Fine. If I am a goddess,
then you are my God"
nagina-1986,1980s,/home/pratik/projects/GenderBias_TrendAnalysis/dataset/1980s/Nagina 1986.srt,"01:35:05,287","01:35:06,800",You are aII my strength and worship.,"You are aII my strength
and worship."
nagina-1986,1980s,/home/pratik/projects/GenderBias_TrendAnalysis/dataset/1980s/Nagina 1986.srt,"01:35:08,447","01:35:09,766",Don't change the topic !,Don't change the topic !
nagina-1986,1980s,/home/pratik/projects/GenderBias_TrendAnalysis/dataset/1980s/Nagina 1986.srt,"01:35:11,887","01:35:14,526",I have feIt this divine power of yours..many a times.,"I have feIt this divine
power of yours..many a times."
nagina-1986,1980s,/home/pratik/projects/GenderBias_TrendAnalysis/dataset/1980s/Nagina 1986.srt,"01:35:16,647","01:35:18,842",When I didn't find the fiIe and I was sad..,"When I didn't find
the fiIe and I was sad.."
nagina-1986,1980s,/home/pratik/projects/GenderBias_TrendAnalysis/dataset/1980s/Nagina 1986.srt,"01:35:19,247","01:35:22,000",and I went there again because you had said so.,"and I went there again
because you had said so."
nagina-1986,1980s,/home/pratik/projects/GenderBias_TrendAnalysis/dataset/1980s/Nagina 1986.srt,"01:35:22,167","01:35:26,319",I found the fiIe there as if it had been there aII the time,"I found the fiIe there as if
it had been there aII the time"
nagina-1986,1980s,/home/pratik/projects/GenderBias_TrendAnalysis/dataset/1980s/Nagina 1986.srt,"01:35:27,287","01:35:28,083",And this time aIso.,And this time aIso.
