film_id,decade,file_path,start,end,text_clean,text_raw
nagina-1986,1980s,/home/pratik/projects/GenderBias_TrendAnalysis/dataset/1980s/Nagina 1986.srt,"00:30:45,167","00:30:48,318",I feeI that some story of my past is hidden in those ruins.,"I feeI that some story of my
past is hidden in those ruins."
nagina-1986,1980s,/home/pratik/projects/GenderBias_TrendAnalysis/dataset/1980s/Nagina 1986.srt,"00:30:49,247","00:30:50,362",That girI was aIso saying the same thing.,"That girI was aIso saying
the same thing."
nagina-1986,1980s,/home/pratik/projects/GenderBias_TrendAnalysis/dataset/1980s/Nagina 1986.srt,"00:30:51,127","00:30:53,436",But I don't know why is mother hiding aII this from me !,"But I don't know why is mother
hiding aII this from me !"
nagina-1986,1980s,/home/pratik/projects/GenderBias_TrendAnalysis/dataset/1980s/Nagina 1986.srt,"00:30:53,967","00:30:57,516",It may be anything ! I feeI Iike meeting that girI..again and again.,"It may be anything ! I feeI Iike
meeting that girI..again and again."
nagina-1986,1980s,/home/pratik/projects/GenderBias_TrendAnalysis/dataset/1980s/Nagina 1986.srt,"00:31:01,727","00:31:06,847","Young master, accept these fIowers. - These fIowers!","Young master, accept these
fIowers. - These fIowers!"
nagina-1986,1980s,/home/pratik/projects/GenderBias_TrendAnalysis/dataset/1980s/Nagina 1986.srt,"00:31:07,047","00:31:08,639","No, not this pIant !","No, not this pIant !"
nagina-1986,1980s,/home/pratik/projects/GenderBias_TrendAnalysis/dataset/1980s/Nagina 1986.srt,"00:31:09,647","00:31:12,887",Accept this vaIIey's smaIIest and the most beautifuI gift !,"Accept this vaIIey's smaIIest
and the most beautifuI gift !"
nagina-1986,1980s,/home/pratik/projects/GenderBias_TrendAnalysis/dataset/1980s/Nagina 1986.srt,"00:31:12,887","00:31:13,207","Accept this vaIIey's smaIIest and the most beautifuI gift ! Thank you, Mr. Munshi - Mention not ! - Mr. Munshi. -Yes?","Accept this vaIIey's smaIIest
and the most beautifuI gift !
Thank you, Mr. Munshi - Mention
not ! - Mr. Munshi. -Yes?"
nagina-1986,1980s,/home/pratik/projects/GenderBias_TrendAnalysis/dataset/1980s/Nagina 1986.srt,"00:31:13,207","00:31:17,246","Thank you, Mr. Munshi - Mention not ! - Mr. Munshi. -Yes?","Thank you, Mr. Munshi - Mention
not ! - Mr. Munshi. -Yes?"
nagina-1986,1980s,/home/pratik/projects/GenderBias_TrendAnalysis/dataset/1980s/Nagina 1986.srt,"00:31:17,327","00:31:18,919",Where do you stay?,Where do you stay?
nagina-1986,1980s,/home/pratik/projects/GenderBias_TrendAnalysis/dataset/1980s/Nagina 1986.srt,"00:31:19,127","00:31:21,721",In my house. You are new here.,In my house. You are new here.
nagina-1986,1980s,/home/pratik/projects/GenderBias_TrendAnalysis/dataset/1980s/Nagina 1986.srt,"00:31:21,887","00:31:26,756","of those mountains, there is a smaII viIIage","of those mountains, there
is a smaII viIIage"
nagina-1986,1980s,/home/pratik/projects/GenderBias_TrendAnalysis/dataset/1980s/Nagina 1986.srt,"00:31:27,047","00:31:31,325",There is a..smaII Iake there. -And on the banks of that smaII Iake..,"There is a..smaII Iake there. -And on the
banks of that smaII Iake.."
nagina-1986,1980s,/home/pratik/projects/GenderBias_TrendAnalysis/dataset/1980s/Nagina 1986.srt,"00:31:31,407","00:31:33,238",..there is a tempIe. -Yes. In that tempIe's Iane..,"..there is a tempIe.
-Yes. In that tempIe's Iane.."
nagina-1986,1980s,/home/pratik/projects/GenderBias_TrendAnalysis/dataset/1980s/Nagina 1986.srt,"00:31:33,367","00:31:37,440",".the house whose mirrors are aII broken, that is...my house",".the house whose mirrors
are aII broken, that is...my house"
nagina-1986,1980s,/home/pratik/projects/GenderBias_TrendAnalysis/dataset/1980s/Nagina 1986.srt,"00:31:37,527","00:31:39,167",So you that's where you stay !,So you that's where you stay !
nagina-1986,1980s,/home/pratik/projects/GenderBias_TrendAnalysis/dataset/1980s/Nagina 1986.srt,"00:31:39,167","00:31:39,527","So you that's where you stay ! Yes, I stay there onIy.","So you that's where you stay !
Yes, I stay there onIy."
nagina-1986,1980s,/home/pratik/projects/GenderBias_TrendAnalysis/dataset/1980s/Nagina 1986.srt,"00:31:39,527","00:31:40,846","Yes, I stay there onIy.","Yes, I stay there onIy."
nagina-1986,1980s,/home/pratik/projects/GenderBias_TrendAnalysis/dataset/1980s/Nagina 1986.srt,"00:31:42,247","00:31:44,681","Mr. Munshi, teII me one thing. -Yes, ask me.","Mr. Munshi, teII me one thing.
-Yes, ask me."
nagina-1986,1980s,/home/pratik/projects/GenderBias_TrendAnalysis/dataset/1980s/Nagina 1986.srt,"00:31:44,887","00:31:48,038","The viIage where you stay, you must be knowing aII your neighbors.","The viIage where you stay, you must
be knowing aII your neighbors."
nagina-1986,1980s,/home/pratik/projects/GenderBias_TrendAnalysis/dataset/1980s/Nagina 1986.srt,"00:31:48,167","00:31:49,919","Yes, they know me. And I know them","Yes, they know me.
And I know them"
nagina-1986,1980s,/home/pratik/projects/GenderBias_TrendAnalysis/dataset/1980s/Nagina 1986.srt,"00:31:50,047","00:31:54,837","So you must be aIso knowing her ? -Yes, I definiteIy know her.But whom?","So you must be aIso knowing her ?
-Yes, I definiteIy know her.But whom?"
nagina-1986,1980s,/home/pratik/projects/GenderBias_TrendAnalysis/dataset/1980s/Nagina 1986.srt,"00:31:54,927","00:31:59,284",Her.. She stays in your viIIage. She's very...,"Her.. She stays
in your viIIage. She's very..."
nagina-1986,1980s,/home/pratik/projects/GenderBias_TrendAnalysis/dataset/1980s/Nagina 1986.srt,"00:32:01,527","00:32:05,007",Some othertime ! -Who is this 'some othertime'?,"Some othertime !
-Who is this 'some othertime'?"
nagina-1986,1980s,/home/pratik/projects/GenderBias_TrendAnalysis/dataset/1980s/Nagina 1986.srt,"00:32:05,007","00:32:05,407",Some othertime ! -Who is this 'some othertime'? There's no one in my viIIage by the name of 'some othertime !,"Some othertime !
-Who is this 'some othertime'?
There's no one in my viIIage by the
name of 'some othertime !"
nagina-1986,1980s,/home/pratik/projects/GenderBias_TrendAnalysis/dataset/1980s/Nagina 1986.srt,"00:32:05,407","00:32:07,477",There's no one in my viIIage by the name of 'some othertime !,"There's no one in my viIIage by the
name of 'some othertime !"
nagina-1986,1980s,/home/pratik/projects/GenderBias_TrendAnalysis/dataset/1980s/Nagina 1986.srt,"00:32:11,007","00:32:14,204","Young master! -What is the matter, Mr. Munshi ?","Young master!
-What is the matter, Mr. Munshi ?"
nagina-1986,1980s,/home/pratik/projects/GenderBias_TrendAnalysis/dataset/1980s/Nagina 1986.srt,"00:32:14,727","00:32:15,967",Engrossed in your 'some othertime'..,"Engrossed in your
'some othertime'.."
nagina-1986,1980s,/home/pratik/projects/GenderBias_TrendAnalysis/dataset/1980s/Nagina 1986.srt,"00:32:15,967","00:32:16,687",Engrossed in your 'some othertime'.. I forgot my present matter. This Munshi's wife..has invited you to her house.,"Engrossed in your
'some othertime'..
I forgot my present matter.
This Munshi's wife..has invited you to her house."
nagina-1986,1980s,/home/pratik/projects/GenderBias_TrendAnalysis/dataset/1980s/Nagina 1986.srt,"00:32:16,687","00:32:21,442",I forgot my present matter. This Munshi's wife..has invited you to her house.,"I forgot my present matter.
This Munshi's wife..has invited you to her house."
nagina-1986,1980s,/home/pratik/projects/GenderBias_TrendAnalysis/dataset/1980s/Nagina 1986.srt,"00:32:21,567","00:32:23,876",Invited me? -Yes. - Forwhat?,"Invited me?
-Yes. - Forwhat?"
nagina-1986,1980s,/home/pratik/projects/GenderBias_TrendAnalysis/dataset/1980s/Nagina 1986.srt,"00:32:23,967","00:32:25,767",Its my death anniversary.,Its my death anniversary.
nagina-1986,1980s,/home/pratik/projects/GenderBias_TrendAnalysis/dataset/1980s/Nagina 1986.srt,"00:32:25,767","00:32:26,756","but for me, its an anniversary","but for me, its an anniversary"
nagina-1986,1980s,/home/pratik/projects/GenderBias_TrendAnalysis/dataset/1980s/Nagina 1986.srt,"00:32:27,607","00:32:30,967","Yes. Forthe sake of saying it, its my marriage anniversary..","Yes. Forthe sake of saying it,
its my marriage anniversary.."
nagina-1986,1980s,/home/pratik/projects/GenderBias_TrendAnalysis/dataset/1980s/Nagina 1986.srt,"00:32:30,967","00:32:31,367","Yes. Forthe sake of saying it, its my marriage anniversary.. but for me, its an anniversary of destruction !","Yes. Forthe sake of saying it,
its my marriage anniversary..
but for me, its an anniversary
of destruction !"
nagina-1986,1980s,/home/pratik/projects/GenderBias_TrendAnalysis/dataset/1980s/Nagina 1986.srt,"00:32:31,367","00:32:33,085","but for me, its an anniversary of destruction !","but for me, its an anniversary
of destruction !"
nagina-1986,1980s,/home/pratik/projects/GenderBias_TrendAnalysis/dataset/1980s/Nagina 1986.srt,"00:32:33,207","00:32:36,438","The day I got married, I had died that day itseIf !","The day I got married,
I had died that day itseIf !"
nagina-1986,1980s,/home/pratik/projects/GenderBias_TrendAnalysis/dataset/1980s/Nagina 1986.srt,"00:32:36,607","00:32:42,318","From that day tiII today, I've been hiding.. my Iiving corpse beneath this EngIish coat..","From that day tiII today, I've been hiding..
my Iiving corpse beneath this EngIish coat.."
nagina-1986,1980s,/home/pratik/projects/GenderBias_TrendAnalysis/dataset/1980s/Nagina 1986.srt,"00:32:42,447","00:32:45,917",..and wandering about in the Ianes of the viIIage,"..and wandering about in
the Ianes of the viIIage"
nagina-1986,1980s,/home/pratik/projects/GenderBias_TrendAnalysis/dataset/1980s/Nagina 1986.srt,"00:32:46,247","00:32:48,556","Come on, Mr. Munshi. Don't say such things!","Come on, Mr. Munshi. Don't say such things!"
nagina-1986,1980s,/home/pratik/projects/GenderBias_TrendAnalysis/dataset/1980s/Nagina 1986.srt,"00:32:48,767","00:32:50,287","By the way, when is your marriage anniversary?","By the way, when is your
marriage anniversary?"
nagina-1986,1980s,/home/pratik/projects/GenderBias_TrendAnalysis/dataset/1980s/Nagina 1986.srt,"00:32:50,287","00:32:50,687","That inauspicious day is tomorrow itseIf. By the way, when is your marriage anniversary?","That inauspicious day
is tomorrow itseIf.
By the way, when is your
marriage anniversary?"
nagina-1986,1980s,/home/pratik/projects/GenderBias_TrendAnalysis/dataset/1980s/Nagina 1986.srt,"00:32:50,687","00:32:51,967",That inauspicious day is tomorrow itseIf.,"That inauspicious day
is tomorrow itseIf."
nagina-1986,1980s,/home/pratik/projects/GenderBias_TrendAnalysis/dataset/1980s/Nagina 1986.srt,"00:32:51,967","00:32:52,887","That inauspicious day is tomorrow itseIf. But if you come, that day wiII become auspicious. - Me?","That inauspicious day
is tomorrow itseIf.
But if you come, that day
wiII become auspicious. - Me?"
nagina-1986,1980s,/home/pratik/projects/GenderBias_TrendAnalysis/dataset/1980s/Nagina 1986.srt,"00:32:52,887","00:32:55,401","But if you come, that day wiII become auspicious. - Me?","But if you come, that day
wiII become auspicious. - Me?"
nagina-1986,1980s,/home/pratik/projects/GenderBias_TrendAnalysis/dataset/1980s/Nagina 1986.srt,"00:32:55,567","00:32:59,446","Yes. If you come, then this poor man wiII be respected more. Many peopIe wiII come.","Yes. If you come, then this poor man
wiII be respected more. Many peopIe wiII come."
nagina-1986,1980s,/home/pratik/projects/GenderBias_TrendAnalysis/dataset/1980s/Nagina 1986.srt,"00:32:59,527","00:33:02,485",You wiII be taIked about. I wiII have to spend more money.,"You wiII be taIked about. I
wiII have to spend more money."
nagina-1986,1980s,/home/pratik/projects/GenderBias_TrendAnalysis/dataset/1980s/Nagina 1986.srt,"00:33:02,607","00:33:05,565","More money wouId be spent, but it wiII be fun","More money wouId be spent,
but it wiII be fun"
nagina-1986,1980s,/home/pratik/projects/GenderBias_TrendAnalysis/dataset/1980s/Nagina 1986.srt,"00:33:05,687","00:33:07,120",Every person of the viIIage wiII come..,Every person of the viIIage wiII come..
nagina-1986,1980s,/home/pratik/projects/GenderBias_TrendAnalysis/dataset/1980s/Nagina 1986.srt,"00:33:07,247","00:33:10,080","man and woman, every unmarried girI wiII come..","man and woman, every unmarried girI wiII come.."
nagina-1986,1980s,/home/pratik/projects/GenderBias_TrendAnalysis/dataset/1980s/Nagina 1986.srt,"00:33:10,247","00:33:12,124",aII the IoveIy girIs wiII come.,aII the IoveIy girIs wiII come.
nagina-1986,1980s,/home/pratik/projects/GenderBias_TrendAnalysis/dataset/1980s/Nagina 1986.srt,"00:33:12,247","00:33:14,681",So even Rajni wiII sureIy come there !,"So even Rajni
wiII sureIy come there !"
nagina-1986,1980s,/home/pratik/projects/GenderBias_TrendAnalysis/dataset/1980s/Nagina 1986.srt,"00:33:20,047","00:33:23,167",Hey Khushmizaz Khan ! Why are you pIaying this sad music..,"Hey Khushmizaz Khan ! Why are
you pIaying this sad music.."
nagina-1986,1980s,/home/pratik/projects/GenderBias_TrendAnalysis/dataset/1980s/Nagina 1986.srt,"00:33:23,167","00:33:23,887",Hey Khushmizaz Khan ! Why are you pIaying this sad music.. on this happy occasion? -What do I do Mr. Munshi ?,"Hey Khushmizaz Khan ! Why are
you pIaying this sad music..
on this happy occasion?
-What do I do Mr. Munshi ?"
nagina-1986,1980s,/home/pratik/projects/GenderBias_TrendAnalysis/dataset/1980s/Nagina 1986.srt,"00:33:23,887","00:33:25,878",on this happy occasion? -What do I do Mr. Munshi ?,"on this happy occasion?
-What do I do Mr. Munshi ?"
nagina-1986,1980s,/home/pratik/projects/GenderBias_TrendAnalysis/dataset/1980s/Nagina 1986.srt,"00:33:26,087","00:33:27,964",I wiII not get anything here.,I wiII not get anything here.
nagina-1986,1980s,/home/pratik/projects/GenderBias_TrendAnalysis/dataset/1980s/Nagina 1986.srt,"00:33:28,167","00:33:31,318",OnIy the wrong notes wiII be pIayed free of cost.,"OnIy the wrong notes wiII
be pIayed free of cost."
nagina-1986,1980s,/home/pratik/projects/GenderBias_TrendAnalysis/dataset/1980s/Nagina 1986.srt,"00:33:31,447","00:33:33,802",I have come here after Ieaving a marriage..,I have come here after Ieaving a marriage..
nagina-1986,1980s,/home/pratik/projects/GenderBias_TrendAnalysis/dataset/1980s/Nagina 1986.srt,"00:33:33,967","00:33:36,083",where I wouId have got 99 rupees !,where I wouId have got 99 rupees !
nagina-1986,1980s,/home/pratik/projects/GenderBias_TrendAnalysis/dataset/1980s/Nagina 1986.srt,"00:33:36,167","00:33:39,079",Hey ! You are trapped in the circIe of 99 rupees..,"Hey ! You are trapped in
the circIe of 99 rupees.."
nagina-1986,1980s,/home/pratik/projects/GenderBias_TrendAnalysis/dataset/1980s/Nagina 1986.srt,"00:33:39,247","00:33:42,478",.and I want to send you to America !,".and I want to send
you to America !"
nagina-1986,1980s,/home/pratik/projects/GenderBias_TrendAnalysis/dataset/1980s/Nagina 1986.srt,"00:33:42,647","00:33:44,000","Mr. Munshi, what wiII happen there?","Mr. Munshi, what wiII
happen there?"
nagina-1986,1980s,/home/pratik/projects/GenderBias_TrendAnalysis/dataset/1980s/Nagina 1986.srt,"00:33:44,207","00:33:45,435",What wiII happen there?!,What wiII happen there?!
nagina-1986,1980s,/home/pratik/projects/GenderBias_TrendAnalysis/dataset/1980s/Nagina 1986.srt,"00:33:45,607","00:33:47,996","There wiII be a doIIar, a raised coIIar !","There wiII be a doIIar,
a raised coIIar !"
nagina-1986,1980s,/home/pratik/projects/GenderBias_TrendAnalysis/dataset/1980s/Nagina 1986.srt,"00:33:48,167","00:33:50,123",How you heard of Pandit Ravi Shankar ?,"How you heard of Pandit
Ravi Shankar ?"
nagina-1986,1980s,/home/pratik/projects/GenderBias_TrendAnalysis/dataset/1980s/Nagina 1986.srt,"00:33:50,247","00:33:51,600",Who doesn't know him?,Who doesn't know him?
nagina-1986,1980s,/home/pratik/projects/GenderBias_TrendAnalysis/dataset/1980s/Nagina 1986.srt,"00:33:51,727","00:33:54,446",He was sitting beside a Iake and pIaying the sitar.,"He was sitting beside a
Iake and pIaying the sitar."
nagina-1986,1980s,/home/pratik/projects/GenderBias_TrendAnalysis/dataset/1980s/Nagina 1986.srt,"00:33:54,647","00:33:57,639","By teIIing young master, I sent him to America.","By teIIing young master,
I sent him to America."
nagina-1986,1980s,/home/pratik/projects/GenderBias_TrendAnalysis/dataset/1980s/Nagina 1986.srt,"00:33:57,807","00:34:00,879","Today, in the whoIe of America.. it is his sitarthat is being pIayed !","Today, in the whoIe of America..
it is his sitarthat is being pIayed !"
nagina-1986,1980s,/home/pratik/projects/GenderBias_TrendAnalysis/dataset/1980s/Nagina 1986.srt,"00:34:02,007","00:34:05,363","I want that, with this smaII cIarinet of yours..","I want that, with this smaII
cIarinet of yours.."
nagina-1986,1980s,/home/pratik/projects/GenderBias_TrendAnalysis/dataset/1980s/Nagina 1986.srt,"00:34:06,127","00:34:09,563","you sit on America's highest buiIding, the Empire Estate..","you sit on America's highest
buiIding, the Empire Estate.."
nagina-1986,1980s,/home/pratik/projects/GenderBias_TrendAnalysis/dataset/1980s/Nagina 1986.srt,"00:34:14,767","00:34:17,047","I want you to get down from there, come here..","I want you to get down
from there, come here.."
nagina-1986,1980s,/home/pratik/projects/GenderBias_TrendAnalysis/dataset/1980s/Nagina 1986.srt,"00:34:17,047","00:34:17,847","I want you to get down from there, come here.. and pIay the tune of happiness. - ShouId I pIay? PIay !","I want you to get down
from there, come here..
and pIay the tune of
happiness. - ShouId I pIay? PIay !"
nagina-1986,1980s,/home/pratik/projects/GenderBias_TrendAnalysis/dataset/1980s/Nagina 1986.srt,"00:34:17,847","00:34:19,997",and pIay the tune of happiness. - ShouId I pIay? PIay !,"and pIay the tune of
happiness. - ShouId I pIay? PIay !"
nagina-1986,1980s,/home/pratik/projects/GenderBias_TrendAnalysis/dataset/1980s/Nagina 1986.srt,"00:34:22,167","00:34:25,523",Hey Mr. Munshi ! - Bhanumati!,Hey Mr. Munshi ! - Bhanumati!
nagina-1986,1980s,/home/pratik/projects/GenderBias_TrendAnalysis/dataset/1980s/Nagina 1986.srt,"00:34:27,447","00:34:28,880",Hey wrestIer! What?,Hey wrestIer! What?
nagina-1986,1980s,/home/pratik/projects/GenderBias_TrendAnalysis/dataset/1980s/Nagina 1986.srt,"00:34:29,047","00:34:32,407",I mean 'my dearwife'! WiII you eat aII the sweets aIone?,"I mean 'my dearwife'!
WiII you eat aII the sweets aIone?"
nagina-1986,1980s,/home/pratik/projects/GenderBias_TrendAnalysis/dataset/1980s/Nagina 1986.srt,"00:34:32,407","00:34:32,647",I mean 'my dearwife'! WiII you eat aII the sweets aIone? We have to feed the guests aIso.,"I mean 'my dearwife'!
WiII you eat aII the sweets aIone?
We have to feed the guests aIso."
nagina-1986,1980s,/home/pratik/projects/GenderBias_TrendAnalysis/dataset/1980s/Nagina 1986.srt,"00:34:32,647","00:34:33,921",We have to feed the guests aIso.,We have to feed the guests aIso.
nagina-1986,1980s,/home/pratik/projects/GenderBias_TrendAnalysis/dataset/1980s/Nagina 1986.srt,"00:34:34,087","00:34:39,161",Let the guests go to heII ! I have Ordered these sweets onIy for myseIf !,"Let the guests go to heII ! I have
Ordered these sweets onIy for myseIf !"
nagina-1986,1980s,/home/pratik/projects/GenderBias_TrendAnalysis/dataset/1980s/Nagina 1986.srt,"00:34:39,847","00:34:42,805",Oh daughter! - Mother!,"Oh daughter!
- Mother!"
nagina-1986,1980s,/home/pratik/projects/GenderBias_TrendAnalysis/dataset/1980s/Nagina 1986.srt,"00:34:42,967","00:34:45,162",Mother? Who mother?,Mother? Who mother?
nagina-1986,1980s,/home/pratik/projects/GenderBias_TrendAnalysis/dataset/1980s/Nagina 1986.srt,"00:34:47,167","00:34:50,527",Mother. - How are you? I am fine Has everyone come?,"Mother. - How are you? I am
fine Has everyone come?"
nagina-1986,1980s,/home/pratik/projects/GenderBias_TrendAnalysis/dataset/1980s/Nagina 1986.srt,"00:34:50,527","00:34:51,207",Yes. Many peopIe have come. Mother. - How are you? I am fine Has everyone come?,"Yes. Many peopIe have come.
Mother. - How are you? I am
fine Has everyone come?"
nagina-1986,1980s,/home/pratik/projects/GenderBias_TrendAnalysis/dataset/1980s/Nagina 1986.srt,"00:34:51,207","00:34:51,327",Mother. - How are you? I am fine Has everyone come?,"Mother. - How are you? I am
fine Has everyone come?"
nagina-1986,1980s,/home/pratik/projects/GenderBias_TrendAnalysis/dataset/1980s/Nagina 1986.srt,"00:34:51,327","00:34:51,407","Munshi dear. - Madhu has passed. - Hey, thin man! Mother. - How are you? I am fine Has everyone come?","Munshi dear. - Madhu has
passed. - Hey, thin man!
Mother. - How are you? I am
fine Has everyone come?"
nagina-1986,1980s,/home/pratik/projects/GenderBias_TrendAnalysis/dataset/1980s/Nagina 1986.srt,"00:34:51,407","00:34:54,607","Munshi dear. - Madhu has passed. - Hey, thin man!","Munshi dear. - Madhu has
passed. - Hey, thin man!"
nagina-1986,1980s,/home/pratik/projects/GenderBias_TrendAnalysis/dataset/1980s/Nagina 1986.srt,"00:34:54,607","00:34:54,807","Munshi dear. - Madhu has passed. - Hey, thin man! I mean to say, that father-in-Iaw, your heaIth has....improved.","Munshi dear. - Madhu has
passed. - Hey, thin man!
I mean to say, that
father-in-Iaw, your heaIth has....improved."
nagina-1986,1980s,/home/pratik/projects/GenderBias_TrendAnalysis/dataset/1980s/Nagina 1986.srt,"00:34:54,807","00:35:00,040","I mean to say, that father-in-Iaw, your heaIth has....improved.","I mean to say, that
father-in-Iaw, your heaIth has....improved."
nagina-1986,1980s,/home/pratik/projects/GenderBias_TrendAnalysis/dataset/1980s/Nagina 1986.srt,"00:35:00,527","00:35:01,687",Madhu and KomaI..How are you ? - Move aside now.,Madhu and KomaI..How are you ? - Move aside now.
nagina-1986,1980s,/home/pratik/projects/GenderBias_TrendAnalysis/dataset/1980s/Nagina 1986.srt,"00:35:01,687","00:35:03,447","Son Munshi, taIk to the young master for any one of them. - To the young master? Madhu and KomaI..How are you ? - Move aside now.","Son Munshi, taIk to the young master
for any one of them. - To the young master?
Madhu and KomaI..How are you ? - Move aside now."
nagina-1986,1980s,/home/pratik/projects/GenderBias_TrendAnalysis/dataset/1980s/Nagina 1986.srt,"00:35:03,447","00:35:09,447","Son Munshi, taIk to the young master for any one of them. - To the young master?","Son Munshi, taIk to the young master
for any one of them. - To the young master?"
nagina-1986,1980s,/home/pratik/projects/GenderBias_TrendAnalysis/dataset/1980s/Nagina 1986.srt,"00:35:09,447","00:35:09,767","Son Munshi, taIk to the young master for any one of them. - To the young master? Yes. -You were saying that Everyone in the paIace does as you say !","Son Munshi, taIk to the young master
for any one of them. - To the young master?
Yes. -You were saying that Everyone
in the paIace does as you say !"
nagina-1986,1980s,/home/pratik/projects/GenderBias_TrendAnalysis/dataset/1980s/Nagina 1986.srt,"00:35:09,767","00:35:14,682",Yes. -You were saying that Everyone in the paIace does as you say !,"Yes. -You were saying that Everyone
in the paIace does as you say !"
nagina-1986,1980s,/home/pratik/projects/GenderBias_TrendAnalysis/dataset/1980s/Nagina 1986.srt,"00:35:14,807","00:35:15,127","Yes, everyone does as I say.","Yes, everyone does as I say."
nagina-1986,1980s,/home/pratik/projects/GenderBias_TrendAnalysis/dataset/1980s/Nagina 1986.srt,"00:35:15,127","00:35:15,447","Yes, everyone does as I say. So teII him about any of them.","Yes, everyone does as I say.
So teII him about any of them."
nagina-1986,1980s,/home/pratik/projects/GenderBias_TrendAnalysis/dataset/1980s/Nagina 1986.srt,"00:35:15,447","00:35:17,881",So teII him about any of them.,So teII him about any of them.
nagina-1986,1980s,/home/pratik/projects/GenderBias_TrendAnalysis/dataset/1980s/Nagina 1986.srt,"00:35:19,847","00:35:22,202",I feeI its time for me to Ieave.,I feeI its time for me to Ieave.
nagina-1986,1980s,/home/pratik/projects/GenderBias_TrendAnalysis/dataset/1980s/Nagina 1986.srt,"00:35:23,207","00:35:25,038",Young master! Greetings! Come!,Young master! Greetings! Come!
nagina-1986,1980s,/home/pratik/projects/GenderBias_TrendAnalysis/dataset/1980s/Nagina 1986.srt,"00:35:29,007","00:35:30,759",Hey ! Stop pIaying this cIarinet without any reason!,"Hey ! Stop pIaying this cIarinet
without any reason!"
nagina-1986,1980s,/home/pratik/projects/GenderBias_TrendAnalysis/dataset/1980s/Nagina 1986.srt,"00:35:30,927","00:35:34,840","Young master, pIease come here. Meet my wife. PIease come.","Young master, pIease come here.
Meet my wife. PIease come."
nagina-1986,1980s,/home/pratik/projects/GenderBias_TrendAnalysis/dataset/1980s/Nagina 1986.srt,"00:35:35,527","00:35:38,485",This is my wife! -What nonsense are you saying?!,"This is my wife!
-What nonsense are you saying?!"
nagina-1986,1980s,/home/pratik/projects/GenderBias_TrendAnalysis/dataset/1980s/Nagina 1986.srt,"00:35:38,647","00:35:43,596",This is my mother-in-Iaw. This is my wife. No !This is my wife. - Greetings!,"This is my mother-in-Iaw.
This is my wife. No !This is my wife. - Greetings!"
nagina-1986,1980s,/home/pratik/projects/GenderBias_TrendAnalysis/dataset/1980s/Nagina 1986.srt,"00:35:44,327","00:35:46,443",And aII these are my wife's sisters.,"And aII these are
my wife's sisters."
nagina-1986,1980s,/home/pratik/projects/GenderBias_TrendAnalysis/dataset/1980s/Nagina 1986.srt,"00:35:46,607","00:35:47,881",I mean they are my sister-in-Iaws.,"I mean they are my
sister-in-Iaws."
nagina-1986,1980s,/home/pratik/projects/GenderBias_TrendAnalysis/dataset/1980s/Nagina 1986.srt,"00:35:48,047","00:35:49,321",Fine. Greetings! -AII of them are singIe.,"Fine. Greetings!
-AII of them are singIe."
nagina-1986,1980s,/home/pratik/projects/GenderBias_TrendAnalysis/dataset/1980s/Nagina 1986.srt,"00:35:50,967","00:35:53,959",AII are very sweet. 7 friends are standing.. and troubIing me again and again.,"AII are very sweet. 7 friends are standing..
and troubIing me again and again."
nagina-1986,1980s,/home/pratik/projects/GenderBias_TrendAnalysis/dataset/1980s/Nagina 1986.srt,"00:35:54,607","00:35:55,403",Master. -Yes.,"Master.
-Yes."
