film_id,decade,file_path,start,end,text_clean,text_raw
agneepath-1990-dvdrip-xvid-e-sub-xrg,1990s,/home/pratik/projects/GenderBias_TrendAnalysis/dataset/1990s/Agneepath 1990 DVDRip XviD E-SuB xRG.srt,"01:52:43,079","01:52:45,360","Who is he, Daddy?","Who is he, Daddy?"
agneepath-1990-dvdrip-xvid-e-sub-xrg,1990s,/home/pratik/projects/GenderBias_TrendAnalysis/dataset/1990s/Agneepath 1990 DVDRip XviD E-SuB xRG.srt,"01:52:46,960","01:52:49,840",Vijay Chavan? - Isn't he a hoodlum?,"Vijay Chavan?
- Isn't he a hoodlum?"
agneepath-1990-dvdrip-xvid-e-sub-xrg,1990s,/home/pratik/projects/GenderBias_TrendAnalysis/dataset/1990s/Agneepath 1990 DVDRip XviD E-SuB xRG.srt,"01:53:27,800","01:53:29,760",We can't sit down to eat with such a person.,"We can't sit down to eat
with such a person."
agneepath-1990-dvdrip-xvid-e-sub-xrg,1990s,/home/pratik/projects/GenderBias_TrendAnalysis/dataset/1990s/Agneepath 1990 DVDRip XviD E-SuB xRG.srt,"01:53:33,399","01:53:35,680",Hey! Where do you think you're going? Sit down. Sit!,"Hey! Where do you think you're
going? Sit down. Sit!"
agneepath-1990-dvdrip-xvid-e-sub-xrg,1990s,/home/pratik/projects/GenderBias_TrendAnalysis/dataset/1990s/Agneepath 1990 DVDRip XviD E-SuB xRG.srt,"01:53:37,399","01:53:38,720",Where do you think you're going?,"Where do you
think you're going?"
agneepath-1990-dvdrip-xvid-e-sub-xrg,1990s,/home/pratik/projects/GenderBias_TrendAnalysis/dataset/1990s/Agneepath 1990 DVDRip XviD E-SuB xRG.srt,"01:53:40,960","01:53:43,000","Do you find it bloody uncomfortable,...","Do you find it bloody
uncomfortable,..."
agneepath-1990-dvdrip-xvid-e-sub-xrg,1990s,/home/pratik/projects/GenderBias_TrendAnalysis/dataset/1990s/Agneepath 1990 DVDRip XviD E-SuB xRG.srt,"01:53:43,119","01:53:44,480",...just because l am sitting next to you?,"...just because l am sitting next
to you?"
agneepath-1990-dvdrip-xvid-e-sub-xrg,1990s,/home/pratik/projects/GenderBias_TrendAnalysis/dataset/1990s/Agneepath 1990 DVDRip XviD E-SuB xRG.srt,"01:53:44,600","01:53:47,160",Have l lighted a fire under your arse?,"Have l lighted a fire under your
arse?"
agneepath-1990-dvdrip-xvid-e-sub-xrg,1990s,/home/pratik/projects/GenderBias_TrendAnalysis/dataset/1990s/Agneepath 1990 DVDRip XviD E-SuB xRG.srt,"01:53:49,479","01:53:52,400",Don't l look human? Am l not human?,"Don't l look human?
Am l not human?"
agneepath-1990-dvdrip-xvid-e-sub-xrg,1990s,/home/pratik/projects/GenderBias_TrendAnalysis/dataset/1990s/Agneepath 1990 DVDRip XviD E-SuB xRG.srt,"01:53:52,520","01:53:54,320",Am l a bloody animal?,Am l a bloody animal?
agneepath-1990-dvdrip-xvid-e-sub-xrg,1990s,/home/pratik/projects/GenderBias_TrendAnalysis/dataset/1990s/Agneepath 1990 DVDRip XviD E-SuB xRG.srt,"01:53:55,119","01:53:57,400","Or, am l not dressed properly? Did you buy me these clothes?","Or, am l not dressed properly?
Did you buy me these clothes?"
agneepath-1990-dvdrip-xvid-e-sub-xrg,1990s,/home/pratik/projects/GenderBias_TrendAnalysis/dataset/1990s/Agneepath 1990 DVDRip XviD E-SuB xRG.srt,"01:53:58,880","01:54:00,760",l bought these with my hard-earned money.,"l bought these with
my hard-earned money."
agneepath-1990-dvdrip-xvid-e-sub-xrg,1990s,/home/pratik/projects/GenderBias_TrendAnalysis/dataset/1990s/Agneepath 1990 DVDRip XviD E-SuB xRG.srt,"01:54:04,560","01:54:06,360",What are the rest ofyou staring at?,"What are the rest ofyou
staring at?"
agneepath-1990-dvdrip-xvid-e-sub-xrg,1990s,/home/pratik/projects/GenderBias_TrendAnalysis/dataset/1990s/Agneepath 1990 DVDRip XviD E-SuB xRG.srt,"01:54:07,680","01:54:10,360","Well, what are you watching? And why are you so bloody silent?","Well, what are you watching?
And why are you so bloody silent?"
agneepath-1990-dvdrip-xvid-e-sub-xrg,1990s,/home/pratik/projects/GenderBias_TrendAnalysis/dataset/1990s/Agneepath 1990 DVDRip XviD E-SuB xRG.srt,"01:54:10,880","01:54:12,640",Has my presence silenced you?,Has my presence silenced you?
agneepath-1990-dvdrip-xvid-e-sub-xrg,1990s,/home/pratik/projects/GenderBias_TrendAnalysis/dataset/1990s/Agneepath 1990 DVDRip XviD E-SuB xRG.srt,"01:54:14,439","01:54:16,000",l've come here to spend my hard-earned money.,"l've come here to spend
my hard-earned money."
agneepath-1990-dvdrip-xvid-e-sub-xrg,1990s,/home/pratik/projects/GenderBias_TrendAnalysis/dataset/1990s/Agneepath 1990 DVDRip XviD E-SuB xRG.srt,"01:54:17,199","01:54:19,480",l've even polished shoes. Have you polished shoes for a living?,"l've even polished shoes. Have
you polished shoes for a living?"
agneepath-1990-dvdrip-xvid-e-sub-xrg,1990s,/home/pratik/projects/GenderBias_TrendAnalysis/dataset/1990s/Agneepath 1990 DVDRip XviD E-SuB xRG.srt,"01:54:19,600","01:54:22,440","No, you haven't. And, have you washed cars for a living?","No, you haven't. And, have you
washed cars for a living?"
agneepath-1990-dvdrip-xvid-e-sub-xrg,1990s,/home/pratik/projects/GenderBias_TrendAnalysis/dataset/1990s/Agneepath 1990 DVDRip XviD E-SuB xRG.srt,"01:54:22,560","01:54:24,320",And you ty to show me up!,And you ty to show me up!
agneepath-1990-dvdrip-xvid-e-sub-xrg,1990s,/home/pratik/projects/GenderBias_TrendAnalysis/dataset/1990s/Agneepath 1990 DVDRip XviD E-SuB xRG.srt,"01:54:24,439","01:54:26,600",Where do they think they're going?,"Where do they think they're
going?"
agneepath-1990-dvdrip-xvid-e-sub-xrg,1990s,/home/pratik/projects/GenderBias_TrendAnalysis/dataset/1990s/Agneepath 1990 DVDRip XviD E-SuB xRG.srt,"01:54:26,720","01:54:28,720",No! What are they tying to tell me?!,"No! What are they tying to tell
me?!"
agneepath-1990-dvdrip-xvid-e-sub-xrg,1990s,/home/pratik/projects/GenderBias_TrendAnalysis/dataset/1990s/Agneepath 1990 DVDRip XviD E-SuB xRG.srt,"01:54:29,159","01:54:30,960",That they're right and l'm wrong!,That they're right and l'm wrong!
agneepath-1990-dvdrip-xvid-e-sub-xrg,1990s,/home/pratik/projects/GenderBias_TrendAnalysis/dataset/1990s/Agneepath 1990 DVDRip XviD E-SuB xRG.srt,"01:54:32,319","01:54:33,480",These people from high society are gentlemen!,"These people from high society
are gentlemen!"
agneepath-1990-dvdrip-xvid-e-sub-xrg,1990s,/home/pratik/projects/GenderBias_TrendAnalysis/dataset/1990s/Agneepath 1990 DVDRip XviD E-SuB xRG.srt,"01:54:33,600","01:54:35,440",And l am the hoodlum!,And l am the hoodlum!
agneepath-1990-dvdrip-xvid-e-sub-xrg,1990s,/home/pratik/projects/GenderBias_TrendAnalysis/dataset/1990s/Agneepath 1990 DVDRip XviD E-SuB xRG.srt,"01:54:35,560","01:54:36,840","Excuse me, Sir. - Am l the hood?!","Excuse me, Sir.
- Am l the hood?!"
agneepath-1990-dvdrip-xvid-e-sub-xrg,1990s,/home/pratik/projects/GenderBias_TrendAnalysis/dataset/1990s/Agneepath 1990 DVDRip XviD E-SuB xRG.srt,"01:54:40,399","01:54:42,560",What was that piece you told me in English?,"What was that piece you told
me in English?"
agneepath-1990-dvdrip-xvid-e-sub-xrg,1990s,/home/pratik/projects/GenderBias_TrendAnalysis/dataset/1990s/Agneepath 1990 DVDRip XviD E-SuB xRG.srt,"01:54:42,680","01:54:44,040",What's this English about?,What's this English about?
agneepath-1990-dvdrip-xvid-e-sub-xrg,1990s,/home/pratik/projects/GenderBias_TrendAnalysis/dataset/1990s/Agneepath 1990 DVDRip XviD E-SuB xRG.srt,"01:54:44,880","01:54:47,360","You want money for those glasses, isn't that so? Well, here you are.","You want money for those glasses,
isn't that so? Well, here you are."
agneepath-1990-dvdrip-xvid-e-sub-xrg,1990s,/home/pratik/projects/GenderBias_TrendAnalysis/dataset/1990s/Agneepath 1990 DVDRip XviD E-SuB xRG.srt,"01:54:47,880","01:54:50,760","Here take money...take that and that, How much more do you want?","Here take money...take that and that,
How much more do you want?"
agneepath-1990-dvdrip-xvid-e-sub-xrg,1990s,/home/pratik/projects/GenderBias_TrendAnalysis/dataset/1990s/Agneepath 1990 DVDRip XviD E-SuB xRG.srt,"01:55:16,159","01:55:19,120","Don, even a mosque has been built in our hutments now.","Don, even a mosque has been
built in our hutments now."
agneepath-1990-dvdrip-xvid-e-sub-xrg,1990s,/home/pratik/projects/GenderBias_TrendAnalysis/dataset/1990s/Agneepath 1990 DVDRip XviD E-SuB xRG.srt,"01:55:23,560","01:55:28,320",A hoodlum... am l a hoodlum?,A hoodlum... am l a hoodlum?
agneepath-1990-dvdrip-xvid-e-sub-xrg,1990s,/home/pratik/projects/GenderBias_TrendAnalysis/dataset/1990s/Agneepath 1990 DVDRip XviD E-SuB xRG.srt,"01:55:32,479","01:55:34,480",l had gone to tell him that his life is in danger.,"l had gone to tell him
that his life is in danger."
agneepath-1990-dvdrip-xvid-e-sub-xrg,1990s,/home/pratik/projects/GenderBias_TrendAnalysis/dataset/1990s/Agneepath 1990 DVDRip XviD E-SuB xRG.srt,"01:55:34,600","01:55:40,280",And he tells his son that l am a hoodlum. A hood!,"And he tells his son that
l am a hoodlum. A hood!"
agneepath-1990-dvdrip-xvid-e-sub-xrg,1990s,/home/pratik/projects/GenderBias_TrendAnalysis/dataset/1990s/Agneepath 1990 DVDRip XviD E-SuB xRG.srt,"01:55:40,399","01:55:42,360","May the Allah grant you a long life, Don.","May the Allah grant
you a long life, Don."
agneepath-1990-dvdrip-xvid-e-sub-xrg,1990s,/home/pratik/projects/GenderBias_TrendAnalysis/dataset/1990s/Agneepath 1990 DVDRip XviD E-SuB xRG.srt,"01:55:42,479","01:55:46,440",l'll show him what a hoodlum is.,"l'll show him what
a hoodlum is."
agneepath-1990-dvdrip-xvid-e-sub-xrg,1990s,/home/pratik/projects/GenderBias_TrendAnalysis/dataset/1990s/Agneepath 1990 DVDRip XviD E-SuB xRG.srt,"01:55:58,479","01:56:01,320",Remain here. The informer wants to meet me alone.,"Remain here. The informer
wants to meet me alone."
agneepath-1990-dvdrip-xvid-e-sub-xrg,1990s,/home/pratik/projects/GenderBias_TrendAnalysis/dataset/1990s/Agneepath 1990 DVDRip XviD E-SuB xRG.srt,"01:56:31,920","01:56:34,600",No! Please don't hurt him.,No! Please don't hurt him.
agneepath-1990-dvdrip-xvid-e-sub-xrg,1990s,/home/pratik/projects/GenderBias_TrendAnalysis/dataset/1990s/Agneepath 1990 DVDRip XviD E-SuB xRG.srt,"01:56:35,000","01:56:36,200",So... you've been raiding Kancha Cheena's hideouts!,"So... you've been raiding
Kancha Cheena's hideouts!"
agneepath-1990-dvdrip-xvid-e-sub-xrg,1990s,/home/pratik/projects/GenderBias_TrendAnalysis/dataset/1990s/Agneepath 1990 DVDRip XviD E-SuB xRG.srt,"01:56:45,800","01:56:48,240",Blood looks nice on your uniform.,Blood looks nice on your uniform.
agneepath-1990-dvdrip-xvid-e-sub-xrg,1990s,/home/pratik/projects/GenderBias_TrendAnalysis/dataset/1990s/Agneepath 1990 DVDRip XviD E-SuB xRG.srt,"01:56:52,079","01:56:54,000",Kancha Cheena wants to hear you scream in pain over the phone.,"Kancha Cheena wants to hear you
scream in pain over the phone."
agneepath-1990-dvdrip-xvid-e-sub-xrg,1990s,/home/pratik/projects/GenderBias_TrendAnalysis/dataset/1990s/Agneepath 1990 DVDRip XviD E-SuB xRG.srt,"01:57:08,039","01:57:09,320",Eh! Commissioner! You've already passed out!,"Eh! Commissioner!
You've already passed out!"
agneepath-1990-dvdrip-xvid-e-sub-xrg,1990s,/home/pratik/projects/GenderBias_TrendAnalysis/dataset/1990s/Agneepath 1990 DVDRip XviD E-SuB xRG.srt,"01:57:28,039","01:57:31,840",You whites will always resort to trickey.,"You whites will always
resort to trickey."
agneepath-1990-dvdrip-xvid-e-sub-xrg,1990s,/home/pratik/projects/GenderBias_TrendAnalysis/dataset/1990s/Agneepath 1990 DVDRip XviD E-SuB xRG.srt,"01:57:36,319","01:57:37,800",And you will always attack the weak.,"And you will always attack the
weak."
agneepath-1990-dvdrip-xvid-e-sub-xrg,1990s,/home/pratik/projects/GenderBias_TrendAnalysis/dataset/1990s/Agneepath 1990 DVDRip XviD E-SuB xRG.srt,"01:57:42,880","01:57:48,400",You've resorted to deceit to get the police officer here.,"You've resorted to deceit to
get the police officer here."
agneepath-1990-dvdrip-xvid-e-sub-xrg,1990s,/home/pratik/projects/GenderBias_TrendAnalysis/dataset/1990s/Agneepath 1990 DVDRip XviD E-SuB xRG.srt,"01:57:51,199","01:57:54,320","Years ago, you had lured an innocent widow into your petrol pump.","Years ago, you had lured an
innocent widow into your petrol pump."
agneepath-1990-dvdrip-xvid-e-sub-xrg,1990s,/home/pratik/projects/GenderBias_TrendAnalysis/dataset/1990s/Agneepath 1990 DVDRip XviD E-SuB xRG.srt,"01:57:55,199","01:57:58,360",You had deceived her. You tried to rape her.,"You had deceived her.
You tried to rape her."
agneepath-1990-dvdrip-xvid-e-sub-xrg,1990s,/home/pratik/projects/GenderBias_TrendAnalysis/dataset/1990s/Agneepath 1990 DVDRip XviD E-SuB xRG.srt,"01:57:58,680","01:58:02,440","And why are you silent... speak up! Go on. Speak up, swine!","And why are you silent... speak up!
Go on. Speak up, swine!"
agneepath-1990-dvdrip-xvid-e-sub-xrg,1990s,/home/pratik/projects/GenderBias_TrendAnalysis/dataset/1990s/Agneepath 1990 DVDRip XviD E-SuB xRG.srt,"01:58:11,439","01:58:14,840",A 12-year old changed your face forever.,"A 12-year old changed
your face forever."
agneepath-1990-dvdrip-xvid-e-sub-xrg,1990s,/home/pratik/projects/GenderBias_TrendAnalysis/dataset/1990s/Agneepath 1990 DVDRip XviD E-SuB xRG.srt,"01:58:15,840","01:58:16,960","But, you're incorrigible.","But, you're incorrigible."
agneepath-1990-dvdrip-xvid-e-sub-xrg,1990s,/home/pratik/projects/GenderBias_TrendAnalysis/dataset/1990s/Agneepath 1990 DVDRip XviD E-SuB xRG.srt,"01:58:21,880","01:58:26,600",The 3-feet tall Vijay has grown six-and-a-half feet tall.,"The 3-feet tall Vijay has grown
six-and-a-half feet tall."
agneepath-1990-dvdrip-xvid-e-sub-xrg,1990s,/home/pratik/projects/GenderBias_TrendAnalysis/dataset/1990s/Agneepath 1990 DVDRip XviD E-SuB xRG.srt,"01:58:26,720","01:58:27,520",But you have not yet changed your ways.,"But you have not yet
changed your ways."
agneepath-1990-dvdrip-xvid-e-sub-xrg,1990s,/home/pratik/projects/GenderBias_TrendAnalysis/dataset/1990s/Agneepath 1990 DVDRip XviD E-SuB xRG.srt,"01:58:28,640","01:58:30,840",Are you the same kid?,Are you the same kid?
agneepath-1990-dvdrip-xvid-e-sub-xrg,1990s,/home/pratik/projects/GenderBias_TrendAnalysis/dataset/1990s/Agneepath 1990 DVDRip XviD E-SuB xRG.srt,"01:58:36,840","01:58:39,960",This contains vermilion. But you aren't aware of it's power.,"This contains vermilion. But you
aren't aware of it's power."
agneepath-1990-dvdrip-xvid-e-sub-xrg,1990s,/home/pratik/projects/GenderBias_TrendAnalysis/dataset/1990s/Agneepath 1990 DVDRip XviD E-SuB xRG.srt,"01:58:41,319","01:58:44,920",lt's what is beholden to women from India.,"lt's what is beholden
to women from India."
agneepath-1990-dvdrip-xvid-e-sub-xrg,1990s,/home/pratik/projects/GenderBias_TrendAnalysis/dataset/1990s/Agneepath 1990 DVDRip XviD E-SuB xRG.srt,"01:58:46,000","01:58:47,160",Let me show you how powerFul this is.,"Let me show you how powerFul
this is."
agneepath-1990-dvdrip-xvid-e-sub-xrg,1990s,/home/pratik/projects/GenderBias_TrendAnalysis/dataset/1990s/Agneepath 1990 DVDRip XviD E-SuB xRG.srt,"01:58:59,600","01:59:01,120","Kancha Cheena on the line for you, Don.","Kancha Cheena on the
line for you, Don."
agneepath-1990-dvdrip-xvid-e-sub-xrg,1990s,/home/pratik/projects/GenderBias_TrendAnalysis/dataset/1990s/Agneepath 1990 DVDRip XviD E-SuB xRG.srt,"01:59:07,720","01:59:09,160","You want to hear the Commissioner scream out in pain, don't you?","You want to hear the Commissioner
scream out in pain, don't you?"
agneepath-1990-dvdrip-xvid-e-sub-xrg,1990s,/home/pratik/projects/GenderBias_TrendAnalysis/dataset/1990s/Agneepath 1990 DVDRip XviD E-SuB xRG.srt,"01:59:09,279","01:59:10,920",Listen to this...,Listen to this...
agneepath-1990-dvdrip-xvid-e-sub-xrg,1990s,/home/pratik/projects/GenderBias_TrendAnalysis/dataset/1990s/Agneepath 1990 DVDRip XviD E-SuB xRG.srt,"01:59:20,720","01:59:21,640",Did you hear that?,Did you hear that?
agneepath-1990-dvdrip-xvid-e-sub-xrg,1990s,/home/pratik/projects/GenderBias_TrendAnalysis/dataset/1990s/Agneepath 1990 DVDRip XviD E-SuB xRG.srt,"01:59:24,159","01:59:27,280","That was a lot of noise. Now, wait for the big bangs.","That was a lot of noise.
Now, wait for the big bangs."
agneepath-1990-dvdrip-xvid-e-sub-xrg,1990s,/home/pratik/projects/GenderBias_TrendAnalysis/dataset/1990s/Agneepath 1990 DVDRip XviD E-SuB xRG.srt,"01:59:43,800","01:59:46,280","Those were big bangs indeed, Vijay Chavan.","Those were big bangs
indeed, Vijay Chavan."
agneepath-1990-dvdrip-xvid-e-sub-xrg,1990s,/home/pratik/projects/GenderBias_TrendAnalysis/dataset/1990s/Agneepath 1990 DVDRip XviD E-SuB xRG.srt,"01:59:46,399","01:59:51,560",He hurt kids... the bloody hood.,He hurt kids... the bloody hood.
agneepath-1990-dvdrip-xvid-e-sub-xrg,1990s,/home/pratik/projects/GenderBias_TrendAnalysis/dataset/1990s/Agneepath 1990 DVDRip XviD E-SuB xRG.srt,"02:00:19,319","02:00:21,000",l've taken you for a brother.,l've taken you for a brother.
agneepath-1990-dvdrip-xvid-e-sub-xrg,1990s,/home/pratik/projects/GenderBias_TrendAnalysis/dataset/1990s/Agneepath 1990 DVDRip XviD E-SuB xRG.srt,"02:00:23,079","02:00:24,240",And l respect you as an elder.,And l respect you as an elder.
agneepath-1990-dvdrip-xvid-e-sub-xrg,1990s,/home/pratik/projects/GenderBias_TrendAnalysis/dataset/1990s/Agneepath 1990 DVDRip XviD E-SuB xRG.srt,"02:00:26,119","02:00:28,800",You had once taken me for a friend. Is the friendship over?,"You had once taken me for a
friend. Is the friendship over?"
agneepath-1990-dvdrip-xvid-e-sub-xrg,1990s,/home/pratik/projects/GenderBias_TrendAnalysis/dataset/1990s/Agneepath 1990 DVDRip XviD E-SuB xRG.srt,"02:00:30,199","02:00:33,960","l'm not related to you. But, aren't your mother and your sister your own?","l'm not related to you. But, aren't
your mother and your sister your own?"
agneepath-1990-dvdrip-xvid-e-sub-xrg,1990s,/home/pratik/projects/GenderBias_TrendAnalysis/dataset/1990s/Agneepath 1990 DVDRip XviD E-SuB xRG.srt,"02:00:35,079","02:00:38,640",lt has been 3 months since you have spoken to them.,"lt has been 3 months since
you have spoken to them."
agneepath-1990-dvdrip-xvid-e-sub-xrg,1990s,/home/pratik/projects/GenderBias_TrendAnalysis/dataset/1990s/Agneepath 1990 DVDRip XviD E-SuB xRG.srt,"02:00:39,920","02:00:43,360","Your mother is sad, and your sister is sad. And, l have been sad too.","Your mother is sad, and your sister
is sad. And, l have been sad too."
agneepath-1990-dvdrip-xvid-e-sub-xrg,1990s,/home/pratik/projects/GenderBias_TrendAnalysis/dataset/1990s/Agneepath 1990 DVDRip XviD E-SuB xRG.srt,"02:00:43,479","02:00:46,120",l can take care ofyour mother and your sister.,"l can take care ofyour
mother and your sister."
agneepath-1990-dvdrip-xvid-e-sub-xrg,1990s,/home/pratik/projects/GenderBias_TrendAnalysis/dataset/1990s/Agneepath 1990 DVDRip XviD E-SuB xRG.srt,"02:00:46,239","02:00:48,800","But, l won't spare you if anything happens to your wife.","But, l won't spare you if
anything happens to your wife."
agneepath-1990-dvdrip-xvid-e-sub-xrg,1990s,/home/pratik/projects/GenderBias_TrendAnalysis/dataset/1990s/Agneepath 1990 DVDRip XviD E-SuB xRG.srt,"02:00:48,920","02:00:52,640",She had come over.,She had come over.
agneepath-1990-dvdrip-xvid-e-sub-xrg,1990s,/home/pratik/projects/GenderBias_TrendAnalysis/dataset/1990s/Agneepath 1990 DVDRip XviD E-SuB xRG.srt,"02:01:24,800","02:01:28,360",Tell me... did you meet them? - Yes.,"Tell me... did you meet them?
- Yes."
agneepath-1990-dvdrip-xvid-e-sub-xrg,1990s,/home/pratik/projects/GenderBias_TrendAnalysis/dataset/1990s/Agneepath 1990 DVDRip XviD E-SuB xRG.srt,"02:01:34,000","02:01:38,360",The world knows what you're about to do. But l don't know a thing!,"The world knows what you're about
to do. But l don't know a thing!"
agneepath-1990-dvdrip-xvid-e-sub-xrg,1990s,/home/pratik/projects/GenderBias_TrendAnalysis/dataset/1990s/Agneepath 1990 DVDRip XviD E-SuB xRG.srt,"02:01:42,000","02:01:45,680",What have you told Krishnan? What have you told him?,"What have you told Krishnan?
What have you told him?"
agneepath-1990-dvdrip-xvid-e-sub-xrg,1990s,/home/pratik/projects/GenderBias_TrendAnalysis/dataset/1990s/Agneepath 1990 DVDRip XviD E-SuB xRG.srt,"02:01:48,119","02:01:51,520",You want to abort the child... you want to kill the child.,"You want to abort the child...
you want to kill the child."
agneepath-1990-dvdrip-xvid-e-sub-xrg,1990s,/home/pratik/projects/GenderBias_TrendAnalysis/dataset/1990s/Agneepath 1990 DVDRip XviD E-SuB xRG.srt,"02:01:52,000","02:01:54,480","lf anything happens to my child, l'll ...","lf anything happens
to my child, l'll ..."
agneepath-1990-dvdrip-xvid-e-sub-xrg,1990s,/home/pratik/projects/GenderBias_TrendAnalysis/dataset/1990s/Agneepath 1990 DVDRip XviD E-SuB xRG.srt,"02:01:54,880","02:01:57,680","You'll kill me, won't you? Go on... kill me...","You'll kill me, won't you?
Go on... kill me..."
agneepath-1990-dvdrip-xvid-e-sub-xrg,1990s,/home/pratik/projects/GenderBias_TrendAnalysis/dataset/1990s/Agneepath 1990 DVDRip XviD E-SuB xRG.srt,"02:01:58,079","02:02:00,280",Go on... You'll be doing me a favour.,"Go on...
You'll be doing me a favour."
agneepath-1990-dvdrip-xvid-e-sub-xrg,1990s,/home/pratik/projects/GenderBias_TrendAnalysis/dataset/1990s/Agneepath 1990 DVDRip XviD E-SuB xRG.srt,"02:02:02,119","02:02:07,880","At least, l'll be spared the trauma of having killed my own child.","At least, l'll be spared the trauma
of having killed my own child."
agneepath-1990-dvdrip-xvid-e-sub-xrg,1990s,/home/pratik/projects/GenderBias_TrendAnalysis/dataset/1990s/Agneepath 1990 DVDRip XviD E-SuB xRG.srt,"02:02:18,000","02:02:21,880",l don't want our child to grow up and call you a hoodlum.,"l don't want our child to
grow up and call you a hoodlum."
agneepath-1990-dvdrip-xvid-e-sub-xrg,1990s,/home/pratik/projects/GenderBias_TrendAnalysis/dataset/1990s/Agneepath 1990 DVDRip XviD E-SuB xRG.srt,"02:02:23,479","02:02:24,880",What are you going to do then?,What are you going to do then?
agneepath-1990-dvdrip-xvid-e-sub-xrg,1990s,/home/pratik/projects/GenderBias_TrendAnalysis/dataset/1990s/Agneepath 1990 DVDRip XviD E-SuB xRG.srt,"02:02:25,720","02:02:27,600","Will you strangle the child? Or, will you kill yourself?","Will you strangle the child?
Or, will you kill yourself?"
agneepath-1990-dvdrip-xvid-e-sub-xrg,1990s,/home/pratik/projects/GenderBias_TrendAnalysis/dataset/1990s/Agneepath 1990 DVDRip XviD E-SuB xRG.srt,"02:02:29,600","02:02:33,480",Take a look at yourself... how you have changed!,"Take a look at yourself...
how you have changed!"
agneepath-1990-dvdrip-xvid-e-sub-xrg,1990s,/home/pratik/projects/GenderBias_TrendAnalysis/dataset/1990s/Agneepath 1990 DVDRip XviD E-SuB xRG.srt,"02:02:35,399","02:02:37,600","ARer the Commissioner's son had called you a goon,...","ARer the Commissioner's son
had called you a goon,..."
agneepath-1990-dvdrip-xvid-e-sub-xrg,1990s,/home/pratik/projects/GenderBias_TrendAnalysis/dataset/1990s/Agneepath 1990 DVDRip XviD E-SuB xRG.srt,"02:02:38,399","02:02:39,920",... you took me to the slums.,... you took me to the slums.
agneepath-1990-dvdrip-xvid-e-sub-xrg,1990s,/home/pratik/projects/GenderBias_TrendAnalysis/dataset/1990s/Agneepath 1990 DVDRip XviD E-SuB xRG.srt,"02:02:40,359","02:02:43,680","You wanted to show me that you are a God, not a goon.","You wanted to show me that
you are a God, not a goon."
agneepath-1990-dvdrip-xvid-e-sub-xrg,1990s,/home/pratik/projects/GenderBias_TrendAnalysis/dataset/1990s/Agneepath 1990 DVDRip XviD E-SuB xRG.srt,"02:02:45,159","02:02:46,880","But, you are no God, Vijay. God was that child...","But, you are no God, Vijay.
God was that child..."
agneepath-1990-dvdrip-xvid-e-sub-xrg,1990s,/home/pratik/projects/GenderBias_TrendAnalysis/dataset/1990s/Agneepath 1990 DVDRip XviD E-SuB xRG.srt,"02:02:47,640","02:02:52,880",...who promised that he'd give a village back to his mother.,"...who promised that he'd give a
village back to his mother."
agneepath-1990-dvdrip-xvid-e-sub-xrg,1990s,/home/pratik/projects/GenderBias_TrendAnalysis/dataset/1990s/Agneepath 1990 DVDRip XviD E-SuB xRG.srt,"02:02:54,359","02:02:56,840",Where is the village? Where is it?,"Where is the village?
Where is it?"
agneepath-1990-dvdrip-xvid-e-sub-xrg,1990s,/home/pratik/projects/GenderBias_TrendAnalysis/dataset/1990s/Agneepath 1990 DVDRip XviD E-SuB xRG.srt,"02:02:58,600","02:03:01,880","l want the village, Vijay.","l want the village, Vijay."
agneepath-1990-dvdrip-xvid-e-sub-xrg,1990s,/home/pratik/projects/GenderBias_TrendAnalysis/dataset/1990s/Agneepath 1990 DVDRip XviD E-SuB xRG.srt,"02:03:06,479","02:03:09,680","But, ifyou do anything to my child...","But, ifyou do anything to my
child..."
agneepath-1990-dvdrip-xvid-e-sub-xrg,1990s,/home/pratik/projects/GenderBias_TrendAnalysis/dataset/1990s/Agneepath 1990 DVDRip XviD E-SuB xRG.srt,"02:03:11,000","02:03:14,880",... l'll kill you.,... l'll kill you.
agneepath-1990-dvdrip-xvid-e-sub-xrg,1990s,/home/pratik/projects/GenderBias_TrendAnalysis/dataset/1990s/Agneepath 1990 DVDRip XviD E-SuB xRG.srt,"02:03:22,319","02:03:23,560",l'll kill you.,l'll kill you.
agneepath-1990-dvdrip-xvid-e-sub-xrg,1990s,/home/pratik/projects/GenderBias_TrendAnalysis/dataset/1990s/Agneepath 1990 DVDRip XviD E-SuB xRG.srt,"02:03:55,000","02:03:57,760",And you've had eveyone addicted n the village - Get out of here.,"And you've had eveyone addicted
n the village - Get out of here."
agneepath-1990-dvdrip-xvid-e-sub-xrg,1990s,/home/pratik/projects/GenderBias_TrendAnalysis/dataset/1990s/Agneepath 1990 DVDRip XviD E-SuB xRG.srt,"02:03:58,319","02:04:00,880",Are you going to hit me? Swine!,Are you going to hit me? Swine!
agneepath-1990-dvdrip-xvid-e-sub-xrg,1990s,/home/pratik/projects/GenderBias_TrendAnalysis/dataset/1990s/Agneepath 1990 DVDRip XviD E-SuB xRG.srt,"02:04:02,000","02:04:05,280",My house... it's a poor man's house.- Liar! Dog!,"My house... it's a poor man's
house.- Liar! Dog!"
agneepath-1990-dvdrip-xvid-e-sub-xrg,1990s,/home/pratik/projects/GenderBias_TrendAnalysis/dataset/1990s/Agneepath 1990 DVDRip XviD E-SuB xRG.srt,"02:04:07,000","02:04:10,200",Never was born a man poorer than you!,"Never was born a man poorer
than you!"
