film_id,decade,file_path,start,end,text_clean,text_raw
agneepath-1990-dvdrip-xvid-e-sub-xrg,1990s,/home/pratik/projects/GenderBias_TrendAnalysis/dataset/1990s/Agneepath 1990 DVDRip XviD E-SuB xRG.srt,"01:12:16,680","01:12:19,840",l'm tired ... vey tired.,l'm tired ... vey tired.
agneepath-1990-dvdrip-xvid-e-sub-xrg,1990s,/home/pratik/projects/GenderBias_TrendAnalysis/dataset/1990s/Agneepath 1990 DVDRip XviD E-SuB xRG.srt,"01:12:21,279","01:12:23,520",Go to sleep now. Let's talk in the morning.,"Go to sleep now.
Let's talk in the morning."
agneepath-1990-dvdrip-xvid-e-sub-xrg,1990s,/home/pratik/projects/GenderBias_TrendAnalysis/dataset/1990s/Agneepath 1990 DVDRip XviD E-SuB xRG.srt,"01:12:50,520","01:12:56,600","There lies the village. Some day, l must give this village back to Mummy.","There lies the village. Some day, l
must give this village back to Mummy."
agneepath-1990-dvdrip-xvid-e-sub-xrg,1990s,/home/pratik/projects/GenderBias_TrendAnalysis/dataset/1990s/Agneepath 1990 DVDRip XviD E-SuB xRG.srt,"01:12:59,119","01:13:02,760",They threw her out ofthat village. l must give the village back to her.,"They threw her out ofthat village.
l must give the village back to her."
agneepath-1990-dvdrip-xvid-e-sub-xrg,1990s,/home/pratik/projects/GenderBias_TrendAnalysis/dataset/1990s/Agneepath 1990 DVDRip XviD E-SuB xRG.srt,"01:13:23,319","01:13:27,840","lt's time now, isn't it, my son?","lt's time now, isn't it, my son?"
agneepath-1990-dvdrip-xvid-e-sub-xrg,1990s,/home/pratik/projects/GenderBias_TrendAnalysis/dataset/1990s/Agneepath 1990 DVDRip XviD E-SuB xRG.srt,"01:13:31,319","01:13:34,120","Yes, Uncle. The time has come.","Yes, Uncle. The time has come."
agneepath-1990-dvdrip-xvid-e-sub-xrg,1990s,/home/pratik/projects/GenderBias_TrendAnalysis/dataset/1990s/Agneepath 1990 DVDRip XviD E-SuB xRG.srt,"01:13:37,000","01:13:37,760",The time has come.,The time has come.
agneepath-1990-dvdrip-xvid-e-sub-xrg,1990s,/home/pratik/projects/GenderBias_TrendAnalysis/dataset/1990s/Agneepath 1990 DVDRip XviD E-SuB xRG.srt,"01:13:51,319","01:13:54,200",Swines!,Swines!
agneepath-1990-dvdrip-xvid-e-sub-xrg,1990s,/home/pratik/projects/GenderBias_TrendAnalysis/dataset/1990s/Agneepath 1990 DVDRip XviD E-SuB xRG.srt,"01:13:57,439","01:14:01,400",You all took the life ofthe school master by stoning him.,"You all took the life ofthe school
master by stoning him."
agneepath-1990-dvdrip-xvid-e-sub-xrg,1990s,/home/pratik/projects/GenderBias_TrendAnalysis/dataset/1990s/Agneepath 1990 DVDRip XviD E-SuB xRG.srt,"01:14:03,479","01:14:12,200",lt's my turn now. l'll throw stones at you now. You brutes!,"lt's my turn now. l'll throw
stones at you now. You brutes!"
agneepath-1990-dvdrip-xvid-e-sub-xrg,1990s,/home/pratik/projects/GenderBias_TrendAnalysis/dataset/1990s/Agneepath 1990 DVDRip XviD E-SuB xRG.srt,"01:14:20,399","01:14:23,880",l don't let the right hand know the crime...,"l don't let the
right hand know the crime..."
agneepath-1990-dvdrip-xvid-e-sub-xrg,1990s,/home/pratik/projects/GenderBias_TrendAnalysis/dataset/1990s/Agneepath 1990 DVDRip XviD E-SuB xRG.srt,"01:14:24,119","01:14:27,000",...done by the leR hand. That's my policy.,"...done by the leR hand.
That's my policy."
agneepath-1990-dvdrip-xvid-e-sub-xrg,1990s,/home/pratik/projects/GenderBias_TrendAnalysis/dataset/1990s/Agneepath 1990 DVDRip XviD E-SuB xRG.srt,"01:14:28,880","01:14:33,280",A powerFul man loses his strength in an alliance with the weak.,"A powerFul man loses his strength
in an alliance with the weak."
agneepath-1990-dvdrip-xvid-e-sub-xrg,1990s,/home/pratik/projects/GenderBias_TrendAnalysis/dataset/1990s/Agneepath 1990 DVDRip XviD E-SuB xRG.srt,"01:14:35,399","01:14:39,080",That's why l always seek the friendship ofthe powerFul.,"That's why l always seek
the friendship ofthe powerFul."
agneepath-1990-dvdrip-xvid-e-sub-xrg,1990s,/home/pratik/projects/GenderBias_TrendAnalysis/dataset/1990s/Agneepath 1990 DVDRip XviD E-SuB xRG.srt,"01:14:40,199","01:14:45,080",Vijay Chavan is coming here on a mission of friendship.,"Vijay Chavan is coming here
on a mission of friendship."
agneepath-1990-dvdrip-xvid-e-sub-xrg,1990s,/home/pratik/projects/GenderBias_TrendAnalysis/dataset/1990s/Agneepath 1990 DVDRip XviD E-SuB xRG.srt,"01:14:45,399","01:14:47,680",Are you going to get into an alliance with Vijay Chavan?,"Are you going to get into
an alliance with Vijay Chavan?"
agneepath-1990-dvdrip-xvid-e-sub-xrg,1990s,/home/pratik/projects/GenderBias_TrendAnalysis/dataset/1990s/Agneepath 1990 DVDRip XviD E-SuB xRG.srt,"01:14:48,119","01:14:49,400",Not ifyou can cut him off.,Not ifyou can cut him off.
agneepath-1990-dvdrip-xvid-e-sub-xrg,1990s,/home/pratik/projects/GenderBias_TrendAnalysis/dataset/1990s/Agneepath 1990 DVDRip XviD E-SuB xRG.srt,"01:14:50,199","01:14:54,240","Else, he'll cut your throat. Get that?","Else, he'll cut your throat.
Get that?"
agneepath-1990-dvdrip-xvid-e-sub-xrg,1990s,/home/pratik/projects/GenderBias_TrendAnalysis/dataset/1990s/Agneepath 1990 DVDRip XviD E-SuB xRG.srt,"01:14:55,399","01:14:57,000",Yes. l understand.,Yes. l understand.
agneepath-1990-dvdrip-xvid-e-sub-xrg,1990s,/home/pratik/projects/GenderBias_TrendAnalysis/dataset/1990s/Agneepath 1990 DVDRip XviD E-SuB xRG.srt,"01:16:41,039","01:16:42,480",What calls for the celebration?,What calls for the celebration?
agneepath-1990-dvdrip-xvid-e-sub-xrg,1990s,/home/pratik/projects/GenderBias_TrendAnalysis/dataset/1990s/Agneepath 1990 DVDRip XviD E-SuB xRG.srt,"01:16:47,000","01:16:49,280",A mighty sword has fallen before a mere thorn.,"A mighty sword has fallen
before a mere thorn."
agneepath-1990-dvdrip-xvid-e-sub-xrg,1990s,/home/pratik/projects/GenderBias_TrendAnalysis/dataset/1990s/Agneepath 1990 DVDRip XviD E-SuB xRG.srt,"01:16:51,560","01:16:55,280",Teylene has done what 4 people...,"Teylene has done
what 4 people..."
agneepath-1990-dvdrip-xvid-e-sub-xrg,1990s,/home/pratik/projects/GenderBias_TrendAnalysis/dataset/1990s/Agneepath 1990 DVDRip XviD E-SuB xRG.srt,"01:16:56,960","01:16:58,680",...and a hundred bullets couldn't do.,"...and a hundred bullets couldn't
do."
agneepath-1990-dvdrip-xvid-e-sub-xrg,1990s,/home/pratik/projects/GenderBias_TrendAnalysis/dataset/1990s/Agneepath 1990 DVDRip XviD E-SuB xRG.srt,"01:16:59,399","01:17:01,160",Has Teylene killed Vijay Chauhan?,"Has Teylene killed Vijay
Chauhan?"
agneepath-1990-dvdrip-xvid-e-sub-xrg,1990s,/home/pratik/projects/GenderBias_TrendAnalysis/dataset/1990s/Agneepath 1990 DVDRip XviD E-SuB xRG.srt,"01:17:28,000","01:17:30,000",l've always been punctual.,l've always been punctual.
agneepath-1990-dvdrip-xvid-e-sub-xrg,1990s,/home/pratik/projects/GenderBias_TrendAnalysis/dataset/1990s/Agneepath 1990 DVDRip XviD E-SuB xRG.srt,"01:17:32,000","01:17:33,760","But, l'm late today. l apologise for the delay.","But, l'm late today.
l apologise for the delay."
agneepath-1990-dvdrip-xvid-e-sub-xrg,1990s,/home/pratik/projects/GenderBias_TrendAnalysis/dataset/1990s/Agneepath 1990 DVDRip XviD E-SuB xRG.srt,"01:17:35,720","01:17:39,600",Someone dumped filth on me.,Someone dumped filth on me.
agneepath-1990-dvdrip-xvid-e-sub-xrg,1990s,/home/pratik/projects/GenderBias_TrendAnalysis/dataset/1990s/Agneepath 1990 DVDRip XviD E-SuB xRG.srt,"01:17:41,199","01:17:43,760",l thought l'd take a wash in the water to get rid ofthe filth.,"l thought l'd take a wash in
the water to get rid ofthe filth."
agneepath-1990-dvdrip-xvid-e-sub-xrg,1990s,/home/pratik/projects/GenderBias_TrendAnalysis/dataset/1990s/Agneepath 1990 DVDRip XviD E-SuB xRG.srt,"01:17:46,039","01:17:50,760",l'm Vijay Dinanath Chavan.,l'm Vijay Dinanath Chavan.
agneepath-1990-dvdrip-xvid-e-sub-xrg,1990s,/home/pratik/projects/GenderBias_TrendAnalysis/dataset/1990s/Agneepath 1990 DVDRip XviD E-SuB xRG.srt,"01:17:51,359","01:17:52,240",And l'm...,And l'm...
agneepath-1990-dvdrip-xvid-e-sub-xrg,1990s,/home/pratik/projects/GenderBias_TrendAnalysis/dataset/1990s/Agneepath 1990 DVDRip XviD E-SuB xRG.srt,"01:17:52,479","01:17:55,280","Kancha Cheena, who lives in a glass house.","Kancha Cheena,
who lives in a glass house."
agneepath-1990-dvdrip-xvid-e-sub-xrg,1990s,/home/pratik/projects/GenderBias_TrendAnalysis/dataset/1990s/Agneepath 1990 DVDRip XviD E-SuB xRG.srt,"01:17:59,479","01:18:03,080",l've met you. l used to clean your car...,"l've met you. l used to
clean your car..."
agneepath-1990-dvdrip-xvid-e-sub-xrg,1990s,/home/pratik/projects/GenderBias_TrendAnalysis/dataset/1990s/Agneepath 1990 DVDRip XviD E-SuB xRG.srt,"01:18:03,199","01:18:06,080",...with a piece of cloth when l was a kid.,"...with a piece of cloth
when l was a kid."
agneepath-1990-dvdrip-xvid-e-sub-xrg,1990s,/home/pratik/projects/GenderBias_TrendAnalysis/dataset/1990s/Agneepath 1990 DVDRip XviD E-SuB xRG.srt,"01:18:06,880","01:18:10,000","And now, you want to wear my clothes.","And now, you want to wear my
clothes."
agneepath-1990-dvdrip-xvid-e-sub-xrg,1990s,/home/pratik/projects/GenderBias_TrendAnalysis/dataset/1990s/Agneepath 1990 DVDRip XviD E-SuB xRG.srt,"01:18:10,399","01:18:13,600",No... not all. l don't want to wear clothes.,"No... not all.
l don't want to wear clothes."
agneepath-1990-dvdrip-xvid-e-sub-xrg,1990s,/home/pratik/projects/GenderBias_TrendAnalysis/dataset/1990s/Agneepath 1990 DVDRip XviD E-SuB xRG.srt,"01:18:14,399","01:18:16,280","lnstead, l want to help someone wear clothes...","lnstead, l want to help
someone wear clothes..."
agneepath-1990-dvdrip-xvid-e-sub-xrg,1990s,/home/pratik/projects/GenderBias_TrendAnalysis/dataset/1990s/Agneepath 1990 DVDRip XviD E-SuB xRG.srt,"01:18:25,199","01:18:26,680",...that is this lady.,...that is this lady.
agneepath-1990-dvdrip-xvid-e-sub-xrg,1990s,/home/pratik/projects/GenderBias_TrendAnalysis/dataset/1990s/Agneepath 1990 DVDRip XviD E-SuB xRG.srt,"01:18:27,119","01:18:28,680",Go on inside. Else you'll catch a cold.,"Go on inside.
Else you'll catch a cold."
agneepath-1990-dvdrip-xvid-e-sub-xrg,1990s,/home/pratik/projects/GenderBias_TrendAnalysis/dataset/1990s/Agneepath 1990 DVDRip XviD E-SuB xRG.srt,"01:18:33,720","01:18:36,480",Shall we talk business? - Come... Iet's sit down.,"Shall we talk business?
- Come... Iet's sit down."
agneepath-1990-dvdrip-xvid-e-sub-xrg,1990s,/home/pratik/projects/GenderBias_TrendAnalysis/dataset/1990s/Agneepath 1990 DVDRip XviD E-SuB xRG.srt,"01:18:41,720","01:18:44,440","Vey ambitious, are you?","Vey ambitious, are you?"
agneepath-1990-dvdrip-xvid-e-sub-xrg,1990s,/home/pratik/projects/GenderBias_TrendAnalysis/dataset/1990s/Agneepath 1990 DVDRip XviD E-SuB xRG.srt,"01:18:47,399","01:18:49,080",l'm way of people...,l'm way of people...
agneepath-1990-dvdrip-xvid-e-sub-xrg,1990s,/home/pratik/projects/GenderBias_TrendAnalysis/dataset/1990s/Agneepath 1990 DVDRip XviD E-SuB xRG.srt,"01:18:49,600","01:18:55,320",...who are over-ambitious.,...who are over-ambitious.
agneepath-1990-dvdrip-xvid-e-sub-xrg,1990s,/home/pratik/projects/GenderBias_TrendAnalysis/dataset/1990s/Agneepath 1990 DVDRip XviD E-SuB xRG.srt,"01:18:58,399","01:19:01,280",Even the most insignificant of men have their ambitions.,"Even the most insignificant
of men have their ambitions."
agneepath-1990-dvdrip-xvid-e-sub-xrg,1990s,/home/pratik/projects/GenderBias_TrendAnalysis/dataset/1990s/Agneepath 1990 DVDRip XviD E-SuB xRG.srt,"01:19:03,720","01:19:08,880","And sometimes, we must slaughter even innocents to achieve our goals.","And sometimes, we must slaughter
even innocents to achieve our goals."
agneepath-1990-dvdrip-xvid-e-sub-xrg,1990s,/home/pratik/projects/GenderBias_TrendAnalysis/dataset/1990s/Agneepath 1990 DVDRip XviD E-SuB xRG.srt,"01:19:10,600","01:19:15,280",Have you not trampled upon the weak and innocent?,"Have you not trampled upon
the weak and innocent?"
agneepath-1990-dvdrip-xvid-e-sub-xrg,1990s,/home/pratik/projects/GenderBias_TrendAnalysis/dataset/1990s/Agneepath 1990 DVDRip XviD E-SuB xRG.srt,"01:19:16,199","01:19:18,480","You have, haven't you? Yes! -What do you want from me?","You have, haven't you? Yes!
-What do you want from me?"
agneepath-1990-dvdrip-xvid-e-sub-xrg,1990s,/home/pratik/projects/GenderBias_TrendAnalysis/dataset/1990s/Agneepath 1990 DVDRip XviD E-SuB xRG.srt,"01:19:20,000","01:19:21,280",Mandwa.,Mandwa.
agneepath-1990-dvdrip-xvid-e-sub-xrg,1990s,/home/pratik/projects/GenderBias_TrendAnalysis/dataset/1990s/Agneepath 1990 DVDRip XviD E-SuB xRG.srt,"01:19:24,960","01:19:26,480",What's in Mandwa for you?,What's in Mandwa for you?
agneepath-1990-dvdrip-xvid-e-sub-xrg,1990s,/home/pratik/projects/GenderBias_TrendAnalysis/dataset/1990s/Agneepath 1990 DVDRip XviD E-SuB xRG.srt,"01:19:30,079","01:19:35,080",That which l can find in any place...,"That which l can
find in any place..."
agneepath-1990-dvdrip-xvid-e-sub-xrg,1990s,/home/pratik/projects/GenderBias_TrendAnalysis/dataset/1990s/Agneepath 1990 DVDRip XviD E-SuB xRG.srt,"01:19:35,399","01:19:40,000",Any place where the laws are Iax.,"Any place where the laws are
Iax."
agneepath-1990-dvdrip-xvid-e-sub-xrg,1990s,/home/pratik/projects/GenderBias_TrendAnalysis/dataset/1990s/Agneepath 1990 DVDRip XviD E-SuB xRG.srt,"01:19:42,039","01:19:46,760",You run a business out of Mandwa. l want to set up base there.,"You run a business out of Mandwa.
l want to set up base there."
agneepath-1990-dvdrip-xvid-e-sub-xrg,1990s,/home/pratik/projects/GenderBias_TrendAnalysis/dataset/1990s/Agneepath 1990 DVDRip XviD E-SuB xRG.srt,"01:19:47,199","01:19:50,680","We can work together. You could make your buck, and l could make mine.","We can work together. You could
make your buck, and l could make mine."
agneepath-1990-dvdrip-xvid-e-sub-xrg,1990s,/home/pratik/projects/GenderBias_TrendAnalysis/dataset/1990s/Agneepath 1990 DVDRip XviD E-SuB xRG.srt,"01:19:52,199","01:19:53,480","Else, ...","Else, ..."
agneepath-1990-dvdrip-xvid-e-sub-xrg,1990s,/home/pratik/projects/GenderBias_TrendAnalysis/dataset/1990s/Agneepath 1990 DVDRip XviD E-SuB xRG.srt,"01:19:55,279","01:20:00,760",... innocents will die as we compete with each other. Isn't that so?,"... innocents will die as we compete
with each other. Isn't that so?"
agneepath-1990-dvdrip-xvid-e-sub-xrg,1990s,/home/pratik/projects/GenderBias_TrendAnalysis/dataset/1990s/Agneepath 1990 DVDRip XviD E-SuB xRG.srt,"01:20:01,720","01:20:05,600","All right. But, be warned.","All right. But, be warned."
agneepath-1990-dvdrip-xvid-e-sub-xrg,1990s,/home/pratik/projects/GenderBias_TrendAnalysis/dataset/1990s/Agneepath 1990 DVDRip XviD E-SuB xRG.srt,"01:20:07,119","01:20:10,280",Don't ty to cross my path. Get that?,"Don't ty to cross my path. Get
that?"
agneepath-1990-dvdrip-xvid-e-sub-xrg,1990s,/home/pratik/projects/GenderBias_TrendAnalysis/dataset/1990s/Agneepath 1990 DVDRip XviD E-SuB xRG.srt,"01:20:12,399","01:20:17,280",There's only one punishment for evey error... death.,"There's only one punishment for
evey error... death."
agneepath-1990-dvdrip-xvid-e-sub-xrg,1990s,/home/pratik/projects/GenderBias_TrendAnalysis/dataset/1990s/Agneepath 1990 DVDRip XviD E-SuB xRG.srt,"01:20:18,520","01:20:22,280",Only death! Take a look... over there.,"Only death!
Take a look... over there."
agneepath-1990-dvdrip-xvid-e-sub-xrg,1990s,/home/pratik/projects/GenderBias_TrendAnalysis/dataset/1990s/Agneepath 1990 DVDRip XviD E-SuB xRG.srt,"01:20:26,119","01:20:28,760",lt's a small giR for you...,lt's a small giR for you...
agneepath-1990-dvdrip-xvid-e-sub-xrg,1990s,/home/pratik/projects/GenderBias_TrendAnalysis/dataset/1990s/Agneepath 1990 DVDRip XviD E-SuB xRG.srt,"01:20:29,600","01:20:33,080",... to mark the beginning of our friendship.,"... to mark the beginning
of our friendship."
agneepath-1990-dvdrip-xvid-e-sub-xrg,1990s,/home/pratik/projects/GenderBias_TrendAnalysis/dataset/1990s/Agneepath 1990 DVDRip XviD E-SuB xRG.srt,"01:20:40,399","01:20:42,680",He was your enemy... Teylene.,He was your enemy... Teylene.
agneepath-1990-dvdrip-xvid-e-sub-xrg,1990s,/home/pratik/projects/GenderBias_TrendAnalysis/dataset/1990s/Agneepath 1990 DVDRip XviD E-SuB xRG.srt,"01:21:05,119","01:21:07,280",What's that mark on your hand?,What's that mark on your hand?
agneepath-1990-dvdrip-xvid-e-sub-xrg,1990s,/home/pratik/projects/GenderBias_TrendAnalysis/dataset/1990s/Agneepath 1990 DVDRip XviD E-SuB xRG.srt,"01:21:10,199","01:21:15,280",l had burnt a petrol pump when l was a kid. l had also burnt my hand.,"l had burnt a petrol pump when
l was a kid. l had also burnt my hand."
agneepath-1990-dvdrip-xvid-e-sub-xrg,1990s,/home/pratik/projects/GenderBias_TrendAnalysis/dataset/1990s/Agneepath 1990 DVDRip XviD E-SuB xRG.srt,"01:21:18,399","01:21:23,320",The petrol pump was mine. l'll send you the bill.,"The petrol pump was mine.
l'll send you the bill."
agneepath-1990-dvdrip-xvid-e-sub-xrg,1990s,/home/pratik/projects/GenderBias_TrendAnalysis/dataset/1990s/Agneepath 1990 DVDRip XviD E-SuB xRG.srt,"01:21:24,439","01:21:26,000",Do send your tailor's address along too.,"Do send your tailor's
address along too."
agneepath-1990-dvdrip-xvid-e-sub-xrg,1990s,/home/pratik/projects/GenderBias_TrendAnalysis/dataset/1990s/Agneepath 1990 DVDRip XviD E-SuB xRG.srt,"01:21:27,439","01:21:31,440",l like the way you dress.,l like the way you dress.
agneepath-1990-dvdrip-xvid-e-sub-xrg,1990s,/home/pratik/projects/GenderBias_TrendAnalysis/dataset/1990s/Agneepath 1990 DVDRip XviD E-SuB xRG.srt,"01:22:23,319","01:22:28,480","Swing, dance and sing...","Swing, dance and sing..."
agneepath-1990-dvdrip-xvid-e-sub-xrg,1990s,/home/pratik/projects/GenderBias_TrendAnalysis/dataset/1990s/Agneepath 1990 DVDRip XviD E-SuB xRG.srt,"01:22:31,159","01:22:35,600","Swing, dance and sing, friends","Swing, dance and sing, friends"
agneepath-1990-dvdrip-xvid-e-sub-xrg,1990s,/home/pratik/projects/GenderBias_TrendAnalysis/dataset/1990s/Agneepath 1990 DVDRip XviD E-SuB xRG.srt,"01:22:40,359","01:22:44,600",Alibaba has met all the 40 thieves.,"Alibaba has met
all the 40 thieves."
agneepath-1990-dvdrip-xvid-e-sub-xrg,1990s,/home/pratik/projects/GenderBias_TrendAnalysis/dataset/1990s/Agneepath 1990 DVDRip XviD E-SuB xRG.srt,"01:23:01,760","01:23:08,800",Let the world listen to something said by a poet.,"Let the world listen to something
said by a poet."
agneepath-1990-dvdrip-xvid-e-sub-xrg,1990s,/home/pratik/projects/GenderBias_TrendAnalysis/dataset/1990s/Agneepath 1990 DVDRip XviD E-SuB xRG.srt,"01:23:10,399","01:23:16,960",Eveybody who shakes hands with you is not a friend.,"Eveybody who shakes hands
with you is not a friend."
agneepath-1990-dvdrip-xvid-e-sub-xrg,1990s,/home/pratik/projects/GenderBias_TrendAnalysis/dataset/1990s/Agneepath 1990 DVDRip XviD E-SuB xRG.srt,"01:23:24,079","01:23:30,480",Who is there in your heart and whom are you looking at?,"Who is there in your heart and
whom are you looking at?"
agneepath-1990-dvdrip-xvid-e-sub-xrg,1990s,/home/pratik/projects/GenderBias_TrendAnalysis/dataset/1990s/Agneepath 1990 DVDRip XviD E-SuB xRG.srt,"01:23:31,760","01:23:36,200",You know it and l am also aware of it.,"You know it and
l am also aware of it."
agneepath-1990-dvdrip-xvid-e-sub-xrg,1990s,/home/pratik/projects/GenderBias_TrendAnalysis/dataset/1990s/Agneepath 1990 DVDRip XviD E-SuB xRG.srt,"01:23:36,960","01:23:38,320",l don't want to tell anyone else.,l don't want to tell anyone else.
agneepath-1990-dvdrip-xvid-e-sub-xrg,1990s,/home/pratik/projects/GenderBias_TrendAnalysis/dataset/1990s/Agneepath 1990 DVDRip XviD E-SuB xRG.srt,"01:23:41,920","01:23:47,800",Alibaba has met all the 40 thieves.,"Alibaba has met all the
40 thieves."
agneepath-1990-dvdrip-xvid-e-sub-xrg,1990s,/home/pratik/projects/GenderBias_TrendAnalysis/dataset/1990s/Agneepath 1990 DVDRip XviD E-SuB xRG.srt,"01:23:49,119","01:23:55,680",These secrets are not meant to be shared with eveyone.,"These secrets are not meant to
be shared with eveyone."
agneepath-1990-dvdrip-xvid-e-sub-xrg,1990s,/home/pratik/projects/GenderBias_TrendAnalysis/dataset/1990s/Agneepath 1990 DVDRip XviD E-SuB xRG.srt,"01:23:57,880","01:24:03,760",Eveybody who shakes hands is not a friend.,"Eveybody who shakes hands is
not a friend."
agneepath-1990-dvdrip-xvid-e-sub-xrg,1990s,/home/pratik/projects/GenderBias_TrendAnalysis/dataset/1990s/Agneepath 1990 DVDRip XviD E-SuB xRG.srt,"01:24:25,199","01:24:39,120",Someone has drunk such a thing that...,"Someone has drunk such a
thing that..."
agneepath-1990-dvdrip-xvid-e-sub-xrg,1990s,/home/pratik/projects/GenderBias_TrendAnalysis/dataset/1990s/Agneepath 1990 DVDRip XviD E-SuB xRG.srt,"01:24:40,720","01:24:44,760",...the thirst is not quenched but there is fire.,"...the thirst is not quenched but
there is fire."
agneepath-1990-dvdrip-xvid-e-sub-xrg,1990s,/home/pratik/projects/GenderBias_TrendAnalysis/dataset/1990s/Agneepath 1990 DVDRip XviD E-SuB xRG.srt,"01:24:46,319","01:24:48,560",This is the effect of love.,This is the effect of love.
agneepath-1990-dvdrip-xvid-e-sub-xrg,1990s,/home/pratik/projects/GenderBias_TrendAnalysis/dataset/1990s/Agneepath 1990 DVDRip XviD E-SuB xRG.srt,"01:24:52,359","01:24:56,800",Alibaba has met all the 40 thieves.,"Alibaba has met all the
40 thieves."
agneepath-1990-dvdrip-xvid-e-sub-xrg,1990s,/home/pratik/projects/GenderBias_TrendAnalysis/dataset/1990s/Agneepath 1990 DVDRip XviD E-SuB xRG.srt,"01:24:58,560","01:25:05,440",All the drinks are not meant for drinking.,"All the drinks are not meant for
drinking."
agneepath-1990-dvdrip-xvid-e-sub-xrg,1990s,/home/pratik/projects/GenderBias_TrendAnalysis/dataset/1990s/Agneepath 1990 DVDRip XviD E-SuB xRG.srt,"01:25:06,960","01:25:13,240",Eveybody who shakes hands with you is not a friend.,"Eveybody who shakes hands
with you is not a friend."
agneepath-1990-dvdrip-xvid-e-sub-xrg,1990s,/home/pratik/projects/GenderBias_TrendAnalysis/dataset/1990s/Agneepath 1990 DVDRip XviD E-SuB xRG.srt,"01:25:30,640","01:25:36,960",l won't allow you to go far away.,"l won't allow you to
go far away."
agneepath-1990-dvdrip-xvid-e-sub-xrg,1990s,/home/pratik/projects/GenderBias_TrendAnalysis/dataset/1990s/Agneepath 1990 DVDRip XviD E-SuB xRG.srt,"01:25:38,199","01:25:44,120",l won't allow you to go far away.,"l won't allow you to
go far away."
agneepath-1990-dvdrip-xvid-e-sub-xrg,1990s,/home/pratik/projects/GenderBias_TrendAnalysis/dataset/1990s/Agneepath 1990 DVDRip XviD E-SuB xRG.srt,"01:25:46,479","01:25:49,640",l will keep you bound with me...,"l will keep you bound
with me..."
agneepath-1990-dvdrip-xvid-e-sub-xrg,1990s,/home/pratik/projects/GenderBias_TrendAnalysis/dataset/1990s/Agneepath 1990 DVDRip XviD E-SuB xRG.srt,"01:25:51,640","01:25:53,320",...just with the help ofthe strength of my hair.,"...just with the help
ofthe strength of my hair."
agneepath-1990-dvdrip-xvid-e-sub-xrg,1990s,/home/pratik/projects/GenderBias_TrendAnalysis/dataset/1990s/Agneepath 1990 DVDRip XviD E-SuB xRG.srt,"01:25:57,680","01:26:01,520",Alibaba has met all the 40 thieves.,"Alibaba has met all
the 40 thieves."
agneepath-1990-dvdrip-xvid-e-sub-xrg,1990s,/home/pratik/projects/GenderBias_TrendAnalysis/dataset/1990s/Agneepath 1990 DVDRip XviD E-SuB xRG.srt,"01:26:03,840","01:26:10,200",All the friends do not show love & loyalty.,"All the friends do not
show love & loyalty."
agneepath-1990-dvdrip-xvid-e-sub-xrg,1990s,/home/pratik/projects/GenderBias_TrendAnalysis/dataset/1990s/Agneepath 1990 DVDRip XviD E-SuB xRG.srt,"01:26:12,000","01:26:18,400",Eveybody who shakes hands with you is not a friend.,"Eveybody who shakes hands
with you is not a friend."
agneepath-1990-dvdrip-xvid-e-sub-xrg,1990s,/home/pratik/projects/GenderBias_TrendAnalysis/dataset/1990s/Agneepath 1990 DVDRip XviD E-SuB xRG.srt,"01:26:19,840","01:26:25,520","Swing, dance and sing...","Swing, dance and sing..."
agneepath-1990-dvdrip-xvid-e-sub-xrg,1990s,/home/pratik/projects/GenderBias_TrendAnalysis/dataset/1990s/Agneepath 1990 DVDRip XviD E-SuB xRG.srt,"01:26:26,680","01:26:32,680","Swing, dance and sing with mery, friends.","Swing, dance and sing
with mery, friends."
agneepath-1990-dvdrip-xvid-e-sub-xrg,1990s,/home/pratik/projects/GenderBias_TrendAnalysis/dataset/1990s/Agneepath 1990 DVDRip XviD E-SuB xRG.srt,"01:26:37,000","01:26:40,600",Alibaba has met all the 40 thieves.,"Alibaba has met all the
40 thieves."
agneepath-1990-dvdrip-xvid-e-sub-xrg,1990s,/home/pratik/projects/GenderBias_TrendAnalysis/dataset/1990s/Agneepath 1990 DVDRip XviD E-SuB xRG.srt,"01:26:49,079","01:26:49,360",Out!... Get out of my way... Step aside.,"Out!... Get out of my way...
Step aside."
agneepath-1990-dvdrip-xvid-e-sub-xrg,1990s,/home/pratik/projects/GenderBias_TrendAnalysis/dataset/1990s/Agneepath 1990 DVDRip XviD E-SuB xRG.srt,"01:26:55,800","01:26:58,680",Anna! Vijay Chavan has gone abroad. And his sister is here all alone.,"Anna! Vijay Chavan has gone abroad.
And his sister is here all alone."
agneepath-1990-dvdrip-xvid-e-sub-xrg,1990s,/home/pratik/projects/GenderBias_TrendAnalysis/dataset/1990s/Agneepath 1990 DVDRip XviD E-SuB xRG.srt,"01:26:59,119","01:27:01,560","l'll be back in sometime, Mummy. Don't wory.","l'll be back in sometime, Mummy.
Don't wory."
agneepath-1990-dvdrip-xvid-e-sub-xrg,1990s,/home/pratik/projects/GenderBias_TrendAnalysis/dataset/1990s/Agneepath 1990 DVDRip XviD E-SuB xRG.srt,"01:27:01,840","01:27:05,920",She needn't wory. Krishnan lyer MA is going to accompany you.,"She needn't wory. Krishnan lyer MA
is going to accompany you."
agneepath-1990-dvdrip-xvid-e-sub-xrg,1990s,/home/pratik/projects/GenderBias_TrendAnalysis/dataset/1990s/Agneepath 1990 DVDRip XviD E-SuB xRG.srt,"01:27:06,319","01:27:10,160",What?! Are you coming with me? -Yes. The guard follows your body.,"What?! Are you coming with me?
-Yes. The guard follows your body."
agneepath-1990-dvdrip-xvid-e-sub-xrg,1990s,/home/pratik/projects/GenderBias_TrendAnalysis/dataset/1990s/Agneepath 1990 DVDRip XviD E-SuB xRG.srt,"01:27:11,279","01:27:14,560","l don't need a bodyguard. And, you needn't come with me.","l don't need a bodyguard.
And, you needn't come with me."
