film_id,decade,file_path,start,end,text_clean,text_raw
soldier-1998-hindi-web-dl-1080p-720p-avc-x264-aac-esubs-by-juleyano,1990s,/home/pratik/projects/GenderBias_TrendAnalysis/dataset/1990s/Soldier (1998) Hindi.WEB.DL.1080p.720p.AVC.x264.AAC.Esubs.BY Juleyano.srt,"00:02:22,173","00:02:24,095",Attention!,Attention!
soldier-1998-hindi-web-dl-1080p-720p-avc-x264-aac-esubs-by-juleyano,1990s,/home/pratik/projects/GenderBias_TrendAnalysis/dataset/1990s/Soldier (1998) Hindi.WEB.DL.1080p.720p.AVC.x264.AAC.Esubs.BY Juleyano.srt,"00:02:29,573","00:02:31,422",Stand at ease!,Stand at ease!
soldier-1998-hindi-web-dl-1080p-720p-avc-x264-aac-esubs-by-juleyano,1990s,/home/pratik/projects/GenderBias_TrendAnalysis/dataset/1990s/Soldier (1998) Hindi.WEB.DL.1080p.720p.AVC.x264.AAC.Esubs.BY Juleyano.srt,"00:02:33,453","00:02:34,787",Major Vijay Malhotra reporting sir.,Major Vijay Malhotra reporting sir.
soldier-1998-hindi-web-dl-1080p-720p-avc-x264-aac-esubs-by-juleyano,1990s,/home/pratik/projects/GenderBias_TrendAnalysis/dataset/1990s/Soldier (1998) Hindi.WEB.DL.1080p.720p.AVC.x264.AAC.Esubs.BY Juleyano.srt,"00:02:35,773","00:02:37,250",- Come. Sit down. - Thank you.,"- Come. Sit down.
- Thank you."
soldier-1998-hindi-web-dl-1080p-720p-avc-x264-aac-esubs-by-juleyano,1990s,/home/pratik/projects/GenderBias_TrendAnalysis/dataset/1990s/Soldier (1998) Hindi.WEB.DL.1080p.720p.AVC.x264.AAC.Esubs.BY Juleyano.srt,"00:02:40,173","00:02:41,817",- Yes Vijay? - Sir.,"- Yes Vijay?
- Sir."
soldier-1998-hindi-web-dl-1080p-720p-avc-x264-aac-esubs-by-juleyano,1990s,/home/pratik/projects/GenderBias_TrendAnalysis/dataset/1990s/Soldier (1998) Hindi.WEB.DL.1080p.720p.AVC.x264.AAC.Esubs.BY Juleyano.srt,"00:02:42,493","00:02:45,365",The truck carrying arms to the border Met with an accident last month.,"The truck carrying arms to the border
Met with an accident last month."
soldier-1998-hindi-web-dl-1080p-720p-avc-x264-aac-esubs-by-juleyano,1990s,/home/pratik/projects/GenderBias_TrendAnalysis/dataset/1990s/Soldier (1998) Hindi.WEB.DL.1080p.720p.AVC.x264.AAC.Esubs.BY Juleyano.srt,"00:02:46,008","00:02:49,233","And the task to enquire the fire in the jeep,","And the task to enquire
the fire in the jeep,"
soldier-1998-hindi-web-dl-1080p-720p-avc-x264-aac-esubs-by-juleyano,1990s,/home/pratik/projects/GenderBias_TrendAnalysis/dataset/1990s/Soldier (1998) Hindi.WEB.DL.1080p.720p.AVC.x264.AAC.Esubs.BY Juleyano.srt,"00:02:49,773","00:02:51,101",I've prepared its' report.,I've prepared its' report.
soldier-1998-hindi-web-dl-1080p-720p-avc-x264-aac-esubs-by-juleyano,1990s,/home/pratik/projects/GenderBias_TrendAnalysis/dataset/1990s/Soldier (1998) Hindi.WEB.DL.1080p.720p.AVC.x264.AAC.Esubs.BY Juleyano.srt,"00:02:51,142","00:02:55,577",- So what's the outcome? - It was a plan not an accident.,"- So what's the outcome?
- It was a plan not an accident."
soldier-1998-hindi-web-dl-1080p-720p-avc-x264-aac-esubs-by-juleyano,1990s,/home/pratik/projects/GenderBias_TrendAnalysis/dataset/1990s/Soldier (1998) Hindi.WEB.DL.1080p.720p.AVC.x264.AAC.Esubs.BY Juleyano.srt,"00:02:56,147","00:02:57,969",The aim of being stealing of arms.,The aim of being stealing of arms.
soldier-1998-hindi-web-dl-1080p-720p-avc-x264-aac-esubs-by-juleyano,1990s,/home/pratik/projects/GenderBias_TrendAnalysis/dataset/1990s/Soldier (1998) Hindi.WEB.DL.1080p.720p.AVC.x264.AAC.Esubs.BY Juleyano.srt,"00:02:58,592","00:03:03,757",Means our people are involved. Must hand the case to intelligence.,"Means our people are involved.
Must hand the case to intelligence."
soldier-1998-hindi-web-dl-1080p-720p-avc-x264-aac-esubs-by-juleyano,1990s,/home/pratik/projects/GenderBias_TrendAnalysis/dataset/1990s/Soldier (1998) Hindi.WEB.DL.1080p.720p.AVC.x264.AAC.Esubs.BY Juleyano.srt,"00:03:03,910","00:03:07,954",I have a request. The truck that is to leave tomorrow,"I have a request.
The truck that is to leave tomorrow"
soldier-1998-hindi-web-dl-1080p-720p-avc-x264-aac-esubs-by-juleyano,1990s,/home/pratik/projects/GenderBias_TrendAnalysis/dataset/1990s/Soldier (1998) Hindi.WEB.DL.1080p.720p.AVC.x264.AAC.Esubs.BY Juleyano.srt,"00:03:08,770","00:03:11,522",give me the responsibility of taking it to the border security force.,"give me the responsibility of taking
it to the border security force."
soldier-1998-hindi-web-dl-1080p-720p-avc-x264-aac-esubs-by-juleyano,1990s,/home/pratik/projects/GenderBias_TrendAnalysis/dataset/1990s/Soldier (1998) Hindi.WEB.DL.1080p.720p.AVC.x264.AAC.Esubs.BY Juleyano.srt,"00:03:12,587","00:03:16,687","If this happens again, the arms looters will be uncontrollable.","If this happens again,
the arms looters will be uncontrollable."
soldier-1998-hindi-web-dl-1080p-720p-avc-x264-aac-esubs-by-juleyano,1990s,/home/pratik/projects/GenderBias_TrendAnalysis/dataset/1990s/Soldier (1998) Hindi.WEB.DL.1080p.720p.AVC.x264.AAC.Esubs.BY Juleyano.srt,"00:03:17,122","00:03:17,507",Okay.,Okay.
soldier-1998-hindi-web-dl-1080p-720p-avc-x264-aac-esubs-by-juleyano,1990s,/home/pratik/projects/GenderBias_TrendAnalysis/dataset/1990s/Soldier (1998) Hindi.WEB.DL.1080p.720p.AVC.x264.AAC.Esubs.BY Juleyano.srt,"00:03:20,800","00:03:22,600",Why doesn't this plane fly?,Why doesn't this plane fly?
soldier-1998-hindi-web-dl-1080p-720p-avc-x264-aac-esubs-by-juleyano,1990s,/home/pratik/projects/GenderBias_TrendAnalysis/dataset/1990s/Soldier (1998) Hindi.WEB.DL.1080p.720p.AVC.x264.AAC.Esubs.BY Juleyano.srt,"00:03:22,727","00:03:26,590","What are you saying, son? Do toys ever fly?","What are you saying, son?
Do toys ever fly?"
soldier-1998-hindi-web-dl-1080p-720p-avc-x264-aac-esubs-by-juleyano,1990s,/home/pratik/projects/GenderBias_TrendAnalysis/dataset/1990s/Soldier (1998) Hindi.WEB.DL.1080p.720p.AVC.x264.AAC.Esubs.BY Juleyano.srt,"00:03:26,702","00:03:28,675",Buy me a flying plane.,Buy me a flying plane.
soldier-1998-hindi-web-dl-1080p-720p-avc-x264-aac-esubs-by-juleyano,1990s,/home/pratik/projects/GenderBias_TrendAnalysis/dataset/1990s/Soldier (1998) Hindi.WEB.DL.1080p.720p.AVC.x264.AAC.Esubs.BY Juleyano.srt,"00:03:28,877","00:03:31,567",First grow up. Then you'll see,First grow up. Then you'll see
soldier-1998-hindi-web-dl-1080p-720p-avc-x264-aac-esubs-by-juleyano,1990s,/home/pratik/projects/GenderBias_TrendAnalysis/dataset/1990s/Soldier (1998) Hindi.WEB.DL.1080p.720p.AVC.x264.AAC.Esubs.BY Juleyano.srt,"00:03:31,607","00:03:36,343",you'll have more planes than people have cars. Go.,"you'll have more planes
than people have cars. Go."
soldier-1998-hindi-web-dl-1080p-720p-avc-x264-aac-esubs-by-juleyano,1990s,/home/pratik/projects/GenderBias_TrendAnalysis/dataset/1990s/Soldier (1998) Hindi.WEB.DL.1080p.720p.AVC.x264.AAC.Esubs.BY Juleyano.srt,"00:03:36,627","00:03:40,145","For the time being, make do with this.","For the time being, make do with this."
soldier-1998-hindi-web-dl-1080p-720p-avc-x264-aac-esubs-by-juleyano,1990s,/home/pratik/projects/GenderBias_TrendAnalysis/dataset/1990s/Soldier (1998) Hindi.WEB.DL.1080p.720p.AVC.x264.AAC.Esubs.BY Juleyano.srt,"00:03:41,285","00:03:44,727","If you fill A, B, C... in his mind instead of this","If you fill A, B, C...
in his mind instead of this"
soldier-1998-hindi-web-dl-1080p-720p-avc-x264-aac-esubs-by-juleyano,1990s,/home/pratik/projects/GenderBias_TrendAnalysis/dataset/1990s/Soldier (1998) Hindi.WEB.DL.1080p.720p.AVC.x264.AAC.Esubs.BY Juleyano.srt,"00:03:45,377","00:03:47,359",he'd learn to write his name.,he'd learn to write his name.
soldier-1998-hindi-web-dl-1080p-720p-avc-x264-aac-esubs-by-juleyano,1990s,/home/pratik/projects/GenderBias_TrendAnalysis/dataset/1990s/Soldier (1998) Hindi.WEB.DL.1080p.720p.AVC.x264.AAC.Esubs.BY Juleyano.srt,"00:03:47,907","00:03:51,695",He will learn. The alphabets are not leaving India.,"He will learn.
The alphabets are not leaving India."
soldier-1998-hindi-web-dl-1080p-720p-avc-x264-aac-esubs-by-juleyano,1990s,/home/pratik/projects/GenderBias_TrendAnalysis/dataset/1990s/Soldier (1998) Hindi.WEB.DL.1080p.720p.AVC.x264.AAC.Esubs.BY Juleyano.srt,"00:03:52,212","00:03:53,656",But look at his age.,But look at his age.
soldier-1998-hindi-web-dl-1080p-720p-avc-x264-aac-esubs-by-juleyano,1990s,/home/pratik/projects/GenderBias_TrendAnalysis/dataset/1990s/Soldier (1998) Hindi.WEB.DL.1080p.720p.AVC.x264.AAC.Esubs.BY Juleyano.srt,"00:03:54,155","00:03:55,220",He's grown so big.,He's grown so big.
soldier-1998-hindi-web-dl-1080p-720p-avc-x264-aac-esubs-by-juleyano,1990s,/home/pratik/projects/GenderBias_TrendAnalysis/dataset/1990s/Soldier (1998) Hindi.WEB.DL.1080p.720p.AVC.x264.AAC.Esubs.BY Juleyano.srt,"00:03:55,497","00:03:58,159","You neither showed him a book, nor did he see a school.","You neither showed him a
book, nor did he see a school."
soldier-1998-hindi-web-dl-1080p-720p-avc-x264-aac-esubs-by-juleyano,1990s,/home/pratik/projects/GenderBias_TrendAnalysis/dataset/1990s/Soldier (1998) Hindi.WEB.DL.1080p.720p.AVC.x264.AAC.Esubs.BY Juleyano.srt,"00:03:58,505","00:03:59,678",Aren't you at all worried?,Aren't you at all worried?
soldier-1998-hindi-web-dl-1080p-720p-avc-x264-aac-esubs-by-juleyano,1990s,/home/pratik/projects/GenderBias_TrendAnalysis/dataset/1990s/Soldier (1998) Hindi.WEB.DL.1080p.720p.AVC.x264.AAC.Esubs.BY Juleyano.srt,"00:03:59,702","00:04:05,319",Buy a couple of buffaloes with the money you'll spend on books.,"Buy a couple of buffaloes with
the money you'll spend on books."
soldier-1998-hindi-web-dl-1080p-720p-avc-x264-aac-esubs-by-juleyano,1990s,/home/pratik/projects/GenderBias_TrendAnalysis/dataset/1990s/Soldier (1998) Hindi.WEB.DL.1080p.720p.AVC.x264.AAC.Esubs.BY Juleyano.srt,"00:04:05,693","00:04:09,013",The boy will drink milk and become as tough as us!,"The boy will drink milk
and become as tough as us!"
soldier-1998-hindi-web-dl-1080p-720p-avc-x264-aac-esubs-by-juleyano,1990s,/home/pratik/projects/GenderBias_TrendAnalysis/dataset/1990s/Soldier (1998) Hindi.WEB.DL.1080p.720p.AVC.x264.AAC.Esubs.BY Juleyano.srt,"00:04:09,036","00:04:11,694",He'll become as clever as brother. You won't believe it.,"He'll become as clever as brother.
You won't believe it."
soldier-1998-hindi-web-dl-1080p-720p-avc-x264-aac-esubs-by-juleyano,1990s,/home/pratik/projects/GenderBias_TrendAnalysis/dataset/1990s/Soldier (1998) Hindi.WEB.DL.1080p.720p.AVC.x264.AAC.Esubs.BY Juleyano.srt,"00:04:19,025","00:04:22,775",- What is it? - Sir has called for an urgent meeting.,"- What is it?
- Sir has called for an urgent meeting."
soldier-1998-hindi-web-dl-1080p-720p-avc-x264-aac-esubs-by-juleyano,1990s,/home/pratik/projects/GenderBias_TrendAnalysis/dataset/1990s/Soldier (1998) Hindi.WEB.DL.1080p.720p.AVC.x264.AAC.Esubs.BY Juleyano.srt,"00:04:23,315","00:04:24,268",What meeting?,What meeting?
soldier-1998-hindi-web-dl-1080p-720p-avc-x264-aac-esubs-by-juleyano,1990s,/home/pratik/projects/GenderBias_TrendAnalysis/dataset/1990s/Soldier (1998) Hindi.WEB.DL.1080p.720p.AVC.x264.AAC.Esubs.BY Juleyano.srt,"00:04:24,309","00:04:27,179",Nothing as such but he has called everybody.,"Nothing as such but he
has called everybody."
soldier-1998-hindi-web-dl-1080p-720p-avc-x264-aac-esubs-by-juleyano,1990s,/home/pratik/projects/GenderBias_TrendAnalysis/dataset/1990s/Soldier (1998) Hindi.WEB.DL.1080p.720p.AVC.x264.AAC.Esubs.BY Juleyano.srt,"00:04:27,440","00:04:28,817",Subhedar Pratap Singh has come.,BALDEV: Subhedar Pratap Singh has come.
soldier-1998-hindi-web-dl-1080p-720p-avc-x264-aac-esubs-by-juleyano,1990s,/home/pratik/projects/GenderBias_TrendAnalysis/dataset/1990s/Soldier (1998) Hindi.WEB.DL.1080p.720p.AVC.x264.AAC.Esubs.BY Juleyano.srt,"00:04:28,856","00:04:33,208",That's fine but what about the cash for the arms we gave last time?,"That's fine but what about the cash
for the arms we gave last time?"
soldier-1998-hindi-web-dl-1080p-720p-avc-x264-aac-esubs-by-juleyano,1990s,/home/pratik/projects/GenderBias_TrendAnalysis/dataset/1990s/Soldier (1998) Hindi.WEB.DL.1080p.720p.AVC.x264.AAC.Esubs.BY Juleyano.srt,"00:04:33,249","00:04:35,772",He's given this bag full!,He's given this bag full!
soldier-1998-hindi-web-dl-1080p-720p-avc-x264-aac-esubs-by-juleyano,1990s,/home/pratik/projects/GenderBias_TrendAnalysis/dataset/1990s/Soldier (1998) Hindi.WEB.DL.1080p.720p.AVC.x264.AAC.Esubs.BY Juleyano.srt,"00:04:38,704","00:04:41,562",- How much is it? - I can't count much.,"- How much is it?
- I can't count much."
soldier-1998-hindi-web-dl-1080p-720p-avc-x264-aac-esubs-by-juleyano,1990s,/home/pratik/projects/GenderBias_TrendAnalysis/dataset/1990s/Soldier (1998) Hindi.WEB.DL.1080p.720p.AVC.x264.AAC.Esubs.BY Juleyano.srt,"00:04:41,900","00:04:44,660",I'll weigh it if you say. Must be 7 or 8 kilos with the bag.,"I'll weigh it if you say.
Must be 7 or 8 kilos with the bag."
soldier-1998-hindi-web-dl-1080p-720p-avc-x264-aac-esubs-by-juleyano,1990s,/home/pratik/projects/GenderBias_TrendAnalysis/dataset/1990s/Soldier (1998) Hindi.WEB.DL.1080p.720p.AVC.x264.AAC.Esubs.BY Juleyano.srt,"00:04:44,862","00:04:49,962","No need. You wait at the corner,","No need. You wait at the corner,"
soldier-1998-hindi-web-dl-1080p-720p-avc-x264-aac-esubs-by-juleyano,1990s,/home/pratik/projects/GenderBias_TrendAnalysis/dataset/1990s/Soldier (1998) Hindi.WEB.DL.1080p.720p.AVC.x264.AAC.Esubs.BY Juleyano.srt,"00:04:50,013","00:04:51,247",- I'll change and come. - Okay.,"- I'll change and come.
- Okay."
soldier-1998-hindi-web-dl-1080p-720p-avc-x264-aac-esubs-by-juleyano,1990s,/home/pratik/projects/GenderBias_TrendAnalysis/dataset/1990s/Soldier (1998) Hindi.WEB.DL.1080p.720p.AVC.x264.AAC.Esubs.BY Juleyano.srt,"00:04:59,260","00:05:03,134",Are you doing the duty for which the government gave you this uniform?,"Are you doing the duty for which the
government gave you this uniform?"
soldier-1998-hindi-web-dl-1080p-720p-avc-x264-aac-esubs-by-juleyano,1990s,/home/pratik/projects/GenderBias_TrendAnalysis/dataset/1990s/Soldier (1998) Hindi.WEB.DL.1080p.720p.AVC.x264.AAC.Esubs.BY Juleyano.srt,"00:05:03,313","00:05:05,562",Of course! That's what I'm doing!,Of course! That's what I'm doing!
soldier-1998-hindi-web-dl-1080p-720p-avc-x264-aac-esubs-by-juleyano,1990s,/home/pratik/projects/GenderBias_TrendAnalysis/dataset/1990s/Soldier (1998) Hindi.WEB.DL.1080p.720p.AVC.x264.AAC.Esubs.BY Juleyano.srt,"00:05:05,775","00:05:08,457",You were but no more!,You were but no more!
soldier-1998-hindi-web-dl-1080p-720p-avc-x264-aac-esubs-by-juleyano,1990s,/home/pratik/projects/GenderBias_TrendAnalysis/dataset/1990s/Soldier (1998) Hindi.WEB.DL.1080p.720p.AVC.x264.AAC.Esubs.BY Juleyano.srt,"00:05:09,305","00:05:11,532",Earlier 3000 rupees used to come on the first of every month.,"Earlier 3000 rupees used to come
on the first of every month."
soldier-1998-hindi-web-dl-1080p-720p-avc-x264-aac-esubs-by-juleyano,1990s,/home/pratik/projects/GenderBias_TrendAnalysis/dataset/1990s/Soldier (1998) Hindi.WEB.DL.1080p.720p.AVC.x264.AAC.Esubs.BY Juleyano.srt,"00:05:12,397","00:05:14,457",Now millions come at any date!,Now millions come at any date!
soldier-1998-hindi-web-dl-1080p-720p-avc-x264-aac-esubs-by-juleyano,1990s,/home/pratik/projects/GenderBias_TrendAnalysis/dataset/1990s/Soldier (1998) Hindi.WEB.DL.1080p.720p.AVC.x264.AAC.Esubs.BY Juleyano.srt,"00:05:15,483","00:05:18,376","I am asking, why? What do we lack?","I am asking, why? What do we lack?"
soldier-1998-hindi-web-dl-1080p-720p-avc-x264-aac-esubs-by-juleyano,1990s,/home/pratik/projects/GenderBias_TrendAnalysis/dataset/1990s/Soldier (1998) Hindi.WEB.DL.1080p.720p.AVC.x264.AAC.Esubs.BY Juleyano.srt,"00:05:18,600","00:05:22,549","What an illiterate woman! I want to live, enjoy!","What an illiterate woman!
I want to live, enjoy!"
soldier-1998-hindi-web-dl-1080p-720p-avc-x264-aac-esubs-by-juleyano,1990s,/home/pratik/projects/GenderBias_TrendAnalysis/dataset/1990s/Soldier (1998) Hindi.WEB.DL.1080p.720p.AVC.x264.AAC.Esubs.BY Juleyano.srt,"00:05:24,373","00:05:26,125",By selling your country?,By selling your country?
soldier-1998-hindi-web-dl-1080p-720p-avc-x264-aac-esubs-by-juleyano,1990s,/home/pratik/projects/GenderBias_TrendAnalysis/dataset/1990s/Soldier (1998) Hindi.WEB.DL.1080p.720p.AVC.x264.AAC.Esubs.BY Juleyano.srt,"00:05:26,293","00:05:29,833",Do you want me to spend all my life carrying a gun?,"Do you want me to spend
all my life carrying a gun?"
soldier-1998-hindi-web-dl-1080p-720p-avc-x264-aac-esubs-by-juleyano,1990s,/home/pratik/projects/GenderBias_TrendAnalysis/dataset/1990s/Soldier (1998) Hindi.WEB.DL.1080p.720p.AVC.x264.AAC.Esubs.BY Juleyano.srt,"00:05:30,065","00:05:31,991",And die at the enemy's hand someday?,And die at the enemy's hand someday?
soldier-1998-hindi-web-dl-1080p-720p-avc-x264-aac-esubs-by-juleyano,1990s,/home/pratik/projects/GenderBias_TrendAnalysis/dataset/1990s/Soldier (1998) Hindi.WEB.DL.1080p.720p.AVC.x264.AAC.Esubs.BY Juleyano.srt,"00:05:32,480","00:05:34,130",You want to be a widow?,You want to be a widow?
soldier-1998-hindi-web-dl-1080p-720p-avc-x264-aac-esubs-by-juleyano,1990s,/home/pratik/projects/GenderBias_TrendAnalysis/dataset/1990s/Soldier (1998) Hindi.WEB.DL.1080p.720p.AVC.x264.AAC.Esubs.BY Juleyano.srt,"00:05:34,973","00:05:36,937",That widow is better than a woman,That widow is better than a woman
soldier-1998-hindi-web-dl-1080p-720p-avc-x264-aac-esubs-by-juleyano,1990s,/home/pratik/projects/GenderBias_TrendAnalysis/dataset/1990s/Soldier (1998) Hindi.WEB.DL.1080p.720p.AVC.x264.AAC.Esubs.BY Juleyano.srt,"00:05:37,900","00:05:40,101",whose husband is a martyr for the nation.,whose husband is a martyr for the nation.
soldier-1998-hindi-web-dl-1080p-720p-avc-x264-aac-esubs-by-juleyano,1990s,/home/pratik/projects/GenderBias_TrendAnalysis/dataset/1990s/Soldier (1998) Hindi.WEB.DL.1080p.720p.AVC.x264.AAC.Esubs.BY Juleyano.srt,"00:05:41,315","00:05:43,576",I can bare to see you dying by a bullet.,I can bare to see you dying by a bullet.
soldier-1998-hindi-web-dl-1080p-720p-avc-x264-aac-esubs-by-juleyano,1990s,/home/pratik/projects/GenderBias_TrendAnalysis/dataset/1990s/Soldier (1998) Hindi.WEB.DL.1080p.720p.AVC.x264.AAC.Esubs.BY Juleyano.srt,"00:05:44,773","00:05:47,493",But I can't bare the stigma of a traitor on you!,"But I can't bare the
stigma of a traitor on you!"
soldier-1998-hindi-web-dl-1080p-720p-avc-x264-aac-esubs-by-juleyano,1990s,/home/pratik/projects/GenderBias_TrendAnalysis/dataset/1990s/Soldier (1998) Hindi.WEB.DL.1080p.720p.AVC.x264.AAC.Esubs.BY Juleyano.srt,"00:05:47,555","00:05:49,167",- Shanti! - I am saying it for the last time,"- Shanti!
- I am saying it for the last time"
soldier-1998-hindi-web-dl-1080p-720p-avc-x264-aac-esubs-by-juleyano,1990s,/home/pratik/projects/GenderBias_TrendAnalysis/dataset/1990s/Soldier (1998) Hindi.WEB.DL.1080p.720p.AVC.x264.AAC.Esubs.BY Juleyano.srt,"00:05:50,121","00:05:51,721",don't be loyal to me.,don't be loyal to me.
soldier-1998-hindi-web-dl-1080p-720p-avc-x264-aac-esubs-by-juleyano,1990s,/home/pratik/projects/GenderBias_TrendAnalysis/dataset/1990s/Soldier (1998) Hindi.WEB.DL.1080p.720p.AVC.x264.AAC.Esubs.BY Juleyano.srt,"00:05:52,573","00:05:57,093","But if you're disloyal to your country, I won't forgive you!","But if you're disloyal to your
country, I won't forgive you!"
soldier-1998-hindi-web-dl-1080p-720p-avc-x264-aac-esubs-by-juleyano,1990s,/home/pratik/projects/GenderBias_TrendAnalysis/dataset/1990s/Soldier (1998) Hindi.WEB.DL.1080p.720p.AVC.x264.AAC.Esubs.BY Juleyano.srt,"00:05:58,293","00:06:00,842",- Mother! - Don't try to teach me!,"- Mother!
- Don't try to teach me!"
soldier-1998-hindi-web-dl-1080p-720p-avc-x264-aac-esubs-by-juleyano,1990s,/home/pratik/projects/GenderBias_TrendAnalysis/dataset/1990s/Soldier (1998) Hindi.WEB.DL.1080p.720p.AVC.x264.AAC.Esubs.BY Juleyano.srt,"00:06:01,335","00:06:03,329",I can leave my wife for money!,I can leave my wife for money!
soldier-1998-hindi-web-dl-1080p-720p-avc-x264-aac-esubs-by-juleyano,1990s,/home/pratik/projects/GenderBias_TrendAnalysis/dataset/1990s/Soldier (1998) Hindi.WEB.DL.1080p.720p.AVC.x264.AAC.Esubs.BY Juleyano.srt,"00:06:12,391","00:06:14,277",Subhedar Pratap Singh has come.,Subhedar Pratap Singh has come.
soldier-1998-hindi-web-dl-1080p-720p-avc-x264-aac-esubs-by-juleyano,1990s,/home/pratik/projects/GenderBias_TrendAnalysis/dataset/1990s/Soldier (1998) Hindi.WEB.DL.1080p.720p.AVC.x264.AAC.Esubs.BY Juleyano.srt,"00:06:15,394","00:06:19,745",What's the matter? DK always meets after delivery of arms.,"What's the matter?
DK always meets after delivery of arms."
soldier-1998-hindi-web-dl-1080p-720p-avc-x264-aac-esubs-by-juleyano,1990s,/home/pratik/projects/GenderBias_TrendAnalysis/dataset/1990s/Soldier (1998) Hindi.WEB.DL.1080p.720p.AVC.x264.AAC.Esubs.BY Juleyano.srt,"00:06:20,502","00:06:23,330",What meeting is this beforehand?,What meeting is this beforehand?
soldier-1998-hindi-web-dl-1080p-720p-avc-x264-aac-esubs-by-juleyano,1990s,/home/pratik/projects/GenderBias_TrendAnalysis/dataset/1990s/Soldier (1998) Hindi.WEB.DL.1080p.720p.AVC.x264.AAC.Esubs.BY Juleyano.srt,"00:06:36,627","00:06:39,185",I've called this meeting,I've called this meeting
soldier-1998-hindi-web-dl-1080p-720p-avc-x264-aac-esubs-by-juleyano,1990s,/home/pratik/projects/GenderBias_TrendAnalysis/dataset/1990s/Soldier (1998) Hindi.WEB.DL.1080p.720p.AVC.x264.AAC.Esubs.BY Juleyano.srt,"00:06:40,670","00:06:46,917","because the truck of arms which is going to the border with you tomorrow,","because the truck of arms which is
going to the border with you tomorrow,"
soldier-1998-hindi-web-dl-1080p-720p-avc-x264-aac-esubs-by-juleyano,1990s,/home/pratik/projects/GenderBias_TrendAnalysis/dataset/1990s/Soldier (1998) Hindi.WEB.DL.1080p.720p.AVC.x264.AAC.Esubs.BY Juleyano.srt,"00:06:48,478","00:06:51,912",you can't loot it easily.,you can't loot it easily.
soldier-1998-hindi-web-dl-1080p-720p-avc-x264-aac-esubs-by-juleyano,1990s,/home/pratik/projects/GenderBias_TrendAnalysis/dataset/1990s/Soldier (1998) Hindi.WEB.DL.1080p.720p.AVC.x264.AAC.Esubs.BY Juleyano.srt,"00:06:54,145","00:06:58,647",- Why? - Because... another in charge is coming.,"- Why?
- Because... another in charge is coming."
soldier-1998-hindi-web-dl-1080p-720p-avc-x264-aac-esubs-by-juleyano,1990s,/home/pratik/projects/GenderBias_TrendAnalysis/dataset/1990s/Soldier (1998) Hindi.WEB.DL.1080p.720p.AVC.x264.AAC.Esubs.BY Juleyano.srt,"00:07:00,042","00:07:02,173",Major Vijay Malhotra.,Major Vijay Malhotra.
soldier-1998-hindi-web-dl-1080p-720p-avc-x264-aac-esubs-by-juleyano,1990s,/home/pratik/projects/GenderBias_TrendAnalysis/dataset/1990s/Soldier (1998) Hindi.WEB.DL.1080p.720p.AVC.x264.AAC.Esubs.BY Juleyano.srt,"00:07:03,102","00:07:04,542",How did you find out?,How did you find out?
soldier-1998-hindi-web-dl-1080p-720p-avc-x264-aac-esubs-by-juleyano,1990s,/home/pratik/projects/GenderBias_TrendAnalysis/dataset/1990s/Soldier (1998) Hindi.WEB.DL.1080p.720p.AVC.x264.AAC.Esubs.BY Juleyano.srt,"00:07:04,793","00:07:09,432","From our fourth partner, Jaswant Dalal, Major's driver.","From our fourth partner,
Jaswant Dalal, Major's driver."
soldier-1998-hindi-web-dl-1080p-720p-avc-x264-aac-esubs-by-juleyano,1990s,/home/pratik/projects/GenderBias_TrendAnalysis/dataset/1990s/Soldier (1998) Hindi.WEB.DL.1080p.720p.AVC.x264.AAC.Esubs.BY Juleyano.srt,"00:07:09,942","00:07:12,335",He is a very strict officer.,He is a very strict officer.
soldier-1998-hindi-web-dl-1080p-720p-avc-x264-aac-esubs-by-juleyano,1990s,/home/pratik/projects/GenderBias_TrendAnalysis/dataset/1990s/Soldier (1998) Hindi.WEB.DL.1080p.720p.AVC.x264.AAC.Esubs.BY Juleyano.srt,"00:07:13,173","00:07:17,011","With him around, forget trucks we can't steal a nail!","With him around,
forget trucks we can't steal a nail!"
soldier-1998-hindi-web-dl-1080p-720p-avc-x264-aac-esubs-by-juleyano,1990s,/home/pratik/projects/GenderBias_TrendAnalysis/dataset/1990s/Soldier (1998) Hindi.WEB.DL.1080p.720p.AVC.x264.AAC.Esubs.BY Juleyano.srt,"00:07:17,052","00:07:20,105",Opportunity never strikes again.,Opportunity never strikes again.
soldier-1998-hindi-web-dl-1080p-720p-avc-x264-aac-esubs-by-juleyano,1990s,/home/pratik/projects/GenderBias_TrendAnalysis/dataset/1990s/Soldier (1998) Hindi.WEB.DL.1080p.720p.AVC.x264.AAC.Esubs.BY Juleyano.srt,"00:07:21,702","00:07:27,627",The truck carries latest arms worth 10 crores that sell like hot cakes.,"The truck carries latest arms worth
10 crores that sell like hot cakes."
soldier-1998-hindi-web-dl-1080p-720p-avc-x264-aac-esubs-by-juleyano,1990s,/home/pratik/projects/GenderBias_TrendAnalysis/dataset/1990s/Soldier (1998) Hindi.WEB.DL.1080p.720p.AVC.x264.AAC.Esubs.BY Juleyano.srt,"00:07:28,302","00:07:31,879",Each of us 4 partners can earn 2.5 crores.,Each of us 4 partners can earn 2.5 crores.
soldier-1998-hindi-web-dl-1080p-720p-avc-x264-aac-esubs-by-juleyano,1990s,/home/pratik/projects/GenderBias_TrendAnalysis/dataset/1990s/Soldier (1998) Hindi.WEB.DL.1080p.720p.AVC.x264.AAC.Esubs.BY Juleyano.srt,"00:07:32,425","00:07:33,027",2.5 crores?,2.5 crores?
soldier-1998-hindi-web-dl-1080p-720p-avc-x264-aac-esubs-by-juleyano,1990s,/home/pratik/projects/GenderBias_TrendAnalysis/dataset/1990s/Soldier (1998) Hindi.WEB.DL.1080p.720p.AVC.x264.AAC.Esubs.BY Juleyano.srt,"00:07:35,239","00:07:39,050","Let it happened anything, we will have those weapons.","Let it happened anything,
we will have those weapons."
soldier-1998-hindi-web-dl-1080p-720p-avc-x264-aac-esubs-by-juleyano,1990s,/home/pratik/projects/GenderBias_TrendAnalysis/dataset/1990s/Soldier (1998) Hindi.WEB.DL.1080p.720p.AVC.x264.AAC.Esubs.BY Juleyano.srt,"00:07:39,797","00:07:41,957",Best of luck gentlemen.,Best of luck gentlemen.
soldier-1998-hindi-web-dl-1080p-720p-avc-x264-aac-esubs-by-juleyano,1990s,/home/pratik/projects/GenderBias_TrendAnalysis/dataset/1990s/Soldier (1998) Hindi.WEB.DL.1080p.720p.AVC.x264.AAC.Esubs.BY Juleyano.srt,"00:08:34,253","00:08:36,598",The soldiers who play with guns and cannons,"The soldiers who play
with guns and cannons"
