film_id,decade,file_path,start,end,text_clean,text_raw
missmary,1950s,/home/pratik/projects/GenderBias_TrendAnalysis/dataset/1950s/MissMary.srt,"01:42:54,770","01:42:58,590",The higher notes...,The higher notes...
missmary,1950s,/home/pratik/projects/GenderBias_TrendAnalysis/dataset/1950s/MissMary.srt,"01:42:58,940","01:43:03,850",and lower notes are so misplaced,and lower notes are so misplaced
missmary,1950s,/home/pratik/projects/GenderBias_TrendAnalysis/dataset/1950s/MissMary.srt,"01:43:05,010","01:43:09,610",The burden of seven notes...,The burden of seven notes...
missmary,1950s,/home/pratik/projects/GenderBias_TrendAnalysis/dataset/1950s/MissMary.srt,"01:43:10,100","01:43:13,650",is a heavy one on my shoulders,is a heavy one on my shoulders
missmary,1950s,/home/pratik/projects/GenderBias_TrendAnalysis/dataset/1950s/MissMary.srt,"01:43:23,110","01:43:27,670",I couldn't even get one note right,"I couldn't even get
one note right"
missmary,1950s,/home/pratik/projects/GenderBias_TrendAnalysis/dataset/1950s/MissMary.srt,"01:43:28,010","01:43:31,860",I failed to impress my sweetheart,I failed to impress my sweetheart
missmary,1950s,/home/pratik/projects/GenderBias_TrendAnalysis/dataset/1950s/MissMary.srt,"01:43:39,570","01:43:43,670",I could neither sing nor I could play any instrument,"I could neither sing
nor I could play any instrument"
missmary,1950s,/home/pratik/projects/GenderBias_TrendAnalysis/dataset/1950s/MissMary.srt,"01:43:44,020","01:43:47,530",I failed to impress my sweetheart,I failed to impress my sweetheart
missmary,1950s,/home/pratik/projects/GenderBias_TrendAnalysis/dataset/1950s/MissMary.srt,"01:43:48,010","01:43:49,110",Damn,Damn
missmary,1950s,/home/pratik/projects/GenderBias_TrendAnalysis/dataset/1950s/MissMary.srt,"01:43:50,370","01:43:53,300",The pitch is your own,The pitch is your own
missmary,1950s,/home/pratik/projects/GenderBias_TrendAnalysis/dataset/1950s/MissMary.srt,"01:43:56,190","01:43:57,286",So...,So...
missmary,1950s,/home/pratik/projects/GenderBias_TrendAnalysis/dataset/1950s/MissMary.srt,"01:43:57,310","01:43:59,490",swirl...,swirl...
missmary,1950s,/home/pratik/projects/GenderBias_TrendAnalysis/dataset/1950s/MissMary.srt,"01:44:01,660","01:44:03,490",warm up your throat...,warm up your throat...
missmary,1950s,/home/pratik/projects/GenderBias_TrendAnalysis/dataset/1950s/MissMary.srt,"01:44:09,240","01:44:11,620",and get into a jig,and get into a jig
missmary,1950s,/home/pratik/projects/GenderBias_TrendAnalysis/dataset/1950s/MissMary.srt,"01:44:30,410","01:44:32,530","Oh my Sita, my dearest...","Oh my Sita, my dearest..."
missmary,1950s,/home/pratik/projects/GenderBias_TrendAnalysis/dataset/1950s/MissMary.srt,"01:44:32,610","01:44:35,060",you are the only one,you are the only one
missmary,1950s,/home/pratik/projects/GenderBias_TrendAnalysis/dataset/1950s/MissMary.srt,"01:44:36,990","01:44:42,530","My love, my sweetheart, my honey","My love, my sweetheart, my honey"
missmary,1950s,/home/pratik/projects/GenderBias_TrendAnalysis/dataset/1950s/MissMary.srt,"01:44:54,730","01:44:57,000",How I wish I'd fly to London...,How I wish I'd fly to London...
missmary,1950s,/home/pratik/projects/GenderBias_TrendAnalysis/dataset/1950s/MissMary.srt,"01:44:59,190","01:45:01,330",and learn the violin,and learn the violin
missmary,1950s,/home/pratik/projects/GenderBias_TrendAnalysis/dataset/1950s/MissMary.srt,"01:45:26,570","01:45:27,940",But sadly...,But sadly...
missmary,1950s,/home/pratik/projects/GenderBias_TrendAnalysis/dataset/1950s/MissMary.srt,"01:45:28,770","01:45:30,610",regretfully...,regretfully...
missmary,1950s,/home/pratik/projects/GenderBias_TrendAnalysis/dataset/1950s/MissMary.srt,"01:45:30,990","01:45:32,930",pity me,pity me
missmary,1950s,/home/pratik/projects/GenderBias_TrendAnalysis/dataset/1950s/MissMary.srt,"01:45:37,290","01:45:40,530","Unfortunately, my love...","Unfortunately, my love..."
missmary,1950s,/home/pratik/projects/GenderBias_TrendAnalysis/dataset/1950s/MissMary.srt,"01:45:40,760","01:45:42,560",I regret...,I regret...
missmary,1950s,/home/pratik/projects/GenderBias_TrendAnalysis/dataset/1950s/MissMary.srt,"01:45:43,170","01:45:45,370",I don't know how to use a fork and spoon,"I don't know how to
use a fork and spoon"
missmary,1950s,/home/pratik/projects/GenderBias_TrendAnalysis/dataset/1950s/MissMary.srt,"01:45:47,590","01:45:49,730",And I failed to impress my beloved,And I failed to impress my beloved
missmary,1950s,/home/pratik/projects/GenderBias_TrendAnalysis/dataset/1950s/MissMary.srt,"01:45:51,970","01:45:54,090",I could neither sing nor I could play any instrument,"I could neither sing
nor I could play any instrument"
missmary,1950s,/home/pratik/projects/GenderBias_TrendAnalysis/dataset/1950s/MissMary.srt,"01:45:54,170","01:45:56,260",I could neither do this nor that,I could neither do this nor that
missmary,1950s,/home/pratik/projects/GenderBias_TrendAnalysis/dataset/1950s/MissMary.srt,"01:46:38,220","01:46:40,400",- For how long have you been here? - I just arrived.,"- For how long have you been here?
- I just arrived."
missmary,1950s,/home/pratik/projects/GenderBias_TrendAnalysis/dataset/1950s/MissMary.srt,"01:46:41,430","01:46:43,610",- Please come in. - It's all right.,"- Please come in.
- It's all right."
missmary,1950s,/home/pratik/projects/GenderBias_TrendAnalysis/dataset/1950s/MissMary.srt,"01:46:44,350","01:46:46,890",- Sita forbid me from entering your room. - I see.,"- Sita forbid me from entering your room.
- I see."
missmary,1950s,/home/pratik/projects/GenderBias_TrendAnalysis/dataset/1950s/MissMary.srt,"01:46:48,040","01:46:51,830","- So Sita's been squealing? - Yes, Sita told everything about you.","- So Sita's been squealing?
- Yes, Sita told everything about you."
missmary,1950s,/home/pratik/projects/GenderBias_TrendAnalysis/dataset/1950s/MissMary.srt,"01:46:52,490","01:46:53,890",She's come for you.,She's come for you.
missmary,1950s,/home/pratik/projects/GenderBias_TrendAnalysis/dataset/1950s/MissMary.srt,"01:46:55,430","01:46:58,660",Where are you going? I'll teach you music. Come on.,"Where are you going?
I'll teach you music. Come on."
missmary,1950s,/home/pratik/projects/GenderBias_TrendAnalysis/dataset/1950s/MissMary.srt,"01:46:59,420","01:47:00,620",Come on.,Come on.
missmary,1950s,/home/pratik/projects/GenderBias_TrendAnalysis/dataset/1950s/MissMary.srt,"01:47:03,630","01:47:04,930","Come on, learn.","Come on, learn."
missmary,1950s,/home/pratik/projects/GenderBias_TrendAnalysis/dataset/1950s/MissMary.srt,"01:47:08,210","01:47:11,590",Not now. I'll be there when he finishes. You stay here.,"Not now. I'll be there
when he finishes. You stay here."
missmary,1950s,/home/pratik/projects/GenderBias_TrendAnalysis/dataset/1950s/MissMary.srt,"01:47:28,900","01:47:36,490","Krishna, the apple of everyone's eye in Vrindavan","Krishna, the apple
of everyone's eye in Vrindavan"
missmary,1950s,/home/pratik/projects/GenderBias_TrendAnalysis/dataset/1950s/MissMary.srt,"01:47:44,420","01:47:52,400",He endeared himself so much that even His beloved Radha envied Him,"He endeared himself so much that
even His beloved Radha envied Him"
missmary,1950s,/home/pratik/projects/GenderBias_TrendAnalysis/dataset/1950s/MissMary.srt,"01:48:34,370","01:48:42,030",Every time He entertained at the banks of the river Jamuna...,"Every time He entertained
at the banks of the river Jamuna..."
missmary,1950s,/home/pratik/projects/GenderBias_TrendAnalysis/dataset/1950s/MissMary.srt,"01:48:42,090","01:48:49,630",His melodious flute...,His melodious flute...
missmary,1950s,/home/pratik/projects/GenderBias_TrendAnalysis/dataset/1950s/MissMary.srt,"01:48:49,740","01:48:53,686",entranced the women in Vrindavan,entranced the women in Vrindavan
missmary,1950s,/home/pratik/projects/GenderBias_TrendAnalysis/dataset/1950s/MissMary.srt,"01:48:53,710","01:48:57,440",I wonder what spell He cast,I wonder what spell He cast
missmary,1950s,/home/pratik/projects/GenderBias_TrendAnalysis/dataset/1950s/MissMary.srt,"01:48:57,490","01:49:04,900","Krishna, the apple of everyone's eye in Vrindavan","Krishna, the apple
of everyone's eye in Vrindavan"
missmary,1950s,/home/pratik/projects/GenderBias_TrendAnalysis/dataset/1950s/MissMary.srt,"01:49:31,660","01:49:39,470","His complexion, like the enchanting dark monsoon clouds","His complexion, like the
enchanting dark monsoon clouds"
missmary,1950s,/home/pratik/projects/GenderBias_TrendAnalysis/dataset/1950s/MissMary.srt,"01:49:39,510","01:49:47,020",He is a magician. He has driven me crazy,"He is a magician.
He has driven me crazy"
missmary,1950s,/home/pratik/projects/GenderBias_TrendAnalysis/dataset/1950s/MissMary.srt,"01:49:47,330","01:49:54,760","For Him, I have put the world behind me","For Him, I have put
the world behind me"
missmary,1950s,/home/pratik/projects/GenderBias_TrendAnalysis/dataset/1950s/MissMary.srt,"01:49:54,790","01:50:02,200","Krishna, the apple of everyone's eye in Vrindavan","Krishna, the apple
of everyone's eye in Vrindavan"
missmary,1950s,/home/pratik/projects/GenderBias_TrendAnalysis/dataset/1950s/MissMary.srt,"01:50:02,330","01:50:09,940",He endeared himself so much that even His beloved Radha envied Him,"He endeared himself so much that
even His beloved Radha envied Him"
missmary,1950s,/home/pratik/projects/GenderBias_TrendAnalysis/dataset/1950s/MissMary.srt,"01:50:29,250","01:50:30,450",Come here.,Come here.
missmary,1950s,/home/pratik/projects/GenderBias_TrendAnalysis/dataset/1950s/MissMary.srt,"01:50:32,080","01:50:34,820",- What's going on? - What?,"- What's going on?
- What?"
missmary,1950s,/home/pratik/projects/GenderBias_TrendAnalysis/dataset/1950s/MissMary.srt,"01:50:34,910","01:50:36,910",She wants to go back home. She's applied for leave.,"She wants to go back home.
She's applied for leave."
missmary,1950s,/home/pratik/projects/GenderBias_TrendAnalysis/dataset/1950s/MissMary.srt,"01:50:37,370","01:50:40,840",- Leave? I don't know anything about it. - And how would you know?,"- Leave? I don't know anything about it.
- And how would you know?"
missmary,1950s,/home/pratik/projects/GenderBias_TrendAnalysis/dataset/1950s/MissMary.srt,"01:50:41,100","01:50:45,470",The two of you have changed. I've been watching you.,"The two of you have changed.
I've been watching you."
missmary,1950s,/home/pratik/projects/GenderBias_TrendAnalysis/dataset/1950s/MissMary.srt,"01:50:46,190","01:50:50,546","Go and placate her. If she leaves, you'll see the worst of me.","Go and placate her. If she leaves,
you'll see the worst of me."
missmary,1950s,/home/pratik/projects/GenderBias_TrendAnalysis/dataset/1950s/MissMary.srt,"01:50:50,570","01:50:52,440",- Go on. - I'll try reasoning with her.,"- Go on.
- I'll try reasoning with her."
missmary,1950s,/home/pratik/projects/GenderBias_TrendAnalysis/dataset/1950s/MissMary.srt,"01:50:54,290","01:50:57,890",They've had a tiff I guess. We must not interfere.,"They've had a tiff I guess.
We must not interfere."
missmary,1950s,/home/pratik/projects/GenderBias_TrendAnalysis/dataset/1950s/MissMary.srt,"01:50:58,180","01:51:01,260","If the matter worsens, we'll lose them.","If the matter worsens,
we'll lose them."
missmary,1950s,/home/pratik/projects/GenderBias_TrendAnalysis/dataset/1950s/MissMary.srt,"01:51:01,660","01:51:05,726","They're just kids. Besides, they don't have anyone to advise them.","They're just kids. Besides, they
don't have anyone to advise them."
missmary,1950s,/home/pratik/projects/GenderBias_TrendAnalysis/dataset/1950s/MissMary.srt,"01:51:05,750","01:51:10,430",Don't you worry. We'll go over after dinner.,"Don't you worry.
We'll go over after dinner."
missmary,1950s,/home/pratik/projects/GenderBias_TrendAnalysis/dataset/1950s/MissMary.srt,"01:51:16,710","01:51:17,810",Well...,Well...
missmary,1950s,/home/pratik/projects/GenderBias_TrendAnalysis/dataset/1950s/MissMary.srt,"01:51:31,900","01:51:33,120",You see...,You see...
missmary,1950s,/home/pratik/projects/GenderBias_TrendAnalysis/dataset/1950s/MissMary.srt,"01:51:42,660","01:51:45,460",- Actually... - What is it? Why don't you talk?,"- Actually...
- What is it? Why don't you talk?"
missmary,1950s,/home/pratik/projects/GenderBias_TrendAnalysis/dataset/1950s/MissMary.srt,"01:51:45,860","01:51:49,100","- I will, but I'm scared of you. - You don't need to be.","- I will, but I'm scared of you.
- You don't need to be."
missmary,1950s,/home/pratik/projects/GenderBias_TrendAnalysis/dataset/1950s/MissMary.srt,"01:51:49,310","01:51:53,070",I'm leaving the day after tomorrow. Then you'll be free to do anything you want.,"I'm leaving the day after tomorrow. Then
you'll be free to do anything you want."
missmary,1950s,/home/pratik/projects/GenderBias_TrendAnalysis/dataset/1950s/MissMary.srt,"01:51:53,420","01:51:58,450","- Nothing of that sort. Think again. - No chance, I've thought enough.","- Nothing of that sort. Think again.
- No chance, I've thought enough."
missmary,1950s,/home/pratik/projects/GenderBias_TrendAnalysis/dataset/1950s/MissMary.srt,"01:51:59,800","01:52:05,340","How selfish. You don't care about me. Just think, if you were to leave...","How selfish. You don't care about me.
Just think, if you were to leave..."
missmary,1950s,/home/pratik/projects/GenderBias_TrendAnalysis/dataset/1950s/MissMary.srt,"01:52:05,590","01:52:08,050","and you never return, what will I tell them?","and you never return,
what will I tell them?"
missmary,1950s,/home/pratik/projects/GenderBias_TrendAnalysis/dataset/1950s/MissMary.srt,"01:52:08,490","01:52:12,460",Anything that comes to mind. You got a silver tongue anyway.,"Anything that comes to mind.
You got a silver tongue anyway."
missmary,1950s,/home/pratik/projects/GenderBias_TrendAnalysis/dataset/1950s/MissMary.srt,"01:52:12,770","01:52:17,580","- You'll find an answer. - Sure, but I don't have the heart.","- You'll find an answer.
- Sure, but I don't have the heart."
missmary,1950s,/home/pratik/projects/GenderBias_TrendAnalysis/dataset/1950s/MissMary.srt,"01:52:18,340","01:52:22,000",- What answer do you have anyway? - Forget it. You'll just take it wrong.,"- What answer do you have anyway?
- Forget it. You'll just take it wrong."
missmary,1950s,/home/pratik/projects/GenderBias_TrendAnalysis/dataset/1950s/MissMary.srt,"01:52:22,370","01:52:24,600","No, I won't. Tell me.","No, I won't. Tell me."
missmary,1950s,/home/pratik/projects/GenderBias_TrendAnalysis/dataset/1950s/MissMary.srt,"01:52:25,170","01:52:28,530",I'll tell them that you've suffered from typhoid back home.,"I'll tell them that you've suffered
from typhoid back home."
missmary,1950s,/home/pratik/projects/GenderBias_TrendAnalysis/dataset/1950s/MissMary.srt,"01:52:29,200","01:52:31,160",And I'll deliberately starve for a couple of days.,"And I'll deliberately starve
for a couple of days."
missmary,1950s,/home/pratik/projects/GenderBias_TrendAnalysis/dataset/1950s/MissMary.srt,"01:52:31,620","01:52:34,500",Then Mr. and Mrs. Rai will say to me...,"Then Mr. and Mrs. Rai
will say to me..."
missmary,1950s,/home/pratik/projects/GenderBias_TrendAnalysis/dataset/1950s/MissMary.srt,"01:52:36,120","01:52:41,290","""Son, be brave. She'll be all right. Why don't you go and look her up.""","""Son, be brave. She'll be all right.
Why don't you go and look her up."""
missmary,1950s,/home/pratik/projects/GenderBias_TrendAnalysis/dataset/1950s/MissMary.srt,"01:52:42,060","01:52:46,140","And I'll say, ""No Mr. Rai. I have got the school to take care of.""","And I'll say, ""No Mr. Rai. I have got
the school to take care of."""
missmary,1950s,/home/pratik/projects/GenderBias_TrendAnalysis/dataset/1950s/MissMary.srt,"01:52:46,500","01:52:49,550","""I'd rather send Cash"". That will see me through for a few days.""","""I'd rather send Cash"". That will
see me through for a few days."""
missmary,1950s,/home/pratik/projects/GenderBias_TrendAnalysis/dataset/1950s/MissMary.srt,"01:52:50,190","01:52:53,110",- Then what? - Simple.,"- Then what?
- Simple."
missmary,1950s,/home/pratik/projects/GenderBias_TrendAnalysis/dataset/1950s/MissMary.srt,"01:52:53,810","01:52:57,920","If you return, good. Else, I'll have Cash send me a telegram.","If you return, good. Else, I'll have
Cash send me a telegram."
missmary,1950s,/home/pratik/projects/GenderBias_TrendAnalysis/dataset/1950s/MissMary.srt,"01:52:58,530","01:53:02,320","Clutching the telegram, a few tears dropping from my eyes...","Clutching the telegram,
a few tears dropping from my eyes..."
missmary,1950s,/home/pratik/projects/GenderBias_TrendAnalysis/dataset/1950s/MissMary.srt,"01:53:02,530","01:53:04,860",and with a deep sigh I will say...,"and with a deep sigh
I will say..."
missmary,1950s,/home/pratik/projects/GenderBias_TrendAnalysis/dataset/1950s/MissMary.srt,"01:53:05,620","01:53:09,830","""Mr. Rai, I should have listened to you the other day.""","""Mr. Rai, I should have
listened to you the other day."""
missmary,1950s,/home/pratik/projects/GenderBias_TrendAnalysis/dataset/1950s/MissMary.srt,"01:53:10,310","01:53:14,040","""It's too late now. She has gone too far away for my eyes to see.""","""It's too late now. She has gone
too far away for my eyes to see."""
missmary,1950s,/home/pratik/projects/GenderBias_TrendAnalysis/dataset/1950s/MissMary.srt,"01:53:14,480","01:53:17,930","- You'll tell them I'm dead? - I can't say you've eloped, can I?","- You'll tell them I'm dead?
- I can't say you've eloped, can I?"
missmary,1950s,/home/pratik/projects/GenderBias_TrendAnalysis/dataset/1950s/MissMary.srt,"01:53:19,280","01:53:22,680",Then you tell me what I'm supposed to do. I still have to feed myself.,"Then you tell me what I'm supposed
to do. I still have to feed myself."
missmary,1950s,/home/pratik/projects/GenderBias_TrendAnalysis/dataset/1950s/MissMary.srt,"01:53:22,900","01:53:26,850",Now don't fool me with an alibi! I know very well what you're up to.,"Now don't fool me with an alibi!
I know very well what you're up to."
missmary,1950s,/home/pratik/projects/GenderBias_TrendAnalysis/dataset/1950s/MissMary.srt,"01:53:27,060","01:53:30,210","After you've told them I'm dead, they'll marry you to Sita.","After you've told them I'm dead,
they'll marry you to Sita."
missmary,1950s,/home/pratik/projects/GenderBias_TrendAnalysis/dataset/1950s/MissMary.srt,"01:53:30,360","01:53:34,550",But I don't care. Marry her and enjoy yourself. I'm not staying here!,"But I don't care. Marry her and
enjoy yourself. I'm not staying here!"
missmary,1950s,/home/pratik/projects/GenderBias_TrendAnalysis/dataset/1950s/MissMary.srt,"01:53:34,940","01:53:39,060","Look, if you accuse me, I will not let you step outside.","Look, if you accuse me,
I will not let you step outside."
missmary,1950s,/home/pratik/projects/GenderBias_TrendAnalysis/dataset/1950s/MissMary.srt,"01:53:39,100","01:53:41,810",- Who are you to stop me? I'm leaving! - No way!,"- Who are you to stop me? I'm leaving!
- No way!"
missmary,1950s,/home/pratik/projects/GenderBias_TrendAnalysis/dataset/1950s/MissMary.srt,"01:53:41,880","01:53:43,640",- I will! - I won't allow you.,"- I will!
- I won't allow you."
missmary,1950s,/home/pratik/projects/GenderBias_TrendAnalysis/dataset/1950s/MissMary.srt,"01:53:43,670","01:53:46,400",- What right do you have? I will go! - You can't.,"- What right do you have? I will go!
- You can't."
missmary,1950s,/home/pratik/projects/GenderBias_TrendAnalysis/dataset/1950s/MissMary.srt,"01:53:46,470","01:53:49,400","- I will, I will! - You can't, you can't!","- I will, I will!
- You can't, you can't!"
missmary,1950s,/home/pratik/projects/GenderBias_TrendAnalysis/dataset/1950s/MissMary.srt,"01:53:51,680","01:53:54,610","- Arun, have patience. - To hell with patience, Mr. Rai!","- Arun, have patience.
- To hell with patience, Mr. Rai!"
missmary,1950s,/home/pratik/projects/GenderBias_TrendAnalysis/dataset/1950s/MissMary.srt,"01:53:54,800","01:53:57,890","Look at her. It's hardly two months, and she wants to go back.","Look at her. It's hardly two months,
and she wants to go back."
missmary,1950s,/home/pratik/projects/GenderBias_TrendAnalysis/dataset/1950s/MissMary.srt,"01:53:58,210","01:54:00,690",- Isn't she being silly? - You stopped me here...,"- Isn't she being silly?
- You stopped me here..."
missmary,1950s,/home/pratik/projects/GenderBias_TrendAnalysis/dataset/1950s/MissMary.srt,"01:54:00,750","01:54:04,300",- or I'd have left the very first month. - This is news!,"- or I'd have left the very first month.
- This is news!"
missmary,1950s,/home/pratik/projects/GenderBias_TrendAnalysis/dataset/1950s/MissMary.srt,"01:54:06,910","01:54:11,120",Know what? She's two months pregnant.,"Know what?
She's two months pregnant."
missmary,1950s,/home/pratik/projects/GenderBias_TrendAnalysis/dataset/1950s/MissMary.srt,"01:54:20,150","01:54:23,810","You mustn't weep, dear. I'll make Arun see reason.","You mustn't weep, dear.
I'll make Arun see reason."
missmary,1950s,/home/pratik/projects/GenderBias_TrendAnalysis/dataset/1950s/MissMary.srt,"01:54:24,390","01:54:28,200","If you want, you can go home for a month. But don't weep.","If you want, you can go home
for a month. But don't weep."
missmary,1950s,/home/pratik/projects/GenderBias_TrendAnalysis/dataset/1950s/MissMary.srt,"01:54:28,630","01:54:30,750",Am I weeping? Just go away.,Am I weeping? Just go away.
missmary,1950s,/home/pratik/projects/GenderBias_TrendAnalysis/dataset/1950s/MissMary.srt,"01:54:37,630","01:54:40,980",You're acting like a child. You mustn't hurt a woman.,"You're acting like a child.
You mustn't hurt a woman."
missmary,1950s,/home/pratik/projects/GenderBias_TrendAnalysis/dataset/1950s/MissMary.srt,"01:54:41,280","01:54:43,750","At such times, every woman would long to go to her mother.","At such times, every woman
would long to go to her mother."
missmary,1950s,/home/pratik/projects/GenderBias_TrendAnalysis/dataset/1950s/MissMary.srt,"01:54:44,430","01:54:48,650",- Send her home for a month or so. - Send her if you want.,"- Send her home for a month or so.
- Send her if you want."
missmary,1950s,/home/pratik/projects/GenderBias_TrendAnalysis/dataset/1950s/MissMary.srt,"01:54:48,840","01:54:52,010",- But I don't agree with this. - Stop being stubborn. Go on.,"- But I don't agree with this.
- Stop being stubborn. Go on."
missmary,1950s,/home/pratik/projects/GenderBias_TrendAnalysis/dataset/1950s/MissMary.srt,"01:54:52,440","01:54:56,980","- Enough Mr. Rai. I've had enough. - You've crossed the line, too.","- Enough Mr. Rai. I've had enough.
- You've crossed the line, too."
missmary,1950s,/home/pratik/projects/GenderBias_TrendAnalysis/dataset/1950s/MissMary.srt,"01:54:59,540","01:55:03,180",Mr Rai! This is doing no good. Open the door.,"Mr Rai! This is doing no good.
Open the door."
missmary,1950s,/home/pratik/projects/GenderBias_TrendAnalysis/dataset/1950s/MissMary.srt,"01:55:04,090","01:55:07,520","Cash, I warn you against opening the door.","Cash, I warn you against
opening the door."
missmary,1950s,/home/pratik/projects/GenderBias_TrendAnalysis/dataset/1950s/MissMary.srt,"01:55:20,350","01:55:21,650",Lock the door.,Lock the door.
missmary,1950s,/home/pratik/projects/GenderBias_TrendAnalysis/dataset/1950s/MissMary.srt,"01:55:58,840","01:56:05,590","Traveller of the nights, oh Moon...","Traveller of the nights,
oh Moon..."
missmary,1950s,/home/pratik/projects/GenderBias_TrendAnalysis/dataset/1950s/MissMary.srt,"01:56:05,970","01:56:09,140",tell me if I'm in the wrong,tell me if I'm in the wrong
missmary,1950s,/home/pratik/projects/GenderBias_TrendAnalysis/dataset/1950s/MissMary.srt,"01:56:09,330","01:56:12,390",It's for you to decide,It's for you to decide
missmary,1950s,/home/pratik/projects/GenderBias_TrendAnalysis/dataset/1950s/MissMary.srt,"01:56:37,300","01:56:43,980",Have I been amorous? Or have my eyes intruded?,"Have I been amorous?
Or have my eyes intruded?"
missmary,1950s,/home/pratik/projects/GenderBias_TrendAnalysis/dataset/1950s/MissMary.srt,"01:56:44,300","01:56:47,510",If I'm not in the wrong...,If I'm not in the wrong...
missmary,1950s,/home/pratik/projects/GenderBias_TrendAnalysis/dataset/1950s/MissMary.srt,"01:56:47,790","01:56:51,050",why is someone so angry?,why is someone so angry?
missmary,1950s,/home/pratik/projects/GenderBias_TrendAnalysis/dataset/1950s/MissMary.srt,"01:56:54,810","01:56:57,990",I shall take it in my stride...,I shall take it in my stride...
missmary,1950s,/home/pratik/projects/GenderBias_TrendAnalysis/dataset/1950s/MissMary.srt,"01:56:58,380","01:57:01,490",any punishment you decree,any punishment you decree
missmary,1950s,/home/pratik/projects/GenderBias_TrendAnalysis/dataset/1950s/MissMary.srt,"01:57:01,810","01:57:05,110",Tell me if I'm in the wrong,Tell me if I'm in the wrong
missmary,1950s,/home/pratik/projects/GenderBias_TrendAnalysis/dataset/1950s/MissMary.srt,"01:57:05,440","01:57:08,530",It's for you to decide,It's for you to decide
missmary,1950s,/home/pratik/projects/GenderBias_TrendAnalysis/dataset/1950s/MissMary.srt,"01:57:08,810","01:57:15,500","Traveller of the nights, oh Moon...","Traveller of the nights,
oh Moon..."
missmary,1950s,/home/pratik/projects/GenderBias_TrendAnalysis/dataset/1950s/MissMary.srt,"01:57:15,830","01:57:19,290",tell me if I have erred,tell me if I have erred
missmary,1950s,/home/pratik/projects/GenderBias_TrendAnalysis/dataset/1950s/MissMary.srt,"01:57:19,360","01:57:22,390",It is for you to decide,It is for you to decide
missmary,1950s,/home/pratik/projects/GenderBias_TrendAnalysis/dataset/1950s/MissMary.srt,"01:57:51,000","01:57:57,780",Someone fails to hold back his feelings,"Someone fails to hold back
his feelings"
missmary,1950s,/home/pratik/projects/GenderBias_TrendAnalysis/dataset/1950s/MissMary.srt,"01:58:49,100","01:58:55,760",Someone's boat has lost its way. Lead her ashore,"Someone's boat has lost its way.
Lead her ashore"
missmary,1950s,/home/pratik/projects/GenderBias_TrendAnalysis/dataset/1950s/MissMary.srt,"01:58:55,980","01:58:59,270",Am I in the wrong?,Am I in the wrong?
