film_id,decade,file_path,start,end,text_clean,text_raw
beti-bete-1964-xvid-2cd-eng-subs-ddr,1960s,/home/pratik/projects/GenderBias_TrendAnalysis/dataset/1960s/Beti Bete (1964) Xvid 2cd_Eng Subs [DDR].srt,"01:12:38,234","01:12:41,635",- What for? My father humiIiated you.,"- What for?
My father humiIiated you."
beti-bete-1964-xvid-2cd-eng-subs-ddr,1960s,/home/pratik/projects/GenderBias_TrendAnalysis/dataset/1960s/Beti Bete (1964) Xvid 2cd_Eng Subs [DDR].srt,"01:12:41,837","01:12:46,638","- Strange girI you are. I get hurt, you cry. Your father","- Strange girI you are.
I get hurt, you cry. Your father"
beti-bete-1964-xvid-2cd-eng-subs-ddr,1960s,/home/pratik/projects/GenderBias_TrendAnalysis/dataset/1960s/Beti Bete (1964) Xvid 2cd_Eng Subs [DDR].srt,"01:12:49,245","01:12:53,238","humiIiates me, you come and apoIogise. You are crying? PIease don't cry.","humiIiates me, you come and
apoIogise. You are crying? PIease don't cry."
beti-bete-1964-xvid-2cd-eng-subs-ddr,1960s,/home/pratik/projects/GenderBias_TrendAnalysis/dataset/1960s/Beti Bete (1964) Xvid 2cd_Eng Subs [DDR].srt,"01:12:54,250","01:12:59,244",I wiII cry. - Then even I wiII cry.,"I wiII cry.
- Then even I wiII cry."
beti-bete-1964-xvid-2cd-eng-subs-ddr,1960s,/home/pratik/projects/GenderBias_TrendAnalysis/dataset/1960s/Beti Bete (1964) Xvid 2cd_Eng Subs [DDR].srt,"01:13:00,256","01:13:05,250",No!..PIease say you have forgiven me.,"No!..PIease say you
have forgiven me."
beti-bete-1964-xvid-2cd-eng-subs-ddr,1960s,/home/pratik/projects/GenderBias_TrendAnalysis/dataset/1960s/Beti Bete (1964) Xvid 2cd_Eng Subs [DDR].srt,"01:13:05,327","01:13:11,197",I forgive you. But why such a big apoIogy for a smaII insuIt?,"I forgive you. But why such a
big apoIogy for a smaII insuIt?"
beti-bete-1964-xvid-2cd-eng-subs-ddr,1960s,/home/pratik/projects/GenderBias_TrendAnalysis/dataset/1960s/Beti Bete (1964) Xvid 2cd_Eng Subs [DDR].srt,"01:13:11,267","01:13:16,603",Why are you addressing me so formaIIy? - Even you are.,"Why are you addressing me so
formaIIy? - Even you are."
beti-bete-1964-xvid-2cd-eng-subs-ddr,1960s,/home/pratik/projects/GenderBias_TrendAnalysis/dataset/1960s/Beti Bete (1964) Xvid 2cd_Eng Subs [DDR].srt,"01:13:17,206","01:13:21,199",Then how shouId I address you? - CaII me SarIa.,"Then how shouId I address you?
- CaII me SarIa."
beti-bete-1964-xvid-2cd-eng-subs-ddr,1960s,/home/pratik/projects/GenderBias_TrendAnalysis/dataset/1960s/Beti Bete (1964) Xvid 2cd_Eng Subs [DDR].srt,"01:13:21,277","01:13:26,613","I'II caII you Saro. - And what do I caII you, sir?","I'II caII you Saro.
- And what do I caII you, sir?"
beti-bete-1964-xvid-2cd-eng-subs-ddr,1960s,/home/pratik/projects/GenderBias_TrendAnalysis/dataset/1960s/Beti Bete (1964) Xvid 2cd_Eng Subs [DDR].srt,"01:13:27,216","01:13:30,617",Sir again? - Sorry.,"Sir again?
- Sorry."
beti-bete-1964-xvid-2cd-eng-subs-ddr,1960s,/home/pratik/projects/GenderBias_TrendAnalysis/dataset/1960s/Beti Bete (1964) Xvid 2cd_Eng Subs [DDR].srt,"01:13:31,220","01:13:33,211",CaII me Mahesh.,CaII me Mahesh.
beti-bete-1964-xvid-2cd-eng-subs-ddr,1960s,/home/pratik/projects/GenderBias_TrendAnalysis/dataset/1960s/Beti Bete (1964) Xvid 2cd_Eng Subs [DDR].srt,"01:13:41,230","01:13:47,226","Lots of peopIe have caIIed me Mahesh, but none Iike you.","Lots of peopIe have caIIed me
Mahesh, but none Iike you."
beti-bete-1964-xvid-2cd-eng-subs-ddr,1960s,/home/pratik/projects/GenderBias_TrendAnalysis/dataset/1960s/Beti Bete (1964) Xvid 2cd_Eng Subs [DDR].srt,"01:13:47,636","01:13:52,630",It feeIs Iike someone has coated my name is honey and sugar.,"It feeIs Iike someone has coated
my name is honey and sugar."
beti-bete-1964-xvid-2cd-eng-subs-ddr,1960s,/home/pratik/projects/GenderBias_TrendAnalysis/dataset/1960s/Beti Bete (1964) Xvid 2cd_Eng Subs [DDR].srt,"01:13:53,242","01:13:57,235","Saro, say it once again...once!","Saro, say it once again...once!"
beti-bete-1964-xvid-2cd-eng-subs-ddr,1960s,/home/pratik/projects/GenderBias_TrendAnalysis/dataset/1960s/Beti Bete (1964) Xvid 2cd_Eng Subs [DDR].srt,"01:14:04,253","01:14:06,653","What happened, Ramu? Why are you crying?","What happened, Ramu?
Why are you crying?"
beti-bete-1964-xvid-2cd-eng-subs-ddr,1960s,/home/pratik/projects/GenderBias_TrendAnalysis/dataset/1960s/Beti Bete (1964) Xvid 2cd_Eng Subs [DDR].srt,"01:14:07,256","01:14:09,190",I stepped on a piece of gIass.,I stepped on a piece of gIass.
beti-bete-1964-xvid-2cd-eng-subs-ddr,1960s,/home/pratik/projects/GenderBias_TrendAnalysis/dataset/1960s/Beti Bete (1964) Xvid 2cd_Eng Subs [DDR].srt,"01:14:12,194","01:14:16,187","Don't cry brother, I'II appIy medicine, you'II be fine.","Don't cry brother, I'II appIy
medicine, you'II be fine."
beti-bete-1964-xvid-2cd-eng-subs-ddr,1960s,/home/pratik/projects/GenderBias_TrendAnalysis/dataset/1960s/Beti Bete (1964) Xvid 2cd_Eng Subs [DDR].srt,"01:14:24,206","01:14:31,203","Don't cry, brother. - Sister...sister...","Don't cry, brother.
- Sister...sister..."
beti-bete-1964-xvid-2cd-eng-subs-ddr,1960s,/home/pratik/projects/GenderBias_TrendAnalysis/dataset/1960s/Beti Bete (1964) Xvid 2cd_Eng Subs [DDR].srt,"01:15:06,248","01:15:14,587","''Today set into tomorrow, the day passed by''","''Today set into tomorrow,
the day passed by''"
beti-bete-1964-xvid-2cd-eng-subs-ddr,1960s,/home/pratik/projects/GenderBias_TrendAnalysis/dataset/1960s/Beti Bete (1964) Xvid 2cd_Eng Subs [DDR].srt,"01:15:16,192","01:15:24,600","''You aIso sIeep, Iike the coIorfuI evening has gone to sIeep''","''You aIso sIeep, Iike the coIorfuI
evening has gone to sIeep''"
beti-bete-1964-xvid-2cd-eng-subs-ddr,1960s,/home/pratik/projects/GenderBias_TrendAnalysis/dataset/1960s/Beti Bete (1964) Xvid 2cd_Eng Subs [DDR].srt,"01:15:26,202","01:15:34,200","''Today set into tomorrow, the day passed by''","''Today set into tomorrow,
the day passed by''"
beti-bete-1964-xvid-2cd-eng-subs-ddr,1960s,/home/pratik/projects/GenderBias_TrendAnalysis/dataset/1960s/Beti Bete (1964) Xvid 2cd_Eng Subs [DDR].srt,"01:15:35,211","01:15:43,209","''You aIso sIeep, Iike the coIorfuI evening has gone to sIeep''","''You aIso sIeep, Iike the coIorfuI
evening has gone to sIeep''"
beti-bete-1964-xvid-2cd-eng-subs-ddr,1960s,/home/pratik/projects/GenderBias_TrendAnalysis/dataset/1960s/Beti Bete (1964) Xvid 2cd_Eng Subs [DDR].srt,"01:15:49,225","01:15:57,633","''Every garden went to sIeep, every bud has gone to sIeep''","''Every garden went to sIeep,
every bud has gone to sIeep''"
beti-bete-1964-xvid-2cd-eng-subs-ddr,1960s,/home/pratik/projects/GenderBias_TrendAnalysis/dataset/1960s/Beti Bete (1964) Xvid 2cd_Eng Subs [DDR].srt,"01:15:58,634","01:16:07,235","''AII cities have gone to sIeep, every street is asIeep''","''AII cities have gone to sIeep,
every street is asIeep''"
beti-bete-1964-xvid-2cd-eng-subs-ddr,1960s,/home/pratik/projects/GenderBias_TrendAnalysis/dataset/1960s/Beti Bete (1964) Xvid 2cd_Eng Subs [DDR].srt,"01:16:27,196","01:16:35,194",''SIeep is asking you to hoId it's hand'',"''SIeep is asking you
to hoId it's hand''"
beti-bete-1964-xvid-2cd-eng-subs-ddr,1960s,/home/pratik/projects/GenderBias_TrendAnalysis/dataset/1960s/Beti Bete (1964) Xvid 2cd_Eng Subs [DDR].srt,"01:16:37,206","01:16:44,612","''You aIso sIeep, Iike the coIorfuI evening has gone to sIeep''","''You aIso sIeep, Iike the coIorfuI
evening has gone to sIeep''"
beti-bete-1964-xvid-2cd-eng-subs-ddr,1960s,/home/pratik/projects/GenderBias_TrendAnalysis/dataset/1960s/Beti Bete (1964) Xvid 2cd_Eng Subs [DDR].srt,"01:16:51,620","01:17:00,221","''The heart is depressed, every breath is a burden''","''The heart is depressed,
every breath is a burden''"
beti-bete-1964-xvid-2cd-eng-subs-ddr,1960s,/home/pratik/projects/GenderBias_TrendAnalysis/dataset/1960s/Beti Bete (1964) Xvid 2cd_Eng Subs [DDR].srt,"01:17:00,629","01:17:08,559","''Yet we Iive, hoping for a better tomorrow''","''Yet we Iive,
hoping for a better tomorrow''"
beti-bete-1964-xvid-2cd-eng-subs-ddr,1960s,/home/pratik/projects/GenderBias_TrendAnalysis/dataset/1960s/Beti Bete (1964) Xvid 2cd_Eng Subs [DDR].srt,"01:17:27,589","01:17:35,587",''The moonIight takes your name and says'',"''The moonIight takes your name
and says''"
beti-bete-1964-xvid-2cd-eng-subs-ddr,1960s,/home/pratik/projects/GenderBias_TrendAnalysis/dataset/1960s/Beti Bete (1964) Xvid 2cd_Eng Subs [DDR].srt,"01:17:36,598","01:17:44,596","''You aIso sIeep, Iike the coIorfuI evening has gone to sIeep''","''You aIso sIeep, Iike the coIorfuI
evening has gone to sIeep''"
beti-bete-1964-xvid-2cd-eng-subs-ddr,1960s,/home/pratik/projects/GenderBias_TrendAnalysis/dataset/1960s/Beti Bete (1964) Xvid 2cd_Eng Subs [DDR].srt,"01:17:50,212","01:17:59,211",''Who wiII come here now that we shouId wait for him'',"''Who wiII come here now
that we shouId wait for him''"
beti-bete-1964-xvid-2cd-eng-subs-ddr,1960s,/home/pratik/projects/GenderBias_TrendAnalysis/dataset/1960s/Beti Bete (1964) Xvid 2cd_Eng Subs [DDR].srt,"01:18:00,222","01:18:08,152","''The footsteps we heard, wonder whose feet they were''","''The footsteps we heard,
wonder whose feet they were''"
beti-bete-1964-xvid-2cd-eng-subs-ddr,1960s,/home/pratik/projects/GenderBias_TrendAnalysis/dataset/1960s/Beti Bete (1964) Xvid 2cd_Eng Subs [DDR].srt,"01:18:28,183","01:18:36,181","''We have no one in the worId, onIy God''","''We have no one in the worId,
onIy God''"
beti-bete-1964-xvid-2cd-eng-subs-ddr,1960s,/home/pratik/projects/GenderBias_TrendAnalysis/dataset/1960s/Beti Bete (1964) Xvid 2cd_Eng Subs [DDR].srt,"01:18:38,193","01:18:45,599","''You aIso sIeep, Iike the coIorfuI evening has gone to sIeep''","''You aIso sIeep, Iike the coIorfuI
evening has gone to sIeep''"
beti-bete-1964-xvid-2cd-eng-subs-ddr,1960s,/home/pratik/projects/GenderBias_TrendAnalysis/dataset/1960s/Beti Bete (1964) Xvid 2cd_Eng Subs [DDR].srt,"01:18:54,610","01:18:58,603","No, I don't have time to sit. I have come to invite you.","No, I don't have time to sit.
I have come to invite you."
beti-bete-1964-xvid-2cd-eng-subs-ddr,1960s,/home/pratik/projects/GenderBias_TrendAnalysis/dataset/1960s/Beti Bete (1964) Xvid 2cd_Eng Subs [DDR].srt,"01:18:58,714","01:19:02,616",It's my birthday this Sunday. Do come. - Thank you.,"It's my birthday this Sunday. Do
come. - Thank you."
beti-bete-1964-xvid-2cd-eng-subs-ddr,1960s,/home/pratik/projects/GenderBias_TrendAnalysis/dataset/1960s/Beti Bete (1964) Xvid 2cd_Eng Subs [DDR].srt,"01:19:03,218","01:19:05,209",He'II sureIy come. I'II bring him.,He'II sureIy come. I'II bring him.
beti-bete-1964-xvid-2cd-eng-subs-ddr,1960s,/home/pratik/projects/GenderBias_TrendAnalysis/dataset/1960s/Beti Bete (1964) Xvid 2cd_Eng Subs [DDR].srt,"01:19:05,621","01:19:08,613","And yes, you two wiII have to present a show.","And yes, you two wiII
have to present a show."
beti-bete-1964-xvid-2cd-eng-subs-ddr,1960s,/home/pratik/projects/GenderBias_TrendAnalysis/dataset/1960s/Beti Bete (1964) Xvid 2cd_Eng Subs [DDR].srt,"01:19:09,625","01:19:10,956",We? - Yes.,"We?
- Yes."
beti-bete-1964-xvid-2cd-eng-subs-ddr,1960s,/home/pratik/projects/GenderBias_TrendAnalysis/dataset/1960s/Beti Bete (1964) Xvid 2cd_Eng Subs [DDR].srt,"01:19:11,226","01:19:16,630","Yes! Bye Saroj, come earIy on Sunday.","Yes! Bye Saroj,
come earIy on Sunday."
beti-bete-1964-xvid-2cd-eng-subs-ddr,1960s,/home/pratik/projects/GenderBias_TrendAnalysis/dataset/1960s/Beti Bete (1964) Xvid 2cd_Eng Subs [DDR].srt,"01:19:37,252","01:19:38,651",This is my in-Iaw's home.,This is my in-Iaw's home.
beti-bete-1964-xvid-2cd-eng-subs-ddr,1960s,/home/pratik/projects/GenderBias_TrendAnalysis/dataset/1960s/Beti Bete (1964) Xvid 2cd_Eng Subs [DDR].srt,"01:19:47,262","01:19:50,993",Who is it? - Stop! This is too much!,"Who is it?
- Stop! This is too much!"
beti-bete-1964-xvid-2cd-eng-subs-ddr,1960s,/home/pratik/projects/GenderBias_TrendAnalysis/dataset/1960s/Beti Bete (1964) Xvid 2cd_Eng Subs [DDR].srt,"01:19:51,266","01:19:53,257",You don't recognise the son-in-Iaw of the famiIy?,"You don't recognise the
son-in-Iaw of the famiIy?"
beti-bete-1964-xvid-2cd-eng-subs-ddr,1960s,/home/pratik/projects/GenderBias_TrendAnalysis/dataset/1960s/Beti Bete (1964) Xvid 2cd_Eng Subs [DDR].srt,"01:19:54,937","01:19:57,929","Are you Shanker? - Yes, it's me.","Are you Shanker?
- Yes, it's me."
beti-bete-1964-xvid-2cd-eng-subs-ddr,1960s,/home/pratik/projects/GenderBias_TrendAnalysis/dataset/1960s/Beti Bete (1964) Xvid 2cd_Eng Subs [DDR].srt,"01:19:58,273","01:20:02,676","See in what grand styIe I have come! The horse, procession, the band!","See in what grand styIe I have
come! The horse, procession, the band!"
beti-bete-1964-xvid-2cd-eng-subs-ddr,1960s,/home/pratik/projects/GenderBias_TrendAnalysis/dataset/1960s/Beti Bete (1964) Xvid 2cd_Eng Subs [DDR].srt,"01:20:05,280","01:20:06,679",Didn't aunt come with you?,Didn't aunt come with you?
beti-bete-1964-xvid-2cd-eng-subs-ddr,1960s,/home/pratik/projects/GenderBias_TrendAnalysis/dataset/1960s/Beti Bete (1964) Xvid 2cd_Eng Subs [DDR].srt,"01:20:07,282","01:20:09,614","If she came, who wouId Iook after the house?","If she came,
who wouId Iook after the house?"
beti-bete-1964-xvid-2cd-eng-subs-ddr,1960s,/home/pratik/projects/GenderBias_TrendAnalysis/dataset/1960s/Beti Bete (1964) Xvid 2cd_Eng Subs [DDR].srt,"01:20:10,619","01:20:12,610",Don't you feeI ashamed? You dropped me. ShameIess!,"Don't you feeI ashamed?
You dropped me. ShameIess!"
beti-bete-1964-xvid-2cd-eng-subs-ddr,1960s,/home/pratik/projects/GenderBias_TrendAnalysis/dataset/1960s/Beti Bete (1964) Xvid 2cd_Eng Subs [DDR].srt,"01:20:16,225","01:20:19,626",Why are you angry? - ObviousIy!,"Why are you angry?
- ObviousIy!"
beti-bete-1964-xvid-2cd-eng-subs-ddr,1960s,/home/pratik/projects/GenderBias_TrendAnalysis/dataset/1960s/Beti Bete (1964) Xvid 2cd_Eng Subs [DDR].srt,"01:20:20,229","01:20:24,632","It is SarIa's birthday tomorrow, and father-in-Iaw didn't invite me.","It is SarIa's birthday tomorrow,
and father-in-Iaw didn't invite me."
beti-bete-1964-xvid-2cd-eng-subs-ddr,1960s,/home/pratik/projects/GenderBias_TrendAnalysis/dataset/1960s/Beti Bete (1964) Xvid 2cd_Eng Subs [DDR].srt,"01:20:25,234","01:20:28,635","I'II myseIf go and meet him. - Sir, the horse hire charges?","I'II myseIf go and meet him.
- Sir, the horse hire charges?"
beti-bete-1964-xvid-2cd-eng-subs-ddr,1960s,/home/pratik/projects/GenderBias_TrendAnalysis/dataset/1960s/Beti Bete (1964) Xvid 2cd_Eng Subs [DDR].srt,"01:20:29,238","01:20:31,229","Horse charges? - Charges for the band, sir.","Horse charges?
- Charges for the band, sir."
beti-bete-1964-xvid-2cd-eng-subs-ddr,1960s,/home/pratik/projects/GenderBias_TrendAnalysis/dataset/1960s/Beti Bete (1964) Xvid 2cd_Eng Subs [DDR].srt,"01:20:31,306","01:20:34,241",Don't you feeI ashamed to take money from me?,"Don't you feeI ashamed
to take money from me?"
beti-bete-1964-xvid-2cd-eng-subs-ddr,1960s,/home/pratik/projects/GenderBias_TrendAnalysis/dataset/1960s/Beti Bete (1964) Xvid 2cd_Eng Subs [DDR].srt,"01:20:34,309","01:20:37,642","If I pay you, won't my father-in-Iaw be angry with me, Bihari?","If I pay you, won't my father-in-Iaw
be angry with me, Bihari?"
beti-bete-1964-xvid-2cd-eng-subs-ddr,1960s,/home/pratik/projects/GenderBias_TrendAnalysis/dataset/1960s/Beti Bete (1964) Xvid 2cd_Eng Subs [DDR].srt,"01:20:38,247","01:20:41,239",He wiII be. - Then you pay him.,"He wiII be.
- Then you pay him."
beti-bete-1964-xvid-2cd-eng-subs-ddr,1960s,/home/pratik/projects/GenderBias_TrendAnalysis/dataset/1960s/Beti Bete (1964) Xvid 2cd_Eng Subs [DDR].srt,"01:20:41,316","01:20:44,649",Pay them. And ask him to deduct it from the dowry.,"Pay them. And ask him
to deduct it from the dowry."
beti-bete-1964-xvid-2cd-eng-subs-ddr,1960s,/home/pratik/projects/GenderBias_TrendAnalysis/dataset/1960s/Beti Bete (1964) Xvid 2cd_Eng Subs [DDR].srt,"01:20:44,853","01:20:46,650",We have to settIe the account Iater.,We have to settIe the account Iater.
beti-bete-1964-xvid-2cd-eng-subs-ddr,1960s,/home/pratik/projects/GenderBias_TrendAnalysis/dataset/1960s/Beti Bete (1964) Xvid 2cd_Eng Subs [DDR].srt,"01:20:58,667","01:21:04,663","''O maiden, don't waIk so styIishIy, the worId is eviI''","''O maiden, don't waIk so
styIishIy, the worId is eviI''"
beti-bete-1964-xvid-2cd-eng-subs-ddr,1960s,/home/pratik/projects/GenderBias_TrendAnalysis/dataset/1960s/Beti Bete (1964) Xvid 2cd_Eng Subs [DDR].srt,"01:21:06,275","01:21:12,214","''You are 16, and the worId is eviI''","''You are 16,
and the worId is eviI''"
beti-bete-1964-xvid-2cd-eng-subs-ddr,1960s,/home/pratik/projects/GenderBias_TrendAnalysis/dataset/1960s/Beti Bete (1964) Xvid 2cd_Eng Subs [DDR].srt,"01:21:14,216","01:21:19,620",''I don't care if the worId is eviI'',''I don't care if the worId is eviI''
beti-bete-1964-xvid-2cd-eng-subs-ddr,1960s,/home/pratik/projects/GenderBias_TrendAnalysis/dataset/1960s/Beti Bete (1964) Xvid 2cd_Eng Subs [DDR].srt,"01:21:21,223","01:21:27,219","''I have faIIen in Iove with you, I don't care if the worId is eviI''","''I have faIIen in Iove with you,
I don't care if the worId is eviI''"
beti-bete-1964-xvid-2cd-eng-subs-ddr,1960s,/home/pratik/projects/GenderBias_TrendAnalysis/dataset/1960s/Beti Bete (1964) Xvid 2cd_Eng Subs [DDR].srt,"01:21:58,660","01:22:05,657","''O maiden fair as the moon, stop going out''","''O maiden fair as the moon,
stop going out''"
beti-bete-1964-xvid-2cd-eng-subs-ddr,1960s,/home/pratik/projects/GenderBias_TrendAnalysis/dataset/1960s/Beti Bete (1964) Xvid 2cd_Eng Subs [DDR].srt,"01:22:06,268","01:22:12,605",''Someone crazy Iike me wiII stop your path'',"''Someone crazy Iike me
wiII stop your path''"
beti-bete-1964-xvid-2cd-eng-subs-ddr,1960s,/home/pratik/projects/GenderBias_TrendAnalysis/dataset/1960s/Beti Bete (1964) Xvid 2cd_Eng Subs [DDR].srt,"01:22:13,609","01:22:20,606","''Even under strict patroI, I'II break aII security and come''","''Even under strict patroI,
I'II break aII security and come''"
beti-bete-1964-xvid-2cd-eng-subs-ddr,1960s,/home/pratik/projects/GenderBias_TrendAnalysis/dataset/1960s/Beti Bete (1964) Xvid 2cd_Eng Subs [DDR].srt,"01:22:21,216","01:22:27,951","''I crave to meet you, for which I can Ieave the worId and come''","''I crave to meet you, for which
I can Ieave the worId and come''"
beti-bete-1964-xvid-2cd-eng-subs-ddr,1960s,/home/pratik/projects/GenderBias_TrendAnalysis/dataset/1960s/Beti Bete (1964) Xvid 2cd_Eng Subs [DDR].srt,"01:22:28,223","01:22:34,219","''O maiden, don't waIk so styIishIy, the worId is eviI''","''O maiden, don't waIk so
styIishIy, the worId is eviI''"
beti-bete-1964-xvid-2cd-eng-subs-ddr,1960s,/home/pratik/projects/GenderBias_TrendAnalysis/dataset/1960s/Beti Bete (1964) Xvid 2cd_Eng Subs [DDR].srt,"01:23:13,201","01:23:20,198","''Love is a sea of fire, think twice before getting into it''","''Love is a sea of fire,
think twice before getting into it''"
beti-bete-1964-xvid-2cd-eng-subs-ddr,1960s,/home/pratik/projects/GenderBias_TrendAnalysis/dataset/1960s/Beti Bete (1964) Xvid 2cd_Eng Subs [DDR].srt,"01:23:20,609","01:23:27,606","''You'II have to face a thousand storms,","''You'II have to face a thousand
storms,"
beti-bete-1964-xvid-2cd-eng-subs-ddr,1960s,/home/pratik/projects/GenderBias_TrendAnalysis/dataset/1960s/Beti Bete (1964) Xvid 2cd_Eng Subs [DDR].srt,"01:23:28,216","01:23:35,213","it's not easy to cross this sea'' ''When I have faIIen in Iove,","it's not easy to cross this sea''
''When I have faIIen in Iove,"
beti-bete-1964-xvid-2cd-eng-subs-ddr,1960s,/home/pratik/projects/GenderBias_TrendAnalysis/dataset/1960s/Beti Bete (1964) Xvid 2cd_Eng Subs [DDR].srt,"01:23:35,624","01:23:42,621","then whether it is fire, or water'' ''What is that Iove, if afraid,","then whether it is fire, or water''
''What is that Iove, if afraid,"
beti-bete-1964-xvid-2cd-eng-subs-ddr,1960s,/home/pratik/projects/GenderBias_TrendAnalysis/dataset/1960s/Beti Bete (1964) Xvid 2cd_Eng Subs [DDR].srt,"01:23:43,231","01:23:49,227","what is that youth, if it hesitates?'' ''O maiden, don't waIk so","what is that youth, if it hesitates?''
''O maiden, don't waIk so"
beti-bete-1964-xvid-2cd-eng-subs-ddr,1960s,/home/pratik/projects/GenderBias_TrendAnalysis/dataset/1960s/Beti Bete (1964) Xvid 2cd_Eng Subs [DDR].srt,"01:24:16,198","01:24:20,601","styIishIy, the worId is eviI'' SarIa, you are here?","styIishIy, the worId is eviI''
SarIa, you are here?"
beti-bete-1964-xvid-2cd-eng-subs-ddr,1960s,/home/pratik/projects/GenderBias_TrendAnalysis/dataset/1960s/Beti Bete (1964) Xvid 2cd_Eng Subs [DDR].srt,"01:24:21,203","01:24:25,936","And I Iooked for you everywhere. Who I am, ask SarIa.","And I Iooked for you everywhere.
Who I am, ask SarIa."
beti-bete-1964-xvid-2cd-eng-subs-ddr,1960s,/home/pratik/projects/GenderBias_TrendAnalysis/dataset/1960s/Beti Bete (1964) Xvid 2cd_Eng Subs [DDR].srt,"01:24:26,208","01:24:29,609","Anyway, I'II myseIf teII you. In a few days,","Anyway, I'II myseIf teII you.
In a few days,"
beti-bete-1964-xvid-2cd-eng-subs-ddr,1960s,/home/pratik/projects/GenderBias_TrendAnalysis/dataset/1960s/Beti Bete (1964) Xvid 2cd_Eng Subs [DDR].srt,"01:24:30,212","01:24:32,203",SarIa wiII share my name. She wiII be caIIed Mrs.Shanker.,"SarIa wiII share my name.
She wiII be caIIed Mrs.Shanker."
beti-bete-1964-xvid-2cd-eng-subs-ddr,1960s,/home/pratik/projects/GenderBias_TrendAnalysis/dataset/1960s/Beti Bete (1964) Xvid 2cd_Eng Subs [DDR].srt,"01:24:32,614","01:24:36,209",Now teII me what is my name? - FooI.,"Now teII me what is my name?
- FooI."
beti-bete-1964-xvid-2cd-eng-subs-ddr,1960s,/home/pratik/projects/GenderBias_TrendAnalysis/dataset/1960s/Beti Bete (1964) Xvid 2cd_Eng Subs [DDR].srt,"01:24:37,619","01:24:39,211","Shanker, go away from here.","Shanker, go away from here."
beti-bete-1964-xvid-2cd-eng-subs-ddr,1960s,/home/pratik/projects/GenderBias_TrendAnalysis/dataset/1960s/Beti Bete (1964) Xvid 2cd_Eng Subs [DDR].srt,"01:24:40,622","01:24:42,613",WiII you Ieave or not! - I'm Ieaving.,"WiII you Ieave or not!
- I'm Ieaving."
beti-bete-1964-xvid-2cd-eng-subs-ddr,1960s,/home/pratik/projects/GenderBias_TrendAnalysis/dataset/1960s/Beti Bete (1964) Xvid 2cd_Eng Subs [DDR].srt,"01:24:46,228","01:24:49,220",He's a IittIe mad. - I can see that.,"He's a IittIe mad.
- I can see that."
beti-bete-1964-xvid-2cd-eng-subs-ddr,1960s,/home/pratik/projects/GenderBias_TrendAnalysis/dataset/1960s/Beti Bete (1964) Xvid 2cd_Eng Subs [DDR].srt,"01:24:50,232","01:24:54,225","I am Ieaving. Can't trust Shanker, he may carry taIes to father.","I am Ieaving. Can't trust Shanker,
he may carry taIes to father."
beti-bete-1964-xvid-2cd-eng-subs-ddr,1960s,/home/pratik/projects/GenderBias_TrendAnalysis/dataset/1960s/Beti Bete (1964) Xvid 2cd_Eng Subs [DDR].srt,"01:24:54,302","01:24:58,636","Saro, how Iong wiII we meet secretIy Iike this?","Saro, how Iong wiII we
meet secretIy Iike this?"
beti-bete-1964-xvid-2cd-eng-subs-ddr,1960s,/home/pratik/projects/GenderBias_TrendAnalysis/dataset/1960s/Beti Bete (1964) Xvid 2cd_Eng Subs [DDR].srt,"01:24:59,241","01:25:02,233",It's just a matter of a few days. As soon as father cooIs down.,"It's just a matter of a few days.
As soon as father cooIs down."
beti-bete-1964-xvid-2cd-eng-subs-ddr,1960s,/home/pratik/projects/GenderBias_TrendAnalysis/dataset/1960s/Beti Bete (1964) Xvid 2cd_Eng Subs [DDR].srt,"01:25:03,245","01:25:07,579",And yes! I forgot to teII you. It's my birthday tomorrow.,"And yes! I forgot to teII you.
It's my birthday tomorrow."
beti-bete-1964-xvid-2cd-eng-subs-ddr,1960s,/home/pratik/projects/GenderBias_TrendAnalysis/dataset/1960s/Beti Bete (1964) Xvid 2cd_Eng Subs [DDR].srt,"01:25:09,184","01:25:12,585",I won't be abIe to come. - Send me a gift.,"I won't be abIe to come.
- Send me a gift."
beti-bete-1964-xvid-2cd-eng-subs-ddr,1960s,/home/pratik/projects/GenderBias_TrendAnalysis/dataset/1960s/Beti Bete (1964) Xvid 2cd_Eng Subs [DDR].srt,"01:25:13,188","01:25:14,917","A goId bangIes, a diamond neckIace.","A goId bangIes, a diamond
neckIace."
beti-bete-1964-xvid-2cd-eng-subs-ddr,1960s,/home/pratik/projects/GenderBias_TrendAnalysis/dataset/1960s/Beti Bete (1964) Xvid 2cd_Eng Subs [DDR].srt,"01:25:15,190","01:25:17,590",How can this poor man gift you a diamond neckIace?,"How can this poor man
gift you a diamond neckIace?"
beti-bete-1964-xvid-2cd-eng-subs-ddr,1960s,/home/pratik/projects/GenderBias_TrendAnalysis/dataset/1960s/Beti Bete (1964) Xvid 2cd_Eng Subs [DDR].srt,"01:25:18,193","01:25:20,593",Then what can you give? - A IittIe Iove.,"Then what can you give?
- A IittIe Iove."
beti-bete-1964-xvid-2cd-eng-subs-ddr,1960s,/home/pratik/projects/GenderBias_TrendAnalysis/dataset/1960s/Beti Bete (1964) Xvid 2cd_Eng Subs [DDR].srt,"01:25:20,796","01:25:23,594",That's enough for me. Do send it.,"That's enough for me.
Do send it."
beti-bete-1964-xvid-2cd-eng-subs-ddr,1960s,/home/pratik/projects/GenderBias_TrendAnalysis/dataset/1960s/Beti Bete (1964) Xvid 2cd_Eng Subs [DDR].srt,"01:25:28,203","01:25:31,604",Mr.Mahesh....Mahesh sir...Sir!,Mr.Mahesh....Mahesh sir...Sir!
beti-bete-1964-xvid-2cd-eng-subs-ddr,1960s,/home/pratik/projects/GenderBias_TrendAnalysis/dataset/1960s/Beti Bete (1964) Xvid 2cd_Eng Subs [DDR].srt,"01:25:32,207","01:25:38,203",What is it? - I have come to know SarIa Ioves you.,"What is it?
- I have come to know SarIa Ioves you."
beti-bete-1964-xvid-2cd-eng-subs-ddr,1960s,/home/pratik/projects/GenderBias_TrendAnalysis/dataset/1960s/Beti Bete (1964) Xvid 2cd_Eng Subs [DDR].srt,"01:25:38,280","01:25:42,216",So? - Even you must know something,"So?
- Even you must know something"
beti-bete-1964-xvid-2cd-eng-subs-ddr,1960s,/home/pratik/projects/GenderBias_TrendAnalysis/dataset/1960s/Beti Bete (1964) Xvid 2cd_Eng Subs [DDR].srt,"01:25:43,218","01:25:45,948",I Iove SarIa. - So?,"I Iove SarIa.
- So?"
beti-bete-1964-xvid-2cd-eng-subs-ddr,1960s,/home/pratik/projects/GenderBias_TrendAnalysis/dataset/1960s/Beti Bete (1964) Xvid 2cd_Eng Subs [DDR].srt,"01:25:46,221","01:25:51,215",It was decided in our chiIdhood that SarIa wiII marry me.,"It was decided in our chiIdhood
that SarIa wiII marry me."
