film_id,decade,file_path,start,end,text_clean,text_raw
sunghursh-1968,1960s,/home/pratik/projects/GenderBias_TrendAnalysis/dataset/1960s/Sunghursh.1968.srt,"01:44:03,134","01:44:05,134",Then I get scared to open my eyes.,Then I get scared to open my eyes.
sunghursh-1968,1960s,/home/pratik/projects/GenderBias_TrendAnalysis/dataset/1960s/Sunghursh.1968.srt,"01:44:05,614","01:44:07,294",Scared that you might get vanished.,Scared that you might get vanished.
sunghursh-1968,1960s,/home/pratik/projects/GenderBias_TrendAnalysis/dataset/1960s/Sunghursh.1968.srt,"01:44:07,494","01:44:08,214",Laila.,Laila.
sunghursh-1968,1960s,/home/pratik/projects/GenderBias_TrendAnalysis/dataset/1960s/Sunghursh.1968.srt,"01:44:09,054","01:44:09,894",Laila?,Laila?
sunghursh-1968,1960s,/home/pratik/projects/GenderBias_TrendAnalysis/dataset/1960s/Sunghursh.1968.srt,"01:44:10,494","01:44:11,134",No.,No.
sunghursh-1968,1960s,/home/pratik/projects/GenderBias_TrendAnalysis/dataset/1960s/Sunghursh.1968.srt,"01:44:11,694","01:44:13,254","I am your Munni, Kundan.","I am your Munni, Kundan."
sunghursh-1968,1960s,/home/pratik/projects/GenderBias_TrendAnalysis/dataset/1960s/Sunghursh.1968.srt,"01:44:13,854","01:44:15,694",Laila was the dancer.,Laila was the dancer.
sunghursh-1968,1960s,/home/pratik/projects/GenderBias_TrendAnalysis/dataset/1960s/Sunghursh.1968.srt,"01:44:16,014","01:44:17,934",And I want to forget her right now.,And I want to forget her right now.
sunghursh-1968,1960s,/home/pratik/projects/GenderBias_TrendAnalysis/dataset/1960s/Sunghursh.1968.srt,"01:44:18,814","01:44:21,734","Kundan, please don't call me by that name again.","Kundan, please don't
call me by that name again."
sunghursh-1968,1960s,/home/pratik/projects/GenderBias_TrendAnalysis/dataset/1960s/Sunghursh.1968.srt,"01:44:21,934","01:44:22,774",Madam.,Madam.
sunghursh-1968,1960s,/home/pratik/projects/GenderBias_TrendAnalysis/dataset/1960s/Sunghursh.1968.srt,"01:44:23,334","01:44:24,694",Mr. Rajasaheb is here.,Mr. Rajasaheb is here.
sunghursh-1968,1960s,/home/pratik/projects/GenderBias_TrendAnalysis/dataset/1960s/Sunghursh.1968.srt,"01:44:25,054","01:44:27,094","I told him a lot, but he is not ready to leave.","I told him a lot,
but he is not ready to leave."
sunghursh-1968,1960s,/home/pratik/projects/GenderBias_TrendAnalysis/dataset/1960s/Sunghursh.1968.srt,"01:44:27,294","01:44:29,694","He says, won't leave without meeting you.","He says,
won't leave without meeting you."
sunghursh-1968,1960s,/home/pratik/projects/GenderBias_TrendAnalysis/dataset/1960s/Sunghursh.1968.srt,"01:44:42,214","01:44:43,254",Yes darling.,Yes darling.
sunghursh-1968,1960s,/home/pratik/projects/GenderBias_TrendAnalysis/dataset/1960s/Sunghursh.1968.srt,"01:44:43,614","01:44:44,374",How are you?,How are you?
sunghursh-1968,1960s,/home/pratik/projects/GenderBias_TrendAnalysis/dataset/1960s/Sunghursh.1968.srt,"01:44:45,414","01:44:46,734",I was fine till now.,I was fine till now.
sunghursh-1968,1960s,/home/pratik/projects/GenderBias_TrendAnalysis/dataset/1960s/Sunghursh.1968.srt,"01:44:47,334","01:44:48,574",What got you here?,What got you here?
sunghursh-1968,1960s,/home/pratik/projects/GenderBias_TrendAnalysis/dataset/1960s/Sunghursh.1968.srt,"01:44:48,774","01:44:51,934","Just to listen to you, to talk to you.","Just to listen to you, to talk to you."
sunghursh-1968,1960s,/home/pratik/projects/GenderBias_TrendAnalysis/dataset/1960s/Sunghursh.1968.srt,"01:44:52,734","01:44:54,574",This place has become very silent.,This place has become very silent.
sunghursh-1968,1960s,/home/pratik/projects/GenderBias_TrendAnalysis/dataset/1960s/Sunghursh.1968.srt,"01:44:55,214","01:44:55,894",Laila.,Laila.
sunghursh-1968,1960s,/home/pratik/projects/GenderBias_TrendAnalysis/dataset/1960s/Sunghursh.1968.srt,"01:44:56,574","01:45:00,174",It is been long since there has been any dance show here.,"It is been long since there
has been any dance show here."
sunghursh-1968,1960s,/home/pratik/projects/GenderBias_TrendAnalysis/dataset/1960s/Sunghursh.1968.srt,"01:45:01,214","01:45:02,854",I have stopped it now.,I have stopped it now.
sunghursh-1968,1960s,/home/pratik/projects/GenderBias_TrendAnalysis/dataset/1960s/Sunghursh.1968.srt,"01:45:04,174","01:45:06,854","I know that, but why has Ganeshi stopped coming here?","I know that,
but why has Ganeshi stopped coming here?"
sunghursh-1968,1960s,/home/pratik/projects/GenderBias_TrendAnalysis/dataset/1960s/Sunghursh.1968.srt,"01:45:07,574","01:45:10,134",I thought he is upset about his brother.,I thought he is upset about his brother.
sunghursh-1968,1960s,/home/pratik/projects/GenderBias_TrendAnalysis/dataset/1960s/Sunghursh.1968.srt,"01:45:10,574","01:45:13,054",So I thought I should come over for some fun.,"So I thought I should
come over for some fun."
sunghursh-1968,1960s,/home/pratik/projects/GenderBias_TrendAnalysis/dataset/1960s/Sunghursh.1968.srt,"01:45:13,134","01:45:14,654",You better leave Mr. Rajasaheb.,You better leave Mr. Rajasaheb.
sunghursh-1968,1960s,/home/pratik/projects/GenderBias_TrendAnalysis/dataset/1960s/Sunghursh.1968.srt,"01:45:15,214","01:45:17,134",I have stopped dancing and singing.,I have stopped dancing and singing.
sunghursh-1968,1960s,/home/pratik/projects/GenderBias_TrendAnalysis/dataset/1960s/Sunghursh.1968.srt,"01:45:17,654","01:45:19,694",You better don't take pains to come here.,"You better don't
take pains to come here."
sunghursh-1968,1960s,/home/pratik/projects/GenderBias_TrendAnalysis/dataset/1960s/Sunghursh.1968.srt,"01:45:19,774","01:45:22,894","Laila, don't be so rude to your lovers.","Laila, don't be so rude to your lovers."
sunghursh-1968,1960s,/home/pratik/projects/GenderBias_TrendAnalysis/dataset/1960s/Sunghursh.1968.srt,"01:45:23,135","01:45:24,125",Take this..,Take this..
sunghursh-1968,1960s,/home/pratik/projects/GenderBias_TrendAnalysis/dataset/1960s/Sunghursh.1968.srt,"01:45:24,205","01:45:26,734","..it is a necklace of real diamonds, which you returned back that day.","..it is a necklace of real diamonds,
which you returned back that day."
sunghursh-1968,1960s,/home/pratik/projects/GenderBias_TrendAnalysis/dataset/1960s/Sunghursh.1968.srt,"01:45:27,254","01:45:28,494",I got it back for you.,I got it back for you.
sunghursh-1968,1960s,/home/pratik/projects/GenderBias_TrendAnalysis/dataset/1960s/Sunghursh.1968.srt,"01:45:28,574","01:45:30,214",Nobody else can.,Nobody else can.
sunghursh-1968,1960s,/home/pratik/projects/GenderBias_TrendAnalysis/dataset/1960s/Sunghursh.1968.srt,"01:45:34,774","01:45:35,894",Rajasaheb.,Rajasaheb.
sunghursh-1968,1960s,/home/pratik/projects/GenderBias_TrendAnalysis/dataset/1960s/Sunghursh.1968.srt,"01:45:36,774","01:45:39,054",This is not a court.,This is not a court.
sunghursh-1968,1960s,/home/pratik/projects/GenderBias_TrendAnalysis/dataset/1960s/Sunghursh.1968.srt,"01:45:40,174","01:45:41,774",This place belongs to 'Laila of the sky'.,"This place belongs
to 'Laila of the sky'."
sunghursh-1968,1960s,/home/pratik/projects/GenderBias_TrendAnalysis/dataset/1960s/Sunghursh.1968.srt,"01:45:43,534","01:45:45,414",Think well before you come here.,Think well before you come here.
sunghursh-1968,1960s,/home/pratik/projects/GenderBias_TrendAnalysis/dataset/1960s/Sunghursh.1968.srt,"01:45:52,494","01:45:54,094",I am leaving you this time.,I am leaving you this time.
sunghursh-1968,1960s,/home/pratik/projects/GenderBias_TrendAnalysis/dataset/1960s/Sunghursh.1968.srt,"01:45:54,574","01:45:58,974",But if you come here again then I will throw your dead body out.,"But if you come here again
then I will throw your dead body out."
sunghursh-1968,1960s,/home/pratik/projects/GenderBias_TrendAnalysis/dataset/1960s/Sunghursh.1968.srt,"01:45:59,134","01:46:00,054",Okay.,Okay.
sunghursh-1968,1960s,/home/pratik/projects/GenderBias_TrendAnalysis/dataset/1960s/Sunghursh.1968.srt,"01:46:00,454","01:46:03,094",Now we will decide upon this once we have the dead body.,"Now we will decide upon
this once we have the dead body."
sunghursh-1968,1960s,/home/pratik/projects/GenderBias_TrendAnalysis/dataset/1960s/Sunghursh.1968.srt,"01:46:03,174","01:46:05,374",Remember Ganeshiprasad.,Remember Ganeshiprasad.
sunghursh-1968,1960s,/home/pratik/projects/GenderBias_TrendAnalysis/dataset/1960s/Sunghursh.1968.srt,"01:46:07,454","01:46:09,614",Dogs don't leave chasing so easily.,Dogs don't leave chasing so easily.
sunghursh-1968,1960s,/home/pratik/projects/GenderBias_TrendAnalysis/dataset/1960s/Sunghursh.1968.srt,"01:46:16,974","01:46:17,894",I am tired Laila.,I am tired Laila.
sunghursh-1968,1960s,/home/pratik/projects/GenderBias_TrendAnalysis/dataset/1960s/Sunghursh.1968.srt,"01:46:19,774","01:46:22,534",I am tired of keeping this weapon with me.,"I am tired of keeping
this weapon with me."
sunghursh-1968,1960s,/home/pratik/projects/GenderBias_TrendAnalysis/dataset/1960s/Sunghursh.1968.srt,"01:46:24,614","01:46:26,294",I missed you a lot last few days.,I missed you a lot last few days.
sunghursh-1968,1960s,/home/pratik/projects/GenderBias_TrendAnalysis/dataset/1960s/Sunghursh.1968.srt,"01:46:27,494","01:46:28,774",I really missed you.,I really missed you.
sunghursh-1968,1960s,/home/pratik/projects/GenderBias_TrendAnalysis/dataset/1960s/Sunghursh.1968.srt,"01:46:29,814","01:46:31,934",But the situation was such that I couldn't come.,"But the situation was
such that I couldn't come."
sunghursh-1968,1960s,/home/pratik/projects/GenderBias_TrendAnalysis/dataset/1960s/Sunghursh.1968.srt,"01:46:32,974","01:46:34,174",I was scared.,I was scared.
sunghursh-1968,1960s,/home/pratik/projects/GenderBias_TrendAnalysis/dataset/1960s/Sunghursh.1968.srt,"01:46:34,574","01:46:35,694",That you might get angry.,That you might get angry.
sunghursh-1968,1960s,/home/pratik/projects/GenderBias_TrendAnalysis/dataset/1960s/Sunghursh.1968.srt,"01:46:37,174","01:46:38,774",Why will I be angry at you?,Why will I be angry at you?
sunghursh-1968,1960s,/home/pratik/projects/GenderBias_TrendAnalysis/dataset/1960s/Sunghursh.1968.srt,"01:46:39,163","01:46:41,563",Laila has got that thing from you..,Laila has got that thing from you..
sunghursh-1968,1960s,/home/pratik/projects/GenderBias_TrendAnalysis/dataset/1960s/Sunghursh.1968.srt,"01:46:42,083","01:46:44,203",..which I had not thought of even in my dreams.,"..which I had not thought
of even in my dreams."
sunghursh-1968,1960s,/home/pratik/projects/GenderBias_TrendAnalysis/dataset/1960s/Sunghursh.1968.srt,"01:46:44,563","01:46:49,043","If Ganeshiprasad too gets that thing from Laila, then his dreams will come true.","If Ganeshiprasad too gets that thing from
Laila, then his dreams will come true."
sunghursh-1968,1960s,/home/pratik/projects/GenderBias_TrendAnalysis/dataset/1960s/Sunghursh.1968.srt,"01:46:50,243","01:46:51,563",Come with me Laila.,Come with me Laila.
sunghursh-1968,1960s,/home/pratik/projects/GenderBias_TrendAnalysis/dataset/1960s/Sunghursh.1968.srt,"01:46:52,003","01:46:55,123","Leave this notorious place, people keep coming here for you.","Leave this notorious place,
people keep coming here for you."
sunghursh-1968,1960s,/home/pratik/projects/GenderBias_TrendAnalysis/dataset/1960s/Sunghursh.1968.srt,"01:46:55,523","01:46:57,363",I keep thinking about you the whole dy.,I keep thinking about you the whole dy.
sunghursh-1968,1960s,/home/pratik/projects/GenderBias_TrendAnalysis/dataset/1960s/Sunghursh.1968.srt,"01:46:57,883","01:47:00,363","If anyone else look at you, I am just not able to tolerate it.","If anyone else look at you,
I am just not able to tolerate it."
sunghursh-1968,1960s,/home/pratik/projects/GenderBias_TrendAnalysis/dataset/1960s/Sunghursh.1968.srt,"01:47:01,243","01:47:04,123",I want to keep you in front of my eyes throughout.,"I want to keep you in
front of my eyes throughout."
sunghursh-1968,1960s,/home/pratik/projects/GenderBias_TrendAnalysis/dataset/1960s/Sunghursh.1968.srt,"01:47:05,003","01:47:06,843",With your eyes shut?,With your eyes shut?
sunghursh-1968,1960s,/home/pratik/projects/GenderBias_TrendAnalysis/dataset/1960s/Sunghursh.1968.srt,"01:47:07,243","01:47:08,283",Shut inside my eyes.,Shut inside my eyes.
sunghursh-1968,1960s,/home/pratik/projects/GenderBias_TrendAnalysis/dataset/1960s/Sunghursh.1968.srt,"01:47:08,363","01:47:09,613",Ganeshiprasad.,Ganeshiprasad.
sunghursh-1968,1960s,/home/pratik/projects/GenderBias_TrendAnalysis/dataset/1960s/Sunghursh.1968.srt,"01:47:10,240","01:47:12,110",Hey Ganeshiprasad! You rascal.,Hey Ganeshiprasad! You rascal.
sunghursh-1968,1960s,/home/pratik/projects/GenderBias_TrendAnalysis/dataset/1960s/Sunghursh.1968.srt,"01:47:12,190","01:47:15,243",Who is this scoundrel? - If you're brave enough then come out.,"Who is this scoundrel?
- If you're brave enough then come out."
sunghursh-1968,1960s,/home/pratik/projects/GenderBias_TrendAnalysis/dataset/1960s/Sunghursh.1968.srt,"01:47:15,723","01:47:18,243","Listen.. please don't go, it must be Rajasaheb's men.","Listen.. please don't go,
it must be Rajasaheb's men."
sunghursh-1968,1960s,/home/pratik/projects/GenderBias_TrendAnalysis/dataset/1960s/Sunghursh.1968.srt,"01:47:26,043","01:47:27,643",What would you do if you had the weapon?,What would you do if you had the weapon?
sunghursh-1968,1960s,/home/pratik/projects/GenderBias_TrendAnalysis/dataset/1960s/Sunghursh.1968.srt,"01:47:27,723","01:47:29,163",Wait!,Wait!
sunghursh-1968,1960s,/home/pratik/projects/GenderBias_TrendAnalysis/dataset/1960s/Sunghursh.1968.srt,"01:48:00,483","01:48:01,723",Go away.,Go away.
sunghursh-1968,1960s,/home/pratik/projects/GenderBias_TrendAnalysis/dataset/1960s/Sunghursh.1968.srt,"01:48:16,763","01:48:18,483",Where did you go away all of a sudden?,"Where did you
go away all of a sudden?"
sunghursh-1968,1960s,/home/pratik/projects/GenderBias_TrendAnalysis/dataset/1960s/Sunghursh.1968.srt,"01:48:19,883","01:48:22,283","The doctor advised you not to talk, sir.","The doctor advised
you not to talk, sir."
sunghursh-1968,1960s,/home/pratik/projects/GenderBias_TrendAnalysis/dataset/1960s/Sunghursh.1968.srt,"01:48:25,483","01:48:28,083",Laila.. - Yes.,"Laila..
- Yes."
sunghursh-1968,1960s,/home/pratik/projects/GenderBias_TrendAnalysis/dataset/1960s/Sunghursh.1968.srt,"01:48:31,083","01:48:34,523",Rajasaheb did a big favour for me while leaving.,"Rajasaheb did a big
favour for me while leaving."
sunghursh-1968,1960s,/home/pratik/projects/GenderBias_TrendAnalysis/dataset/1960s/Sunghursh.1968.srt,"01:48:35,563","01:48:36,603",Good.,Good.
sunghursh-1968,1960s,/home/pratik/projects/GenderBias_TrendAnalysis/dataset/1960s/Sunghursh.1968.srt,"01:48:37,803","01:48:40,163",At least I can be with you for some days.,"At least I can be
with you for some days."
sunghursh-1968,1960s,/home/pratik/projects/GenderBias_TrendAnalysis/dataset/1960s/Sunghursh.1968.srt,"01:48:43,803","01:48:47,283",I've heard people give space in their heart too while giving space in their house.,"I've heard people give space in their heart
too while giving space in their house."
sunghursh-1968,1960s,/home/pratik/projects/GenderBias_TrendAnalysis/dataset/1960s/Sunghursh.1968.srt,"01:48:54,403","01:48:55,803",He is our guest.,He is our guest.
sunghursh-1968,1960s,/home/pratik/projects/GenderBias_TrendAnalysis/dataset/1960s/Sunghursh.1968.srt,"01:48:56,243","01:48:58,083","Till I am here, even he will stay here.","Till I am here, even he will stay here."
sunghursh-1968,1960s,/home/pratik/projects/GenderBias_TrendAnalysis/dataset/1960s/Sunghursh.1968.srt,"01:48:59,083","01:49:00,723",I will make arrangements for his stay.,I will make arrangements for his stay.
sunghursh-1968,1960s,/home/pratik/projects/GenderBias_TrendAnalysis/dataset/1960s/Sunghursh.1968.srt,"01:49:03,883","01:49:05,363",Did you see my Laila?,Did you see my Laila?
sunghursh-1968,1960s,/home/pratik/projects/GenderBias_TrendAnalysis/dataset/1960s/Sunghursh.1968.srt,"01:49:05,843","01:49:08,203","Yes, I saw her.","Yes, I saw her."
sunghursh-1968,1960s,/home/pratik/projects/GenderBias_TrendAnalysis/dataset/1960s/Sunghursh.1968.srt,"01:49:08,403","01:49:10,083",She is so beautiful.,She is so beautiful.
sunghursh-1968,1960s,/home/pratik/projects/GenderBias_TrendAnalysis/dataset/1960s/Sunghursh.1968.srt,"01:49:11,963","01:49:13,923",I love her a lot.,I love her a lot.
sunghursh-1968,1960s,/home/pratik/projects/GenderBias_TrendAnalysis/dataset/1960s/Sunghursh.1968.srt,"01:49:15,003","01:49:17,643",I can sacrifice everything for her.,I can sacrifice everything for her.
sunghursh-1968,1960s,/home/pratik/projects/GenderBias_TrendAnalysis/dataset/1960s/Sunghursh.1968.srt,"01:49:19,243","01:49:22,523",But I couldn't understand till date the amount of love she feels for me.,"But I couldn't understand till date
the amount of love she feels for me."
sunghursh-1968,1960s,/home/pratik/projects/GenderBias_TrendAnalysis/dataset/1960s/Sunghursh.1968.srt,"01:49:22,963","01:49:25,723",If she loves me or not.,If she loves me or not.
sunghursh-1968,1960s,/home/pratik/projects/GenderBias_TrendAnalysis/dataset/1960s/Sunghursh.1968.srt,"01:49:25,963","01:49:27,443",You take rest.,You take rest.
sunghursh-1968,1960s,/home/pratik/projects/GenderBias_TrendAnalysis/dataset/1960s/Sunghursh.1968.srt,"01:49:28,523","01:49:29,843",Listen. - Yes.,"Listen.
- Yes."
sunghursh-1968,1960s,/home/pratik/projects/GenderBias_TrendAnalysis/dataset/1960s/Sunghursh.1968.srt,"01:49:30,603","01:49:32,403",You don't have relative here in this city?,"You don't have relative
here in this city?"
sunghursh-1968,1960s,/home/pratik/projects/GenderBias_TrendAnalysis/dataset/1960s/Sunghursh.1968.srt,"01:49:33,763","01:49:35,523",No one apart from you.,No one apart from you.
sunghursh-1968,1960s,/home/pratik/projects/GenderBias_TrendAnalysis/dataset/1960s/Sunghursh.1968.srt,"01:49:36,963","01:49:38,923",Tell me if you have any problems.,Tell me if you have any problems.
sunghursh-1968,1960s,/home/pratik/projects/GenderBias_TrendAnalysis/dataset/1960s/Sunghursh.1968.srt,"01:49:39,723","01:49:41,083",Don't worry about me.,Don't worry about me.
sunghursh-1968,1960s,/home/pratik/projects/GenderBias_TrendAnalysis/dataset/1960s/Sunghursh.1968.srt,"01:50:03,243","01:50:04,403",Kundan.,Kundan.
sunghursh-1968,1960s,/home/pratik/projects/GenderBias_TrendAnalysis/dataset/1960s/Sunghursh.1968.srt,"01:50:05,643","01:50:08,243",Please take your Munni away from this place.,"Please take your Munni
away from this place."
sunghursh-1968,1960s,/home/pratik/projects/GenderBias_TrendAnalysis/dataset/1960s/Sunghursh.1968.srt,"01:50:08,643","01:50:11,003",Laila's lovers will not let her survive.,Laila's lovers will not let her survive.
sunghursh-1968,1960s,/home/pratik/projects/GenderBias_TrendAnalysis/dataset/1960s/Sunghursh.1968.srt,"01:50:11,483","01:50:14,163",Send my Munni back to that Laila.,Send my Munni back to that Laila.
sunghursh-1968,1960s,/home/pratik/projects/GenderBias_TrendAnalysis/dataset/1960s/Sunghursh.1968.srt,"01:50:15,363","01:50:18,603",Whom Ganeshji loves so much.,Whom Ganeshji loves so much.
sunghursh-1968,1960s,/home/pratik/projects/GenderBias_TrendAnalysis/dataset/1960s/Sunghursh.1968.srt,"01:50:18,883","01:50:20,563",Don't you love Munni?,Don't you love Munni?
sunghursh-1968,1960s,/home/pratik/projects/GenderBias_TrendAnalysis/dataset/1960s/Sunghursh.1968.srt,"01:50:21,483","01:50:23,003",Don't you want me?,Don't you want me?
sunghursh-1968,1960s,/home/pratik/projects/GenderBias_TrendAnalysis/dataset/1960s/Sunghursh.1968.srt,"01:50:23,643","01:50:24,883",I love you a lot Munni.,I love you a lot Munni.
sunghursh-1968,1960s,/home/pratik/projects/GenderBias_TrendAnalysis/dataset/1960s/Sunghursh.1968.srt,"01:50:26,203","01:50:28,123",I love you a lot.,I love you a lot.
sunghursh-1968,1960s,/home/pratik/projects/GenderBias_TrendAnalysis/dataset/1960s/Sunghursh.1968.srt,"01:50:29,363","01:50:32,043",But I can't take away Ganeshi's happiness for my selfishness.,"But I can't take away Ganeshi's
happiness for my selfishness."
sunghursh-1968,1960s,/home/pratik/projects/GenderBias_TrendAnalysis/dataset/1960s/Sunghursh.1968.srt,"01:50:33,203","01:50:34,923",I can't make him sad.,I can't make him sad.
sunghursh-1968,1960s,/home/pratik/projects/GenderBias_TrendAnalysis/dataset/1960s/Sunghursh.1968.srt,"01:50:37,843","01:50:39,203",He doesn't know me.,He doesn't know me.
sunghursh-1968,1960s,/home/pratik/projects/GenderBias_TrendAnalysis/dataset/1960s/Sunghursh.1968.srt,"01:50:39,403","01:50:41,843",But I know who I am.,But I know who I am.
sunghursh-1968,1960s,/home/pratik/projects/GenderBias_TrendAnalysis/dataset/1960s/Sunghursh.1968.srt,"01:50:42,683","01:50:45,123",I will sacrifice my love.,I will sacrifice my love.
sunghursh-1968,1960s,/home/pratik/projects/GenderBias_TrendAnalysis/dataset/1960s/Sunghursh.1968.srt,"01:50:45,723","01:50:48,563",But I will never hurt him.,But I will never hurt him.
sunghursh-1968,1960s,/home/pratik/projects/GenderBias_TrendAnalysis/dataset/1960s/Sunghursh.1968.srt,"01:50:48,643","01:50:50,483",You will sacrifice me for him?,You will sacrifice me for him?
sunghursh-1968,1960s,/home/pratik/projects/GenderBias_TrendAnalysis/dataset/1960s/Sunghursh.1968.srt,"01:50:51,203","01:50:53,843",Who rates your Munni with their money.,Who rates your Munni with their money.
sunghursh-1968,1960s,/home/pratik/projects/GenderBias_TrendAnalysis/dataset/1960s/Sunghursh.1968.srt,"01:50:54,363","01:50:57,883",They want to give and take hearts being high on alcohol.,"They want to give and take
hearts being high on alcohol."
sunghursh-1968,1960s,/home/pratik/projects/GenderBias_TrendAnalysis/dataset/1960s/Sunghursh.1968.srt,"01:50:57,963","01:50:59,403",I hate these people.,I hate these people.
sunghursh-1968,1960s,/home/pratik/projects/GenderBias_TrendAnalysis/dataset/1960s/Sunghursh.1968.srt,"01:51:02,363","01:51:03,203",Kundan.,Kundan.
sunghursh-1968,1960s,/home/pratik/projects/GenderBias_TrendAnalysis/dataset/1960s/Sunghursh.1968.srt,"01:51:03,843","01:51:05,123",I am yours.,I am yours.
sunghursh-1968,1960s,/home/pratik/projects/GenderBias_TrendAnalysis/dataset/1960s/Sunghursh.1968.srt,"01:51:05,483","01:51:07,083",I love you.,I love you.
sunghursh-1968,1960s,/home/pratik/projects/GenderBias_TrendAnalysis/dataset/1960s/Sunghursh.1968.srt,"01:51:07,803","01:51:09,443",Please don't separate me from yourself.,Please don't separate me from yourself.
sunghursh-1968,1960s,/home/pratik/projects/GenderBias_TrendAnalysis/dataset/1960s/Sunghursh.1968.srt,"01:51:09,723","01:51:12,363",I will be disgraced. - Munni..,"I will be disgraced.
- Munni.."
sunghursh-1968,1960s,/home/pratik/projects/GenderBias_TrendAnalysis/dataset/1960s/Sunghursh.1968.srt,"01:51:13,603","01:51:16,323","Kundan's conscience is guilty, you've to help him.","Kundan's conscience is guilty,
you've to help him."
sunghursh-1968,1960s,/home/pratik/projects/GenderBias_TrendAnalysis/dataset/1960s/Sunghursh.1968.srt,"01:51:17,883","01:51:22,003",You don't know how much we have been rude to Ganeshi's family.,"You don't know how much we
have been rude to Ganeshi's family."
sunghursh-1968,1960s,/home/pratik/projects/GenderBias_TrendAnalysis/dataset/1960s/Sunghursh.1968.srt,"01:51:23,123","01:51:25,083",We have killed his father.,We have killed his father.
sunghursh-1968,1960s,/home/pratik/projects/GenderBias_TrendAnalysis/dataset/1960s/Sunghursh.1968.srt,"01:51:25,923","01:51:27,643",Made his mother a widow.,Made his mother a widow.
sunghursh-1968,1960s,/home/pratik/projects/GenderBias_TrendAnalysis/dataset/1960s/Sunghursh.1968.srt,"01:51:29,003","01:51:31,203",She died due to the sorrows.,She died due to the sorrows.
sunghursh-1968,1960s,/home/pratik/projects/GenderBias_TrendAnalysis/dataset/1960s/Sunghursh.1968.srt,"01:51:35,403","01:51:38,043",My grandfather has killed many innocent people.,"My grandfather has killed
many innocent people."
sunghursh-1968,1960s,/home/pratik/projects/GenderBias_TrendAnalysis/dataset/1960s/Sunghursh.1968.srt,"01:51:39,683","01:51:43,523","He is no more now, but he indirectly has put all the blames upon me.","He is no more now, but he indirectly
has put all the blames upon me."
sunghursh-1968,1960s,/home/pratik/projects/GenderBias_TrendAnalysis/dataset/1960s/Sunghursh.1968.srt,"01:51:45,483","01:51:47,163",I'm entangled in his sins.,I'm entangled in his sins.
sunghursh-1968,1960s,/home/pratik/projects/GenderBias_TrendAnalysis/dataset/1960s/Sunghursh.1968.srt,"01:51:48,363","01:51:50,883",I have killed Dwarka with these hands.,I have killed Dwarka with these hands.
sunghursh-1968,1960s,/home/pratik/projects/GenderBias_TrendAnalysis/dataset/1960s/Sunghursh.1968.srt,"01:51:53,643","01:51:56,323",I have to make up for this mistake.,I have to make up for this mistake.
sunghursh-1968,1960s,/home/pratik/projects/GenderBias_TrendAnalysis/dataset/1960s/Sunghursh.1968.srt,"01:51:57,323","01:52:02,203",I have to give up on my dreams and wishes and help Ganeshi and his family.,"I have to give up on my dreams and
wishes and help Ganeshi and his family."
sunghursh-1968,1960s,/home/pratik/projects/GenderBias_TrendAnalysis/dataset/1960s/Sunghursh.1968.srt,"01:52:03,283","01:52:04,603",This is my duty.,This is my duty.
sunghursh-1968,1960s,/home/pratik/projects/GenderBias_TrendAnalysis/dataset/1960s/Sunghursh.1968.srt,"01:52:06,923","01:52:08,963",Then listen to me Kundan.,Then listen to me Kundan.
sunghursh-1968,1960s,/home/pratik/projects/GenderBias_TrendAnalysis/dataset/1960s/Sunghursh.1968.srt,"01:52:09,683","01:52:12,123",I can't gift my love to someone for you.,I can't gift my love to someone for you.
sunghursh-1968,1960s,/home/pratik/projects/GenderBias_TrendAnalysis/dataset/1960s/Sunghursh.1968.srt,"01:52:12,843","01:52:14,203",You fulfill your duties..,You fulfill your duties..
sunghursh-1968,1960s,/home/pratik/projects/GenderBias_TrendAnalysis/dataset/1960s/Sunghursh.1968.srt,"01:52:14,803","01:52:16,403",..and I will fulfill my love.,..and I will fulfill my love.
