film_id,decade,file_path,start,end,text_clean,text_raw
bunty-aur-babli-2005-1080p-webrip-x264-aac5-1-yts,2000s,/home/pratik/projects/GenderBias_TrendAnalysis/dataset/2000s/Bunty.Aur.Babli.2005.1080p.WEBRip.x264.AAC5.1-[YTS.srt,"00:01:00,422","00:01:03,004",This is India..,This is India..
bunty-aur-babli-2005-1080p-webrip-x264-aac5-1-yts,2000s,/home/pratik/projects/GenderBias_TrendAnalysis/dataset/2000s/Bunty.Aur.Babli.2005.1080p.WEBRip.x264.AAC5.1-[YTS.srt,"00:01:03,094","00:01:05,805","the land that glistens, shines..","the land that glistens, shines.."
bunty-aur-babli-2005-1080p-webrip-x264-aac5-1-yts,2000s,/home/pratik/projects/GenderBias_TrendAnalysis/dataset/2000s/Bunty.Aur.Babli.2005.1080p.WEBRip.x264.AAC5.1-[YTS.srt,"00:01:05,885","00:01:09,307",..the land bedecked with the glitter of dreams..,"..the land bedecked with
the glitter of dreams.."
bunty-aur-babli-2005-1080p-webrip-x264-aac5-1-yts,2000s,/home/pratik/projects/GenderBias_TrendAnalysis/dataset/2000s/Bunty.Aur.Babli.2005.1080p.WEBRip.x264.AAC5.1-[YTS.srt,"00:01:09,387","00:01:12,429",..beckoning you..,..beckoning you..
bunty-aur-babli-2005-1080p-webrip-x264-aac5-1-yts,2000s,/home/pratik/projects/GenderBias_TrendAnalysis/dataset/2000s/Bunty.Aur.Babli.2005.1080p.WEBRip.x264.AAC5.1-[YTS.srt,"00:01:12,770","00:01:14,931","if you nurse a hunger, she says, here..","if you nurse a hunger,
she says, here.."
bunty-aur-babli-2005-1080p-webrip-x264-aac5-1-yts,2000s,/home/pratik/projects/GenderBias_TrendAnalysis/dataset/2000s/Bunty.Aur.Babli.2005.1080p.WEBRip.x264.AAC5.1-[YTS.srt,"00:01:15,021","00:01:17,102",you'll find what satisfies it. Come..,"you'll find what
satisfies it. Come.."
bunty-aur-babli-2005-1080p-webrip-x264-aac5-1-yts,2000s,/home/pratik/projects/GenderBias_TrendAnalysis/dataset/2000s/Bunty.Aur.Babli.2005.1080p.WEBRip.x264.AAC5.1-[YTS.srt,"00:01:18,063","00:01:18,973",rub your shoulders. till they're blue..,"rub your shoulders.
till they're blue.."
bunty-aur-babli-2005-1080p-webrip-x264-aac5-1-yts,2000s,/home/pratik/projects/GenderBias_TrendAnalysis/dataset/2000s/Bunty.Aur.Babli.2005.1080p.WEBRip.x264.AAC5.1-[YTS.srt,"00:01:19,023","00:01:20,564","with fame, wealth, power, glory..","with fame, wealth, power, glory.."
bunty-aur-babli-2005-1080p-webrip-x264-aac5-1-yts,2000s,/home/pratik/projects/GenderBias_TrendAnalysis/dataset/2000s/Bunty.Aur.Babli.2005.1080p.WEBRip.x264.AAC5.1-[YTS.srt,"00:01:20,644","00:01:22,435",..and your life becomes..,..and your life becomes..
bunty-aur-babli-2005-1080p-webrip-x264-aac5-1-yts,2000s,/home/pratik/projects/GenderBias_TrendAnalysis/dataset/2000s/Bunty.Aur.Babli.2005.1080p.WEBRip.x264.AAC5.1-[YTS.srt,"00:01:22,526","00:01:25,267",..a sunlit dream you never want to wake out of,"..a sunlit dream you
never want to wake out of"
bunty-aur-babli-2005-1080p-webrip-x264-aac5-1-yts,2000s,/home/pratik/projects/GenderBias_TrendAnalysis/dataset/2000s/Bunty.Aur.Babli.2005.1080p.WEBRip.x264.AAC5.1-[YTS.srt,"00:01:25,938","00:01:31,611","Yes, this is India.. a dream..","Yes, this is India.. a dream.."
bunty-aur-babli-2005-1080p-webrip-x264-aac5-1-yts,2000s,/home/pratik/projects/GenderBias_TrendAnalysis/dataset/2000s/Bunty.Aur.Babli.2005.1080p.WEBRip.x264.AAC5.1-[YTS.srt,"00:01:31,731","00:01:34,483",..that Bunty and Babli dreamt every night of their lives,"..that Bunty and Babli
dreamt every night of their lives"
bunty-aur-babli-2005-1080p-webrip-x264-aac5-1-yts,2000s,/home/pratik/projects/GenderBias_TrendAnalysis/dataset/2000s/Bunty.Aur.Babli.2005.1080p.WEBRip.x264.AAC5.1-[YTS.srt,"00:01:35,033","00:01:39,656",And this is the India they live in..,And this is the India they live in..
bunty-aur-babli-2005-1080p-webrip-x264-aac5-1-yts,2000s,/home/pratik/projects/GenderBias_TrendAnalysis/dataset/2000s/Bunty.Aur.Babli.2005.1080p.WEBRip.x264.AAC5.1-[YTS.srt,"00:01:39,736","00:01:41,157",..an India that says..,..an India that says..
bunty-aur-babli-2005-1080p-webrip-x264-aac5-1-yts,2000s,/home/pratik/projects/GenderBias_TrendAnalysis/dataset/2000s/Bunty.Aur.Babli.2005.1080p.WEBRip.x264.AAC5.1-[YTS.srt,"00:01:41,237","00:01:44,619",your dreams should end where your arms do..,"your dreams should end
where your arms do.."
bunty-aur-babli-2005-1080p-webrip-x264-aac5-1-yts,2000s,/home/pratik/projects/GenderBias_TrendAnalysis/dataset/2000s/Bunty.Aur.Babli.2005.1080p.WEBRip.x264.AAC5.1-[YTS.srt,"00:01:45,159","00:01:48,411",and you should feel only as much hunger as you can satisfy..,"and you should feel only as
much hunger as you can satisfy.."
bunty-aur-babli-2005-1080p-webrip-x264-aac5-1-yts,2000s,/home/pratik/projects/GenderBias_TrendAnalysis/dataset/2000s/Bunty.Aur.Babli.2005.1080p.WEBRip.x264.AAC5.1-[YTS.srt,"00:01:48,542","00:01:49,622",step forward..,step forward..
bunty-aur-babli-2005-1080p-webrip-x264-aac5-1-yts,2000s,/home/pratik/projects/GenderBias_TrendAnalysis/dataset/2000s/Bunty.Aur.Babli.2005.1080p.WEBRip.x264.AAC5.1-[YTS.srt,"00:01:49,742","00:01:52,334",but only when. you're in step with the others..,"but only when. you're in
step with the others.."
bunty-aur-babli-2005-1080p-webrip-x264-aac5-1-yts,2000s,/home/pratik/projects/GenderBias_TrendAnalysis/dataset/2000s/Bunty.Aur.Babli.2005.1080p.WEBRip.x264.AAC5.1-[YTS.srt,"00:01:52,454","00:01:56,246",float to the top but not at the cost of anyone else,"float to the top but not
at the cost of anyone else"
bunty-aur-babli-2005-1080p-webrip-x264-aac5-1-yts,2000s,/home/pratik/projects/GenderBias_TrendAnalysis/dataset/2000s/Bunty.Aur.Babli.2005.1080p.WEBRip.x264.AAC5.1-[YTS.srt,"00:01:56,336","00:01:58,958","love, compassion, honesty, respect..","love, compassion, honesty, respect.."
bunty-aur-babli-2005-1080p-webrip-x264-aac5-1-yts,2000s,/home/pratik/projects/GenderBias_TrendAnalysis/dataset/2000s/Bunty.Aur.Babli.2005.1080p.WEBRip.x264.AAC5.1-[YTS.srt,"00:01:59,048","00:02:00,839",..are what matter most..,..are what matter most..
bunty-aur-babli-2005-1080p-webrip-x264-aac5-1-yts,2000s,/home/pratik/projects/GenderBias_TrendAnalysis/dataset/2000s/Bunty.Aur.Babli.2005.1080p.WEBRip.x264.AAC5.1-[YTS.srt,"00:02:01,379","00:02:04,922",this too is India..,this too is India..
bunty-aur-babli-2005-1080p-webrip-x264-aac5-1-yts,2000s,/home/pratik/projects/GenderBias_TrendAnalysis/dataset/2000s/Bunty.Aur.Babli.2005.1080p.WEBRip.x264.AAC5.1-[YTS.srt,"00:02:06,002","00:02:10,345",the India Bunty and Babli grew up in,the India Bunty and Babli grew up in
bunty-aur-babli-2005-1080p-webrip-x264-aac5-1-yts,2000s,/home/pratik/projects/GenderBias_TrendAnalysis/dataset/2000s/Bunty.Aur.Babli.2005.1080p.WEBRip.x264.AAC5.1-[YTS.srt,"00:02:10,755","00:02:13,217",but didn't feel like they belonged to,"but didn't feel
like they belonged to"
bunty-aur-babli-2005-1080p-webrip-x264-aac5-1-yts,2000s,/home/pratik/projects/GenderBias_TrendAnalysis/dataset/2000s/Bunty.Aur.Babli.2005.1080p.WEBRip.x264.AAC5.1-[YTS.srt,"00:02:14,257","00:02:18,140",This world we live in has two kinds of people,"This world we live in
has two kinds of people"
bunty-aur-babli-2005-1080p-webrip-x264-aac5-1-yts,2000s,/home/pratik/projects/GenderBias_TrendAnalysis/dataset/2000s/Bunty.Aur.Babli.2005.1080p.WEBRip.x264.AAC5.1-[YTS.srt,"00:02:19,511","00:02:22,352","One, the kind that does just one thing all their lives and..","One, the kind that does just
one thing all their lives and.."
bunty-aur-babli-2005-1080p-webrip-x264-aac5-1-yts,2000s,/home/pratik/projects/GenderBias_TrendAnalysis/dataset/2000s/Bunty.Aur.Babli.2005.1080p.WEBRip.x264.AAC5.1-[YTS.srt,"00:02:22,432","00:02:23,303",the kind that does..,the kind that does..
bunty-aur-babli-2005-1080p-webrip-x264-aac5-1-yts,2000s,/home/pratik/projects/GenderBias_TrendAnalysis/dataset/2000s/Bunty.Aur.Babli.2005.1080p.WEBRip.x264.AAC5.1-[YTS.srt,"00:02:23,393","00:02:25,854",..just about everything in one life,..just about everything in one life
bunty-aur-babli-2005-1080p-webrip-x264-aac5-1-yts,2000s,/home/pratik/projects/GenderBias_TrendAnalysis/dataset/2000s/Bunty.Aur.Babli.2005.1080p.WEBRip.x264.AAC5.1-[YTS.srt,"00:02:26,395","00:02:30,227","I didn't say that, they did and they didn't just say it, they lived it","I didn't say that, they did and they
didn't just say it, they lived it"
bunty-aur-babli-2005-1080p-webrip-x264-aac5-1-yts,2000s,/home/pratik/projects/GenderBias_TrendAnalysis/dataset/2000s/Bunty.Aur.Babli.2005.1080p.WEBRip.x264.AAC5.1-[YTS.srt,"00:02:31,018","00:02:32,358",And how! No one ever lived life..,And how! No one ever lived life..
bunty-aur-babli-2005-1080p-webrip-x264-aac5-1-yts,2000s,/home/pratik/projects/GenderBias_TrendAnalysis/dataset/2000s/Bunty.Aur.Babli.2005.1080p.WEBRip.x264.AAC5.1-[YTS.srt,"00:02:32,439","00:02:34,019",..like they lived theirs and perhaps..,"..like they lived
theirs and perhaps.."
bunty-aur-babli-2005-1080p-webrip-x264-aac5-1-yts,2000s,/home/pratik/projects/GenderBias_TrendAnalysis/dataset/2000s/Bunty.Aur.Babli.2005.1080p.WEBRip.x264.AAC5.1-[YTS.srt,"00:02:34,110","00:02:35,771",..no one ever will,..no one ever will
bunty-aur-babli-2005-1080p-webrip-x264-aac5-1-yts,2000s,/home/pratik/projects/GenderBias_TrendAnalysis/dataset/2000s/Bunty.Aur.Babli.2005.1080p.WEBRip.x264.AAC5.1-[YTS.srt,"00:02:37,482","00:02:40,403","So much excitement.. so much adventure, so many joys..","So much excitement.. so
much adventure, so many joys.."
bunty-aur-babli-2005-1080p-webrip-x264-aac5-1-yts,2000s,/home/pratik/projects/GenderBias_TrendAnalysis/dataset/2000s/Bunty.Aur.Babli.2005.1080p.WEBRip.x264.AAC5.1-[YTS.srt,"00:02:40,483","00:02:42,735",..all in one single lifetime..,..all in one single lifetime..
bunty-aur-babli-2005-1080p-webrip-x264-aac5-1-yts,2000s,/home/pratik/projects/GenderBias_TrendAnalysis/dataset/2000s/Bunty.Aur.Babli.2005.1080p.WEBRip.x264.AAC5.1-[YTS.srt,"00:02:42,825","00:02:47,568","no one could have imagined it possible, not even them.","no one could have imagined
it possible, not even them."
bunty-aur-babli-2005-1080p-webrip-x264-aac5-1-yts,2000s,/home/pratik/projects/GenderBias_TrendAnalysis/dataset/2000s/Bunty.Aur.Babli.2005.1080p.WEBRip.x264.AAC5.1-[YTS.srt,"00:02:48,448","00:02:51,660",Or then again maybe they could have,Or then again maybe they could have
bunty-aur-babli-2005-1080p-webrip-x264-aac5-1-yts,2000s,/home/pratik/projects/GenderBias_TrendAnalysis/dataset/2000s/Bunty.Aur.Babli.2005.1080p.WEBRip.x264.AAC5.1-[YTS.srt,"00:03:07,880","00:03:11,923",Small town cocoons These dull afternoons..,"Small town cocoons
These dull afternoons.."
bunty-aur-babli-2005-1080p-webrip-x264-aac5-1-yts,2000s,/home/pratik/projects/GenderBias_TrendAnalysis/dataset/2000s/Bunty.Aur.Babli.2005.1080p.WEBRip.x264.AAC5.1-[YTS.srt,"00:03:12,003","00:03:16,135",I want to pack them up and go away.. away..,"I want to pack them up
and go away.. away.."
bunty-aur-babli-2005-1080p-webrip-x264-aac5-1-yts,2000s,/home/pratik/projects/GenderBias_TrendAnalysis/dataset/2000s/Bunty.Aur.Babli.2005.1080p.WEBRip.x264.AAC5.1-[YTS.srt,"00:03:18,427","00:03:22,549",The rains come slow The river lies low..,"The rains come slow
The river lies low.."
bunty-aur-babli-2005-1080p-webrip-x264-aac5-1-yts,2000s,/home/pratik/projects/GenderBias_TrendAnalysis/dataset/2000s/Bunty.Aur.Babli.2005.1080p.WEBRip.x264.AAC5.1-[YTS.srt,"00:03:22,639","00:03:26,592",The sea will carry me away,The sea will carry me away
bunty-aur-babli-2005-1080p-webrip-x264-aac5-1-yts,2000s,/home/pratik/projects/GenderBias_TrendAnalysis/dataset/2000s/Bunty.Aur.Babli.2005.1080p.WEBRip.x264.AAC5.1-[YTS.srt,"00:03:26,852","00:03:30,975",Small town cocoons These dull afternoons..,"Small town cocoons
These dull afternoons.."
bunty-aur-babli-2005-1080p-webrip-x264-aac5-1-yts,2000s,/home/pratik/projects/GenderBias_TrendAnalysis/dataset/2000s/Bunty.Aur.Babli.2005.1080p.WEBRip.x264.AAC5.1-[YTS.srt,"00:03:31,055","00:03:35,267",I want to pack them up and go away.. away..,"I want to pack them up
and go away.. away.."
bunty-aur-babli-2005-1080p-webrip-x264-aac5-1-yts,2000s,/home/pratik/projects/GenderBias_TrendAnalysis/dataset/2000s/Bunty.Aur.Babli.2005.1080p.WEBRip.x264.AAC5.1-[YTS.srt,"00:03:35,357","00:03:39,480",The rains come slow The river lies low..,"The rains come slow
The river lies low.."
bunty-aur-babli-2005-1080p-webrip-x264-aac5-1-yts,2000s,/home/pratik/projects/GenderBias_TrendAnalysis/dataset/2000s/Bunty.Aur.Babli.2005.1080p.WEBRip.x264.AAC5.1-[YTS.srt,"00:03:39,560","00:03:43,192",The sea will carry me away,The sea will carry me away
bunty-aur-babli-2005-1080p-webrip-x264-aac5-1-yts,2000s,/home/pratik/projects/GenderBias_TrendAnalysis/dataset/2000s/Bunty.Aur.Babli.2005.1080p.WEBRip.x264.AAC5.1-[YTS.srt,"00:03:43,442","00:03:52,488","Going away, I'm going away Oh Ram Chand re..","Going away, I'm going
away Oh Ram Chand re.."
bunty-aur-babli-2005-1080p-webrip-x264-aac5-1-yts,2000s,/home/pratik/projects/GenderBias_TrendAnalysis/dataset/2000s/Bunty.Aur.Babli.2005.1080p.WEBRip.x264.AAC5.1-[YTS.srt,"00:03:52,568","00:03:56,490",Dhadak'dhadak Dhadak'dhadak Watch the smoke billow,"Dhadak'dhadak
Dhadak'dhadak Watch the smoke billow"
bunty-aur-babli-2005-1080p-webrip-x264-aac5-1-yts,2000s,/home/pratik/projects/GenderBias_TrendAnalysis/dataset/2000s/Bunty.Aur.Babli.2005.1080p.WEBRip.x264.AAC5.1-[YTS.srt,"00:03:56,620","00:04:00,743",Dhadak'dhadak Dhadak'dhadak Hear the whistle blow,"Dhadak'dhadak
Dhadak'dhadak Hear the whistle blow"
bunty-aur-babli-2005-1080p-webrip-x264-aac5-1-yts,2000s,/home/pratik/projects/GenderBias_TrendAnalysis/dataset/2000s/Bunty.Aur.Babli.2005.1080p.WEBRip.x264.AAC5.1-[YTS.srt,"00:04:00,823","00:04:05,166",Dhadak'dhadak Dhadak'dhadak Watch the smoke billow,"Dhadak'dhadak
Dhadak'dhadak Watch the smoke billow"
bunty-aur-babli-2005-1080p-webrip-x264-aac5-1-yts,2000s,/home/pratik/projects/GenderBias_TrendAnalysis/dataset/2000s/Bunty.Aur.Babli.2005.1080p.WEBRip.x264.AAC5.1-[YTS.srt,"00:04:05,246","00:04:09,958","Dhadak'dhadak Dhadak'dhadak Call me, oh, watch me go..","Dhadak'dhadak Dhadak'dhadak
Call me, oh, watch me go.."
bunty-aur-babli-2005-1080p-webrip-x264-aac5-1-yts,2000s,/home/pratik/projects/GenderBias_TrendAnalysis/dataset/2000s/Bunty.Aur.Babli.2005.1080p.WEBRip.x264.AAC5.1-[YTS.srt,"00:04:35,094","00:04:43,229","Stand aside, make way for me Those clouds are mine to hold","Stand aside, make way for me
Those clouds are mine to hold"
bunty-aur-babli-2005-1080p-webrip-x264-aac5-1-yts,2000s,/home/pratik/projects/GenderBias_TrendAnalysis/dataset/2000s/Bunty.Aur.Babli.2005.1080p.WEBRip.x264.AAC5.1-[YTS.srt,"00:04:43,519","00:04:50,944","Burnt in black on a white sheet sky I'll write my name, big and bold","Burnt in black on a white sheet sky
I'll write my name, big and bold"
bunty-aur-babli-2005-1080p-webrip-x264-aac5-1-yts,2000s,/home/pratik/projects/GenderBias_TrendAnalysis/dataset/2000s/Bunty.Aur.Babli.2005.1080p.WEBRip.x264.AAC5.1-[YTS.srt,"00:04:51,024","00:04:54,986",On the street that curves around the moon..,"On the street that
curves around the moon.."
bunty-aur-babli-2005-1080p-webrip-x264-aac5-1-yts,2000s,/home/pratik/projects/GenderBias_TrendAnalysis/dataset/2000s/Bunty.Aur.Babli.2005.1080p.WEBRip.x264.AAC5.1-[YTS.srt,"00:04:55,106","00:04:59,319",At the bend is where I'll stay,At the bend is where I'll stay
bunty-aur-babli-2005-1080p-webrip-x264-aac5-1-yts,2000s,/home/pratik/projects/GenderBias_TrendAnalysis/dataset/2000s/Bunty.Aur.Babli.2005.1080p.WEBRip.x264.AAC5.1-[YTS.srt,"00:04:59,409","00:05:08,154","On the street that curves around the moon I'll stay far, far away","On the street that curves around
the moon I'll stay far, far away"
bunty-aur-babli-2005-1080p-webrip-x264-aac5-1-yts,2000s,/home/pratik/projects/GenderBias_TrendAnalysis/dataset/2000s/Bunty.Aur.Babli.2005.1080p.WEBRip.x264.AAC5.1-[YTS.srt,"00:05:08,284","00:05:16,579","Going away, I'm going away Oh Ram Chand re..","Going away, I'm going
away Oh Ram Chand re.."
bunty-aur-babli-2005-1080p-webrip-x264-aac5-1-yts,2000s,/home/pratik/projects/GenderBias_TrendAnalysis/dataset/2000s/Bunty.Aur.Babli.2005.1080p.WEBRip.x264.AAC5.1-[YTS.srt,"00:05:16,669","00:05:20,962",Dhadak'dhadak Dhadak'dhadak Watch the smoke billow,"Dhadak'dhadak Dhadak'dhadak
Watch the smoke billow"
bunty-aur-babli-2005-1080p-webrip-x264-aac5-1-yts,2000s,/home/pratik/projects/GenderBias_TrendAnalysis/dataset/2000s/Bunty.Aur.Babli.2005.1080p.WEBRip.x264.AAC5.1-[YTS.srt,"00:05:21,042","00:05:25,085",Dhadak'dhadak Dhadak'dhadak Hear the whistle blow,"Dhadak'dhadak Dhadak'dhadak
Hear the whistle blow"
bunty-aur-babli-2005-1080p-webrip-x264-aac5-1-yts,2000s,/home/pratik/projects/GenderBias_TrendAnalysis/dataset/2000s/Bunty.Aur.Babli.2005.1080p.WEBRip.x264.AAC5.1-[YTS.srt,"00:05:25,175","00:05:29,467",Dhadak'dhadak Dhadak'dhadak Watch the smoke billow,"Dhadak'dhadak Dhadak'dhadak
Watch the smoke billow"
bunty-aur-babli-2005-1080p-webrip-x264-aac5-1-yts,2000s,/home/pratik/projects/GenderBias_TrendAnalysis/dataset/2000s/Bunty.Aur.Babli.2005.1080p.WEBRip.x264.AAC5.1-[YTS.srt,"00:05:29,547","00:05:33,920","Dhadak'dhadak Dhadak'dhadak Call me, oh, watch me go..","Dhadak'dhadak Dhadak'dhadak
Call me, oh, watch me go.."
bunty-aur-babli-2005-1080p-webrip-x264-aac5-1-yts,2000s,/home/pratik/projects/GenderBias_TrendAnalysis/dataset/2000s/Bunty.Aur.Babli.2005.1080p.WEBRip.x264.AAC5.1-[YTS.srt,"00:06:02,648","00:06:06,860",Small town cocoons These dull afternoons,"Small town cocoons
These dull afternoons"
bunty-aur-babli-2005-1080p-webrip-x264-aac5-1-yts,2000s,/home/pratik/projects/GenderBias_TrendAnalysis/dataset/2000s/Bunty.Aur.Babli.2005.1080p.WEBRip.x264.AAC5.1-[YTS.srt,"00:06:06,950","00:06:11,073",I want to pack them up and go away.. away..,"I want to pack them up
and go away.. away.."
bunty-aur-babli-2005-1080p-webrip-x264-aac5-1-yts,2000s,/home/pratik/projects/GenderBias_TrendAnalysis/dataset/2000s/Bunty.Aur.Babli.2005.1080p.WEBRip.x264.AAC5.1-[YTS.srt,"00:06:11,153","00:06:15,326",Small town cocoons These dull afternoons..,"Small town cocoons
These dull afternoons.."
bunty-aur-babli-2005-1080p-webrip-x264-aac5-1-yts,2000s,/home/pratik/projects/GenderBias_TrendAnalysis/dataset/2000s/Bunty.Aur.Babli.2005.1080p.WEBRip.x264.AAC5.1-[YTS.srt,"00:06:15,406","00:06:19,448",I want to pack them up and go away.. away..,"I want to pack them up
and go away.. away.."
bunty-aur-babli-2005-1080p-webrip-x264-aac5-1-yts,2000s,/home/pratik/projects/GenderBias_TrendAnalysis/dataset/2000s/Bunty.Aur.Babli.2005.1080p.WEBRip.x264.AAC5.1-[YTS.srt,"00:06:19,578","00:06:23,701",The rains come slow The river lies low..,"The rains come slow
The river lies low.."
bunty-aur-babli-2005-1080p-webrip-x264-aac5-1-yts,2000s,/home/pratik/projects/GenderBias_TrendAnalysis/dataset/2000s/Bunty.Aur.Babli.2005.1080p.WEBRip.x264.AAC5.1-[YTS.srt,"00:06:23,791","00:06:27,253",The sea will carry me away,The sea will carry me away
bunty-aur-babli-2005-1080p-webrip-x264-aac5-1-yts,2000s,/home/pratik/projects/GenderBias_TrendAnalysis/dataset/2000s/Bunty.Aur.Babli.2005.1080p.WEBRip.x264.AAC5.1-[YTS.srt,"00:06:27,713","00:06:36,959","Going away, I'm going away Oh Ram Chand re..","Going away, I'm going
away Oh Ram Chand re.."
bunty-aur-babli-2005-1080p-webrip-x264-aac5-1-yts,2000s,/home/pratik/projects/GenderBias_TrendAnalysis/dataset/2000s/Bunty.Aur.Babli.2005.1080p.WEBRip.x264.AAC5.1-[YTS.srt,"00:06:37,049","00:06:40,961",Dhadak'dhadak Dhadak'dhadak Watch the smoke billow,"Dhadak'dhadak Dhadak'dhadak
Watch the smoke billow"
bunty-aur-babli-2005-1080p-webrip-x264-aac5-1-yts,2000s,/home/pratik/projects/GenderBias_TrendAnalysis/dataset/2000s/Bunty.Aur.Babli.2005.1080p.WEBRip.x264.AAC5.1-[YTS.srt,"00:06:41,091","00:06:45,264",Dhadak'dhadak Dhadak'dhadak Hear the whistle blow,"Dhadak'dhadak Dhadak'dhadak
Hear the whistle blow"
bunty-aur-babli-2005-1080p-webrip-x264-aac5-1-yts,2000s,/home/pratik/projects/GenderBias_TrendAnalysis/dataset/2000s/Bunty.Aur.Babli.2005.1080p.WEBRip.x264.AAC5.1-[YTS.srt,"00:06:45,304","00:06:49,387",Dhadak'dhadak Dhadak'dhadak Watch the smoke billow,"Dhadak'dhadak Dhadak'dhadak
Watch the smoke billow"
bunty-aur-babli-2005-1080p-webrip-x264-aac5-1-yts,2000s,/home/pratik/projects/GenderBias_TrendAnalysis/dataset/2000s/Bunty.Aur.Babli.2005.1080p.WEBRip.x264.AAC5.1-[YTS.srt,"00:06:49,517","00:06:54,219","Dhadak'dhadak Dhadak'dhadak Call me, oh, watch me go..","Dhadak'dhadak Dhadak'dhadak
Call me, oh, watch me go.."
bunty-aur-babli-2005-1080p-webrip-x264-aac5-1-yts,2000s,/home/pratik/projects/GenderBias_TrendAnalysis/dataset/2000s/Bunty.Aur.Babli.2005.1080p.WEBRip.x264.AAC5.1-[YTS.srt,"00:07:10,940","00:07:15,032",When I ride l carry in my hair..,When I ride l carry in my hair..
bunty-aur-babli-2005-1080p-webrip-x264-aac5-1-yts,2000s,/home/pratik/projects/GenderBias_TrendAnalysis/dataset/2000s/Bunty.Aur.Babli.2005.1080p.WEBRip.x264.AAC5.1-[YTS.srt,"00:07:15,112","00:07:18,905",The cool whispers of the wind,The cool whispers of the wind
bunty-aur-babli-2005-1080p-webrip-x264-aac5-1-yts,2000s,/home/pratik/projects/GenderBias_TrendAnalysis/dataset/2000s/Bunty.Aur.Babli.2005.1080p.WEBRip.x264.AAC5.1-[YTS.srt,"00:07:19,245","00:07:26,789","Ride across the earth, the sky Leave the world behind, unhinged","Ride across the earth, the sky
Leave the world behind, unhinged"
bunty-aur-babli-2005-1080p-webrip-x264-aac5-1-yts,2000s,/home/pratik/projects/GenderBias_TrendAnalysis/dataset/2000s/Bunty.Aur.Babli.2005.1080p.WEBRip.x264.AAC5.1-[YTS.srt,"00:07:26,870","00:07:30,832","My forehead adorned, my jewel,","My forehead adorned, my jewel,"
bunty-aur-babli-2005-1080p-webrip-x264-aac5-1-yts,2000s,/home/pratik/projects/GenderBias_TrendAnalysis/dataset/2000s/Bunty.Aur.Babli.2005.1080p.WEBRip.x264.AAC5.1-[YTS.srt,"00:07:30,912","00:07:35,165",the moon I can't walk unnoticed amidst the stars,"the moon I can't walk
unnoticed amidst the stars"
bunty-aur-babli-2005-1080p-webrip-x264-aac5-1-yts,2000s,/home/pratik/projects/GenderBias_TrendAnalysis/dataset/2000s/Bunty.Aur.Babli.2005.1080p.WEBRip.x264.AAC5.1-[YTS.srt,"00:07:35,255","00:07:43,840",moon I can't live unnoticed up here with stars,"moon I can't live
unnoticed up here with stars"
bunty-aur-babli-2005-1080p-webrip-x264-aac5-1-yts,2000s,/home/pratik/projects/GenderBias_TrendAnalysis/dataset/2000s/Bunty.Aur.Babli.2005.1080p.WEBRip.x264.AAC5.1-[YTS.srt,"00:07:43,920","00:07:52,805","Going away, I'm going away Oh Ram Chand re..","Going away, I'm going
away Oh Ram Chand re.."
bunty-aur-babli-2005-1080p-webrip-x264-aac5-1-yts,2000s,/home/pratik/projects/GenderBias_TrendAnalysis/dataset/2000s/Bunty.Aur.Babli.2005.1080p.WEBRip.x264.AAC5.1-[YTS.srt,"00:07:52,886","00:08:01,011",Dhadak'dhadak Dhadak'dhadak Watch the smoke billow,"Dhadak'dhadak Dhadak'dhadak
Watch the smoke billow"
bunty-aur-babli-2005-1080p-webrip-x264-aac5-1-yts,2000s,/home/pratik/projects/GenderBias_TrendAnalysis/dataset/2000s/Bunty.Aur.Babli.2005.1080p.WEBRip.x264.AAC5.1-[YTS.srt,"00:08:01,101","00:08:05,313",Dhadak'dhadak Dhadak'dhadak Hear the whistle blow,"Dhadak'dhadak Dhadak'dhadak
Hear the whistle blow"
bunty-aur-babli-2005-1080p-webrip-x264-aac5-1-yts,2000s,/home/pratik/projects/GenderBias_TrendAnalysis/dataset/2000s/Bunty.Aur.Babli.2005.1080p.WEBRip.x264.AAC5.1-[YTS.srt,"00:08:05,353","00:08:10,066","Dhadak'dhadak Dhadak'dhadak Call me, oh, watch me go..","Dhadak'dhadak Dhadak'dhadak
Call me, oh, watch me go.."
bunty-aur-babli-2005-1080p-webrip-x264-aac5-1-yts,2000s,/home/pratik/projects/GenderBias_TrendAnalysis/dataset/2000s/Bunty.Aur.Babli.2005.1080p.WEBRip.x264.AAC5.1-[YTS.srt,"00:08:21,733","00:08:29,368",Dhadak'dhadak Dhadak'dhadak,Dhadak'dhadak Dhadak'dhadak
bunty-aur-babli-2005-1080p-webrip-x264-aac5-1-yts,2000s,/home/pratik/projects/GenderBias_TrendAnalysis/dataset/2000s/Bunty.Aur.Babli.2005.1080p.WEBRip.x264.AAC5.1-[YTS.srt,"00:08:30,699","00:09:05,550","Call me, oh, watch me go..","Call me, oh, watch me go.."
bunty-aur-babli-2005-1080p-webrip-x264-aac5-1-yts,2000s,/home/pratik/projects/GenderBias_TrendAnalysis/dataset/2000s/Bunty.Aur.Babli.2005.1080p.WEBRip.x264.AAC5.1-[YTS.srt,"00:09:08,932","00:09:10,853",It's not going to come. - It will,"It's not going to come.
- It will"
bunty-aur-babli-2005-1080p-webrip-x264-aac5-1-yts,2000s,/home/pratik/projects/GenderBias_TrendAnalysis/dataset/2000s/Bunty.Aur.Babli.2005.1080p.WEBRip.x264.AAC5.1-[YTS.srt,"00:09:11,224","00:09:13,355",It won't. - It will,"It won't.
- It will"
bunty-aur-babli-2005-1080p-webrip-x264-aac5-1-yts,2000s,/home/pratik/projects/GenderBias_TrendAnalysis/dataset/2000s/Bunty.Aur.Babli.2005.1080p.WEBRip.x264.AAC5.1-[YTS.srt,"00:09:14,266","00:09:16,897","Boy, go down to the tap and have your bath","Boy, go down to the
tap and have your bath"
bunty-aur-babli-2005-1080p-webrip-x264-aac5-1-yts,2000s,/home/pratik/projects/GenderBias_TrendAnalysis/dataset/2000s/Bunty.Aur.Babli.2005.1080p.WEBRip.x264.AAC5.1-[YTS.srt,"00:09:17,017","00:09:18,358",Or you'll be standing at the end of a very long line,"Or you'll be standing at
the end of a very long line"
bunty-aur-babli-2005-1080p-webrip-x264-aac5-1-yts,2000s,/home/pratik/projects/GenderBias_TrendAnalysis/dataset/2000s/Bunty.Aur.Babli.2005.1080p.WEBRip.x264.AAC5.1-[YTS.srt,"00:09:19,519","00:09:23,191",No dearth of people wanting to get into a line,"No dearth of people
wanting to get into a line"
bunty-aur-babli-2005-1080p-webrip-x264-aac5-1-yts,2000s,/home/pratik/projects/GenderBias_TrendAnalysis/dataset/2000s/Bunty.Aur.Babli.2005.1080p.WEBRip.x264.AAC5.1-[YTS.srt,"00:09:23,321","00:09:25,442",What do you mean? - What I mean Ma is..,"What do you mean?
- What I mean Ma is.."
bunty-aur-babli-2005-1080p-webrip-x264-aac5-1-yts,2000s,/home/pratik/projects/GenderBias_TrendAnalysis/dataset/2000s/Bunty.Aur.Babli.2005.1080p.WEBRip.x264.AAC5.1-[YTS.srt,"00:09:26,193","00:09:31,316","this world has two kinds of people, one, those who line up before taps..","this world has two kinds of people,
one, those who line up before taps.."
