film_id,decade,file_path,start,end,text_clean,text_raw
bunty-aur-babli-2005-1080p-webrip-x264-aac5-1-yts,2000s,/home/pratik/projects/GenderBias_TrendAnalysis/dataset/2000s/Bunty.Aur.Babli.2005.1080p.WEBRip.x264.AAC5.1-[YTS.srt,"01:18:41,498","01:18:45,620",You know what it's worth? Not five paise. lt's a fake,"You know what it's worth?
Not five paise. lt's a fake"
bunty-aur-babli-2005-1080p-webrip-x264-aac5-1-yts,2000s,/home/pratik/projects/GenderBias_TrendAnalysis/dataset/2000s/Bunty.Aur.Babli.2005.1080p.WEBRip.x264.AAC5.1-[YTS.srt,"01:18:58,638","01:19:01,470",Who? - What?,"Who?
- What?"
bunty-aur-babli-2005-1080p-webrip-x264-aac5-1-yts,2000s,/home/pratik/projects/GenderBias_TrendAnalysis/dataset/2000s/Bunty.Aur.Babli.2005.1080p.WEBRip.x264.AAC5.1-[YTS.srt,"01:19:02,841","01:19:07,224",What's your name?,What's your name?
bunty-aur-babli-2005-1080p-webrip-x264-aac5-1-yts,2000s,/home/pratik/projects/GenderBias_TrendAnalysis/dataset/2000s/Bunty.Aur.Babli.2005.1080p.WEBRip.x264.AAC5.1-[YTS.srt,"01:19:08,184","01:19:09,725",Mehmood,Mehmood
bunty-aur-babli-2005-1080p-webrip-x264-aac5-1-yts,2000s,/home/pratik/projects/GenderBias_TrendAnalysis/dataset/2000s/Bunty.Aur.Babli.2005.1080p.WEBRip.x264.AAC5.1-[YTS.srt,"01:19:10,896","01:19:12,187",You're a comedian?,You're a comedian?
bunty-aur-babli-2005-1080p-webrip-x264-aac5-1-yts,2000s,/home/pratik/projects/GenderBias_TrendAnalysis/dataset/2000s/Bunty.Aur.Babli.2005.1080p.WEBRip.x264.AAC5.1-[YTS.srt,"01:19:15,479","01:19:16,850",Let's start by making you laugh?,Let's start by making you laugh?
bunty-aur-babli-2005-1080p-webrip-x264-aac5-1-yts,2000s,/home/pratik/projects/GenderBias_TrendAnalysis/dataset/2000s/Bunty.Aur.Babli.2005.1080p.WEBRip.x264.AAC5.1-[YTS.srt,"01:19:18,651","01:19:20,602","Okay, two jokes for you","Okay, two jokes for you"
bunty-aur-babli-2005-1080p-webrip-x264-aac5-1-yts,2000s,/home/pratik/projects/GenderBias_TrendAnalysis/dataset/2000s/Bunty.Aur.Babli.2005.1080p.WEBRip.x264.AAC5.1-[YTS.srt,"01:19:21,943","01:19:23,103",One,One
bunty-aur-babli-2005-1080p-webrip-x264-aac5-1-yts,2000s,/home/pratik/projects/GenderBias_TrendAnalysis/dataset/2000s/Bunty.Aur.Babli.2005.1080p.WEBRip.x264.AAC5.1-[YTS.srt,"01:19:24,104","01:19:26,566",Mrs and Mr Flea come out after a matinee show,"Mrs and Mr Flea come
out after a matinee show"
bunty-aur-babli-2005-1080p-webrip-x264-aac5-1-yts,2000s,/home/pratik/projects/GenderBias_TrendAnalysis/dataset/2000s/Bunty.Aur.Babli.2005.1080p.WEBRip.x264.AAC5.1-[YTS.srt,"01:19:27,446","01:19:29,447","Mrs Flea says, l'm tired today","Mrs Flea says, l'm tired today"
bunty-aur-babli-2005-1080p-webrip-x264-aac5-1-yts,2000s,/home/pratik/projects/GenderBias_TrendAnalysis/dataset/2000s/Bunty.Aur.Babli.2005.1080p.WEBRip.x264.AAC5.1-[YTS.srt,"01:19:30,358","01:19:32,489","Mr Flea says, honey don't worry, I'll hail us a dog","Mr Flea says, honey don't worry,
I'll hail us a dog"
bunty-aur-babli-2005-1080p-webrip-x264-aac5-1-yts,2000s,/home/pratik/projects/GenderBias_TrendAnalysis/dataset/2000s/Bunty.Aur.Babli.2005.1080p.WEBRip.x264.AAC5.1-[YTS.srt,"01:19:45,787","01:19:50,710",You are that dog.. the one they rode for the hike,"You are that dog.. the
one they rode for the hike"
bunty-aur-babli-2005-1080p-webrip-x264-aac5-1-yts,2000s,/home/pratik/projects/GenderBias_TrendAnalysis/dataset/2000s/Bunty.Aur.Babli.2005.1080p.WEBRip.x264.AAC5.1-[YTS.srt,"01:19:52,171","01:19:54,373","Now spill it, did you go to Center One that night or no?","Now spill it, did you go to
Center One that night or no?"
bunty-aur-babli-2005-1080p-webrip-x264-aac5-1-yts,2000s,/home/pratik/projects/GenderBias_TrendAnalysis/dataset/2000s/Bunty.Aur.Babli.2005.1080p.WEBRip.x264.AAC5.1-[YTS.srt,"01:19:55,924","01:19:57,124",No sir,No sir
bunty-aur-babli-2005-1080p-webrip-x264-aac5-1-yts,2000s,/home/pratik/projects/GenderBias_TrendAnalysis/dataset/2000s/Bunty.Aur.Babli.2005.1080p.WEBRip.x264.AAC5.1-[YTS.srt,"01:20:01,217","01:20:03,168","This here, is my second joke","This here, is my second joke"
bunty-aur-babli-2005-1080p-webrip-x264-aac5-1-yts,2000s,/home/pratik/projects/GenderBias_TrendAnalysis/dataset/2000s/Bunty.Aur.Babli.2005.1080p.WEBRip.x264.AAC5.1-[YTS.srt,"01:20:08,631","01:20:10,052",Where are those two now?,Where are those two now?
bunty-aur-babli-2005-1080p-webrip-x264-aac5-1-yts,2000s,/home/pratik/projects/GenderBias_TrendAnalysis/dataset/2000s/Bunty.Aur.Babli.2005.1080p.WEBRip.x264.AAC5.1-[YTS.srt,"01:20:10,132","01:20:12,974",Long time.. gone,Long time.. gone
bunty-aur-babli-2005-1080p-webrip-x264-aac5-1-yts,2000s,/home/pratik/projects/GenderBias_TrendAnalysis/dataset/2000s/Bunty.Aur.Babli.2005.1080p.WEBRip.x264.AAC5.1-[YTS.srt,"01:20:15,265","01:20:16,476",Names?,Names?
bunty-aur-babli-2005-1080p-webrip-x264-aac5-1-yts,2000s,/home/pratik/projects/GenderBias_TrendAnalysis/dataset/2000s/Bunty.Aur.Babli.2005.1080p.WEBRip.x264.AAC5.1-[YTS.srt,"01:20:16,556","01:20:19,598",Bunty and Babli,Bunty and Babli
bunty-aur-babli-2005-1080p-webrip-x264-aac5-1-yts,2000s,/home/pratik/projects/GenderBias_TrendAnalysis/dataset/2000s/Bunty.Aur.Babli.2005.1080p.WEBRip.x264.AAC5.1-[YTS.srt,"01:20:25,312","01:20:26,562",How old are they?,How old are they?
bunty-aur-babli-2005-1080p-webrip-x264-aac5-1-yts,2000s,/home/pratik/projects/GenderBias_TrendAnalysis/dataset/2000s/Bunty.Aur.Babli.2005.1080p.WEBRip.x264.AAC5.1-[YTS.srt,"01:20:26,642","01:20:29,524",Bunty's around 23-24,Bunty's around 23-24
bunty-aur-babli-2005-1080p-webrip-x264-aac5-1-yts,2000s,/home/pratik/projects/GenderBias_TrendAnalysis/dataset/2000s/Bunty.Aur.Babli.2005.1080p.WEBRip.x264.AAC5.1-[YTS.srt,"01:20:31,395","01:20:32,986",Babli is 20-21,Babli is 20-21
bunty-aur-babli-2005-1080p-webrip-x264-aac5-1-yts,2000s,/home/pratik/projects/GenderBias_TrendAnalysis/dataset/2000s/Bunty.Aur.Babli.2005.1080p.WEBRip.x264.AAC5.1-[YTS.srt,"01:20:33,277","01:20:39,070","She was really sweet, well mannered and intelligent, sir","She was really sweet, well
mannered and intelligent, sir"
bunty-aur-babli-2005-1080p-webrip-x264-aac5-1-yts,2000s,/home/pratik/projects/GenderBias_TrendAnalysis/dataset/2000s/Bunty.Aur.Babli.2005.1080p.WEBRip.x264.AAC5.1-[YTS.srt,"01:20:39,150","01:20:42,992","Even the boy was all heart, great guy","Even the boy was
all heart, great guy"
bunty-aur-babli-2005-1080p-webrip-x264-aac5-1-yts,2000s,/home/pratik/projects/GenderBias_TrendAnalysis/dataset/2000s/Bunty.Aur.Babli.2005.1080p.WEBRip.x264.AAC5.1-[YTS.srt,"01:20:43,573","01:20:44,744","That's quite something, sir","That's quite something, sir"
bunty-aur-babli-2005-1080p-webrip-x264-aac5-1-yts,2000s,/home/pratik/projects/GenderBias_TrendAnalysis/dataset/2000s/Bunty.Aur.Babli.2005.1080p.WEBRip.x264.AAC5.1-[YTS.srt,"01:20:44,824","01:20:46,995","No, you asses are quite something","No, you asses are quite something"
bunty-aur-babli-2005-1080p-webrip-x264-aac5-1-yts,2000s,/home/pratik/projects/GenderBias_TrendAnalysis/dataset/2000s/Bunty.Aur.Babli.2005.1080p.WEBRip.x264.AAC5.1-[YTS.srt,"01:20:48,496","01:20:50,947",To think that petty criminals..,To think that petty criminals..
bunty-aur-babli-2005-1080p-webrip-x264-aac5-1-yts,2000s,/home/pratik/projects/GenderBias_TrendAnalysis/dataset/2000s/Bunty.Aur.Babli.2005.1080p.WEBRip.x264.AAC5.1-[YTS.srt,"01:20:51,037","01:20:54,950","booked for cheating, misdemeanour, malfeasance, fraud and perjury..","booked for cheating, misdemeanour,
malfeasance, fraud and perjury.."
bunty-aur-babli-2005-1080p-webrip-x264-aac5-1-yts,2000s,/home/pratik/projects/GenderBias_TrendAnalysis/dataset/2000s/Bunty.Aur.Babli.2005.1080p.WEBRip.x264.AAC5.1-[YTS.srt,"01:20:55,750","01:20:59,373",are quite something,are quite something
bunty-aur-babli-2005-1080p-webrip-x264-aac5-1-yts,2000s,/home/pratik/projects/GenderBias_TrendAnalysis/dataset/2000s/Bunty.Aur.Babli.2005.1080p.WEBRip.x264.AAC5.1-[YTS.srt,"01:21:00,373","01:21:02,545","And not just you, the whole lot of you from..","And not just you, the
whole lot of you from.."
bunty-aur-babli-2005-1080p-webrip-x264-aac5-1-yts,2000s,/home/pratik/projects/GenderBias_TrendAnalysis/dataset/2000s/Bunty.Aur.Babli.2005.1080p.WEBRip.x264.AAC5.1-[YTS.srt,"01:21:02,625","01:21:04,045",..this generation is quite something,..this generation is quite something
bunty-aur-babli-2005-1080p-webrip-x264-aac5-1-yts,2000s,/home/pratik/projects/GenderBias_TrendAnalysis/dataset/2000s/Bunty.Aur.Babli.2005.1080p.WEBRip.x264.AAC5.1-[YTS.srt,"01:21:05,756","01:21:09,379","Right and wrong, good esteem and bad, good deeds and bad..","Right and wrong, good esteem
and bad, good deeds and bad.."
bunty-aur-babli-2005-1080p-webrip-x264-aac5-1-yts,2000s,/home/pratik/projects/GenderBias_TrendAnalysis/dataset/2000s/Bunty.Aur.Babli.2005.1080p.WEBRip.x264.AAC5.1-[YTS.srt,"01:21:09,759","01:21:12,341",you've forgotten what sets them apart,"you've forgotten
what sets them apart"
bunty-aur-babli-2005-1080p-webrip-x264-aac5-1-yts,2000s,/home/pratik/projects/GenderBias_TrendAnalysis/dataset/2000s/Bunty.Aur.Babli.2005.1080p.WEBRip.x264.AAC5.1-[YTS.srt,"01:21:18,344","01:21:19,965",But I can tell the difference.,But I can tell the difference.
bunty-aur-babli-2005-1080p-webrip-x264-aac5-1-yts,2000s,/home/pratik/projects/GenderBias_TrendAnalysis/dataset/2000s/Bunty.Aur.Babli.2005.1080p.WEBRip.x264.AAC5.1-[YTS.srt,"01:21:21,676","01:21:23,888",And l'm going to teach you fools too,And l'm going to teach you fools too
bunty-aur-babli-2005-1080p-webrip-x264-aac5-1-yts,2000s,/home/pratik/projects/GenderBias_TrendAnalysis/dataset/2000s/Bunty.Aur.Babli.2005.1080p.WEBRip.x264.AAC5.1-[YTS.srt,"01:21:25,349","01:21:29,221",The newspapers say that for boys and girls in schools and colleges..,"The newspapers say that for boys
and girls in schools and colleges.."
bunty-aur-babli-2005-1080p-webrip-x264-aac5-1-yts,2000s,/home/pratik/projects/GenderBias_TrendAnalysis/dataset/2000s/Bunty.Aur.Babli.2005.1080p.WEBRip.x264.AAC5.1-[YTS.srt,"01:21:29,311","01:21:34,524",these two crooks are role models. - So they want to be role models?,"these two crooks are role models.
- So they want to be role models?"
bunty-aur-babli-2005-1080p-webrip-x264-aac5-1-yts,2000s,/home/pratik/projects/GenderBias_TrendAnalysis/dataset/2000s/Bunty.Aur.Babli.2005.1080p.WEBRip.x264.AAC5.1-[YTS.srt,"01:21:36,776","01:21:37,976",Fine..,Fine..
bunty-aur-babli-2005-1080p-webrip-x264-aac5-1-yts,2000s,/home/pratik/projects/GenderBias_TrendAnalysis/dataset/2000s/Bunty.Aur.Babli.2005.1080p.WEBRip.x264.AAC5.1-[YTS.srt,"01:21:39,988","01:21:42,189",then that's what they'll become..,then that's what they'll become..
bunty-aur-babli-2005-1080p-webrip-x264-aac5-1-yts,2000s,/home/pratik/projects/GenderBias_TrendAnalysis/dataset/2000s/Bunty.Aur.Babli.2005.1080p.WEBRip.x264.AAC5.1-[YTS.srt,"01:21:44,360","01:21:51,655",I'll make them a fine example of a cure for this generation,"I'll make them a fine example
of a cure for this generation"
bunty-aur-babli-2005-1080p-webrip-x264-aac5-1-yts,2000s,/home/pratik/projects/GenderBias_TrendAnalysis/dataset/2000s/Bunty.Aur.Babli.2005.1080p.WEBRip.x264.AAC5.1-[YTS.srt,"01:21:55,407","01:21:58,199",What did you say their names were? - Bunty and Babli,"What did you say their names were?
- Bunty and Babli"
bunty-aur-babli-2005-1080p-webrip-x264-aac5-1-yts,2000s,/home/pratik/projects/GenderBias_TrendAnalysis/dataset/2000s/Bunty.Aur.Babli.2005.1080p.WEBRip.x264.AAC5.1-[YTS.srt,"01:22:00,250","01:22:02,992",This Bunty-Babli better watch out for me,"This Bunty-Babli
better watch out for me"
bunty-aur-babli-2005-1080p-webrip-x264-aac5-1-yts,2000s,/home/pratik/projects/GenderBias_TrendAnalysis/dataset/2000s/Bunty.Aur.Babli.2005.1080p.WEBRip.x264.AAC5.1-[YTS.srt,"01:22:15,910","01:22:23,085",We'll always place each other before ourselves,"We'll always place each
other before ourselves"
bunty-aur-babli-2005-1080p-webrip-x264-aac5-1-yts,2000s,/home/pratik/projects/GenderBias_TrendAnalysis/dataset/2000s/Bunty.Aur.Babli.2005.1080p.WEBRip.x264.AAC5.1-[YTS.srt,"01:22:23,797","01:22:24,917",Okay,Okay
bunty-aur-babli-2005-1080p-webrip-x264-aac5-1-yts,2000s,/home/pratik/projects/GenderBias_TrendAnalysis/dataset/2000s/Bunty.Aur.Babli.2005.1080p.WEBRip.x264.AAC5.1-[YTS.srt,"01:22:25,338","01:22:27,919",We'll never ever break each other's hearts,"We'll never ever
break each other's hearts"
bunty-aur-babli-2005-1080p-webrip-x264-aac5-1-yts,2000s,/home/pratik/projects/GenderBias_TrendAnalysis/dataset/2000s/Bunty.Aur.Babli.2005.1080p.WEBRip.x264.AAC5.1-[YTS.srt,"01:22:29,961","01:22:31,502",And if we do so accidentally..,And if we do so accidentally..
bunty-aur-babli-2005-1080p-webrip-x264-aac5-1-yts,2000s,/home/pratik/projects/GenderBias_TrendAnalysis/dataset/2000s/Bunty.Aur.Babli.2005.1080p.WEBRip.x264.AAC5.1-[YTS.srt,"01:22:31,592","01:22:33,423",..we won't burst into tears without warning,"..we won't burst into
tears without warning"
bunty-aur-babli-2005-1080p-webrip-x264-aac5-1-yts,2000s,/home/pratik/projects/GenderBias_TrendAnalysis/dataset/2000s/Bunty.Aur.Babli.2005.1080p.WEBRip.x264.AAC5.1-[YTS.srt,"01:22:34,265","01:22:39,759","Okay, we will never eat or drink anything without each other","Okay, we will never eat or
drink anything without each other"
bunty-aur-babli-2005-1080p-webrip-x264-aac5-1-yts,2000s,/home/pratik/projects/GenderBias_TrendAnalysis/dataset/2000s/Bunty.Aur.Babli.2005.1080p.WEBRip.x264.AAC5.1-[YTS.srt,"01:22:41,310","01:22:43,181",Except early morning tea,Except early morning tea
bunty-aur-babli-2005-1080p-webrip-x264-aac5-1-yts,2000s,/home/pratik/projects/GenderBias_TrendAnalysis/dataset/2000s/Bunty.Aur.Babli.2005.1080p.WEBRip.x264.AAC5.1-[YTS.srt,"01:22:43,933","01:22:46,064",You wake up like a queen at noon I can't wait that long,"You wake up like a queen at
noon I can't wait that long"
bunty-aur-babli-2005-1080p-webrip-x264-aac5-1-yts,2000s,/home/pratik/projects/GenderBias_TrendAnalysis/dataset/2000s/Bunty.Aur.Babli.2005.1080p.WEBRip.x264.AAC5.1-[YTS.srt,"01:22:48,315","01:22:50,568",We'll give each other the same amount of love forever,"We'll give each other the
same amount of love forever"
bunty-aur-babli-2005-1080p-webrip-x264-aac5-1-yts,2000s,/home/pratik/projects/GenderBias_TrendAnalysis/dataset/2000s/Bunty.Aur.Babli.2005.1080p.WEBRip.x264.AAC5.1-[YTS.srt,"01:22:50,648","01:22:53,149",Why? We can give more! I'll love you even more tomorrow..,"Why? We can give more! I'll
love you even more tomorrow.."
bunty-aur-babli-2005-1080p-webrip-x264-aac5-1-yts,2000s,/home/pratik/projects/GenderBias_TrendAnalysis/dataset/2000s/Bunty.Aur.Babli.2005.1080p.WEBRip.x264.AAC5.1-[YTS.srt,"01:22:53,649","01:22:58,693",more the day after and so much more the day after the day after,"more the day after and so much
more the day after the day after"
bunty-aur-babli-2005-1080p-webrip-x264-aac5-1-yts,2000s,/home/pratik/projects/GenderBias_TrendAnalysis/dataset/2000s/Bunty.Aur.Babli.2005.1080p.WEBRip.x264.AAC5.1-[YTS.srt,"01:23:00,656","01:23:04,449",We'll cut off all ties with those who don't understand us,"We'll cut off all ties with
those who don't understand us"
bunty-aur-babli-2005-1080p-webrip-x264-aac5-1-yts,2000s,/home/pratik/projects/GenderBias_TrendAnalysis/dataset/2000s/Bunty.Aur.Babli.2005.1080p.WEBRip.x264.AAC5.1-[YTS.srt,"01:23:04,539","01:23:08,621",Except our parents. - Your parents,"Except our parents.
- Your parents"
bunty-aur-babli-2005-1080p-webrip-x264-aac5-1-yts,2000s,/home/pratik/projects/GenderBias_TrendAnalysis/dataset/2000s/Bunty.Aur.Babli.2005.1080p.WEBRip.x264.AAC5.1-[YTS.srt,"01:23:12,545","01:23:14,587",We'll be Bunty-Babli for the rest of our lives,"We'll be Bunty-Babli
for the rest of our lives"
bunty-aur-babli-2005-1080p-webrip-x264-aac5-1-yts,2000s,/home/pratik/projects/GenderBias_TrendAnalysis/dataset/2000s/Bunty.Aur.Babli.2005.1080p.WEBRip.x264.AAC5.1-[YTS.srt,"01:23:14,667","01:23:18,709",And we'll live out all our dreams. - Except..,"And we'll live out all our dreams.
- Except.."
bunty-aur-babli-2005-1080p-webrip-x264-aac5-1-yts,2000s,/home/pratik/projects/GenderBias_TrendAnalysis/dataset/2000s/Bunty.Aur.Babli.2005.1080p.WEBRip.x264.AAC5.1-[YTS.srt,"01:23:19,801","01:23:22,963",Except? - Leave that to me,"Except?
- Leave that to me"
bunty-aur-babli-2005-1080p-webrip-x264-aac5-1-yts,2000s,/home/pratik/projects/GenderBias_TrendAnalysis/dataset/2000s/Bunty.Aur.Babli.2005.1080p.WEBRip.x264.AAC5.1-[YTS.srt,"01:23:23,713","01:23:24,885",Okay,Okay
bunty-aur-babli-2005-1080p-webrip-x264-aac5-1-yts,2000s,/home/pratik/projects/GenderBias_TrendAnalysis/dataset/2000s/Bunty.Aur.Babli.2005.1080p.WEBRip.x264.AAC5.1-[YTS.srt,"01:23:28,057","01:23:31,510",Oye Rakesh just married!,Oye Rakesh just married!
bunty-aur-babli-2005-1080p-webrip-x264-aac5-1-yts,2000s,/home/pratik/projects/GenderBias_TrendAnalysis/dataset/2000s/Bunty.Aur.Babli.2005.1080p.WEBRip.x264.AAC5.1-[YTS.srt,"01:23:50,695","01:23:51,906",Look..,Look..
bunty-aur-babli-2005-1080p-webrip-x264-aac5-1-yts,2000s,/home/pratik/projects/GenderBias_TrendAnalysis/dataset/2000s/Bunty.Aur.Babli.2005.1080p.WEBRip.x264.AAC5.1-[YTS.srt,"01:23:52,777","01:23:57,911",right at the outset of this marriage I want to tell you all about my past,"right at the outset of this marriage
I want to tell you all about my past"
bunty-aur-babli-2005-1080p-webrip-x264-aac5-1-yts,2000s,/home/pratik/projects/GenderBias_TrendAnalysis/dataset/2000s/Bunty.Aur.Babli.2005.1080p.WEBRip.x264.AAC5.1-[YTS.srt,"01:23:59,081","01:24:02,074",I don't want any issues later,I don't want any issues later
bunty-aur-babli-2005-1080p-webrip-x264-aac5-1-yts,2000s,/home/pratik/projects/GenderBias_TrendAnalysis/dataset/2000s/Bunty.Aur.Babli.2005.1080p.WEBRip.x264.AAC5.1-[YTS.srt,"01:24:04,085","01:24:09,921","In school, when I was in Class Two,","In school, when I was in Class Two,"
bunty-aur-babli-2005-1080p-webrip-x264-aac5-1-yts,2000s,/home/pratik/projects/GenderBias_TrendAnalysis/dataset/2000s/Bunty.Aur.Babli.2005.1080p.WEBRip.x264.AAC5.1-[YTS.srt,"01:24:11,042","01:24:14,295",Mukesh used to sit behind me,Mukesh used to sit behind me
bunty-aur-babli-2005-1080p-webrip-x264-aac5-1-yts,2000s,/home/pratik/projects/GenderBias_TrendAnalysis/dataset/2000s/Bunty.Aur.Babli.2005.1080p.WEBRip.x264.AAC5.1-[YTS.srt,"01:24:15,465","01:24:18,677",He used to tug at my plaits,He used to tug at my plaits
bunty-aur-babli-2005-1080p-webrip-x264-aac5-1-yts,2000s,/home/pratik/projects/GenderBias_TrendAnalysis/dataset/2000s/Bunty.Aur.Babli.2005.1080p.WEBRip.x264.AAC5.1-[YTS.srt,"01:24:22,971","01:24:28,935",And you know.. it used to make me giggle like crazy,"And you know.. it used to
make me giggle like crazy"
bunty-aur-babli-2005-1080p-webrip-x264-aac5-1-yts,2000s,/home/pratik/projects/GenderBias_TrendAnalysis/dataset/2000s/Bunty.Aur.Babli.2005.1080p.WEBRip.x264.AAC5.1-[YTS.srt,"01:24:30,057","01:24:32,518",These boys are all scoundrels,These boys are all scoundrels
bunty-aur-babli-2005-1080p-webrip-x264-aac5-1-yts,2000s,/home/pratik/projects/GenderBias_TrendAnalysis/dataset/2000s/Bunty.Aur.Babli.2005.1080p.WEBRip.x264.AAC5.1-[YTS.srt,"01:24:33,899","01:24:38,353",They'll try their luck with every cute girl,"They'll try their luck
with every cute girl"
bunty-aur-babli-2005-1080p-webrip-x264-aac5-1-yts,2000s,/home/pratik/projects/GenderBias_TrendAnalysis/dataset/2000s/Bunty.Aur.Babli.2005.1080p.WEBRip.x264.AAC5.1-[YTS.srt,"01:24:40,365","01:24:41,696",How true,How true
bunty-aur-babli-2005-1080p-webrip-x264-aac5-1-yts,2000s,/home/pratik/projects/GenderBias_TrendAnalysis/dataset/2000s/Bunty.Aur.Babli.2005.1080p.WEBRip.x264.AAC5.1-[YTS.srt,"01:24:43,067","01:24:48,361","How lucky I am, you aren't like those boys","How lucky I am, you
aren't like those boys"
bunty-aur-babli-2005-1080p-webrip-x264-aac5-1-yts,2000s,/home/pratik/projects/GenderBias_TrendAnalysis/dataset/2000s/Bunty.Aur.Babli.2005.1080p.WEBRip.x264.AAC5.1-[YTS.srt,"01:24:49,783","01:24:54,245",Rakesh.. you're such a good boy,Rakesh.. you're such a good boy
bunty-aur-babli-2005-1080p-webrip-x264-aac5-1-yts,2000s,/home/pratik/projects/GenderBias_TrendAnalysis/dataset/2000s/Bunty.Aur.Babli.2005.1080p.WEBRip.x264.AAC5.1-[YTS.srt,"01:24:54,325","01:24:56,077",Sweet boy,Sweet boy
bunty-aur-babli-2005-1080p-webrip-x264-aac5-1-yts,2000s,/home/pratik/projects/GenderBias_TrendAnalysis/dataset/2000s/Bunty.Aur.Babli.2005.1080p.WEBRip.x264.AAC5.1-[YTS.srt,"01:25:00,081","01:25:03,123",So.. what I was saying was..,So.. what I was saying was..
bunty-aur-babli-2005-1080p-webrip-x264-aac5-1-yts,2000s,/home/pratik/projects/GenderBias_TrendAnalysis/dataset/2000s/Bunty.Aur.Babli.2005.1080p.WEBRip.x264.AAC5.1-[YTS.srt,"01:25:05,505","01:25:09,969",..now that you are my wife..,..now that you are my wife..
bunty-aur-babli-2005-1080p-webrip-x264-aac5-1-yts,2000s,/home/pratik/projects/GenderBias_TrendAnalysis/dataset/2000s/Bunty.Aur.Babli.2005.1080p.WEBRip.x264.AAC5.1-[YTS.srt,"01:25:12,140","01:25:16,263",my mate in joy and sorrow..,my mate in joy and sorrow..
bunty-aur-babli-2005-1080p-webrip-x264-aac5-1-yts,2000s,/home/pratik/projects/GenderBias_TrendAnalysis/dataset/2000s/Bunty.Aur.Babli.2005.1080p.WEBRip.x264.AAC5.1-[YTS.srt,"01:25:18,555","01:25:20,307",for all my days to come..,for all my days to come..
bunty-aur-babli-2005-1080p-webrip-x264-aac5-1-yts,2000s,/home/pratik/projects/GenderBias_TrendAnalysis/dataset/2000s/Bunty.Aur.Babli.2005.1080p.WEBRip.x264.AAC5.1-[YTS.srt,"01:25:22,228","01:25:26,892",and nights.. understand?,and nights.. understand?
bunty-aur-babli-2005-1080p-webrip-x264-aac5-1-yts,2000s,/home/pratik/projects/GenderBias_TrendAnalysis/dataset/2000s/Bunty.Aur.Babli.2005.1080p.WEBRip.x264.AAC5.1-[YTS.srt,"01:25:37,820","01:25:40,323",Asleep? On your wedding night!,Asleep? On your wedding night!
bunty-aur-babli-2005-1080p-webrip-x264-aac5-1-yts,2000s,/home/pratik/projects/GenderBias_TrendAnalysis/dataset/2000s/Bunty.Aur.Babli.2005.1080p.WEBRip.x264.AAC5.1-[YTS.srt,"01:25:52,252","01:25:56,045",This world we live in has two kinds of people..,"This world we live in
has two kinds of people.."
bunty-aur-babli-2005-1080p-webrip-x264-aac5-1-yts,2000s,/home/pratik/projects/GenderBias_TrendAnalysis/dataset/2000s/Bunty.Aur.Babli.2005.1080p.WEBRip.x264.AAC5.1-[YTS.srt,"01:25:58,086","01:26:04,421",those who aren't married and those who are,"those who aren't
married and those who are"
bunty-aur-babli-2005-1080p-webrip-x264-aac5-1-yts,2000s,/home/pratik/projects/GenderBias_TrendAnalysis/dataset/2000s/Bunty.Aur.Babli.2005.1080p.WEBRip.x264.AAC5.1-[YTS.srt,"01:26:06,683","01:26:07,804",So?,So?
bunty-aur-babli-2005-1080p-webrip-x264-aac5-1-yts,2000s,/home/pratik/projects/GenderBias_TrendAnalysis/dataset/2000s/Bunty.Aur.Babli.2005.1080p.WEBRip.x264.AAC5.1-[YTS.srt,"01:26:09,305","01:26:11,097","So you belong to the latter, no?","So you belong to the latter, no?"
bunty-aur-babli-2005-1080p-webrip-x264-aac5-1-yts,2000s,/home/pratik/projects/GenderBias_TrendAnalysis/dataset/2000s/Bunty.Aur.Babli.2005.1080p.WEBRip.x264.AAC5.1-[YTS.srt,"01:26:13,519","01:26:14,809",So?,So?
bunty-aur-babli-2005-1080p-webrip-x264-aac5-1-yts,2000s,/home/pratik/projects/GenderBias_TrendAnalysis/dataset/2000s/Bunty.Aur.Babli.2005.1080p.WEBRip.x264.AAC5.1-[YTS.srt,"01:26:16,191","01:26:17,892",So marry me now you fool,So marry me now you fool
bunty-aur-babli-2005-1080p-webrip-x264-aac5-1-yts,2000s,/home/pratik/projects/GenderBias_TrendAnalysis/dataset/2000s/Bunty.Aur.Babli.2005.1080p.WEBRip.x264.AAC5.1-[YTS.srt,"01:26:57,224","01:27:01,887","Look, above me..","Look, above me.."
bunty-aur-babli-2005-1080p-webrip-x264-aac5-1-yts,2000s,/home/pratik/projects/GenderBias_TrendAnalysis/dataset/2000s/Bunty.Aur.Babli.2005.1080p.WEBRip.x264.AAC5.1-[YTS.srt,"01:27:05,479","01:27:10,855",..the sky's soared away.,..the sky's soared away.
bunty-aur-babli-2005-1080p-webrip-x264-aac5-1-yts,2000s,/home/pratik/projects/GenderBias_TrendAnalysis/dataset/2000s/Bunty.Aur.Babli.2005.1080p.WEBRip.x264.AAC5.1-[YTS.srt,"01:27:17,650","01:27:25,987","Look, above me, the sky's soared away.","Look, above me, the
sky's soared away."
bunty-aur-babli-2005-1080p-webrip-x264-aac5-1-yts,2000s,/home/pratik/projects/GenderBias_TrendAnalysis/dataset/2000s/Bunty.Aur.Babli.2005.1080p.WEBRip.x264.AAC5.1-[YTS.srt,"01:27:26,077","01:27:43,300",I see my skies breaking free of the earth at the horizon..,"I see my skies breaking free
of the earth at the horizon.."
bunty-aur-babli-2005-1080p-webrip-x264-aac5-1-yts,2000s,/home/pratik/projects/GenderBias_TrendAnalysis/dataset/2000s/Bunty.Aur.Babli.2005.1080p.WEBRip.x264.AAC5.1-[YTS.srt,"01:27:43,380","01:27:47,133","soft, slow, on tip-toe bit by thieving bit..","soft, slow, on tip-toe
bit by thieving bit.."
bunty-aur-babli-2005-1080p-webrip-x264-aac5-1-yts,2000s,/home/pratik/projects/GenderBias_TrendAnalysis/dataset/2000s/Bunty.Aur.Babli.2005.1080p.WEBRip.x264.AAC5.1-[YTS.srt,"01:27:47,213","01:27:50,555","soft, slow, tip-toeing my love","soft, slow, tip-toeing my love"
bunty-aur-babli-2005-1080p-webrip-x264-aac5-1-yts,2000s,/home/pratik/projects/GenderBias_TrendAnalysis/dataset/2000s/Bunty.Aur.Babli.2005.1080p.WEBRip.x264.AAC5.1-[YTS.srt,"01:27:51,267","01:27:55,309","soft, slow, on tip-toe bit by thieving bit..","soft, slow, on tip-toe
bit by thieving bit.."
bunty-aur-babli-2005-1080p-webrip-x264-aac5-1-yts,2000s,/home/pratik/projects/GenderBias_TrendAnalysis/dataset/2000s/Bunty.Aur.Babli.2005.1080p.WEBRip.x264.AAC5.1-[YTS.srt,"01:27:55,349","01:27:58,602","soft, slow, tip-toeing my love","soft, slow, tip-toeing my love"
bunty-aur-babli-2005-1080p-webrip-x264-aac5-1-yts,2000s,/home/pratik/projects/GenderBias_TrendAnalysis/dataset/2000s/Bunty.Aur.Babli.2005.1080p.WEBRip.x264.AAC5.1-[YTS.srt,"01:27:59,433","01:28:03,646","soft, slow, on tip-toe bit by thieving bit..","soft, slow, on tip-toe
bit by thieving bit.."
bunty-aur-babli-2005-1080p-webrip-x264-aac5-1-yts,2000s,/home/pratik/projects/GenderBias_TrendAnalysis/dataset/2000s/Bunty.Aur.Babli.2005.1080p.WEBRip.x264.AAC5.1-[YTS.srt,"01:28:03,726","01:28:06,649","soft, slow, tip-toeing my love","soft, slow, tip-toeing my love"
