film_id,decade,file_path,start,end,text_clean,text_raw
animal-2023-1080p-nf-web-dl-ddp5-1-h,2020s,/home/pratik/projects/GenderBias_TrendAnalysis/dataset/2020s/Animal.2023.1080p.NF.WEB-DL.DDP5.1.H.srt,"01:26:48,416","01:26:50,166",God didn't give you any hair on your head...,"God didn't give you
any hair on your head..."
animal-2023-1080p-nf-web-dl-ddp5-1-h,2020s,/home/pratik/projects/GenderBias_TrendAnalysis/dataset/2020s/Animal.2023.1080p.NF.WEB-DL.DDP5.1.H.srt,"01:26:50,875","01:26:52,083",and you're shaving off what you got down there.,"and you're shaving off
what you got down there."
animal-2023-1080p-nf-web-dl-ddp5-1-h,2020s,/home/pratik/projects/GenderBias_TrendAnalysis/dataset/2020s/Animal.2023.1080p.NF.WEB-DL.DDP5.1.H.srt,"01:26:52,250","01:26:53,250",Have some sense.,Have some sense.
animal-2023-1080p-nf-web-dl-ddp5-1-h,2020s,/home/pratik/projects/GenderBias_TrendAnalysis/dataset/2020s/Animal.2023.1080p.NF.WEB-DL.DDP5.1.H.srt,"01:26:53,416","01:26:56,000","God gave you hair down there for a reason, right?","God gave you hair down there
for a reason, right?"
animal-2023-1080p-nf-web-dl-ddp5-1-h,2020s,/home/pratik/projects/GenderBias_TrendAnalysis/dataset/2020s/Animal.2023.1080p.NF.WEB-DL.DDP5.1.H.srt,"01:26:56,250","01:26:58,291",Why are you shaving it off? Did your girlfriend ask you to?,"Why are you shaving it off?
Did your girlfriend ask you to?"
animal-2023-1080p-nf-web-dl-ddp5-1-h,2020s,/home/pratik/projects/GenderBias_TrendAnalysis/dataset/2020s/Animal.2023.1080p.NF.WEB-DL.DDP5.1.H.srt,"01:26:58,791","01:27:00,375",- Did your doctor ask you to? - Listen...,"- Did your doctor ask you to?
- Listen..."
animal-2023-1080p-nf-web-dl-ddp5-1-h,2020s,/home/pratik/projects/GenderBias_TrendAnalysis/dataset/2020s/Animal.2023.1080p.NF.WEB-DL.DDP5.1.H.srt,"01:27:00,583","01:27:03,000",Why do you shave it off? It's a natural process. Let it grow.,"Why do you shave it off?
It's a natural process. Let it grow."
animal-2023-1080p-nf-web-dl-ddp5-1-h,2020s,/home/pratik/projects/GenderBias_TrendAnalysis/dataset/2020s/Animal.2023.1080p.NF.WEB-DL.DDP5.1.H.srt,"01:27:03,458","01:27:05,833","Listen, just give me one day.","Listen, just give me one day."
animal-2023-1080p-nf-web-dl-ddp5-1-h,2020s,/home/pratik/projects/GenderBias_TrendAnalysis/dataset/2020s/Animal.2023.1080p.NF.WEB-DL.DDP5.1.H.srt,"01:27:06,291","01:27:08,875","By tomorrow, you will have 365 new pairs of underwear.","By tomorrow, you will have
365 new pairs of underwear."
animal-2023-1080p-nf-web-dl-ddp5-1-h,2020s,/home/pratik/projects/GenderBias_TrendAnalysis/dataset/2020s/Animal.2023.1080p.NF.WEB-DL.DDP5.1.H.srt,"01:27:09,541","01:27:10,416",Okay?,Okay?
animal-2023-1080p-nf-web-dl-ddp5-1-h,2020s,/home/pratik/projects/GenderBias_TrendAnalysis/dataset/2020s/Animal.2023.1080p.NF.WEB-DL.DDP5.1.H.srt,"01:27:10,666","01:27:11,916",Don't wear anything today.,Don't wear anything today.
animal-2023-1080p-nf-web-dl-ddp5-1-h,2020s,/home/pratik/projects/GenderBias_TrendAnalysis/dataset/2020s/Animal.2023.1080p.NF.WEB-DL.DDP5.1.H.srt,"01:27:12,583","01:27:13,458",Yeah...,Yeah...
animal-2023-1080p-nf-web-dl-ddp5-1-h,2020s,/home/pratik/projects/GenderBias_TrendAnalysis/dataset/2020s/Animal.2023.1080p.NF.WEB-DL.DDP5.1.H.srt,"01:27:15,083","01:27:16,708","Brother, you got us all suited up...","Brother, you got us all suited up..."
animal-2023-1080p-nf-web-dl-ddp5-1-h,2020s,/home/pratik/projects/GenderBias_TrendAnalysis/dataset/2020s/Animal.2023.1080p.NF.WEB-DL.DDP5.1.H.srt,"01:27:17,208","01:27:18,291",and you're rocking a kurta and lungi?,and you're rocking a kurta and lungi?
animal-2023-1080p-nf-web-dl-ddp5-1-h,2020s,/home/pratik/projects/GenderBias_TrendAnalysis/dataset/2020s/Animal.2023.1080p.NF.WEB-DL.DDP5.1.H.srt,"01:27:20,708","01:27:21,875",Who is the main guy?,Who is the main guy?
animal-2023-1080p-nf-web-dl-ddp5-1-h,2020s,/home/pratik/projects/GenderBias_TrendAnalysis/dataset/2020s/Animal.2023.1080p.NF.WEB-DL.DDP5.1.H.srt,"01:27:25,958","01:27:26,833",Freddy.,Freddy.
animal-2023-1080p-nf-web-dl-ddp5-1-h,2020s,/home/pratik/projects/GenderBias_TrendAnalysis/dataset/2020s/Animal.2023.1080p.NF.WEB-DL.DDP5.1.H.srt,"01:27:32,125","01:27:34,708",You're the one who talked to our engineer on the phone?,"You're the one who talked
to our engineer on the phone?"
animal-2023-1080p-nf-web-dl-ddp5-1-h,2020s,/home/pratik/projects/GenderBias_TrendAnalysis/dataset/2020s/Animal.2023.1080p.NF.WEB-DL.DDP5.1.H.srt,"01:27:35,791","01:27:36,708",What a vision!,What a vision!
animal-2023-1080p-nf-web-dl-ddp5-1-h,2020s,/home/pratik/projects/GenderBias_TrendAnalysis/dataset/2020s/Animal.2023.1080p.NF.WEB-DL.DDP5.1.H.srt,"01:27:38,208","01:27:39,208",What a thought!,What a thought!
animal-2023-1080p-nf-web-dl-ddp5-1-h,2020s,/home/pratik/projects/GenderBias_TrendAnalysis/dataset/2020s/Animal.2023.1080p.NF.WEB-DL.DDP5.1.H.srt,"01:27:39,708","01:27:40,958",My team is going crazy.,My team is going crazy.
animal-2023-1080p-nf-web-dl-ddp5-1-h,2020s,/home/pratik/projects/GenderBias_TrendAnalysis/dataset/2020s/Animal.2023.1080p.NF.WEB-DL.DDP5.1.H.srt,"01:27:43,208","01:27:44,708",Let's get straight to the point.,Let's get straight to the point.
animal-2023-1080p-nf-web-dl-ddp5-1-h,2020s,/home/pratik/projects/GenderBias_TrendAnalysis/dataset/2020s/Animal.2023.1080p.NF.WEB-DL.DDP5.1.H.srt,"01:27:44,791","01:27:47,208",These guys are no saints.,These guys are no saints.
animal-2023-1080p-nf-web-dl-ddp5-1-h,2020s,/home/pratik/projects/GenderBias_TrendAnalysis/dataset/2020s/Animal.2023.1080p.NF.WEB-DL.DDP5.1.H.srt,"01:27:47,416","01:27:49,541",They got no history.,They got no history.
animal-2023-1080p-nf-web-dl-ddp5-1-h,2020s,/home/pratik/projects/GenderBias_TrendAnalysis/dataset/2020s/Animal.2023.1080p.NF.WEB-DL.DDP5.1.H.srt,"01:27:49,625","01:27:52,416","Clean, loaded, no record.","Clean, loaded, no record."
animal-2023-1080p-nf-web-dl-ddp5-1-h,2020s,/home/pratik/projects/GenderBias_TrendAnalysis/dataset/2020s/Animal.2023.1080p.NF.WEB-DL.DDP5.1.H.srt,"01:27:52,500","01:27:53,791","Skip the details, bro.","Skip the details, bro."
animal-2023-1080p-nf-web-dl-ddp5-1-h,2020s,/home/pratik/projects/GenderBias_TrendAnalysis/dataset/2020s/Animal.2023.1080p.NF.WEB-DL.DDP5.1.H.srt,"01:27:53,875","01:27:55,708",- Just show us a demo of this beauty. - Hey!,"- Just show us a demo of this beauty.
- Hey!"
animal-2023-1080p-nf-web-dl-ddp5-1-h,2020s,/home/pratik/projects/GenderBias_TrendAnalysis/dataset/2020s/Animal.2023.1080p.NF.WEB-DL.DDP5.1.H.srt,"01:27:55,833","01:27:56,875",- Hey! - Hey!,"- Hey!
- Hey!"
animal-2023-1080p-nf-web-dl-ddp5-1-h,2020s,/home/pratik/projects/GenderBias_TrendAnalysis/dataset/2020s/Animal.2023.1080p.NF.WEB-DL.DDP5.1.H.srt,"01:27:57,291","01:27:58,458",Never put your hand on my shoulder!,Never put your hand on my shoulder!
animal-2023-1080p-nf-web-dl-ddp5-1-h,2020s,/home/pratik/projects/GenderBias_TrendAnalysis/dataset/2020s/Animal.2023.1080p.NF.WEB-DL.DDP5.1.H.srt,"01:28:00,375","01:28:02,958",Never touch my shoulder.,Never touch my shoulder.
animal-2023-1080p-nf-web-dl-ddp5-1-h,2020s,/home/pratik/projects/GenderBias_TrendAnalysis/dataset/2020s/Animal.2023.1080p.NF.WEB-DL.DDP5.1.H.srt,"01:28:06,916","01:28:09,166",I'm not here to show you some damn toy!,"I'm not here
to show you some damn toy!"
animal-2023-1080p-nf-web-dl-ddp5-1-h,2020s,/home/pratik/projects/GenderBias_TrendAnalysis/dataset/2020s/Animal.2023.1080p.NF.WEB-DL.DDP5.1.H.srt,"01:28:10,666","01:28:11,666",Don't cross the line.,Don't cross the line.
animal-2023-1080p-nf-web-dl-ddp5-1-h,2020s,/home/pratik/projects/GenderBias_TrendAnalysis/dataset/2020s/Animal.2023.1080p.NF.WEB-DL.DDP5.1.H.srt,"01:28:13,000","01:28:14,666",Freaking dimwits.,Freaking dimwits.
animal-2023-1080p-nf-web-dl-ddp5-1-h,2020s,/home/pratik/projects/GenderBias_TrendAnalysis/dataset/2020s/Animal.2023.1080p.NF.WEB-DL.DDP5.1.H.srt,"01:28:14,916","01:28:16,916",All they have is money.,All they have is money.
animal-2023-1080p-nf-web-dl-ddp5-1-h,2020s,/home/pratik/projects/GenderBias_TrendAnalysis/dataset/2020s/Animal.2023.1080p.NF.WEB-DL.DDP5.1.H.srt,"01:28:17,416","01:28:19,875",They got no discipline or manners.,They got no discipline or manners.
animal-2023-1080p-nf-web-dl-ddp5-1-h,2020s,/home/pratik/projects/GenderBias_TrendAnalysis/dataset/2020s/Animal.2023.1080p.NF.WEB-DL.DDP5.1.H.srt,"01:28:21,125","01:28:22,000","Look at how he's acting, asshole.","Look at how he's acting, asshole."
animal-2023-1080p-nf-web-dl-ddp5-1-h,2020s,/home/pratik/projects/GenderBias_TrendAnalysis/dataset/2020s/Animal.2023.1080p.NF.WEB-DL.DDP5.1.H.srt,"01:28:22,083","01:28:23,833",- Hey! - Hey!,"- Hey!
- Hey!"
animal-2023-1080p-nf-web-dl-ddp5-1-h,2020s,/home/pratik/projects/GenderBias_TrendAnalysis/dataset/2020s/Animal.2023.1080p.NF.WEB-DL.DDP5.1.H.srt,"01:28:25,833","01:28:27,083",Keep quiet.,Keep quiet.
animal-2023-1080p-nf-web-dl-ddp5-1-h,2020s,/home/pratik/projects/GenderBias_TrendAnalysis/dataset/2020s/Animal.2023.1080p.NF.WEB-DL.DDP5.1.H.srt,"01:28:27,625","01:28:30,083","Sir, they know you're cursing at them.","Sir, they know you're cursing at them."
animal-2023-1080p-nf-web-dl-ddp5-1-h,2020s,/home/pratik/projects/GenderBias_TrendAnalysis/dataset/2020s/Animal.2023.1080p.NF.WEB-DL.DDP5.1.H.srt,"01:28:30,166","01:28:31,416",They should.,They should.
animal-2023-1080p-nf-web-dl-ddp5-1-h,2020s,/home/pratik/projects/GenderBias_TrendAnalysis/dataset/2020s/Animal.2023.1080p.NF.WEB-DL.DDP5.1.H.srt,"01:28:31,791","01:28:32,958",He had the guts to touch Freddy.,He had the guts to touch Freddy.
animal-2023-1080p-nf-web-dl-ddp5-1-h,2020s,/home/pratik/projects/GenderBias_TrendAnalysis/dataset/2020s/Animal.2023.1080p.NF.WEB-DL.DDP5.1.H.srt,"01:28:37,291","01:28:40,041",I usually don't make deliveries in person.,I usually don't make deliveries in person.
animal-2023-1080p-nf-web-dl-ddp5-1-h,2020s,/home/pratik/projects/GenderBias_TrendAnalysis/dataset/2020s/Animal.2023.1080p.NF.WEB-DL.DDP5.1.H.srt,"01:28:40,416","01:28:42,750","I came here, especially for that man.","I came here, especially for that man."
animal-2023-1080p-nf-web-dl-ddp5-1-h,2020s,/home/pratik/projects/GenderBias_TrendAnalysis/dataset/2020s/Animal.2023.1080p.NF.WEB-DL.DDP5.1.H.srt,"01:28:42,833","01:28:43,958",The man...,The man...
animal-2023-1080p-nf-web-dl-ddp5-1-h,2020s,/home/pratik/projects/GenderBias_TrendAnalysis/dataset/2020s/Animal.2023.1080p.NF.WEB-DL.DDP5.1.H.srt,"01:28:45,125","01:28:48,500",who briefed my team about this machine.,who briefed my team about this machine.
animal-2023-1080p-nf-web-dl-ddp5-1-h,2020s,/home/pratik/projects/GenderBias_TrendAnalysis/dataset/2020s/Animal.2023.1080p.NF.WEB-DL.DDP5.1.H.srt,"01:28:48,750","01:28:49,750","Freddy, please continue.","Freddy, please continue."
animal-2023-1080p-nf-web-dl-ddp5-1-h,2020s,/home/pratik/projects/GenderBias_TrendAnalysis/dataset/2020s/Animal.2023.1080p.NF.WEB-DL.DDP5.1.H.srt,"01:28:50,833","01:28:54,125",Your guys think I'm some kind of food delivery guy.,"Your guys think
I'm some kind of food delivery guy."
animal-2023-1080p-nf-web-dl-ddp5-1-h,2020s,/home/pratik/projects/GenderBias_TrendAnalysis/dataset/2020s/Animal.2023.1080p.NF.WEB-DL.DDP5.1.H.srt,"01:28:55,541","01:28:56,625",I'm a man of force!,I'm a man of force!
animal-2023-1080p-nf-web-dl-ddp5-1-h,2020s,/home/pratik/projects/GenderBias_TrendAnalysis/dataset/2020s/Animal.2023.1080p.NF.WEB-DL.DDP5.1.H.srt,"01:29:01,791","01:29:04,750",Brother! Where are you?,Brother! Where are you?
animal-2023-1080p-nf-web-dl-ddp5-1-h,2020s,/home/pratik/projects/GenderBias_TrendAnalysis/dataset/2020s/Animal.2023.1080p.NF.WEB-DL.DDP5.1.H.srt,"01:29:07,125","01:29:08,958",I don't even bloody know your name.,I don't even bloody know your name.
animal-2023-1080p-nf-web-dl-ddp5-1-h,2020s,/home/pratik/projects/GenderBias_TrendAnalysis/dataset/2020s/Animal.2023.1080p.NF.WEB-DL.DDP5.1.H.srt,"01:29:12,583","01:29:14,208","As soon as you know shit's about to go down,","As soon as you know
shit's about to go down,"
animal-2023-1080p-nf-web-dl-ddp5-1-h,2020s,/home/pratik/projects/GenderBias_TrendAnalysis/dataset/2020s/Animal.2023.1080p.NF.WEB-DL.DDP5.1.H.srt,"01:29:14,291","01:29:17,375",the first thing you have to do is keep your family jewels safe and secure.,"the first thing you have to do is keep
your family jewels safe and secure."
animal-2023-1080p-nf-web-dl-ddp5-1-h,2020s,/home/pratik/projects/GenderBias_TrendAnalysis/dataset/2020s/Animal.2023.1080p.NF.WEB-DL.DDP5.1.H.srt,"01:29:17,541","01:29:19,583","If you don't wear a tight supporter or underwear,","If you don't wear a tight supporter
or underwear,"
animal-2023-1080p-nf-web-dl-ddp5-1-h,2020s,/home/pratik/projects/GenderBias_TrendAnalysis/dataset/2020s/Animal.2023.1080p.NF.WEB-DL.DDP5.1.H.srt,"01:29:19,750","01:29:21,291",they're going to get beaten around like a drum.,"they're going
to get beaten around like a drum."
animal-2023-1080p-nf-web-dl-ddp5-1-h,2020s,/home/pratik/projects/GenderBias_TrendAnalysis/dataset/2020s/Animal.2023.1080p.NF.WEB-DL.DDP5.1.H.srt,"01:29:21,708","01:29:25,916","If the action happens indoors, then headphones are a must.","If the action happens indoors,
then headphones are a must."
animal-2023-1080p-nf-web-dl-ddp5-1-h,2020s,/home/pratik/projects/GenderBias_TrendAnalysis/dataset/2020s/Animal.2023.1080p.NF.WEB-DL.DDP5.1.H.srt,"01:29:26,000","01:29:28,750","For the ones with turbans, use earbuds. Okay?","For the ones with turbans,
use earbuds. Okay?"
animal-2023-1080p-nf-web-dl-ddp5-1-h,2020s,/home/pratik/projects/GenderBias_TrendAnalysis/dataset/2020s/Animal.2023.1080p.NF.WEB-DL.DDP5.1.H.srt,"01:29:29,708","01:29:31,833",Good. Now coming to this...,Good. Now coming to this...
animal-2023-1080p-nf-web-dl-ddp5-1-h,2020s,/home/pratik/projects/GenderBias_TrendAnalysis/dataset/2020s/Animal.2023.1080p.NF.WEB-DL.DDP5.1.H.srt,"01:29:44,583","01:29:46,833",Put on your headphones. Move! Move fast!,"Put on your headphones.
Move! Move fast!"
animal-2023-1080p-nf-web-dl-ddp5-1-h,2020s,/home/pratik/projects/GenderBias_TrendAnalysis/dataset/2020s/Animal.2023.1080p.NF.WEB-DL.DDP5.1.H.srt,"01:29:47,166","01:29:48,250",Fast! Fast! Fast!,Fast! Fast! Fast!
animal-2023-1080p-nf-web-dl-ddp5-1-h,2020s,/home/pratik/projects/GenderBias_TrendAnalysis/dataset/2020s/Animal.2023.1080p.NF.WEB-DL.DDP5.1.H.srt,"01:29:50,958","01:29:51,875","Freddy, give me your underwear.","Freddy, give me your underwear."
animal-2023-1080p-nf-web-dl-ddp5-1-h,2020s,/home/pratik/projects/GenderBias_TrendAnalysis/dataset/2020s/Animal.2023.1080p.NF.WEB-DL.DDP5.1.H.srt,"01:29:52,750","01:29:54,208",- Hand me your underwear. - What?,"- Hand me your underwear.
- What?"
animal-2023-1080p-nf-web-dl-ddp5-1-h,2020s,/home/pratik/projects/GenderBias_TrendAnalysis/dataset/2020s/Animal.2023.1080p.NF.WEB-DL.DDP5.1.H.srt,"01:29:54,416","01:29:56,750",I'm not wearing one. I got to go outside. Do you understand?,"I'm not wearing one. I got to go outside.
Do you understand?"
animal-2023-1080p-nf-web-dl-ddp5-1-h,2020s,/home/pratik/projects/GenderBias_TrendAnalysis/dataset/2020s/Animal.2023.1080p.NF.WEB-DL.DDP5.1.H.srt,"01:29:56,833","01:29:57,916",- Do you want me to show you? - Hey!,"- Do you want me to show you?
- Hey!"
animal-2023-1080p-nf-web-dl-ddp5-1-h,2020s,/home/pratik/projects/GenderBias_TrendAnalysis/dataset/2020s/Animal.2023.1080p.NF.WEB-DL.DDP5.1.H.srt,"01:29:59,541","01:30:00,416",What...,What...
animal-2023-1080p-nf-web-dl-ddp5-1-h,2020s,/home/pratik/projects/GenderBias_TrendAnalysis/dataset/2020s/Animal.2023.1080p.NF.WEB-DL.DDP5.1.H.srt,"01:30:01,791","01:30:02,791",what are you going show me?,what are you going show me?
animal-2023-1080p-nf-web-dl-ddp5-1-h,2020s,/home/pratik/projects/GenderBias_TrendAnalysis/dataset/2020s/Animal.2023.1080p.NF.WEB-DL.DDP5.1.H.srt,"01:30:03,083","01:30:05,000","You want me to show you my ""black""?","You want me
to show you my ""black""?"
animal-2023-1080p-nf-web-dl-ddp5-1-h,2020s,/home/pratik/projects/GenderBias_TrendAnalysis/dataset/2020s/Animal.2023.1080p.NF.WEB-DL.DDP5.1.H.srt,"01:30:05,125","01:30:06,041","Hey, come here.","Hey, come here."
animal-2023-1080p-nf-web-dl-ddp5-1-h,2020s,/home/pratik/projects/GenderBias_TrendAnalysis/dataset/2020s/Animal.2023.1080p.NF.WEB-DL.DDP5.1.H.srt,"01:30:07,458","01:30:08,583",What is the name of your boss?,What is the name of your boss?
animal-2023-1080p-nf-web-dl-ddp5-1-h,2020s,/home/pratik/projects/GenderBias_TrendAnalysis/dataset/2020s/Animal.2023.1080p.NF.WEB-DL.DDP5.1.H.srt,"01:30:13,333","01:30:17,041","Hey, bring it on, baby!","<i>Hey, bring it on, baby!</i>"
animal-2023-1080p-nf-web-dl-ddp5-1-h,2020s,/home/pratik/projects/GenderBias_TrendAnalysis/dataset/2020s/Animal.2023.1080p.NF.WEB-DL.DDP5.1.H.srt,"01:30:27,875","01:30:28,791",Hey!,Hey!
animal-2023-1080p-nf-web-dl-ddp5-1-h,2020s,/home/pratik/projects/GenderBias_TrendAnalysis/dataset/2020s/Animal.2023.1080p.NF.WEB-DL.DDP5.1.H.srt,"01:30:32,708","01:30:34,125",This is how you fucking shoot!,This is how you fucking shoot!
animal-2023-1080p-nf-web-dl-ddp5-1-h,2020s,/home/pratik/projects/GenderBias_TrendAnalysis/dataset/2020s/Animal.2023.1080p.NF.WEB-DL.DDP5.1.H.srt,"01:30:35,041","01:30:36,875",The discussion is getting dull,<i>The discussion is getting dull</i>
animal-2023-1080p-nf-web-dl-ddp5-1-h,2020s,/home/pratik/projects/GenderBias_TrendAnalysis/dataset/2020s/Animal.2023.1080p.NF.WEB-DL.DDP5.1.H.srt,"01:30:37,416","01:30:41,541","It's time to celebrate Let's head to the square, my buddy","<i>It's time to celebrate
Let's head to the square, my buddy</i>"
animal-2023-1080p-nf-web-dl-ddp5-1-h,2020s,/home/pratik/projects/GenderBias_TrendAnalysis/dataset/2020s/Animal.2023.1080p.NF.WEB-DL.DDP5.1.H.srt,"01:30:41,791","01:30:44,041","There are drinks hidden Come on, let's get rowdy","<i>There are drinks hidden
Come on, let's get rowdy</i>"
animal-2023-1080p-nf-web-dl-ddp5-1-h,2020s,/home/pratik/projects/GenderBias_TrendAnalysis/dataset/2020s/Animal.2023.1080p.NF.WEB-DL.DDP5.1.H.srt,"01:30:44,125","01:30:46,375","Brother, grab some appetizers too","<i>Brother, grab some appetizers too</i>"
animal-2023-1080p-nf-web-dl-ddp5-1-h,2020s,/home/pratik/projects/GenderBias_TrendAnalysis/dataset/2020s/Animal.2023.1080p.NF.WEB-DL.DDP5.1.H.srt,"01:30:46,458","01:30:50,833","Pintya, it's time for crazy disco dancing Me and you","<i>Pintya, it's time for crazy disco dancing
Me and you</i>"
animal-2023-1080p-nf-web-dl-ddp5-1-h,2020s,/home/pratik/projects/GenderBias_TrendAnalysis/dataset/2020s/Animal.2023.1080p.NF.WEB-DL.DDP5.1.H.srt,"01:30:50,916","01:30:55,125","- Hey, Dolby-guy, call for the DJ - Call for the DJ","<i>- Hey, Dolby-guy, call for the DJ
- Call for the DJ</i>"
animal-2023-1080p-nf-web-dl-ddp5-1-h,2020s,/home/pratik/projects/GenderBias_TrendAnalysis/dataset/2020s/Animal.2023.1080p.NF.WEB-DL.DDP5.1.H.srt,"01:30:55,208","01:30:59,625","- Hey, Dolby-guy, call for the DJ - Call for the DJ","<i>- Hey, Dolby-guy, call for the DJ
- Call for the DJ</i>"
animal-2023-1080p-nf-web-dl-ddp5-1-h,2020s,/home/pratik/projects/GenderBias_TrendAnalysis/dataset/2020s/Animal.2023.1080p.NF.WEB-DL.DDP5.1.H.srt,"01:30:59,708","01:31:04,041","- Hey, Dolby-guy, call for the DJ - Call for the DJ","<i>- Hey, Dolby-guy, call for the DJ
- Call for the DJ</i>"
animal-2023-1080p-nf-web-dl-ddp5-1-h,2020s,/home/pratik/projects/GenderBias_TrendAnalysis/dataset/2020s/Animal.2023.1080p.NF.WEB-DL.DDP5.1.H.srt,"01:31:04,250","01:31:08,500","- Hey, Dolby-guy, call for the DJ - Voice it up one time!","<i>- Hey, Dolby-guy, call for the DJ
- Voice it up one time!</i>"
animal-2023-1080p-nf-web-dl-ddp5-1-h,2020s,/home/pratik/projects/GenderBias_TrendAnalysis/dataset/2020s/Animal.2023.1080p.NF.WEB-DL.DDP5.1.H.srt,"01:31:08,583","01:31:10,750",Bounce the music I am a get all-round,"<i>Bounce the music
I am a get all-round</i>"
animal-2023-1080p-nf-web-dl-ddp5-1-h,2020s,/home/pratik/projects/GenderBias_TrendAnalysis/dataset/2020s/Animal.2023.1080p.NF.WEB-DL.DDP5.1.H.srt,"01:31:10,833","01:31:12,958",Heat it up on the beat up the sound,<i>Heat it up on the beat up the sound</i>
animal-2023-1080p-nf-web-dl-ddp5-1-h,2020s,/home/pratik/projects/GenderBias_TrendAnalysis/dataset/2020s/Animal.2023.1080p.NF.WEB-DL.DDP5.1.H.srt,"01:31:18,916","01:31:22,041",That fellow took my headphones as well.,That fellow took my headphones as well.
animal-2023-1080p-nf-web-dl-ddp5-1-h,2020s,/home/pratik/projects/GenderBias_TrendAnalysis/dataset/2020s/Animal.2023.1080p.NF.WEB-DL.DDP5.1.H.srt,"01:31:22,375","01:31:23,500",- Sir! - Hey!,"- Sir!
- Hey!"
animal-2023-1080p-nf-web-dl-ddp5-1-h,2020s,/home/pratik/projects/GenderBias_TrendAnalysis/dataset/2020s/Animal.2023.1080p.NF.WEB-DL.DDP5.1.H.srt,"01:31:25,083","01:31:29,291","- Sir, you want my underwear? - What?","- Sir, you want my underwear?
- What?"
animal-2023-1080p-nf-web-dl-ddp5-1-h,2020s,/home/pratik/projects/GenderBias_TrendAnalysis/dataset/2020s/Animal.2023.1080p.NF.WEB-DL.DDP5.1.H.srt,"01:31:29,375","01:31:31,666",He keeps playing peppy songs,<i>He keeps playing peppy songs</i>
animal-2023-1080p-nf-web-dl-ddp5-1-h,2020s,/home/pratik/projects/GenderBias_TrendAnalysis/dataset/2020s/Animal.2023.1080p.NF.WEB-DL.DDP5.1.H.srt,"01:31:31,833","01:31:36,750",Brother fills his glass And goes bottoms up once more,"<i>Brother fills his glass
And goes bottoms up once more</i>"
animal-2023-1080p-nf-web-dl-ddp5-1-h,2020s,/home/pratik/projects/GenderBias_TrendAnalysis/dataset/2020s/Animal.2023.1080p.NF.WEB-DL.DDP5.1.H.srt,"01:31:41,666","01:31:43,375",DJ is in the mood now,<i>DJ is in the mood now</i>
animal-2023-1080p-nf-web-dl-ddp5-1-h,2020s,/home/pratik/projects/GenderBias_TrendAnalysis/dataset/2020s/Animal.2023.1080p.NF.WEB-DL.DDP5.1.H.srt,"01:31:43,458","01:31:46,041",He keeps playing peppy songs For us to rock the dance floor,"<i>He keeps playing peppy songs
For us to rock the dance floor</i>"
animal-2023-1080p-nf-web-dl-ddp5-1-h,2020s,/home/pratik/projects/GenderBias_TrendAnalysis/dataset/2020s/Animal.2023.1080p.NF.WEB-DL.DDP5.1.H.srt,"01:31:46,250","01:31:50,333",Brother fills his glass And goes bottoms up once more,"<i>Brother fills his glass
And goes bottoms up once more</i>"
animal-2023-1080p-nf-web-dl-ddp5-1-h,2020s,/home/pratik/projects/GenderBias_TrendAnalysis/dataset/2020s/Animal.2023.1080p.NF.WEB-DL.DDP5.1.H.srt,"01:31:50,583","01:31:52,916",He's recharged and ready Feeling the dance floor,"<i>He's recharged and ready
Feeling the dance floor</i>"
animal-2023-1080p-nf-web-dl-ddp5-1-h,2020s,/home/pratik/projects/GenderBias_TrendAnalysis/dataset/2020s/Animal.2023.1080p.NF.WEB-DL.DDP5.1.H.srt,"01:31:53,000","01:31:55,083",Now he's playing lezim with great zest,<i>Now he's playing lezim with great zest</i>
animal-2023-1080p-nf-web-dl-ddp5-1-h,2020s,/home/pratik/projects/GenderBias_TrendAnalysis/dataset/2020s/Animal.2023.1080p.NF.WEB-DL.DDP5.1.H.srt,"01:31:55,166","01:31:57,291","Pintya sits tired, needing some rest","<i>Pintya sits tired, needing some rest</i>"
animal-2023-1080p-nf-web-dl-ddp5-1-h,2020s,/home/pratik/projects/GenderBias_TrendAnalysis/dataset/2020s/Animal.2023.1080p.NF.WEB-DL.DDP5.1.H.srt,"01:31:57,375","01:31:59,916",But brother pulls him back Doesn't let him go,"<i>But brother pulls him back
Doesn't let him go</i>"
animal-2023-1080p-nf-web-dl-ddp5-1-h,2020s,/home/pratik/projects/GenderBias_TrendAnalysis/dataset/2020s/Animal.2023.1080p.NF.WEB-DL.DDP5.1.H.srt,"01:32:00,125","01:32:01,458",He kicked him then...,<i>He kicked him then...</i>
animal-2023-1080p-nf-web-dl-ddp5-1-h,2020s,/home/pratik/projects/GenderBias_TrendAnalysis/dataset/2020s/Animal.2023.1080p.NF.WEB-DL.DDP5.1.H.srt,"01:32:04,291","01:32:06,958",- He said we are friends forever... - Balli! How many left?,"<i>- He said we are friends forever...</i>
- Balli! How many left?"
animal-2023-1080p-nf-web-dl-ddp5-1-h,2020s,/home/pratik/projects/GenderBias_TrendAnalysis/dataset/2020s/Animal.2023.1080p.NF.WEB-DL.DDP5.1.H.srt,"01:32:07,041","01:32:08,750",- Like the drum and the cymbals - Fourteen.,"<i>- Like the drum and the cymbals</i>
- Fourteen."
animal-2023-1080p-nf-web-dl-ddp5-1-h,2020s,/home/pratik/projects/GenderBias_TrendAnalysis/dataset/2020s/Animal.2023.1080p.NF.WEB-DL.DDP5.1.H.srt,"01:32:08,833","01:32:11,125",- Stay focused. - We are meant to be together,"- Stay focused.
<i>- We are meant to be together</i>"
animal-2023-1080p-nf-web-dl-ddp5-1-h,2020s,/home/pratik/projects/GenderBias_TrendAnalysis/dataset/2020s/Animal.2023.1080p.NF.WEB-DL.DDP5.1.H.srt,"01:32:11,208","01:32:15,500","- Hey, Dolby-guy... - Call for the DJ","<i>- Hey, Dolby-guy...
- Call for the DJ</i>"
animal-2023-1080p-nf-web-dl-ddp5-1-h,2020s,/home/pratik/projects/GenderBias_TrendAnalysis/dataset/2020s/Animal.2023.1080p.NF.WEB-DL.DDP5.1.H.srt,"01:32:15,625","01:32:19,916","- Hey, Dolby-guy... - Call for the DJ","<i>- Hey, Dolby-guy...
- Call for the DJ</i>"
animal-2023-1080p-nf-web-dl-ddp5-1-h,2020s,/home/pratik/projects/GenderBias_TrendAnalysis/dataset/2020s/Animal.2023.1080p.NF.WEB-DL.DDP5.1.H.srt,"01:32:20,000","01:32:24,625","- Hey, Dolby-guy... - Call for the DJ","<i>- Hey, Dolby-guy...
- Call for the DJ</i>"
animal-2023-1080p-nf-web-dl-ddp5-1-h,2020s,/home/pratik/projects/GenderBias_TrendAnalysis/dataset/2020s/Animal.2023.1080p.NF.WEB-DL.DDP5.1.H.srt,"01:32:24,708","01:32:28,833","Hey, Dolby-guy, call for the DJ","<i>Hey, Dolby-guy, call for the DJ</i>"
animal-2023-1080p-nf-web-dl-ddp5-1-h,2020s,/home/pratik/projects/GenderBias_TrendAnalysis/dataset/2020s/Animal.2023.1080p.NF.WEB-DL.DDP5.1.H.srt,"01:32:28,916","01:32:33,250","- Hey, Dolby-guy, call for the DJ - Come on!","<i>- Hey, Dolby-guy, call for the DJ
- Come on!</i>"
animal-2023-1080p-nf-web-dl-ddp5-1-h,2020s,/home/pratik/projects/GenderBias_TrendAnalysis/dataset/2020s/Animal.2023.1080p.NF.WEB-DL.DDP5.1.H.srt,"01:32:33,333","01:32:37,375","- Hey, Dolby-guy, call for the DJ - Come on!","<i>- Hey, Dolby-guy, call for the DJ
- Come on!</i>"
