film_id,decade,file_path,start,end,text_clean,text_raw
animal-2023-1080p-nf-web-dl-ddp5-1-h,2020s,/home/pratik/projects/GenderBias_TrendAnalysis/dataset/2020s/Animal.2023.1080p.NF.WEB-DL.DDP5.1.H.srt,"00:01:00,041","00:01:01,666",POWER PROGRESS VICTORY,POWER PROGRESS VICTORY
animal-2023-1080p-nf-web-dl-ddp5-1-h,2020s,/home/pratik/projects/GenderBias_TrendAnalysis/dataset/2020s/Animal.2023.1080p.NF.WEB-DL.DDP5.1.H.srt,"00:01:06,500","00:01:09,958","40th birthday, 50th birthday, 60th birthday...","40th birthday, 50th birthday,
60th birthday..."
animal-2023-1080p-nf-web-dl-ddp5-1-h,2020s,/home/pratik/projects/GenderBias_TrendAnalysis/dataset/2020s/Animal.2023.1080p.NF.WEB-DL.DDP5.1.H.srt,"00:01:12,291","00:01:13,750",There hasn't been a single birthday,There hasn't been a single birthday
animal-2023-1080p-nf-web-dl-ddp5-1-h,2020s,/home/pratik/projects/GenderBias_TrendAnalysis/dataset/2020s/Animal.2023.1080p.NF.WEB-DL.DDP5.1.H.srt,"00:01:13,833","00:01:16,375","where I peacefully greeted him with ""Happy birthday, Papa.""","where I peacefully greeted him
with ""Happy birthday, Papa."""
animal-2023-1080p-nf-web-dl-ddp5-1-h,2020s,/home/pratik/projects/GenderBias_TrendAnalysis/dataset/2020s/Animal.2023.1080p.NF.WEB-DL.DDP5.1.H.srt,"00:01:20,250","00:01:24,000",We always fought over one thing or another.,"We always fought over
one thing or another."
animal-2023-1080p-nf-web-dl-ddp5-1-h,2020s,/home/pratik/projects/GenderBias_TrendAnalysis/dataset/2020s/Animal.2023.1080p.NF.WEB-DL.DDP5.1.H.srt,"00:01:25,791","00:01:27,416","Brother, it's seven o'clock in the morning.","Brother, it's seven o'clock
in the morning."
animal-2023-1080p-nf-web-dl-ddp5-1-h,2020s,/home/pratik/projects/GenderBias_TrendAnalysis/dataset/2020s/Animal.2023.1080p.NF.WEB-DL.DDP5.1.H.srt,"00:01:27,916","00:01:29,125",How much more do you wish to drink?,How much more do you wish to drink?
animal-2023-1080p-nf-web-dl-ddp5-1-h,2020s,/home/pratik/projects/GenderBias_TrendAnalysis/dataset/2020s/Animal.2023.1080p.NF.WEB-DL.DDP5.1.H.srt,"00:01:29,666","00:01:33,500","Papa used to say that when your son will become like you,","Papa used to say that
when your son will become like you,"
animal-2023-1080p-nf-web-dl-ddp5-1-h,2020s,/home/pratik/projects/GenderBias_TrendAnalysis/dataset/2020s/Animal.2023.1080p.NF.WEB-DL.DDP5.1.H.srt,"00:01:34,416","00:01:35,625",then you'll understand how I feel.,{\an8}then you'll understand how I feel.
animal-2023-1080p-nf-web-dl-ddp5-1-h,2020s,/home/pratik/projects/GenderBias_TrendAnalysis/dataset/2020s/Animal.2023.1080p.NF.WEB-DL.DDP5.1.H.srt,"00:01:39,833","00:01:42,208","And I used to tell him, ""Papa, when I didn't turn out to be like you...","{\an8}And I used to tell him, ""Papa, when
I didn't turn out to be like you..."
animal-2023-1080p-nf-web-dl-ddp5-1-h,2020s,/home/pratik/projects/GenderBias_TrendAnalysis/dataset/2020s/Animal.2023.1080p.NF.WEB-DL.DDP5.1.H.srt,"00:01:43,541","00:01:45,625","then why would my son turn out to be like me?""","then why would my son
turn out to be like me?"""
animal-2023-1080p-nf-web-dl-ddp5-1-h,2020s,/home/pratik/projects/GenderBias_TrendAnalysis/dataset/2020s/Animal.2023.1080p.NF.WEB-DL.DDP5.1.H.srt,"00:01:55,000","00:01:56,208","Once upon a time, there was this king","Once upon a time,
there was this king"
animal-2023-1080p-nf-web-dl-ddp5-1-h,2020s,/home/pratik/projects/GenderBias_TrendAnalysis/dataset/2020s/Animal.2023.1080p.NF.WEB-DL.DDP5.1.H.srt,"00:01:56,291","00:01:58,500","who had a sexy daughter, a young princess.","who had a sexy daughter,
a young princess."
animal-2023-1080p-nf-web-dl-ddp5-1-h,2020s,/home/pratik/projects/GenderBias_TrendAnalysis/dataset/2020s/Animal.2023.1080p.NF.WEB-DL.DDP5.1.H.srt,"00:01:59,750","00:02:01,416","One day, she was taking a bath out in the jungle,","One day, she was taking
a bath out in the jungle,"
animal-2023-1080p-nf-web-dl-ddp5-1-h,2020s,/home/pratik/projects/GenderBias_TrendAnalysis/dataset/2020s/Animal.2023.1080p.NF.WEB-DL.DDP5.1.H.srt,"00:02:01,500","00:02:04,208",and this monkey showed up and started mimicking and teasing her.,"and this monkey showed up
and started mimicking and teasing her."
animal-2023-1080p-nf-web-dl-ddp5-1-h,2020s,/home/pratik/projects/GenderBias_TrendAnalysis/dataset/2020s/Animal.2023.1080p.NF.WEB-DL.DDP5.1.H.srt,"00:02:04,750","00:02:07,291",Princess got angry and splashed water at the monkey.,"Princess got angry
and splashed water at the monkey."
animal-2023-1080p-nf-web-dl-ddp5-1-h,2020s,/home/pratik/projects/GenderBias_TrendAnalysis/dataset/2020s/Animal.2023.1080p.NF.WEB-DL.DDP5.1.H.srt,"00:02:07,875","00:02:10,083","The monkey splashed water back at her, and he gestured...","The monkey splashed water
back at her, and he gestured..."
animal-2023-1080p-nf-web-dl-ddp5-1-h,2020s,/home/pratik/projects/GenderBias_TrendAnalysis/dataset/2020s/Animal.2023.1080p.NF.WEB-DL.DDP5.1.H.srt,"00:02:13,916","00:02:16,250","Princess got upset, obviously.","Princess got upset, obviously."
animal-2023-1080p-nf-web-dl-ddp5-1-h,2020s,/home/pratik/projects/GenderBias_TrendAnalysis/dataset/2020s/Animal.2023.1080p.NF.WEB-DL.DDP5.1.H.srt,"00:02:16,750","00:02:18,166","She went straight to the king and told him,","She went straight to the king
and told him,"
animal-2023-1080p-nf-web-dl-ddp5-1-h,2020s,/home/pratik/projects/GenderBias_TrendAnalysis/dataset/2020s/Animal.2023.1080p.NF.WEB-DL.DDP5.1.H.srt,"00:02:18,250","00:02:21,250","""Papa, there is a toxic monkey in the jungle teasing me!","""Papa, there is a toxic monkey
in the jungle teasing me!"
animal-2023-1080p-nf-web-dl-ddp5-1-h,2020s,/home/pratik/projects/GenderBias_TrendAnalysis/dataset/2020s/Animal.2023.1080p.NF.WEB-DL.DDP5.1.H.srt,"00:02:22,916","00:02:24,166","He is making such lewd gestures.""","He is making such lewd gestures."""
animal-2023-1080p-nf-web-dl-ddp5-1-h,2020s,/home/pratik/projects/GenderBias_TrendAnalysis/dataset/2020s/Animal.2023.1080p.NF.WEB-DL.DDP5.1.H.srt,"00:02:24,791","00:02:25,791",The king got furious.,The king got furious.
animal-2023-1080p-nf-web-dl-ddp5-1-h,2020s,/home/pratik/projects/GenderBias_TrendAnalysis/dataset/2020s/Animal.2023.1080p.NF.WEB-DL.DDP5.1.H.srt,"00:02:25,916","00:02:28,125","He called his minister over and said, ""What the fuck!","He called his minister over and said,
""What the fuck!"
animal-2023-1080p-nf-web-dl-ddp5-1-h,2020s,/home/pratik/projects/GenderBias_TrendAnalysis/dataset/2020s/Animal.2023.1080p.NF.WEB-DL.DDP5.1.H.srt,"00:02:28,333","00:02:31,208",There's a cheeky monkey in the jungle messing with my daughter.,"There's a cheeky monkey
in the jungle messing with my daughter."
animal-2023-1080p-nf-web-dl-ddp5-1-h,2020s,/home/pratik/projects/GenderBias_TrendAnalysis/dataset/2020s/Animal.2023.1080p.NF.WEB-DL.DDP5.1.H.srt,"00:02:31,291","00:02:32,666","Go and deal with him.""","Go and deal with him."""
animal-2023-1080p-nf-web-dl-ddp5-1-h,2020s,/home/pratik/projects/GenderBias_TrendAnalysis/dataset/2020s/Animal.2023.1080p.NF.WEB-DL.DDP5.1.H.srt,"00:02:33,333","00:02:35,416","The minister went up to the monkey and asked him,","The minister went up to the monkey
and asked him,"
animal-2023-1080p-nf-web-dl-ddp5-1-h,2020s,/home/pratik/projects/GenderBias_TrendAnalysis/dataset/2020s/Animal.2023.1080p.NF.WEB-DL.DDP5.1.H.srt,"00:02:35,500","00:02:37,000","""What do you think you're doing, dude?","""What do you think you're doing, dude?"
animal-2023-1080p-nf-web-dl-ddp5-1-h,2020s,/home/pratik/projects/GenderBias_TrendAnalysis/dataset/2020s/Animal.2023.1080p.NF.WEB-DL.DDP5.1.H.srt,"00:02:37,666","00:02:39,416","You're freaking out the entire royal court.""","You're freaking out
the entire royal court."""
animal-2023-1080p-nf-web-dl-ddp5-1-h,2020s,/home/pratik/projects/GenderBias_TrendAnalysis/dataset/2020s/Animal.2023.1080p.NF.WEB-DL.DDP5.1.H.srt,"00:02:39,791","00:02:42,375","And the monkey said, ""What do you think you're doing, dude?","And the monkey said,
""What do you think you're doing, dude?"
animal-2023-1080p-nf-web-dl-ddp5-1-h,2020s,/home/pratik/projects/GenderBias_TrendAnalysis/dataset/2020s/Animal.2023.1080p.NF.WEB-DL.DDP5.1.H.srt,"00:02:42,666","00:02:44,333","You're freaking out the entire royal court.""","You're freaking out
the entire royal court."""
animal-2023-1080p-nf-web-dl-ddp5-1-h,2020s,/home/pratik/projects/GenderBias_TrendAnalysis/dataset/2020s/Animal.2023.1080p.NF.WEB-DL.DDP5.1.H.srt,"00:02:44,916","00:02:48,291","Whatever the minister did or said, the monkey would repeat it.","Whatever the minister did or said,
the monkey would repeat it."
animal-2023-1080p-nf-web-dl-ddp5-1-h,2020s,/home/pratik/projects/GenderBias_TrendAnalysis/dataset/2020s/Animal.2023.1080p.NF.WEB-DL.DDP5.1.H.srt,"00:02:49,166","00:02:52,958",The minister got all confused and started racking his brain.,"The minister got all confused
and started racking his brain."
animal-2023-1080p-nf-web-dl-ddp5-1-h,2020s,/home/pratik/projects/GenderBias_TrendAnalysis/dataset/2020s/Animal.2023.1080p.NF.WEB-DL.DDP5.1.H.srt,"00:02:53,208","00:02:54,125",Then he got an idea!,Then he got an idea!
animal-2023-1080p-nf-web-dl-ddp5-1-h,2020s,/home/pratik/projects/GenderBias_TrendAnalysis/dataset/2020s/Animal.2023.1080p.NF.WEB-DL.DDP5.1.H.srt,"00:02:54,333","00:02:57,375","He summoned two swords, one real and one fake.","He summoned two swords,
one real and one fake."
animal-2023-1080p-nf-web-dl-ddp5-1-h,2020s,/home/pratik/projects/GenderBias_TrendAnalysis/dataset/2020s/Animal.2023.1080p.NF.WEB-DL.DDP5.1.H.srt,"00:02:57,666","00:02:59,000","He kept the fake one for himself,","He kept the fake one for himself,"
animal-2023-1080p-nf-web-dl-ddp5-1-h,2020s,/home/pratik/projects/GenderBias_TrendAnalysis/dataset/2020s/Animal.2023.1080p.NF.WEB-DL.DDP5.1.H.srt,"00:02:59,375","00:03:01,375",and he threw the real sword towards the monkey.,"and he threw the real sword towards
the monkey."
animal-2023-1080p-nf-web-dl-ddp5-1-h,2020s,/home/pratik/projects/GenderBias_TrendAnalysis/dataset/2020s/Animal.2023.1080p.NF.WEB-DL.DDP5.1.H.srt,"00:03:02,083","00:03:03,500","Then, he took the fake sword and...","Then, he took the fake sword and..."
animal-2023-1080p-nf-web-dl-ddp5-1-h,2020s,/home/pratik/projects/GenderBias_TrendAnalysis/dataset/2020s/Animal.2023.1080p.NF.WEB-DL.DDP5.1.H.srt,"00:03:09,291","00:03:10,875",pretended to act all dramatic like he was dying.,"pretended to act all dramatic
like he was dying."
animal-2023-1080p-nf-web-dl-ddp5-1-h,2020s,/home/pratik/projects/GenderBias_TrendAnalysis/dataset/2020s/Animal.2023.1080p.NF.WEB-DL.DDP5.1.H.srt,"00:03:11,833","00:03:13,166",The monkey saw this...,The monkey saw this...
animal-2023-1080p-nf-web-dl-ddp5-1-h,2020s,/home/pratik/projects/GenderBias_TrendAnalysis/dataset/2020s/Animal.2023.1080p.NF.WEB-DL.DDP5.1.H.srt,"00:03:13,875","00:03:15,500",grabbed the real sword and went...,grabbed the real sword and went...
animal-2023-1080p-nf-web-dl-ddp5-1-h,2020s,/home/pratik/projects/GenderBias_TrendAnalysis/dataset/2020s/Animal.2023.1080p.NF.WEB-DL.DDP5.1.H.srt,"00:03:22,541","00:03:23,541",Hey!,Hey!
animal-2023-1080p-nf-web-dl-ddp5-1-h,2020s,/home/pratik/projects/GenderBias_TrendAnalysis/dataset/2020s/Animal.2023.1080p.NF.WEB-DL.DDP5.1.H.srt,"00:03:34,166","00:03:35,875",Silence! Silence!,<i>Silence! Silence!</i>
animal-2023-1080p-nf-web-dl-ddp5-1-h,2020s,/home/pratik/projects/GenderBias_TrendAnalysis/dataset/2020s/Animal.2023.1080p.NF.WEB-DL.DDP5.1.H.srt,"00:03:36,041","00:03:37,166","Silence, class!","<i>Silence, class!</i>"
animal-2023-1080p-nf-web-dl-ddp5-1-h,2020s,/home/pratik/projects/GenderBias_TrendAnalysis/dataset/2020s/Animal.2023.1080p.NF.WEB-DL.DDP5.1.H.srt,"00:03:37,916","00:03:39,750","Now, children, behave yourselves!","{\an8}<i>Now, children, behave yourselves!</i>"
animal-2023-1080p-nf-web-dl-ddp5-1-h,2020s,/home/pratik/projects/GenderBias_TrendAnalysis/dataset/2020s/Animal.2023.1080p.NF.WEB-DL.DDP5.1.H.srt,"00:03:40,166","00:03:42,333",Who will define what an animal is?,{\an8}<i>Who will define what an animal is?</i>
animal-2023-1080p-nf-web-dl-ddp5-1-h,2020s,/home/pratik/projects/GenderBias_TrendAnalysis/dataset/2020s/Animal.2023.1080p.NF.WEB-DL.DDP5.1.H.srt,"00:03:44,875","00:03:49,416",Animals are multicellular organisms in the biological kingdom Animalia.,"Animals are multicellular organisms
in the biological kingdom Animalia."
animal-2023-1080p-nf-web-dl-ddp5-1-h,2020s,/home/pratik/projects/GenderBias_TrendAnalysis/dataset/2020s/Animal.2023.1080p.NF.WEB-DL.DDP5.1.H.srt,"00:03:49,833","00:03:52,041","Animals consume organic material,","Animals consume organic material,"
animal-2023-1080p-nf-web-dl-ddp5-1-h,2020s,/home/pratik/projects/GenderBias_TrendAnalysis/dataset/2020s/Animal.2023.1080p.NF.WEB-DL.DDP5.1.H.srt,"00:03:52,125","00:03:53,791",breathe oxygen and reproduce.,breathe oxygen and reproduce.
animal-2023-1080p-nf-web-dl-ddp5-1-h,2020s,/home/pratik/projects/GenderBias_TrendAnalysis/dataset/2020s/Animal.2023.1080p.NF.WEB-DL.DDP5.1.H.srt,"00:03:53,875","00:03:57,250","The word ""animal"" comes from the Latin animalis,","The word ""animal""
comes from the Latin animalis,"
animal-2023-1080p-nf-web-dl-ddp5-1-h,2020s,/home/pratik/projects/GenderBias_TrendAnalysis/dataset/2020s/Animal.2023.1080p.NF.WEB-DL.DDP5.1.H.srt,"00:03:57,416","00:04:00,125","meaning ""having breath or soul"".","meaning ""having breath or soul""."
animal-2023-1080p-nf-web-dl-ddp5-1-h,2020s,/home/pratik/projects/GenderBias_TrendAnalysis/dataset/2020s/Animal.2023.1080p.NF.WEB-DL.DDP5.1.H.srt,"00:04:00,541","00:04:01,666",Where are you going?,Where are you going?
animal-2023-1080p-nf-web-dl-ddp5-1-h,2020s,/home/pratik/projects/GenderBias_TrendAnalysis/dataset/2020s/Animal.2023.1080p.NF.WEB-DL.DDP5.1.H.srt,"00:04:01,791","00:04:05,125","- How dare you disturb my class? - Ma'am, my sisters have come.","- How dare you disturb my class?
- Ma'am, my sisters have come."
animal-2023-1080p-nf-web-dl-ddp5-1-h,2020s,/home/pratik/projects/GenderBias_TrendAnalysis/dataset/2020s/Animal.2023.1080p.NF.WEB-DL.DDP5.1.H.srt,"00:04:05,208","00:04:07,333",- Show me your hand. - Today's my father's birthday.,"- Show me your hand.
- Today's my father's birthday."
animal-2023-1080p-nf-web-dl-ddp5-1-h,2020s,/home/pratik/projects/GenderBias_TrendAnalysis/dataset/2020s/Animal.2023.1080p.NF.WEB-DL.DDP5.1.H.srt,"00:04:07,416","00:04:08,666",Show me your hand!,Show me your hand!
animal-2023-1080p-nf-web-dl-ddp5-1-h,2020s,/home/pratik/projects/GenderBias_TrendAnalysis/dataset/2020s/Animal.2023.1080p.NF.WEB-DL.DDP5.1.H.srt,"00:04:13,625","00:04:14,500",Hand up!,Hand up!
animal-2023-1080p-nf-web-dl-ddp5-1-h,2020s,/home/pratik/projects/GenderBias_TrendAnalysis/dataset/2020s/Animal.2023.1080p.NF.WEB-DL.DDP5.1.H.srt,"00:04:16,166","00:04:19,041",Just go and kneel down there till the class gets over!,"Just go and kneel down there
till the class gets over!"
animal-2023-1080p-nf-web-dl-ddp5-1-h,2020s,/home/pratik/projects/GenderBias_TrendAnalysis/dataset/2020s/Animal.2023.1080p.NF.WEB-DL.DDP5.1.H.srt,"00:04:26,500","00:04:30,333","So, in carnivorous and omnivorous species,","So, in carnivorous
and omnivorous species,"
animal-2023-1080p-nf-web-dl-ddp5-1-h,2020s,/home/pratik/projects/GenderBias_TrendAnalysis/dataset/2020s/Animal.2023.1080p.NF.WEB-DL.DDP5.1.H.srt,"00:04:30,666","00:04:34,708",the predators feed on the another organism called its prey.,"the predators feed
on the another organism called its prey."
animal-2023-1080p-nf-web-dl-ddp5-1-h,2020s,/home/pratik/projects/GenderBias_TrendAnalysis/dataset/2020s/Animal.2023.1080p.NF.WEB-DL.DDP5.1.H.srt,"00:04:34,791","00:04:36,166","- Understood? - Yes, ma'am.","- Understood?
- Yes, ma'am."
animal-2023-1080p-nf-web-dl-ddp5-1-h,2020s,/home/pratik/projects/GenderBias_TrendAnalysis/dataset/2020s/Animal.2023.1080p.NF.WEB-DL.DDP5.1.H.srt,"00:04:36,250","00:04:38,625",There is one star in my sky,{\an8}<i>There is one star in my sky</i>
animal-2023-1080p-nf-web-dl-ddp5-1-h,2020s,/home/pratik/projects/GenderBias_TrendAnalysis/dataset/2020s/Animal.2023.1080p.NF.WEB-DL.DDP5.1.H.srt,"00:04:38,708","00:04:42,458",And that one star is you,{\an8}<i>And that one star is you</i>
animal-2023-1080p-nf-web-dl-ddp5-1-h,2020s,/home/pratik/projects/GenderBias_TrendAnalysis/dataset/2020s/Animal.2023.1080p.NF.WEB-DL.DDP5.1.H.srt,"00:04:43,083","00:04:47,250",I have no one but you,<i>I have no one but you</i>
animal-2023-1080p-nf-web-dl-ddp5-1-h,2020s,/home/pratik/projects/GenderBias_TrendAnalysis/dataset/2020s/Animal.2023.1080p.NF.WEB-DL.DDP5.1.H.srt,"00:04:47,541","00:04:51,416",You are my whole world,{\an8}<i>You are my whole world</i>
animal-2023-1080p-nf-web-dl-ddp5-1-h,2020s,/home/pratik/projects/GenderBias_TrendAnalysis/dataset/2020s/Animal.2023.1080p.NF.WEB-DL.DDP5.1.H.srt,"00:04:51,500","00:04:55,791",I put you in a place,{\an8}<i>I put you in a place</i>
animal-2023-1080p-nf-web-dl-ddp5-1-h,2020s,/home/pratik/projects/GenderBias_TrendAnalysis/dataset/2020s/Animal.2023.1080p.NF.WEB-DL.DDP5.1.H.srt,"00:04:56,041","00:05:00,083",Where no one is,{\an8}<i>Where no one is</i>
animal-2023-1080p-nf-web-dl-ddp5-1-h,2020s,/home/pratik/projects/GenderBias_TrendAnalysis/dataset/2020s/Animal.2023.1080p.NF.WEB-DL.DDP5.1.H.srt,"00:05:00,708","00:05:02,833","Papa, my life","{\an8}<i>Papa, my life</i>"
animal-2023-1080p-nf-web-dl-ddp5-1-h,2020s,/home/pratik/projects/GenderBias_TrendAnalysis/dataset/2020s/Animal.2023.1080p.NF.WEB-DL.DDP5.1.H.srt,"00:05:02,916","00:05:08,875",Keep your hand on my head every moment,{\an8}<i>Keep your hand on my head every moment</i>
animal-2023-1080p-nf-web-dl-ddp5-1-h,2020s,/home/pratik/projects/GenderBias_TrendAnalysis/dataset/2020s/Animal.2023.1080p.NF.WEB-DL.DDP5.1.H.srt,"00:05:09,166","00:05:13,791","- Papa! - Papa, my life, walk with me","{\an8}- Papa!
<i>- Papa, my life, walk with me</i>"
animal-2023-1080p-nf-web-dl-ddp5-1-h,2020s,/home/pratik/projects/GenderBias_TrendAnalysis/dataset/2020s/Animal.2023.1080p.NF.WEB-DL.DDP5.1.H.srt,"00:05:13,958","00:05:17,875",You are the stone in every river,{\an8}<i>You are the stone in every river</i>
animal-2023-1080p-nf-web-dl-ddp5-1-h,2020s,/home/pratik/projects/GenderBias_TrendAnalysis/dataset/2020s/Animal.2023.1080p.NF.WEB-DL.DDP5.1.H.srt,"00:05:18,000","00:05:20,166",For me,{\an8}<i>For me</i>
animal-2023-1080p-nf-web-dl-ddp5-1-h,2020s,/home/pratik/projects/GenderBias_TrendAnalysis/dataset/2020s/Animal.2023.1080p.NF.WEB-DL.DDP5.1.H.srt,"00:05:20,250","00:05:26,375",These methods stop with you,{\an8}<i>These methods stop with you</i>
animal-2023-1080p-nf-web-dl-ddp5-1-h,2020s,/home/pratik/projects/GenderBias_TrendAnalysis/dataset/2020s/Animal.2023.1080p.NF.WEB-DL.DDP5.1.H.srt,"00:05:27,083","00:05:29,291","-Papa, my life - Papa!","{\an8}<i>-Papa, my life</i>
- Papa!"
animal-2023-1080p-nf-web-dl-ddp5-1-h,2020s,/home/pratik/projects/GenderBias_TrendAnalysis/dataset/2020s/Animal.2023.1080p.NF.WEB-DL.DDP5.1.H.srt,"00:05:29,375","00:05:35,125",-Keep your hand on my head every moment - Papa!,"{\an8}<i>-Keep your hand on my head every moment</i>
- Papa!"
animal-2023-1080p-nf-web-dl-ddp5-1-h,2020s,/home/pratik/projects/GenderBias_TrendAnalysis/dataset/2020s/Animal.2023.1080p.NF.WEB-DL.DDP5.1.H.srt,"00:05:35,875","00:05:40,166","-Papa, my life, walk with me - Papa!","{\an8}<i>-Papa, my life, walk with me</i>
- Papa!"
animal-2023-1080p-nf-web-dl-ddp5-1-h,2020s,/home/pratik/projects/GenderBias_TrendAnalysis/dataset/2020s/Animal.2023.1080p.NF.WEB-DL.DDP5.1.H.srt,"00:05:40,375","00:05:44,083",You are the stone in every river,{\an8}<i>You are the stone in every river</i>
animal-2023-1080p-nf-web-dl-ddp5-1-h,2020s,/home/pratik/projects/GenderBias_TrendAnalysis/dataset/2020s/Animal.2023.1080p.NF.WEB-DL.DDP5.1.H.srt,"00:05:44,416","00:05:46,500",For me,{\an8}<i>For me</i>
animal-2023-1080p-nf-web-dl-ddp5-1-h,2020s,/home/pratik/projects/GenderBias_TrendAnalysis/dataset/2020s/Animal.2023.1080p.NF.WEB-DL.DDP5.1.H.srt,"00:05:46,625","00:05:52,833",-These methods stop with you - Papa!,"{\an8}<i>-These methods stop with you</i>
- Papa!"
animal-2023-1080p-nf-web-dl-ddp5-1-h,2020s,/home/pratik/projects/GenderBias_TrendAnalysis/dataset/2020s/Animal.2023.1080p.NF.WEB-DL.DDP5.1.H.srt,"00:05:53,833","00:05:54,791",Mom!,{\an8}Mom!
animal-2023-1080p-nf-web-dl-ddp5-1-h,2020s,/home/pratik/projects/GenderBias_TrendAnalysis/dataset/2020s/Animal.2023.1080p.NF.WEB-DL.DDP5.1.H.srt,"00:06:00,291","00:06:01,833","Mom, where's Papa?","Mom, where's Papa?"
animal-2023-1080p-nf-web-dl-ddp5-1-h,2020s,/home/pratik/projects/GenderBias_TrendAnalysis/dataset/2020s/Animal.2023.1080p.NF.WEB-DL.DDP5.1.H.srt,"00:06:02,208","00:06:04,708",You know he is a very busy man.,You know he is a very busy man.
animal-2023-1080p-nf-web-dl-ddp5-1-h,2020s,/home/pratik/projects/GenderBias_TrendAnalysis/dataset/2020s/Animal.2023.1080p.NF.WEB-DL.DDP5.1.H.srt,"00:06:05,416","00:06:07,208","He had to rush to the factory, son.","He had to rush to the factory, son."
animal-2023-1080p-nf-web-dl-ddp5-1-h,2020s,/home/pratik/projects/GenderBias_TrendAnalysis/dataset/2020s/Animal.2023.1080p.NF.WEB-DL.DDP5.1.H.srt,"00:06:07,541","00:06:09,625","Hey, let's make a clone of your father...","Hey, let's make a clone of your father..."
animal-2023-1080p-nf-web-dl-ddp5-1-h,2020s,/home/pratik/projects/GenderBias_TrendAnalysis/dataset/2020s/Animal.2023.1080p.NF.WEB-DL.DDP5.1.H.srt,"00:06:10,125","00:06:12,416",so we can have one at home and one at the office.,"so we can have one at home
and one at the office."
animal-2023-1080p-nf-web-dl-ddp5-1-h,2020s,/home/pratik/projects/GenderBias_TrendAnalysis/dataset/2020s/Animal.2023.1080p.NF.WEB-DL.DDP5.1.H.srt,"00:06:12,666","00:06:14,166",Cloning takes too long.,Cloning takes too long.
animal-2023-1080p-nf-web-dl-ddp5-1-h,2020s,/home/pratik/projects/GenderBias_TrendAnalysis/dataset/2020s/Animal.2023.1080p.NF.WEB-DL.DDP5.1.H.srt,"00:06:14,541","00:06:16,000",We'll have to find a body double.,We'll have to find a body double.
animal-2023-1080p-nf-web-dl-ddp5-1-h,2020s,/home/pratik/projects/GenderBias_TrendAnalysis/dataset/2020s/Animal.2023.1080p.NF.WEB-DL.DDP5.1.H.srt,"00:06:16,791","00:06:18,333","But no matter how many lookalikes we find,","But no matter
how many lookalikes we find,"
animal-2023-1080p-nf-web-dl-ddp5-1-h,2020s,/home/pratik/projects/GenderBias_TrendAnalysis/dataset/2020s/Animal.2023.1080p.NF.WEB-DL.DDP5.1.H.srt,"00:06:18,416","00:06:19,875",no one can compare to Papa.,no one can compare to Papa.
animal-2023-1080p-nf-web-dl-ddp5-1-h,2020s,/home/pratik/projects/GenderBias_TrendAnalysis/dataset/2020s/Animal.2023.1080p.NF.WEB-DL.DDP5.1.H.srt,"00:06:19,958","00:06:24,208",You are constantly in my heart,{\an8}<i>You are constantly in my heart</i>
animal-2023-1080p-nf-web-dl-ddp5-1-h,2020s,/home/pratik/projects/GenderBias_TrendAnalysis/dataset/2020s/Animal.2023.1080p.NF.WEB-DL.DDP5.1.H.srt,"00:06:24,375","00:06:28,250",- Just like my heartbeat - Papa!,"<i>- Just like my heartbeat</i>
- Papa!"
animal-2023-1080p-nf-web-dl-ddp5-1-h,2020s,/home/pratik/projects/GenderBias_TrendAnalysis/dataset/2020s/Animal.2023.1080p.NF.WEB-DL.DDP5.1.H.srt,"00:06:28,625","00:06:33,083",You are with me in my head No matter where I go,"{\an8}<i>You are with me in my head
No matter where I go</i>"
animal-2023-1080p-nf-web-dl-ddp5-1-h,2020s,/home/pratik/projects/GenderBias_TrendAnalysis/dataset/2020s/Animal.2023.1080p.NF.WEB-DL.DDP5.1.H.srt,"00:06:33,166","00:06:37,083",Whether you are there or not,{\an8}<i>Whether you are there or not</i>
animal-2023-1080p-nf-web-dl-ddp5-1-h,2020s,/home/pratik/projects/GenderBias_TrendAnalysis/dataset/2020s/Animal.2023.1080p.NF.WEB-DL.DDP5.1.H.srt,"00:06:37,250","00:06:41,541",-You are always there in my sight - Papa!,"{\an8}<i>-You are always there in my sight</i>
- Papa!"
animal-2023-1080p-nf-web-dl-ddp5-1-h,2020s,/home/pratik/projects/GenderBias_TrendAnalysis/dataset/2020s/Animal.2023.1080p.NF.WEB-DL.DDP5.1.H.srt,"00:06:41,625","00:06:45,083",- Papa! - Wherever I go,"{\an8}- Papa!
<i>- Wherever I go</i>"
animal-2023-1080p-nf-web-dl-ddp5-1-h,2020s,/home/pratik/projects/GenderBias_TrendAnalysis/dataset/2020s/Animal.2023.1080p.NF.WEB-DL.DDP5.1.H.srt,"00:06:45,166","00:06:46,166",Papa...,{\an8}Papa...
animal-2023-1080p-nf-web-dl-ddp5-1-h,2020s,/home/pratik/projects/GenderBias_TrendAnalysis/dataset/2020s/Animal.2023.1080p.NF.WEB-DL.DDP5.1.H.srt,"00:06:46,375","00:06:49,333","Papa, my life Keep your hand on my head...","{\an8}<i>Papa, my life
Keep your hand on my head...</i>"
animal-2023-1080p-nf-web-dl-ddp5-1-h,2020s,/home/pratik/projects/GenderBias_TrendAnalysis/dataset/2020s/Animal.2023.1080p.NF.WEB-DL.DDP5.1.H.srt,"00:06:49,416","00:06:51,125",The kids made a cake for you.,{\an8}The kids made a cake for you.
animal-2023-1080p-nf-web-dl-ddp5-1-h,2020s,/home/pratik/projects/GenderBias_TrendAnalysis/dataset/2020s/Animal.2023.1080p.NF.WEB-DL.DDP5.1.H.srt,"00:06:51,250","00:06:53,708","They waited for you, but got tired and went to bed.","They waited for you,
but got tired and went to bed."
animal-2023-1080p-nf-web-dl-ddp5-1-h,2020s,/home/pratik/projects/GenderBias_TrendAnalysis/dataset/2020s/Animal.2023.1080p.NF.WEB-DL.DDP5.1.H.srt,"00:06:53,875","00:06:55,166",And you didn't even bother,And you didn't even bother
animal-2023-1080p-nf-web-dl-ddp5-1-h,2020s,/home/pratik/projects/GenderBias_TrendAnalysis/dataset/2020s/Animal.2023.1080p.NF.WEB-DL.DDP5.1.H.srt,"00:06:55,250","00:06:58,208",to meet the kids on your birthday despite calling them from school.,"to meet the kids on your birthday
despite calling them from school."
animal-2023-1080p-nf-web-dl-ddp5-1-h,2020s,/home/pratik/projects/GenderBias_TrendAnalysis/dataset/2020s/Animal.2023.1080p.NF.WEB-DL.DDP5.1.H.srt,"00:06:58,500","00:06:59,500","Don't worry, Jyoti.","Don't worry, Jyoti."
animal-2023-1080p-nf-web-dl-ddp5-1-h,2020s,/home/pratik/projects/GenderBias_TrendAnalysis/dataset/2020s/Animal.2023.1080p.NF.WEB-DL.DDP5.1.H.srt,"00:07:00,083","00:07:01,083",I'll make it up.,I'll make it up.
