film_id,decade,file_path,start,end,text_clean,text_raw
animal-2023-1080p-nf-web-dl-ddp5-1-h,2020s,/home/pratik/projects/GenderBias_TrendAnalysis/dataset/2020s/Animal.2023.1080p.NF.WEB-DL.DDP5.1.H.srt,"02:27:17,125","02:27:19,000",- in the world nowadays. - I see.,"- in the world nowadays.
- I see."
animal-2023-1080p-nf-web-dl-ddp5-1-h,2020s,/home/pratik/projects/GenderBias_TrendAnalysis/dataset/2020s/Animal.2023.1080p.NF.WEB-DL.DDP5.1.H.srt,"02:27:19,583","02:27:21,416",You should be happy I'm not doing drugs at least.,"You should be happy
I'm not doing drugs at least."
animal-2023-1080p-nf-web-dl-ddp5-1-h,2020s,/home/pratik/projects/GenderBias_TrendAnalysis/dataset/2020s/Animal.2023.1080p.NF.WEB-DL.DDP5.1.H.srt,"02:27:21,500","02:27:24,291","- Otherwise, I'd keep sitting-- - Cut this nonsense out.","- Otherwise, I'd keep sitting--
- Cut this nonsense out."
animal-2023-1080p-nf-web-dl-ddp5-1-h,2020s,/home/pratik/projects/GenderBias_TrendAnalysis/dataset/2020s/Animal.2023.1080p.NF.WEB-DL.DDP5.1.H.srt,"02:27:24,625","02:27:26,583","Tell me, what are you doing with that girl?","Tell me, what are you
doing with that girl?"
animal-2023-1080p-nf-web-dl-ddp5-1-h,2020s,/home/pratik/projects/GenderBias_TrendAnalysis/dataset/2020s/Animal.2023.1080p.NF.WEB-DL.DDP5.1.H.srt,"02:27:27,541","02:27:28,916","Come on, Grandpa, I can't tell you that.","Come on, Grandpa,
I can't tell you that."
animal-2023-1080p-nf-web-dl-ddp5-1-h,2020s,/home/pratik/projects/GenderBias_TrendAnalysis/dataset/2020s/Animal.2023.1080p.NF.WEB-DL.DDP5.1.H.srt,"02:27:29,125","02:27:30,250",You shameless punk!,You shameless punk!
animal-2023-1080p-nf-web-dl-ddp5-1-h,2020s,/home/pratik/projects/GenderBias_TrendAnalysis/dataset/2020s/Animal.2023.1080p.NF.WEB-DL.DDP5.1.H.srt,"02:27:31,791","02:27:34,416",I never thought you'd become this shameless.,"I never thought
you'd become this shameless."
animal-2023-1080p-nf-web-dl-ddp5-1-h,2020s,/home/pratik/projects/GenderBias_TrendAnalysis/dataset/2020s/Animal.2023.1080p.NF.WEB-DL.DDP5.1.H.srt,"02:27:34,708","02:27:36,458","Grandpa, back in your day, did you ever...","Grandpa, back in your day, did you ever..."
animal-2023-1080p-nf-web-dl-ddp5-1-h,2020s,/home/pratik/projects/GenderBias_TrendAnalysis/dataset/2020s/Animal.2023.1080p.NF.WEB-DL.DDP5.1.H.srt,"02:27:36,541","02:27:37,666",outside of marriage...,outside of marriage...
animal-2023-1080p-nf-web-dl-ddp5-1-h,2020s,/home/pratik/projects/GenderBias_TrendAnalysis/dataset/2020s/Animal.2023.1080p.NF.WEB-DL.DDP5.1.H.srt,"02:27:38,916","02:27:40,791",- Never? - Never!,"- Never?
- Never!"
animal-2023-1080p-nf-web-dl-ddp5-1-h,2020s,/home/pratik/projects/GenderBias_TrendAnalysis/dataset/2020s/Animal.2023.1080p.NF.WEB-DL.DDP5.1.H.srt,"02:27:54,708","02:27:57,625",What's right? What's wrong?,<i>What's right? What's wrong?</i>
animal-2023-1080p-nf-web-dl-ddp5-1-h,2020s,/home/pratik/projects/GenderBias_TrendAnalysis/dataset/2020s/Animal.2023.1080p.NF.WEB-DL.DDP5.1.H.srt,"02:27:57,875","02:28:00,708",I don't know,<i>I don't know</i>
animal-2023-1080p-nf-web-dl-ddp5-1-h,2020s,/home/pratik/projects/GenderBias_TrendAnalysis/dataset/2020s/Animal.2023.1080p.NF.WEB-DL.DDP5.1.H.srt,"02:28:01,000","02:28:03,833",- If you have the answers... - Your wife?,"<i>- If you have the answers...</i>
- Your wife?"
animal-2023-1080p-nf-web-dl-ddp5-1-h,2020s,/home/pratik/projects/GenderBias_TrendAnalysis/dataset/2020s/Animal.2023.1080p.NF.WEB-DL.DDP5.1.H.srt,"02:28:04,125","02:28:06,708",- Please tell me - Yeah.,"<i>- Please tell me</i>
- Yeah."
animal-2023-1080p-nf-web-dl-ddp5-1-h,2020s,/home/pratik/projects/GenderBias_TrendAnalysis/dataset/2020s/Animal.2023.1080p.NF.WEB-DL.DDP5.1.H.srt,"02:28:06,791","02:28:09,500",- Kids? - Yeah.,"- Kids?
- Yeah."
animal-2023-1080p-nf-web-dl-ddp5-1-h,2020s,/home/pratik/projects/GenderBias_TrendAnalysis/dataset/2020s/Animal.2023.1080p.NF.WEB-DL.DDP5.1.H.srt,"02:28:10,416","02:28:13,541",- I've been lost for too long - She is calling.,"<i>- I've been lost for too long</i>
- She is calling."
animal-2023-1080p-nf-web-dl-ddp5-1-h,2020s,/home/pratik/projects/GenderBias_TrendAnalysis/dataset/2020s/Animal.2023.1080p.NF.WEB-DL.DDP5.1.H.srt,"02:28:13,625","02:28:19,208",If you have found me Tell me where I belong,"<i>If you have found me
Tell me where I belong</i>"
animal-2023-1080p-nf-web-dl-ddp5-1-h,2020s,/home/pratik/projects/GenderBias_TrendAnalysis/dataset/2020s/Animal.2023.1080p.NF.WEB-DL.DDP5.1.H.srt,"02:28:27,083","02:28:33,083","Your scent, it's like a dream","<i>Your scent, it's like a dream</i>"
animal-2023-1080p-nf-web-dl-ddp5-1-h,2020s,/home/pratik/projects/GenderBias_TrendAnalysis/dataset/2020s/Animal.2023.1080p.NF.WEB-DL.DDP5.1.H.srt,"02:28:33,208","02:28:39,458",I want to lose myself in it and be free,<i>I want to lose myself in it and be free</i>
animal-2023-1080p-nf-web-dl-ddp5-1-h,2020s,/home/pratik/projects/GenderBias_TrendAnalysis/dataset/2020s/Animal.2023.1080p.NF.WEB-DL.DDP5.1.H.srt,"02:28:39,541","02:28:45,666",I want to hide the mornings in my embrace,<i>I want to hide the mornings in my embrace</i>
animal-2023-1080p-nf-web-dl-ddp5-1-h,2020s,/home/pratik/projects/GenderBias_TrendAnalysis/dataset/2020s/Animal.2023.1080p.NF.WEB-DL.DDP5.1.H.srt,"02:28:45,791","02:28:51,375",And be together forever this way,<i>And be together forever this way</i>
animal-2023-1080p-nf-web-dl-ddp5-1-h,2020s,/home/pratik/projects/GenderBias_TrendAnalysis/dataset/2020s/Animal.2023.1080p.NF.WEB-DL.DDP5.1.H.srt,"02:28:51,625","02:28:57,666",I want to spend my days Being simply mesmerized by you,"<i>I want to spend my days
Being simply mesmerized by you</i>"
animal-2023-1080p-nf-web-dl-ddp5-1-h,2020s,/home/pratik/projects/GenderBias_TrendAnalysis/dataset/2020s/Animal.2023.1080p.NF.WEB-DL.DDP5.1.H.srt,"02:28:57,750","02:29:03,291",I've met you before,<i>I've met you before</i>
animal-2023-1080p-nf-web-dl-ddp5-1-h,2020s,/home/pratik/projects/GenderBias_TrendAnalysis/dataset/2020s/Animal.2023.1080p.NF.WEB-DL.DDP5.1.H.srt,"02:29:03,875","02:29:06,541",When our eyes first intertwined,<i>When our eyes first intertwined</i>
animal-2023-1080p-nf-web-dl-ddp5-1-h,2020s,/home/pratik/projects/GenderBias_TrendAnalysis/dataset/2020s/Animal.2023.1080p.NF.WEB-DL.DDP5.1.H.srt,"02:29:06,875","02:29:10,041","That's how I felt, you know","<i>That's how I felt, you know</i>"
animal-2023-1080p-nf-web-dl-ddp5-1-h,2020s,/home/pratik/projects/GenderBias_TrendAnalysis/dataset/2020s/Animal.2023.1080p.NF.WEB-DL.DDP5.1.H.srt,"02:29:10,125","02:29:15,750",You touched my wounds,<i>You touched my wounds</i>
animal-2023-1080p-nf-web-dl-ddp5-1-h,2020s,/home/pratik/projects/GenderBias_TrendAnalysis/dataset/2020s/Animal.2023.1080p.NF.WEB-DL.DDP5.1.H.srt,"02:29:16,166","02:29:22,625",And my heart... it healed,<i>And my heart... it healed</i>
animal-2023-1080p-nf-web-dl-ddp5-1-h,2020s,/home/pratik/projects/GenderBias_TrendAnalysis/dataset/2020s/Animal.2023.1080p.NF.WEB-DL.DDP5.1.H.srt,"02:29:23,333","02:29:26,500",We're both a little crazy,<i>We're both a little crazy</i>
animal-2023-1080p-nf-web-dl-ddp5-1-h,2020s,/home/pratik/projects/GenderBias_TrendAnalysis/dataset/2020s/Animal.2023.1080p.NF.WEB-DL.DDP5.1.H.srt,"02:29:26,583","02:29:29,541",Floating like clouds up above,<i>Floating like clouds up above</i>
animal-2023-1080p-nf-web-dl-ddp5-1-h,2020s,/home/pratik/projects/GenderBias_TrendAnalysis/dataset/2020s/Animal.2023.1080p.NF.WEB-DL.DDP5.1.H.srt,"02:29:29,625","02:29:35,041","Come, let's rain down Come, let's soak in love","<i>Come, let's rain down
Come, let's soak in love</i>"
animal-2023-1080p-nf-web-dl-ddp5-1-h,2020s,/home/pratik/projects/GenderBias_TrendAnalysis/dataset/2020s/Animal.2023.1080p.NF.WEB-DL.DDP5.1.H.srt,"02:29:35,125","02:29:40,041",I've met you before,<i>I've met you before</i>
animal-2023-1080p-nf-web-dl-ddp5-1-h,2020s,/home/pratik/projects/GenderBias_TrendAnalysis/dataset/2020s/Animal.2023.1080p.NF.WEB-DL.DDP5.1.H.srt,"02:29:41,291","02:29:43,166",He bloody gave me a lecture that day for doing this stuff.,"He bloody gave me a lecture
that day for doing this stuff."
animal-2023-1080p-nf-web-dl-ddp5-1-h,2020s,/home/pratik/projects/GenderBias_TrendAnalysis/dataset/2020s/Animal.2023.1080p.NF.WEB-DL.DDP5.1.H.srt,"02:29:43,666","02:29:45,833","This is a 200-year-old British Club,","This is a 200-year-old British Club,"
animal-2023-1080p-nf-web-dl-ddp5-1-h,2020s,/home/pratik/projects/GenderBias_TrendAnalysis/dataset/2020s/Animal.2023.1080p.NF.WEB-DL.DDP5.1.H.srt,"02:29:46,708","02:29:49,625",and he has booked it to do the same stuff?,and he has booked it to do the same stuff?
animal-2023-1080p-nf-web-dl-ddp5-1-h,2020s,/home/pratik/projects/GenderBias_TrendAnalysis/dataset/2020s/Animal.2023.1080p.NF.WEB-DL.DDP5.1.H.srt,"02:29:49,916","02:29:51,083","It's love, brother.","It's love, brother."
animal-2023-1080p-nf-web-dl-ddp5-1-h,2020s,/home/pratik/projects/GenderBias_TrendAnalysis/dataset/2020s/Animal.2023.1080p.NF.WEB-DL.DDP5.1.H.srt,"02:29:51,458","02:29:53,833",And rich people tend to fall in love a couple of times at least.,"And rich people tend to fall
in love a couple of times at least."
animal-2023-1080p-nf-web-dl-ddp5-1-h,2020s,/home/pratik/projects/GenderBias_TrendAnalysis/dataset/2020s/Animal.2023.1080p.NF.WEB-DL.DDP5.1.H.srt,"02:29:54,041","02:29:55,791","This isn't love, man.","This isn't love, man."
animal-2023-1080p-nf-web-dl-ddp5-1-h,2020s,/home/pratik/projects/GenderBias_TrendAnalysis/dataset/2020s/Animal.2023.1080p.NF.WEB-DL.DDP5.1.H.srt,"02:29:56,125","02:29:58,708","The only difference is that we have to pay for it,","The only difference is that we have
to pay for it,"
animal-2023-1080p-nf-web-dl-ddp5-1-h,2020s,/home/pratik/projects/GenderBias_TrendAnalysis/dataset/2020s/Animal.2023.1080p.NF.WEB-DL.DDP5.1.H.srt,"02:29:59,291","02:30:00,500",and he uses his expertise.,and he uses his expertise.
animal-2023-1080p-nf-web-dl-ddp5-1-h,2020s,/home/pratik/projects/GenderBias_TrendAnalysis/dataset/2020s/Animal.2023.1080p.NF.WEB-DL.DDP5.1.H.srt,"02:30:00,583","02:30:02,375",He's got her fianc's heart inside him.,He's got her fianc's heart inside him.
animal-2023-1080p-nf-web-dl-ddp5-1-h,2020s,/home/pratik/projects/GenderBias_TrendAnalysis/dataset/2020s/Animal.2023.1080p.NF.WEB-DL.DDP5.1.H.srt,"02:30:02,750","02:30:04,000",He probably got touched by it or something.,"He probably got touched
by it or something."
animal-2023-1080p-nf-web-dl-ddp5-1-h,2020s,/home/pratik/projects/GenderBias_TrendAnalysis/dataset/2020s/Animal.2023.1080p.NF.WEB-DL.DDP5.1.H.srt,"02:30:04,083","02:30:05,791",There is no such thing!,There is no such thing!
animal-2023-1080p-nf-web-dl-ddp5-1-h,2020s,/home/pratik/projects/GenderBias_TrendAnalysis/dataset/2020s/Animal.2023.1080p.NF.WEB-DL.DDP5.1.H.srt,"02:30:05,875","02:30:08,208","Brother, I think he's in love too.","Brother, I think he's in love too."
animal-2023-1080p-nf-web-dl-ddp5-1-h,2020s,/home/pratik/projects/GenderBias_TrendAnalysis/dataset/2020s/Animal.2023.1080p.NF.WEB-DL.DDP5.1.H.srt,"02:30:08,291","02:30:09,166",Love?,Love?
animal-2023-1080p-nf-web-dl-ddp5-1-h,2020s,/home/pratik/projects/GenderBias_TrendAnalysis/dataset/2020s/Animal.2023.1080p.NF.WEB-DL.DDP5.1.H.srt,"02:30:09,375","02:30:10,250",In just one week?,In just one week?
animal-2023-1080p-nf-web-dl-ddp5-1-h,2020s,/home/pratik/projects/GenderBias_TrendAnalysis/dataset/2020s/Animal.2023.1080p.NF.WEB-DL.DDP5.1.H.srt,"02:30:10,500","02:30:11,875",Did he ever offer you a cup of tea?,Did he ever offer you a cup of tea?
animal-2023-1080p-nf-web-dl-ddp5-1-h,2020s,/home/pratik/projects/GenderBias_TrendAnalysis/dataset/2020s/Animal.2023.1080p.NF.WEB-DL.DDP5.1.H.srt,"02:30:12,791","02:30:15,583","Look over there, he's offering her a mixed fruit juice.","Look over there,
he's offering her a mixed fruit juice."
animal-2023-1080p-nf-web-dl-ddp5-1-h,2020s,/home/pratik/projects/GenderBias_TrendAnalysis/dataset/2020s/Animal.2023.1080p.NF.WEB-DL.DDP5.1.H.srt,"02:30:15,666","02:30:16,708",The one he made himself.,The one he made himself.
animal-2023-1080p-nf-web-dl-ddp5-1-h,2020s,/home/pratik/projects/GenderBias_TrendAnalysis/dataset/2020s/Animal.2023.1080p.NF.WEB-DL.DDP5.1.H.srt,"02:30:17,041","02:30:18,875","He's in love with her, dummy.","He's in love with her, dummy."
animal-2023-1080p-nf-web-dl-ddp5-1-h,2020s,/home/pratik/projects/GenderBias_TrendAnalysis/dataset/2020s/Animal.2023.1080p.NF.WEB-DL.DDP5.1.H.srt,"02:30:18,958","02:30:21,000",Who will get the mixed fruit juice? Her or you?,"Who will get the mixed fruit juice?
Her or you?"
animal-2023-1080p-nf-web-dl-ddp5-1-h,2020s,/home/pratik/projects/GenderBias_TrendAnalysis/dataset/2020s/Animal.2023.1080p.NF.WEB-DL.DDP5.1.H.srt,"02:30:21,083","02:30:23,833",We were also offering them breakfast that day.,"We were also offering them
breakfast that day."
animal-2023-1080p-nf-web-dl-ddp5-1-h,2020s,/home/pratik/projects/GenderBias_TrendAnalysis/dataset/2020s/Animal.2023.1080p.NF.WEB-DL.DDP5.1.H.srt,"02:30:25,291","02:30:26,875","Sangram, just let it go.","Sangram, just let it go."
animal-2023-1080p-nf-web-dl-ddp5-1-h,2020s,/home/pratik/projects/GenderBias_TrendAnalysis/dataset/2020s/Animal.2023.1080p.NF.WEB-DL.DDP5.1.H.srt,"02:30:26,958","02:30:30,208","Seriously, headman! Stop it.","Seriously, headman! Stop it."
animal-2023-1080p-nf-web-dl-ddp5-1-h,2020s,/home/pratik/projects/GenderBias_TrendAnalysis/dataset/2020s/Animal.2023.1080p.NF.WEB-DL.DDP5.1.H.srt,"02:30:30,541","02:30:32,500",He'll go ballistic if he hears us.,He'll go ballistic if he hears us.
animal-2023-1080p-nf-web-dl-ddp5-1-h,2020s,/home/pratik/projects/GenderBias_TrendAnalysis/dataset/2020s/Animal.2023.1080p.NF.WEB-DL.DDP5.1.H.srt,"02:30:35,625","02:30:36,708",He's headed this way.,He's headed this way.
animal-2023-1080p-nf-web-dl-ddp5-1-h,2020s,/home/pratik/projects/GenderBias_TrendAnalysis/dataset/2020s/Animal.2023.1080p.NF.WEB-DL.DDP5.1.H.srt,"02:30:40,291","02:30:41,208",What are you staring at?,What are you staring at?
animal-2023-1080p-nf-web-dl-ddp5-1-h,2020s,/home/pratik/projects/GenderBias_TrendAnalysis/dataset/2020s/Animal.2023.1080p.NF.WEB-DL.DDP5.1.H.srt,"02:30:44,750","02:30:48,041",Treat her the way you treat Gitanjali at home.,"Treat her the way
you treat Gitanjali at home."
animal-2023-1080p-nf-web-dl-ddp5-1-h,2020s,/home/pratik/projects/GenderBias_TrendAnalysis/dataset/2020s/Animal.2023.1080p.NF.WEB-DL.DDP5.1.H.srt,"02:30:48,500","02:30:49,458","Yes, brother.","Yes, brother."
animal-2023-1080p-nf-web-dl-ddp5-1-h,2020s,/home/pratik/projects/GenderBias_TrendAnalysis/dataset/2020s/Animal.2023.1080p.NF.WEB-DL.DDP5.1.H.srt,"02:30:49,916","02:30:50,791",Okay?,Okay?
animal-2023-1080p-nf-web-dl-ddp5-1-h,2020s,/home/pratik/projects/GenderBias_TrendAnalysis/dataset/2020s/Animal.2023.1080p.NF.WEB-DL.DDP5.1.H.srt,"02:30:51,333","02:30:53,333",- That's exactly what I was telling him. - Brother...,"- That's exactly what I was telling him.
- Brother..."
animal-2023-1080p-nf-web-dl-ddp5-1-h,2020s,/home/pratik/projects/GenderBias_TrendAnalysis/dataset/2020s/Animal.2023.1080p.NF.WEB-DL.DDP5.1.H.srt,"02:30:53,416","02:30:54,291",Shut up.,Shut up.
animal-2023-1080p-nf-web-dl-ddp5-1-h,2020s,/home/pratik/projects/GenderBias_TrendAnalysis/dataset/2020s/Animal.2023.1080p.NF.WEB-DL.DDP5.1.H.srt,"02:30:54,875","02:30:55,750",Sunny...,Sunny...
animal-2023-1080p-nf-web-dl-ddp5-1-h,2020s,/home/pratik/projects/GenderBias_TrendAnalysis/dataset/2020s/Animal.2023.1080p.NF.WEB-DL.DDP5.1.H.srt,"02:31:00,666","02:31:01,625",Enjoy the love.,Enjoy the love.
animal-2023-1080p-nf-web-dl-ddp5-1-h,2020s,/home/pratik/projects/GenderBias_TrendAnalysis/dataset/2020s/Animal.2023.1080p.NF.WEB-DL.DDP5.1.H.srt,"02:31:03,875","02:31:06,208",Did he really hear us?,Did he really hear us?
animal-2023-1080p-nf-web-dl-ddp5-1-h,2020s,/home/pratik/projects/GenderBias_TrendAnalysis/dataset/2020s/Animal.2023.1080p.NF.WEB-DL.DDP5.1.H.srt,"02:31:06,375","02:31:08,625",- I don't know. - He didn't have his hearing aid on.,"- I don't know.
- He didn't have his hearing aid on."
animal-2023-1080p-nf-web-dl-ddp5-1-h,2020s,/home/pratik/projects/GenderBias_TrendAnalysis/dataset/2020s/Animal.2023.1080p.NF.WEB-DL.DDP5.1.H.srt,"02:31:10,125","02:31:11,958",Paali! Royal!,Paali! Royal!
animal-2023-1080p-nf-web-dl-ddp5-1-h,2020s,/home/pratik/projects/GenderBias_TrendAnalysis/dataset/2020s/Animal.2023.1080p.NF.WEB-DL.DDP5.1.H.srt,"02:31:12,583","02:31:13,458","Yes, sister-in-law?","Yes, sister-in-law?"
animal-2023-1080p-nf-web-dl-ddp5-1-h,2020s,/home/pratik/projects/GenderBias_TrendAnalysis/dataset/2020s/Animal.2023.1080p.NF.WEB-DL.DDP5.1.H.srt,"02:31:14,000","02:31:15,208",What's happening with your brother?,What's happening with your brother?
animal-2023-1080p-nf-web-dl-ddp5-1-h,2020s,/home/pratik/projects/GenderBias_TrendAnalysis/dataset/2020s/Animal.2023.1080p.NF.WEB-DL.DDP5.1.H.srt,"02:31:16,000","02:31:18,208",He's not showing up for lunch. He doesn't even make it for dinner.,"He's not showing up for lunch.
He doesn't even make it for dinner."
animal-2023-1080p-nf-web-dl-ddp5-1-h,2020s,/home/pratik/projects/GenderBias_TrendAnalysis/dataset/2020s/Animal.2023.1080p.NF.WEB-DL.DDP5.1.H.srt,"02:31:18,541","02:31:19,458",Call him up.,Call him up.
animal-2023-1080p-nf-web-dl-ddp5-1-h,2020s,/home/pratik/projects/GenderBias_TrendAnalysis/dataset/2020s/Animal.2023.1080p.NF.WEB-DL.DDP5.1.H.srt,"02:31:19,541","02:31:21,208","Actually, he's pretty busy these days.","Actually, he's pretty busy these days."
animal-2023-1080p-nf-web-dl-ddp5-1-h,2020s,/home/pratik/projects/GenderBias_TrendAnalysis/dataset/2020s/Animal.2023.1080p.NF.WEB-DL.DDP5.1.H.srt,"02:31:21,708","02:31:23,000",He's busy 24-7?,He's busy 24-7?
animal-2023-1080p-nf-web-dl-ddp5-1-h,2020s,/home/pratik/projects/GenderBias_TrendAnalysis/dataset/2020s/Animal.2023.1080p.NF.WEB-DL.DDP5.1.H.srt,"02:31:23,791","02:31:24,750",Call him right now.,Call him right now.
animal-2023-1080p-nf-web-dl-ddp5-1-h,2020s,/home/pratik/projects/GenderBias_TrendAnalysis/dataset/2020s/Animal.2023.1080p.NF.WEB-DL.DDP5.1.H.srt,"02:31:32,166","02:31:33,166",He's not picking up.,He's not picking up.
animal-2023-1080p-nf-web-dl-ddp5-1-h,2020s,/home/pratik/projects/GenderBias_TrendAnalysis/dataset/2020s/Animal.2023.1080p.NF.WEB-DL.DDP5.1.H.srt,"02:31:37,250","02:31:38,625",You didn't even dial once.,You didn't even dial once.
animal-2023-1080p-nf-web-dl-ddp5-1-h,2020s,/home/pratik/projects/GenderBias_TrendAnalysis/dataset/2020s/Animal.2023.1080p.NF.WEB-DL.DDP5.1.H.srt,"02:31:38,958","02:31:40,000",Why did you act like you did?,Why did you act like you did?
animal-2023-1080p-nf-web-dl-ddp5-1-h,2020s,/home/pratik/projects/GenderBias_TrendAnalysis/dataset/2020s/Animal.2023.1080p.NF.WEB-DL.DDP5.1.H.srt,"02:31:41,333","02:31:42,416","Who's this ""Sister-in-law 2""?","Who's this ""Sister-in-law 2""?"
animal-2023-1080p-nf-web-dl-ddp5-1-h,2020s,/home/pratik/projects/GenderBias_TrendAnalysis/dataset/2020s/Animal.2023.1080p.NF.WEB-DL.DDP5.1.H.srt,"02:31:42,833","02:31:44,833",She's the wife of my cousin in Jalandhar.,She's the wife of my cousin in Jalandhar.
animal-2023-1080p-nf-web-dl-ddp5-1-h,2020s,/home/pratik/projects/GenderBias_TrendAnalysis/dataset/2020s/Animal.2023.1080p.NF.WEB-DL.DDP5.1.H.srt,"02:31:46,166","02:31:49,125",She's a working woman. She's probably asleep. Let's not disturb her.,"She's a working woman. She's probably
asleep. Let's not disturb her."
animal-2023-1080p-nf-web-dl-ddp5-1-h,2020s,/home/pratik/projects/GenderBias_TrendAnalysis/dataset/2020s/Animal.2023.1080p.NF.WEB-DL.DDP5.1.H.srt,"02:31:49,583","02:31:51,000",It's pretty late. She's probably asleep.,"It's pretty late.
She's probably asleep."
animal-2023-1080p-nf-web-dl-ddp5-1-h,2020s,/home/pratik/projects/GenderBias_TrendAnalysis/dataset/2020s/Animal.2023.1080p.NF.WEB-DL.DDP5.1.H.srt,"02:31:55,541","02:31:56,625",She's not answering either.,She's not answering either.
animal-2023-1080p-nf-web-dl-ddp5-1-h,2020s,/home/pratik/projects/GenderBias_TrendAnalysis/dataset/2020s/Animal.2023.1080p.NF.WEB-DL.DDP5.1.H.srt,"02:31:56,708","02:31:58,125","Like I said, she's probably asleep.","Like I said, she's probably asleep."
animal-2023-1080p-nf-web-dl-ddp5-1-h,2020s,/home/pratik/projects/GenderBias_TrendAnalysis/dataset/2020s/Animal.2023.1080p.NF.WEB-DL.DDP5.1.H.srt,"02:32:00,500","02:32:01,583","Come, guys.","Come, guys."
animal-2023-1080p-nf-web-dl-ddp5-1-h,2020s,/home/pratik/projects/GenderBias_TrendAnalysis/dataset/2020s/Animal.2023.1080p.NF.WEB-DL.DDP5.1.H.srt,"02:32:04,000","02:32:06,875","I want to order a Rolls Royce, but I have a special request.","I want to order a Rolls Royce,
but I have a special request."
animal-2023-1080p-nf-web-dl-ddp5-1-h,2020s,/home/pratik/projects/GenderBias_TrendAnalysis/dataset/2020s/Animal.2023.1080p.NF.WEB-DL.DDP5.1.H.srt,"02:32:08,083","02:32:09,083",I want this color.,I want this color.
animal-2023-1080p-nf-web-dl-ddp5-1-h,2020s,/home/pratik/projects/GenderBias_TrendAnalysis/dataset/2020s/Animal.2023.1080p.NF.WEB-DL.DDP5.1.H.srt,"02:32:09,625","02:32:10,916",Can you see it? Right here.,"Can you see it?
Right here."
animal-2023-1080p-nf-web-dl-ddp5-1-h,2020s,/home/pratik/projects/GenderBias_TrendAnalysis/dataset/2020s/Animal.2023.1080p.NF.WEB-DL.DDP5.1.H.srt,"02:32:11,791","02:32:13,041",Can you see it?,Can you see it?
animal-2023-1080p-nf-web-dl-ddp5-1-h,2020s,/home/pratik/projects/GenderBias_TrendAnalysis/dataset/2020s/Animal.2023.1080p.NF.WEB-DL.DDP5.1.H.srt,"02:32:14,083","02:32:15,750",It's okay. They are professionals.,It's okay. They are professionals.
animal-2023-1080p-nf-web-dl-ddp5-1-h,2020s,/home/pratik/projects/GenderBias_TrendAnalysis/dataset/2020s/Animal.2023.1080p.NF.WEB-DL.DDP5.1.H.srt,"02:32:16,458","02:32:17,833",I want exactly this color.,I want exactly this color.
animal-2023-1080p-nf-web-dl-ddp5-1-h,2020s,/home/pratik/projects/GenderBias_TrendAnalysis/dataset/2020s/Animal.2023.1080p.NF.WEB-DL.DDP5.1.H.srt,"02:32:18,666","02:32:19,625",Is it possible?,Is it possible?
animal-2023-1080p-nf-web-dl-ddp5-1-h,2020s,/home/pratik/projects/GenderBias_TrendAnalysis/dataset/2020s/Animal.2023.1080p.NF.WEB-DL.DDP5.1.H.srt,"02:32:20,125","02:32:22,083","If there are any formalities, they'll sort it out.","If there are any formalities,
they'll sort it out."
animal-2023-1080p-nf-web-dl-ddp5-1-h,2020s,/home/pratik/projects/GenderBias_TrendAnalysis/dataset/2020s/Animal.2023.1080p.NF.WEB-DL.DDP5.1.H.srt,"02:32:22,375","02:32:24,708","If you want to match it with a color chart,","If you want to match
it with a color chart,"
animal-2023-1080p-nf-web-dl-ddp5-1-h,2020s,/home/pratik/projects/GenderBias_TrendAnalysis/dataset/2020s/Animal.2023.1080p.NF.WEB-DL.DDP5.1.H.srt,"02:32:24,791","02:32:26,416","take some photos in good lighting, then I'll arrange it.","take some photos in good lighting,
then I'll arrange it."
animal-2023-1080p-nf-web-dl-ddp5-1-h,2020s,/home/pratik/projects/GenderBias_TrendAnalysis/dataset/2020s/Animal.2023.1080p.NF.WEB-DL.DDP5.1.H.srt,"02:32:26,500","02:32:27,375",She's very cooperative.,She's very cooperative.
animal-2023-1080p-nf-web-dl-ddp5-1-h,2020s,/home/pratik/projects/GenderBias_TrendAnalysis/dataset/2020s/Animal.2023.1080p.NF.WEB-DL.DDP5.1.H.srt,"02:32:29,500","02:32:30,458",Place the order.,Place the order.
animal-2023-1080p-nf-web-dl-ddp5-1-h,2020s,/home/pratik/projects/GenderBias_TrendAnalysis/dataset/2020s/Animal.2023.1080p.NF.WEB-DL.DDP5.1.H.srt,"02:32:30,875","02:32:31,750","Sure, sir.","Sure, sir."
animal-2023-1080p-nf-web-dl-ddp5-1-h,2020s,/home/pratik/projects/GenderBias_TrendAnalysis/dataset/2020s/Animal.2023.1080p.NF.WEB-DL.DDP5.1.H.srt,"02:32:31,833","02:32:32,708","Thank you, sir.","Thank you, sir."
animal-2023-1080p-nf-web-dl-ddp5-1-h,2020s,/home/pratik/projects/GenderBias_TrendAnalysis/dataset/2020s/Animal.2023.1080p.NF.WEB-DL.DDP5.1.H.srt,"02:32:37,333","02:32:39,291",It's okay. It's me.,It's okay. It's me.
animal-2023-1080p-nf-web-dl-ddp5-1-h,2020s,/home/pratik/projects/GenderBias_TrendAnalysis/dataset/2020s/Animal.2023.1080p.NF.WEB-DL.DDP5.1.H.srt,"02:32:39,375","02:32:42,458",We're both a little crazy,<i>We're both a little crazy</i>
animal-2023-1080p-nf-web-dl-ddp5-1-h,2020s,/home/pratik/projects/GenderBias_TrendAnalysis/dataset/2020s/Animal.2023.1080p.NF.WEB-DL.DDP5.1.H.srt,"02:32:42,541","02:32:45,500",Floating like clouds up above,<i>Floating like clouds up above</i>
animal-2023-1080p-nf-web-dl-ddp5-1-h,2020s,/home/pratik/projects/GenderBias_TrendAnalysis/dataset/2020s/Animal.2023.1080p.NF.WEB-DL.DDP5.1.H.srt,"02:32:45,583","02:32:50,958","Come, let's rain down Come, let's soak in love","<i>Come, let's rain down
Come, let's soak in love</i>"
animal-2023-1080p-nf-web-dl-ddp5-1-h,2020s,/home/pratik/projects/GenderBias_TrendAnalysis/dataset/2020s/Animal.2023.1080p.NF.WEB-DL.DDP5.1.H.srt,"02:32:51,041","02:32:56,541",I've met you before,<i>I've met you before</i>
animal-2023-1080p-nf-web-dl-ddp5-1-h,2020s,/home/pratik/projects/GenderBias_TrendAnalysis/dataset/2020s/Animal.2023.1080p.NF.WEB-DL.DDP5.1.H.srt,"02:32:57,208","02:32:59,250",When our eyes first intertwined,<i>When our eyes first intertwined</i>
animal-2023-1080p-nf-web-dl-ddp5-1-h,2020s,/home/pratik/projects/GenderBias_TrendAnalysis/dataset/2020s/Animal.2023.1080p.NF.WEB-DL.DDP5.1.H.srt,"02:33:00,291","02:33:03,416","That's how I felt, you know","<i>That's how I felt, you know</i>"
animal-2023-1080p-nf-web-dl-ddp5-1-h,2020s,/home/pratik/projects/GenderBias_TrendAnalysis/dataset/2020s/Animal.2023.1080p.NF.WEB-DL.DDP5.1.H.srt,"02:33:03,500","02:33:08,625",You touched my wounds,<i>You touched my wounds</i>
animal-2023-1080p-nf-web-dl-ddp5-1-h,2020s,/home/pratik/projects/GenderBias_TrendAnalysis/dataset/2020s/Animal.2023.1080p.NF.WEB-DL.DDP5.1.H.srt,"02:33:09,625","02:33:15,000",- And my heart... it healed - Same color.,"<i>- And my heart... it healed</i>
- Same color."
animal-2023-1080p-nf-web-dl-ddp5-1-h,2020s,/home/pratik/projects/GenderBias_TrendAnalysis/dataset/2020s/Animal.2023.1080p.NF.WEB-DL.DDP5.1.H.srt,"02:33:59,583","02:34:01,125",Zoya... look at this.,Zoya... look at this.
